headline,href
Longtime OKC civil rights leader and minister the Rev. John A. Reed dies,/story/news/2024/08/26/fairview-baptist-church-okc-minister-john-a-reed-dies/74958471007/
"Oklahoma high school softball storylines, players to watch",/story/sports/high-school/softball/2024/08/26/oklahoma-high-school-softball-storylines-players-to-watch-2024-season/74951800007/
Several school districts have bonds on the ballot Tuesday: What to know,/story/news/education/2024/08/26/oklahoma-elections-2024-public-school-bond-proposals-ballot/74952771007/
Toby Keith hits and holiday albums to get posthumous release: What to know,/story/entertainment/2024/08/26/toby-keith-special-new-remastered-greatest-hits-christmas-album/74952758007/
Legislator: Oklahomans deserve better than Ryan Walters,/story/opinion/columns/2024/08/26/oklahoma-legislator-on-why-ryan-walters-needs-to-be-impeached-or-leave/74938487007/
A decades-long mystery about 'the compound' in Edmond…,/story/news/2024/08/26/gambling-nudist-rumors-persist-after-fencing-removal-at-the-compound/74820468007/
Vote: The Oklahoman's Landmark Fine Homes fall HS…,/story/sports/high-school/2024/08/26/vote-landmark-fine-homes-fall-high-school-athletes-of-the-week/74959112007/
Where CeeDee Lamb ranks in highest-paid OU players in NFL,/story/sports/college/sooners/2024/08/26/ou-football-nfl-players-salary-contract-ceedee-lamb-dallas-cowboys/74956179007/
,
Authorities raid illegal Okmulgee County marijuana grow,/story/news/crime/2024/08/26/oklahoma-task-force-seizes-thousands-of-marijuana-plants-in-raid/74953821007/
Longtime OKC civil rights leader and minister the Rev. John A. Reed dies,/story/news/2024/08/26/fairview-baptist-church-okc-minister-john-a-reed-dies/74958471007/
Several school districts have bonds on the ballot Tuesday: What to know,/story/news/education/2024/08/26/oklahoma-elections-2024-public-school-bond-proposals-ballot/74952771007/
American flags at Edmond North in protest of flag policy,/picture-gallery/news/2024/08/26/edmond-north-american-flag-protest-photos/74954535007/
"Oklahoma high school softball storylines, players to watch",/story/sports/high-school/softball/2024/08/26/oklahoma-high-school-softball-storylines-players-to-watch-2024-season/74951800007/
The Oklahoman’s 2024 Class A-I HS football preseason rankings,/story/sports/high-school/football/2024/08/26/oklahoma-high-school-football-2024-ossaa-class-a-i-preseason-rankings/74940483007/
Vote: The Oklahoman's Landmark Fine Homes fall HS athletes of the week,/story/sports/high-school/2024/08/26/vote-landmark-fine-homes-fall-high-school-athletes-of-the-week/74959112007/
Impacts of the Dell layoffs in OKC still up in the air,/story/business/employment/2024/08/24/dell-layoffs-okc-warn-notice/74887826007/
"Another Amazon OKC delivery station in the works, with up to 200 jobs",/story/business/2024/08/23/amazon-delivery-station-coming-oklahoma-city-200-jobs/74813556007/
Oklahoma City home prices dropped slightly in July,/story/business/real-estate/2024/08/20/okc-home-prices-dropped-july-2024/74815074007/
One key issue is missing from OK's November ballot: Abortion care access Janelle Stecklein,/story/opinion/columns/2024/08/26/oklahoma-elections-2024-abortion-access-not-on-ballot/74950256007/
Legislator: Oklahomans deserve better than Ryan Walters Rep. Andy Fugate,/story/opinion/columns/2024/08/26/oklahoma-legislator-on-why-ryan-walters-needs-to-be-impeached-or-leave/74938487007/
Arts education in Oklahoma essential to cultural fabric of our state Trent Riley,/story/opinion/columns/2024/08/26/arts-education-in-curriculum-would-boost-oklahoma-student-performance/74886250007/
"Outages, delays at Seattle airport continue after cyberattack",/story/travel/2024/08/26/seattle-seatac-airport-delays-cyberattack/74957392007/
'Not mindful or demure': Man files trademarks for trending phrase,/story/money/2024/08/26/man-files-trademark-for-jools-lebrons-very-mindful-very-demure/74957913007/
21-year-old man drowns trying to save teenage girl from in Texas lake,/story/news/nation/2024/08/26/waxahachie-lake-drowning/74958018007/
Toby Keith hits and holiday albums to get posthumous release: What to know,/story/entertainment/2024/08/26/toby-keith-special-new-remastered-greatest-hits-christmas-album/74952758007/
What is Oklahoma's Best Craft Brewery? Vote in Round 1 of our bracket,/story/lifestyle/food/2024/08/26/best-breweries-in-oklahoma-vote-bracket-round-1/73708132007/
"Toby Keith tribute show to premiere this week: TV channel, streaming",/story/entertainment/2024/08/26/toby-keith-american-icon-tribute-show-tonight-how-to-watch-schedule/74952878007/
,/picture-gallery/news/religion/2024/08/26/fairview-baptist-church-okc-john-a-reed-photos/74910739007/
Winners Announced!,https://oklahoman.gannettcontests.com/2024-Oklahoman-Communitys-Choice-Awards-Winners/?itm_campaign=Oklahoma%202024%20BOB&itm_medium=con&itm_source=secondStreet
Enter to Win!,http://oklahoman.gannettcontests.com/2024-Oklahoma-State-Fair-Ultimate/?itm_campaign=2024%20Oklahoma%20State%20Fair%20Ultimate&itm_medium=con&itm_source=secondStreet
One key issue is missing from OK's November ballot: Abortion care accessJanelle Stecklein,/story/opinion/columns/2024/08/26/oklahoma-elections-2024-abortion-access-not-on-ballot/74950256007/
American flags at Edmond North in protest of flag policy,/picture-gallery/news/2024/08/26/edmond-north-american-flag-protest-photos/74954535007/
What is Oklahoma's Best Craft Brewery? Vote in Round 1 of our bracket,/story/lifestyle/food/2024/08/26/best-breweries-in-oklahoma-vote-bracket-round-1/73708132007/
Edmond North community protests after student barred from displaying flag,/story/news/2024/08/26/edmond-north-protests-after-student-barred-from-displaying-american-flag/74951553007/
The Oklahoman’s 2024 Class A-I HS football preseason rankings,/story/sports/high-school/football/2024/08/26/oklahoma-high-school-football-2024-ossaa-class-a-i-preseason-rankings/74940483007/
,https://cm.oklahoman.com/site-feedback/?platform=Tangent-Desktop&url=https%3A%2F%2Fwww.oklahoman.com%2F&marketName=oklahoman&cta=Right-Rail
