headline,href
2026 soon will be here. What are your New Year's resolutions?,/story/opinion/columns/more-voices/2025/12/30/with-2026-just-around-the-corner-what-have-you-resolved-to-do-survey/87950790007/
How will Oklahoma Sooners fare in 2026? Here are 26 bold predictions,/story/sports/college/sooners/2026/01/01/ou-athletics-26-bold-predictions-year-2026-oklahoma-sooners-sec/87882971007/
Top photos of 2025: See The Oklahoman's Pictures of the Year,/story/news/state/2026/01/01/the-oklahoman-newspaper-best-photos-2025-okc-thunder-wcws-protests/87814184007/
"What's open, closed on New Year's Day in Oklahoma",/story/news/local/2025/12/31/are-banks-open-on-new-years-day-will-mail-run-whats-open-closed/87946315007/
OKC Thunder broadcaster Eleno Ornelas brings NBA to…,/story/sports/nba/thunder/2025/12/31/okc-thunder-spanish-broadcaster-eleno-ornelas-living-dreams-nba-mlb-texas-rangers/87775137007/
OU football transfer portal tracker: Sooners DL Markus…,/story/sports/college/sooners/2025/12/22/oklahoma-football-transfer-portal-tracker-2026/87875249007/
Celebrate the Thunder's first NBA title with this…,/story/sports/nba/thunder/2025/12/17/celebrate-okc-thunder-nba-championship-commemorative-book/87805943007/
,
Celebrate Oklahoma high school basketball with 'The Big…,/story/sports/high-school/basketball/2025/12/17/celebrate-oklahoma-high-school-basketball-big-house-book/87806019007/
What you need to know about OKC Thunder schedule and how…,/story/sports/nba/thunder/2025/10/21/okc-thunder-schedule-dates-times-tv-streaming/86811489007/
Shopping,/shopping/
How to buy USMNT vs. Paraguay 2026 World Cup soccer tickets in LA,/story/shopping/2026/01/01/how-to-buy-usmnt-vs-paraguay-world-cup-soccer-tickets-los-angeles/87962614007/
"Try Amazon’s #1 joint and muscle relief cream with 90,000+ reviews",/story/shopping/2026/01/01/penetrex-muscle-relief-cream-posture/87911841007/
"City noise, snoring, menopause? Ozlo Sleepbuds help you sleep better",/story/shopping/2026/01/01/better-sleep-ozlo-sleepbuds-on-sale/87947052007/
News,/news/
Top photos of 2025: See The Oklahoman's Pictures of the Year,/story/news/state/2026/01/01/the-oklahoman-newspaper-best-photos-2025-okc-thunder-wcws-protests/87814184007/
"What's open, closed on New Year's Day in Oklahoma",/story/news/local/2025/12/31/are-banks-open-on-new-years-day-will-mail-run-whats-open-closed/87946315007/
Behind the work to improve access to mental health care in Oklahoma,/story/news/healthcare/2025/12/30/oklahoma-mental-health-care-access-improvements/86224235007/
Sports,/sports/
How will Oklahoma Sooners fare in 2026? Here are 26 bold predictions,/story/sports/college/sooners/2026/01/01/ou-athletics-26-bold-predictions-year-2026-oklahoma-sooners-sec/87882971007/
"Newcastle girls, Crossings Christian boys win Mustang Holiday Classic",/story/sports/high-school/basketball/2025/12/31/oklahoma-high-school-basketball-newcastle-girls-crossings-christian-boys-win-mustang-holiday-classic/87979247007/
OSU suffers stunning collapse to Baylor in Big 12 women's basketball,/story/sports/college/cowboys/2025/12/31/oklahoma-state-baylor-score-big-12-womens-basketball-osu-cowgirls-bears/87974271007/
Life,/life/
THE FUTURE OF THE PAST Cowboy museum gets new look with first-of-its-kind exhibit,/story/entertainment/2026/01/01/national-cowboy-western-heritage-museum-gets-new-immersive-exhibit/87974370007/
Look at photos of the new OKC exhibit 'The Cowboy: An Immersive Journey',/picture-gallery/entertainment/2026/01/01/see-photos-of-okcs-national-cowboy-museums-new-immersive-journey/87974389007/
See Bono and The Edge play at the 2025 Woody Guthrie Prize event in Tulsa,/videos/entertainment/2025/12/31/see-2025-woody-guthrie-prize-honorees-bono-and-the-edge-perform-in-tulsa/87970658007/
Business,/business/
Resolution approved by council halts 2017 bond project for bike lanes,/story/business/transportation/2025/12/31/oklahoma-city-council-vote-halts-bicycle-lanes-on-classen-boulevard/87975898007/
"Former Chesapeake Energy west campus sold, housing planned at The Peake",/story/business/real-estate/2025/12/31/former-chesapeake-energy-campus-sold-new-housing-planned-for-site/87889261007/
OCC director removed after lengthy executive session,/story/business/energy-resource/2025/12/31/oklahoma-corporation-commission-removes-director-of-administration/87966497007/
Opinion,/opinion/
2026 soon will be here. What are your New Year's resolutions?,/story/opinion/columns/more-voices/2025/12/30/with-2026-just-around-the-corner-what-have-you-resolved-to-do-survey/87950790007/
Schools in Oklahoma are not graded using a bell curve Adam Tyner,/story/opinion/columns/guest/2025/12/31/oklahoma-does-not-use-a-bell-curve-for-school-report-cards-thats-a-myth/87891185007/
OU professor deserves an apology at minimum for illegal ICE detention William C. Wertz,/story/opinion/editorials/2025/12/31/ou-oklahoma-professor-detained-by-ice-owed-apology/87964290007/
Trending,https://www.usatoday.com/news/trending/
When are 2026's federal holidays? See the list.,/story/news/nation/2026/01/01/2026-federal-holiday-schedule-list/87969814007/
See New Year's Eve celebrations from across the US live,/story/news/nation/2025/12/31/watch-live-us-nye-2025-celebrations/87978493007/
Dog treats recalled due to Salmonella contamination,/story/money/2025/12/31/dog-treats-recalled-states-salmonella-contamination/87973176007/
,/picture-gallery/entertainment/2026/01/01/see-photos-of-okcs-national-cowboy-museums-new-immersive-journey/87974389007/
Nominate Today!,https://www.profootballhof.com/news/2025/09/pro-football-hall-of-fame-awards-of-character-recognize-extraordinary-individuals/?utm_source=Localiq&utm_medium=promo&utm_campaign=awards&&itm_campaign=PFHOF%20Awards%20of%20Character&itm_medium=con&itm_source=secondStreet
Vote Each Week!,https://www.oklahoman.com/sports/high-school/?itm_campaign=Athlete%20of%20the%20Week%20Landmark%20OKC&itm_medium=con&itm_source=secondStreet
Enter Now,https://www.kalahariresorts.com/win?itm_campaign=Get%20Kalaharid%20Away%20Winter%202026&itm_medium=con&itm_source=secondStreet#//?
Behind the work to improve access to mental health care in Oklahoma,/story/news/healthcare/2025/12/30/oklahoma-mental-health-care-access-improvements/86224235007/
How do Oklahoma colleges compare to the rest of the nation?,/story/news/education/2025/12/30/forbes-top-universities-college-rankings-ou-oklahoma-osu/87947583007/
Edmond Visual Arts Commission still reframing city's self perception,/story/news/local/edmond/2025/12/30/edmond-visual-arts-commission-oklahoma-public-art-program-growing-pains/87343600007/
"Newcastle girls, Crossings Christian boys win Mustang Holiday Classic",/story/sports/high-school/basketball/2025/12/31/oklahoma-high-school-basketball-newcastle-girls-crossings-christian-boys-win-mustang-holiday-classic/87979247007/
OSU suffers stunning collapse to Baylor in Big 12 women's basketball,/story/sports/college/cowboys/2025/12/31/oklahoma-state-baylor-score-big-12-womens-basketball-osu-cowgirls-bears/87974271007/
,https://cm.oklahoman.com/site-feedback/?platform=Tangent-Desktop&url=https%3A%2F%2Fwww.oklahoman.com%2F&marketName=oklahoman&cta=Right-Rail
