headline,href
See inside OKC's campaign ahead of the NBA arena vote in December,/story/news/local/2023/09/29/elections-2023-okc-thunder-nba-arena-campaign-mayor-david-holt/70984660007/
State education board asking for $47 million less than last year,/story/news/politics/state/2023/09/28/oklahoma-state-board-education-ryan-walters-why-budget-request-millions-less-2022/70991512007/
How RyJan Reininger carries family football legacy at OSD,/story/sports/high-school/football/2023/09/29/oklahoma-school-for-the-deaf-high-school-football-ryjan-reininger-family-legacy/70994270007/
"Edmond man going to mental facility, not prison, for fatally shooting his parents",/story/news/2023/09/29/edmond-oklahoma-man-not-guilty-reason-insanity-verdict-is-rare/70987341007/
Downtown OKC businesses still haven't fully recovered…,/story/business/real-estate/2023/09/28/okc-building-vacancies-businesses-impacted-work-from-home-covid/70866549007/
Vote now in the final round of our Best Barbecue Bracket,/story/lifestyle/food/2023/09/26/oklahoma-bbq-bedlam-vs-the-butcher-final-round-the-oklahoman-bracket/70965480007/
See what Public Eye investigations have found so far,/story/news/2023/09/19/public-eye-investigates-your-problems-around-okc-see-what-weve-found/70862250007/
The Oklahoman's Week 5 picks for every HS football game…,/story/sports/high-school/football/2023/09/27/oklahoma-high-school-football-week-5-picks-for-every-game-in-the-state/70982464007/
,
Daylight saving time 2023: When do the clocks 'fall…,/story/news/2023/09/12/daylight-savings-time-2023-when-do-we-fall-back-oklahoma/70830589007/
See inside OKC's campaign ahead of the NBA arena vote in December,/story/news/local/2023/09/29/elections-2023-okc-thunder-nba-arena-campaign-mayor-david-holt/70984660007/
State education board asking for $47 million less than last year,/story/news/politics/state/2023/09/28/oklahoma-state-board-education-ryan-walters-why-budget-request-millions-less-2022/70991512007/
"Edmond man going to mental facility, not prison, for fatally shooting his parents",/story/news/2023/09/29/edmond-oklahoma-man-not-guilty-reason-insanity-verdict-is-rare/70987341007/
How RyJan Reininger carries family football legacy at OSD,/story/sports/high-school/football/2023/09/29/oklahoma-school-for-the-deaf-high-school-football-ryjan-reininger-family-legacy/70994270007/
The Oklahoman's Week 5 picks for every HS football game in the state,/story/sports/high-school/football/2023/09/27/oklahoma-high-school-football-week-5-picks-for-every-game-in-the-state/70982464007/
Bixby still storming through Class 6A-I as it searches for identity,/story/sports/high-school/football/2023/09/29/bixby-vs-southmoore-score-oklahoma-high-school-football-2023-ossaa-week-5/70998655007/
Downtown OKC businesses still haven't fully recovered from COVID,/story/business/real-estate/2023/09/28/okc-building-vacancies-businesses-impacted-work-from-home-covid/70866549007/
These are the largest employers in Oklahoma,/story/business/employment/2023/09/27/oklahoma-employment-largest-employers-in-state-amazon-hobby-lobby-ou-osu/70962395007/
Commercial real estate transactions from across the Oklahoma City area,/story/business/real-estate/2023/09/22/okc-commercial-real-estate-transactions-september-2023/70909436007/
Muscogee (Creek) Nation Recognizes Freedmen civil rights Carla D. Pratt,/story/opinion/2023/09/28/why-tribal-court-reversed-denying-citizenship-to-freedmen-decendants/70995144007/
"Guest: Suicide takes immeasurable toll, but help is available Tony Stelter",/story/opinion/2023/09/28/oklahomans-reach-out-for-any-mental-health-support-you-need-call-988/70967015007/
"Obstructionism, threats to shutdown the government is not governing Kendra Horn",/story/opinion/2023/09/27/kendra-horn-says-congress-needs-work-horses-not-social-media-influencers/70985331007/
National Coffee Day 2023: Where to get a deal on your daily cup,/story/money/food/2023/09/28/national-coffee-day-2023-deals-dunkin-starbucks/70970235007/
Meet the Oklahoma couple who dressed up as Taylor-Travis for Halloween in 2020,/story/entertainment/celebrities/2023/09/28/oklahoma-couple-dressed-taylor-travis-halloween-2020/70992398007/
Lego working to find more sustainable product alternative by 2032,/story/money/2023/09/28/lego-sustainable-product-alternative-2032/70996408007/
Vote now in the final round of our Best Barbecue Bracket,/story/lifestyle/food/2023/09/26/oklahoma-bbq-bedlam-vs-the-butcher-final-round-the-oklahoman-bracket/70965480007/
Java Jolt: 16 great shops to visit for National Coffee Day,/story/lifestyle/food/2023/09/29/national-coffee-day-2023-deals-okc-october-1/70980646007/
Myriad Gardens alive with Monarch Butterflies,/picture-gallery/lifestyle/features/2023/09/27/monarch-butterfly-migration-in-oklahoma-city-myriad-gardens/70982995007/
,/picture-gallery/news/2023/09/28/oklahoma-state-board-education-september-meeting-ryan-walters-protestors/70992257007/
ENTER TODAY,https://usatoday.gannettcontests.com/Cayman-Islands-Dept-of-Tourism-Dream-Getaway/?itm_campaign=Cayman%20Islands%20Dream%20Getaway&itm_medium=con&itm_source=secondStreet
NOMINATE TODAY,https://oklahoman.gannettcontests.com/Cardiovascular-Health-Clinic-Amazing-Teachers/rounds/1/gallery?itm_campaign=Cardiovascular%20Health%20Clinic%20Amazing%20Teacher%20Awards&itm_medium=con&itm_source=secondStreet
Vote Every Week!,https://www.oklahoman.com/sports/high-school/?itm_campaign=Athlete%20of%20the%20Week%20Landmark%20OKC&itm_medium=con&itm_source=secondStreet
See a full list of fall events around Oklahoma through November,/story/entertainment/2023/09/29/things-to-do-oklahoma-fall-2023-tulsa-state-fair-okc-shows/70995444007/
"Why Gov. Stitt, former governors are planning a fireside chat next week",/story/news/2023/09/29/governor-kevin-stitt-guthrie-oklahoma-territorial-museum-fireside-chat/70991992007/
What impacts could a 2028 Olympics event in OKC have? Your questions answered,/story/news/2023/09/28/2028-summer-olympics-okc-whitewater-rapids-event-impacts/70859852007/
Monarch butterflies in peak migration in Oklahoma. Where to see them.,/story/news/2023/09/28/peak-monarch-butterfly-migration-locations-oklahoma-2023/70989026007/
How to see the traveling Vietnam memorial wall replica in Oklahoma,/story/news/2023/09/28/fort-reno-oklahoma-vietnam-war-memorial-wall-display/70980037007/
,https://cm.oklahoman.com/site-feedback/?platform=Tangent-Desktop&url=https%3A%2F%2Fwww.oklahoman.com%2F&marketName=oklahoman&cta=Right-Rail
