headline,href
Live: What time does the eclipse start in Oklahoma? Cloud cover?,/story/news/state/2024/04/08/live-updates-2024-solar-eclipse-today-in-oklahoma/73215887007/
"The eclipse is here, but so are the clouds. What to know",/story/news/2024/04/08/solar-eclipse-2024-see-forecast-live-cloud-cover-for-oklahoma-eclipse/73215581007/
The 2024 solar eclipse is today! Here's everything you need to know,/story/news/2024/04/08/solar-eclipse-2024-is-today-everything-you-need-to-know-in-oklahoma/73215620007/
"This tiny Oklahoma town is ready for 100,000 eclipse visitors",/story/news/2024/04/08/hochatown-broken-bow-oklahoma-solar-eclipse-2024/73206266007/
Wildfires in western Oklahoma prompt request for…,/story/news/2024/04/07/evacuation-centers-opened-after-wildfires-in-woodward-county-oklahoma/73235840007/
See live Oklahoma eclipse traffic with this map,/story/news/2024/04/07/2024-eclipse-see-live-oklahoma-eclipse-traffic-with-this-map/73221930007/
Powerball winning numbers for jackpot worth $1.3 billion,/story/money/lottery/2024/04/06/powerball-winning-numbers/73229046007/
Oklahoma eclipse viewing will 'not be ideal' due to low…,/story/news/2024/04/06/low-clouds-predicted-to-impede-oklahoma-view-during-2024-solar-eclipse/73215553007/
Oklahoma State's A.J. Green tasked with backing up Ollie…,/story/sports/college/cowboys/2024/04/08/oklahoma-state-football-a-j-green-backing-up-ollie-gordon-ii-osu-cowboys-big-12/73218280007/
,
Live: What time does the eclipse start in Oklahoma? Cloud cover?,/story/news/state/2024/04/08/live-updates-2024-solar-eclipse-today-in-oklahoma/73215887007/
"The eclipse is here, but so are the clouds. What to know",/story/news/2024/04/08/solar-eclipse-2024-see-forecast-live-cloud-cover-for-oklahoma-eclipse/73215581007/
The 2024 solar eclipse is today! Here's everything you need to know,/story/news/2024/04/08/solar-eclipse-2024-is-today-everything-you-need-to-know-in-oklahoma/73215620007/
Thunder-Hornets takeaways: OKC snap three-game skid in road finale,/story/sports/nba/thunder/2024/04/07/okc-thunder-vs-charlotte-hornets-score-nba-highlights-aaron-wiggins/73239591007/
Oklahoma State's A.J. Green tasked with backing up Ollie Gordon II,/story/sports/college/cowboys/2024/04/08/oklahoma-state-football-a-j-green-backing-up-ollie-gordon-ii-osu-cowboys-big-12/73218280007/
The Oklahoman's 2024 All-City high school girls swimming roster,/story/sports/high-school/swimming-diving/2024/04/08/oklahoma-high-school-girls-swimming-the-oklahomans-2024-all-city-team/73235281007/
Here's a look at unusual stops on the 2024 OKC-area Architecture Tour,/story/business/real-estate/2024/04/08/oklahoma-city-architecture-tour-willa-d-johnson-first-united-bank-moore/73178915007/
Commercial real estate transactions from across the Oklahoma City area,/story/business/real-estate/2024/04/05/commercial-real-estate-transactions-from-across-the-oklahoma-city-area/73195163007/
Lawton plant to manufacture platform to link national defense systems,/story/business/real-estate/2024/04/04/lawton-ok-getting-picogrid-factory-military-uses/73122400007/
Why do we hate people who are different from 'mainstream' Americans? Nancy E. Snow,/story/opinion/columns/2024/04/08/anti-lgtbq-climate-oklahoma-leads-bullying-suicide-nex-benedict/73163617007/
Stitt's family values vision needs to include those with disabilities Richard Anderson,/story/opinion/columns/2024/04/08/oklahomans-need-updated-disability-laws-gov-kevin-stitt-opinion/73164461007/
Muckraking journalist's greatest claim to fame came in OKC Jack McElroy,/story/opinion/2024/04/07/carl-magee-oklahoma-journalist-invented-parking-meter/73163627007/
April 8 eclipse deals and specials: Some emerge now ahead of event,/story/money/2024/03/27/2024-eclipse-food-deals/73104573007/
Solar eclipse day is here! See photos from across the US,/story/news/nation/2024/04/08/2024-total-solar-eclipse-photos/73215249007/
"When is the next total solar eclipse after 2024? Future date, path explained",/story/news/nation/2024/04/08/when-is-the-next-total-solar-eclipse-after-2024/73221296007/
"On CMT Music Awards red carpet, Toby Keith's children remember him",/story/entertainment/2024/04/08/toby-keiths-children-lainey-wilson-trisha-yearwood-remember-him-on-cmt-music-awards-red-carpet/73239607007/
Add these 10 can't-miss places to your Oklahoma bucket list,/story/lifestyle/travel/2024/04/08/10-must-see-places-to-add-to-your-oklahoma-bucket-list/73094390007/
"Adopt a pet: Meet Pita, Gin and Tonic and others at shelters",/story/lifestyle/2024/04/08/meet-pita-tonic-gin-scrappy-others-at-okc-area-animal-shelters/73176993007/
,/picture-gallery/sports/college/big-12/2024/04/06/ou-baseball-faces-osu-in-game-2-of-bedlam-see-our-best-photos/73229272007/
ENTER NOW! ENTER OFTEN!,https://oklahoman.gannettcontests.com/Swadleys-Catering-Co-Catered-Party/?itm_campaign=Swadley%E2%80%99s%20Catering%20Co.%20-%20Catered%20Party%20Giveaway!&itm_medium=con&itm_source=secondStreet
Don’t Miss Out!,https://oklahoman.gannettcontests.com/2024-Home-and-Garden-Refresh/?itm_campaign=2024%20Home%20%26amp%3B%20Garden%20Refresh%20-%20The%20Oklahoman&itm_medium=con&itm_source=secondStreet
ENTER TODAY,https://usatoday.gannettcontests.com/Bourbon-and-Beyond-VIP-Experience-2024/?itm_campaign=Bourbon%20and%20Beyond%202024&itm_medium=con&itm_source=secondStreet
"On CMT Music Awards red carpet, Toby Keith's children remember him",/story/entertainment/2024/04/08/toby-keiths-children-lainey-wilson-trisha-yearwood-remember-him-on-cmt-music-awards-red-carpet/73239607007/
Here's a look at unusual stops on the 2024 OKC-area Architecture Tour,/story/business/real-estate/2024/04/08/oklahoma-city-architecture-tour-willa-d-johnson-first-united-bank-moore/73178915007/
"Senator waging personal war to fight diabetes, insulin costs",/story/news/politics/government/2024/04/08/oklahoma-legislature-senator-carri-hicks-diabetes-advocacy-day-insulin-costs/73216915007/
Why do we hate people who are different from 'mainstream' Americans?Nancy E. Snow,/story/opinion/columns/2024/04/08/anti-lgtbq-climate-oklahoma-leads-bullying-suicide-nex-benedict/73163617007/
Human hive in Edmond ensures future for endangered colony of bees,/story/news/local/2024/04/08/beekeepers-chiropractor-and-landscaper-team-up-rescue-honeybees-edmond-ok/72977982007/
,https://cm.oklahoman.com/site-feedback/?platform=Tangent-Desktop&url=https%3A%2F%2Fwww.oklahoman.com%2F&marketName=oklahoman&cta=Right-Rail
