headline,href
"Tribal leaders say Stitt's speech misrepresents Oklahoma's past, present",/story/news/politics/2026/02/04/oklahoma-tribal-leaders-condemn-kevin-stitt-state-of-the-state-remarks/88493396007/
"Nonprofit builds 'villages' of help for Black moms-to-be, families",/story/news/healthcare/2026/02/04/imanis-village-okc-oklahoma-black-families-community-nonprofit/87253365007/
Oklahoma Episcopal bishop signs immigration crackdown letter,/story/news/2026/02/04/oklahoma-episcopal-bishop-immigration-ice-border-patrol-minnesota-letter/88490967007/
Is OK County-owned building being remodeled for DA a 'money pit'?,/story/news/2026/02/04/oklahoma-county-investors-capital-building-renovation-district-attorney-da-cost/88481114007/
Help us honor 250 women who shaped the United States,/story/news/local/2026/01/20/usa-today-women-who-shaped-the-nation-nomination-form-oklahoma-city/88264855007/
Patty Gasso says this OU freshman swings like the…,/story/sports/college/sooners/2026/02/04/ou-softball-catcher-kendall-wells-impresses-patty-gasso-oklahoma-sooners/88479502007/
"Will VAST, other Devon restaurants close with HQ move to…",/story/entertainment/dining/2026/02/03/vast-okc-devon-tower-restaurants-affected-by-headquarters-move/88478384007/
,
Vote: Landmark Fine Homes HS boys athlete of week for…,/story/sports/high-school/athlete-of-the-week/2026/02/02/vote-landmark-fine-homes-high-school-boys-athlete-of-week-for-jan-26-feb-1/88479983007/
Vote: Landmark Fine Homes HS girls athlete of week for…,/story/sports/high-school/athlete-of-the-week/2026/02/02/vote-landmark-fine-homes-high-school-girls-athlete-of-week-for-jan-26-feb-1/88480212007/
News,/news/
"Tribal leaders say Stitt's speech misrepresents Oklahoma's past, present",/story/news/politics/2026/02/04/oklahoma-tribal-leaders-condemn-kevin-stitt-state-of-the-state-remarks/88493396007/
"Nonprofit builds 'villages' of help for Black moms-to-be, families",/story/news/healthcare/2026/02/04/imanis-village-okc-oklahoma-black-families-community-nonprofit/87253365007/
Oklahoma Episcopal bishop signs immigration crackdown letter,/story/news/2026/02/04/oklahoma-episcopal-bishop-immigration-ice-border-patrol-minnesota-letter/88490967007/
Sports,/sports/
Who will sign with OSU football Wednesday? A look at key additions,/story/sports/college/cowboys/2026/02/04/oklahoma-state-football-signing-day-2026-key-additions-osu-cowboys/88494019007/
Thunder dominates Magic as SGA extends his historic scoring streak,/story/sports/nba/thunder/2026/02/03/thunder-vs-magic-score-nba-shai-gilgeous-alexander-isaiah-hartenstein-stats/88501048007/
Patty Gasso says this OU freshman swings like the program greats,/story/sports/college/sooners/2026/02/04/ou-softball-catcher-kendall-wells-impresses-patty-gasso-oklahoma-sooners/88479502007/
Life,/life/
Oklahoma City student has designs on winning national phone contest,/story/lifestyle/features/2026/02/04/okc-boys-and-girls-club-oklahoma-county-phone-case-design-contest/88302574007/
"Will VAST, other Devon restaurants close with HQ move to Houston?",/story/entertainment/dining/2026/02/03/vast-okc-devon-tower-restaurants-affected-by-headquarters-move/88478384007/
"Meet OKC mothers, babies and the doulas who helped them",/picture-gallery/lifestyle/features/2026/02/04/imanis-village-christmas-wonderland-2025-okc-st-john-missionary-baptist-church/87708579007/
Business,/business/
"Will $2,000 tariff checks come in February? Latest from SCOTUS, Trump",/story/business/economy/2026/02/03/will-we-get-2000-tariff-checks-in-february-latest-from-trump-scotus/88489739007/
"Will we get $2,000 tariff checks with tax refunds? Latest updates",/story/business/economy/2026/02/03/2000-tariff-checks-this-tax-season-latest-trump-comments-stimulus-checks/88489317007/
Devon moving HQ is latest hit to Oklahoma's status as energy hub,/story/business/energy-resource/2026/02/03/devon-coterra-merger-other-businesses-that-have-left-oklahoma/88480195007/
Opinion,/opinion/
The Oklahoman endorses David Holt for a third term as OKC mayor,/story/opinion/editorials/2026/02/04/holt-a-low-key-diplomat-should-be-reelected-editorial/88492121007/
How do you feel about Devon Energy moving headquarters? Tell us,/story/opinion/columns/more-voices/2026/02/03/devon-coterra-merger-how-will-okc-devon-tower-be-impacted-survey/88488013007/
"If you're a teacher, we'd like to hear directly from you William C. Wertz",/story/opinion/columns/more-voices/2026/02/03/tell-us-your-experiences-were-asking-for-feedback-from-oklahoma-teachers-survey/88411560007/
Trending,https://www.usatoday.com/news/trending/
All Bahama Breeze restaurants set to close. See locations,/story/money/food/2026/02/03/bahama-breeze-closing/88498178007/
Mega Millions winning numbers for Feb. 3 drawing: $323M jackpot,/story/money/lottery/2026/02/03/mega-millions-winning-numbers-february-3-jackpot-drawing/88498926007/
"Jackie and Shadow, beloved bald eagles, lose eggs to raven attack",/story/news/nation/2026/02/03/eagles-jackie-shadow-lose-eggs-raven-california/88495393007/
Shopping,/shopping/
Heading to the World Cup? Rent an RV for affordable + flexible travel,/story/shopping/2026/02/04/outdoorsy-rv-rental-world-cup-2026/88187544007/
Is longevity the new gut health? Discover mitochondria‑boosting gummies,https://www.usatoday.com/story/shopping/2026/01/29/shop-timeline-mitopure-supplements-gummies/88362865007/
Shop the best Amazon deals and offers today,https://www.usatoday.com/story/shopping/best-amazon-deals-today/88032223007/
,/picture-gallery/lifestyle/features/2026/02/04/imanis-village-christmas-wonderland-2025-okc-st-john-missionary-baptist-church/87708579007/
ENTER NOW,https://usatoday.gannettcontests.com/State-Farm-Big-Game-/?itm_campaign=State%20Farm%20Big%20Game%20Sweepstakes&itm_medium=con&itm_source=secondStreet
Nominate Today!,https://www.profootballhof.com/news/2025/09/pro-football-hall-of-fame-awards-of-character-recognize-extraordinary-individuals/?utm_source=Localiq&utm_medium=promo&utm_campaign=awards&&itm_campaign=PFHOF%20Awards%20of%20Character&itm_medium=con&itm_source=secondStreet
Vote Each Week!,https://www.oklahoman.com/sports/high-school/?itm_campaign=Athlete%20of%20the%20Week%20Landmark%20OKC&itm_medium=con&itm_source=secondStreet
Grandmother behind Oklahoma Panhandle double murder sentenced to prison,/story/news/2026/02/04/tifany-adams-oklahoma-panhandle-2024-double-murder-life-in-prison-sentence/88492227007/
Oklahoma City student has designs on winning national phone contest,/story/lifestyle/features/2026/02/04/okc-boys-and-girls-club-oklahoma-county-phone-case-design-contest/88302574007/
Who will sign with OSU football Wednesday? A look at key additions,/story/sports/college/cowboys/2026/02/04/oklahoma-state-football-signing-day-2026-key-additions-osu-cowboys/88494019007/
Thunder dominates Magic as SGA extends his historic scoring streak,/story/sports/nba/thunder/2026/02/03/thunder-vs-magic-score-nba-shai-gilgeous-alexander-isaiah-hartenstein-stats/88501048007/
"20 arrested in Operation Blunt Force targeting illegal pot farms, AG says",/story/news/crime/2026/02/03/20-arrested-after-investigation-of-illegal-oklahoma-pot-farms-ag-says/88480633007/
,https://cm.oklahoman.com/site-feedback/?platform=Tangent-Desktop&url=https%3A%2F%2Fwww.oklahoman.com%2F&marketName=oklahoman&cta=Right-Rail
