headline,href
Midwest City hopes to raze abandoned Heritage Park Mall as litigation continues,/story/business/real-estate/2025/01/14/heritage-park-mall-midwest-city-future-awaiting-razing/75874753007/
A look at potential candidates for Oklahoma governor,/story/news/2025/01/14/oklahoma-elections-2026-governor-confirmed-potential-candidates-gentner-drummond-ryan-walters/77671337007/
"Education, health care top Senate Democrats' 2025 policy agenda",/story/news/politics/government/2025/01/14/oklahoma-legislative-session-2025-senate-democrat-agenda-education-health-are/77672564007/
AG Gentner Drummond announces his bid for Oklahoma governor,/story/news/politics/state/2025/01/13/oklahoma-elections-gentner-drummond-campaign-governor-2026/77603880007/
"Blake Griffin, Trae Young announce merger of AAU teams",/story/sports/high-school/basketball/2025/01/14/blake-griffin-trae-young-announce-merger-of-aau-teams/77627826007/
Philadelphia 76ers' Joel Embiid is out with foot injury…,/story/sports/nba/thunder/2025/01/14/thunder-76ers-prediction-picks-odds-latest-news-injury-updates-alex-caruso-joel-embiid/77680723007/
"What channel is OSU vs BYU on today? Time, TV schedule",/story/sports/college/cowboys/2025/01/14/oklahoma-state-byu-channel-today-time-tv-schedule-streaming-info-mens-basketball/77676854007/
"OSU vs Houston channel today, time, TV schedule…",/story/sports/college/cowboys/2025/01/14/oklahoma-state-womens-basketball-houston-channel-today-time-tv-schedule-streaming-info/77676381007/
,
Alex Caruso injury update: OKC Thunder guard set to…,/story/sports/nba/thunder/2025/01/13/alex-caruso-injury-update-okc-thunder-guard-philadelphia-76ers/77681324007/
A look at potential candidates for Oklahoma governor,/story/news/2025/01/14/oklahoma-elections-2026-governor-confirmed-potential-candidates-gentner-drummond-ryan-walters/77671337007/
"Education, health care top Senate Democrats' 2025 policy agenda",/story/news/politics/government/2025/01/14/oklahoma-legislative-session-2025-senate-democrat-agenda-education-health-are/77672564007/
AG Gentner Drummond announces his bid for Oklahoma governor,/story/news/politics/state/2025/01/13/oklahoma-elections-gentner-drummond-campaign-governor-2026/77603880007/
Why did Sophia Bordi reclassify to join OU early? It was a 'necessity',/story/sports/college/sooners/2025/01/14/ou-softball-sophia-bordi-reclassify-2024-recruiting-class-patty-gasso-sec-oklahoma-sooners/77625016007/
Which OKC-area boys basketball games should you watch this week?,/story/sports/high-school/basketball/2025/01/14/oklahoma-high-school-boys-basketball-games-of-the-week-january-13-19/77676572007/
"Blake Griffin, Trae Young announce merger of AAU teams",/story/sports/high-school/basketball/2025/01/14/blake-griffin-trae-young-announce-merger-of-aau-teams/77627826007/
Midwest City hopes to raze abandoned Heritage Park Mall as litigation continues,/story/business/real-estate/2025/01/14/heritage-park-mall-midwest-city-future-awaiting-razing/75874753007/
Ardent Health plans to expand EMS services to several Oklahoma cities,/story/business/local/2025/01/13/more-ambulatory-services-coming-to-oklahoma-through-acquisition/77492360007/
"When does the IRS start accepting tax returns? See deadlines, tips",/story/business/finance/2025/01/13/when-does-the-irs-start-accepting-tax-returns-2025-tax-deadline-tips/77666841007/
How do you feel about changing the limits on deer hunting? Vote,/story/opinion/2025/01/14/oklahoma-deer-bag-limit-legislature-may-reduce-survey/77655903007/
"70,000 OK homes, businesses on track to receive high-speed internet Mike Sanders",/story/opinion/columns/2025/01/13/oklahoma-broadband-internet-grants-rural-communities/77588827007/
What was Ryan Walters' grade in Oklahoman Poll? William C. Wertz,/story/opinion/columns/your-voice/2025/01/13/oklahoman-readers-performance-poll-ryan-walters-grade-2024-bible-controversy-schools-pornography/77593968007/
"What to know about Pete Hegseth's confirmation hearing, how to watch",/story/news/politics/2025/01/14/pete-hegseth-senate-confirmation-hearing-details/77683173007/
DirecTV's new MySports streaming service. Now in these 24 cities.,/story/sports/2025/01/14/directv-new-sports-streaming-service-mysports/77684046007/
'You're alive!' Wildfire victim's emotional reunion with Oreo the dog,/story/news/nation/2025/01/13/california-wildfires-pets-dogs-reunions/77681644007/
Get $300 off a luxe Saatva mattress and white glove delivery for free,/story/shopping/2025/01/08/saatva-new-year-mattress-sale/77548840007/
You can get a one-year BJ's membership for 75% off this January,/story/shopping/2025/01/13/bjs-membership-discount-groupon-2025/77676428007/
Are you ready for an emergency? Pack these essentials so you're prepared,/story/shopping/2025/01/09/emergency-go-bag-what-to-pack/77586914007/
The Drake Seafood and Oysterette is closing. What we know,/story/lifestyle/food/2025/01/13/restaurants-closing-in-okc-the-drake-seafood-oysterette/77672686007/
Dining guide OKC: Where to eat in each neighborhood in 2025,/picture-gallery/lifestyle/food/2025/01/13/okc-restaurants-where-to-eat-in-each-neighborhood/77668681007/
When would TikTok be banned? What to know after Supreme Court hearing,/story/entertainment/2025/01/13/is-tiktok-getting-banned-whats-next-after-supreme-court-hearing/77598228007/
,/picture-gallery/sports/nba/thunder/2025/01/02/okc-thunder-vs-l-a-clippers-at-paycom-center-see-our-top-photos/77411304007/
Enter Your Pet Photo Today,https://newsok.gannettcontests.com/USAs-Favorite-Pet/?itm_campaign=2024%20USAs%20Favorite%20Pet%20Photos%20Non-Sponsored&itm_medium=con&itm_source=secondStreet
Check out the Winners!,https://cdn.gatehousemedia.com/gh-sites/global/ads/contests/winners/2024wishwinWINNERS_RV2.pdf?itm_campaign=2024%20Wish%20and%20Win%20winners%20phase%202&itm_medium=con&itm_source=secondStreet
Congratulations Winners!,https://cdn.gatehousemedia.com/gh-sites/global/ads/contests/winners/2024FootballFandom_WinnerAd.pdf?itm_campaign=2024%20Football%20Fandom%20Winners&itm_medium=con&itm_source=secondStreet
Which is bigger threat to Thunder in West? Mavericks or Nuggets?,/story/sports/nba/thunder/2025/01/14/okc-thunder-western-conference-nba-playoffs-dallas-mavericks-denver-nuggets/77678730007/
Why did Sophia Bordi reclassify to join OU early? It was a 'necessity',/story/sports/college/sooners/2025/01/14/ou-softball-sophia-bordi-reclassify-2024-recruiting-class-patty-gasso-sec-oklahoma-sooners/77625016007/
How do you feel about changing the limits on deer hunting? Vote,/story/opinion/2025/01/14/oklahoma-deer-bag-limit-legislature-may-reduce-survey/77655903007/
"Oklahoma high school fall sports All-State, All-City teams for 2024",/story/sports/high-school/2025/01/12/oklahoma-high-school-football-softball-volleyball-cross-country-2024-all-state-city-teams-ossaa/77581436007/
Which OKC-area boys basketball games should you watch this week?,/story/sports/high-school/basketball/2025/01/14/oklahoma-high-school-boys-basketball-games-of-the-week-january-13-19/77676572007/
,https://cm.oklahoman.com/site-feedback/?platform=Tangent-Desktop&url=https%3A%2F%2Fwww.oklahoman.com%2F&marketName=oklahoman&cta=Right-Rail
