headline,href
Oklahoma officially joins SEC. Time to adapt to new world for Sooners.,/story/sports/college/sooners/2024/07/01/ou-football-sec-partnership-oklahoma-sooners-fans-conference-realignment/74270104007/
Why Isaiah Hartenstein is perfect fit for Thunder in NBA free agency,/story/sports/nba/thunder/2024/07/01/okc-thunder-isaiah-hartenstein-nba-free-agency-perfect-fit-chris-paul-nutmeg/74273186007/
Take 'A Look Inside' the making of the movie 'Twisters' in Oklahoma,/story/entertainment/2024/07/01/twisters-2024-oklahoma-behind-the-scenes-feature-a-look-inside/74269815007/
Weigh in: Supreme Court rules presidents immune from some prosecution,/story/opinion/2024/07/01/supreme-court-immunity-trump-ruling-share-your-thoughts/74269805007/
Want to expand your comprehension of our state…,/story/opinion/columns/2024/07/01/opinion-reading-books-about-oklahoma-is-a-good-way-to-pass-time-during-summer/74195015007/
"25 years ago, Bricktown canal set the course for OKC's…",/story/news/local/2024/07/01/the-bricktown-canal-at-25-okcs-image-transformed-with-waterway/74249966007/
"OKC officer arrested, charged with rape, kidnapping",/story/news/2024/06/30/alleged-victim-accuses-oklahoma-city-police-officer-of-kidnapping-rape/74261589007/
OG&E bills set to increase starting July 1,/story/news/2024/06/26/oge-oklahoma-raises-rates-customers-corporation-commission/74207720007/
Did former Lincoln Riley run away from SEC? Joe…,/story/sports/college/sooners/2024/07/01/lincoln-riley-joe-castiglione-oklahoma-sooners-sec-move/74275821007/
,
"Marches, memories and Mary Poppins: Our best photos in June",/picture-gallery/news/2024/07/01/wcws-okc-zoo-the-oklahoman-best-photos-june-2024/74254922007/
5 notable Oklahoma laws are going into effect today: What to know,/story/news/politics/2024/07/01/new-laws-in-oklahoma-these-bills-go-into-effect-on-july-1/74270078007/
Natural gas companies want lawsuit over 2021 prices dismissed or moved,/story/news/2024/07/01/oklahoma-natural-gas-price-surge-2021-winter-storm-attorney-general-lawsuit/74268711007/
Oklahoma officially joins SEC. Time to adapt to new world for Sooners.,/story/sports/college/sooners/2024/07/01/ou-football-sec-partnership-oklahoma-sooners-fans-conference-realignment/74270104007/
Why Isaiah Hartenstein is perfect fit for Thunder in NBA free agency,/story/sports/nba/thunder/2024/07/01/okc-thunder-isaiah-hartenstein-nba-free-agency-perfect-fit-chris-paul-nutmeg/74273186007/
Did former Lincoln Riley run away from SEC? Joe Castiglione hints at it,/story/sports/college/sooners/2024/07/01/lincoln-riley-joe-castiglione-oklahoma-sooners-sec-move/74275821007/
Beverly Hills brokerage The Agency Oklahoma City opens in Edmond,/story/business/real-estate/2024/06/27/buying-beverly-hills-mauricio-umansky-opens-the-agency-okc-real-housewives-beverly-hills/74207651007/
Arts Institute ready for space at Edmond park after plans finalized,/story/business/real-estate/2024/06/14/edmond-fine-arts-institute-ready-for-space-at-new-art-park-oklahoma-okc-oklahoma-city/74083792007/
"Oklahoma wheat harvest is more than half complete, with varying yields",/story/business/agricultural/2024/06/14/oklahoma-hard-red-winter-wheat-harvest-more-than-half-done-despite-weather-rain-challenges/74084467007/
Weigh in: Supreme Court rules presidents immune from some prosecution,/story/opinion/2024/07/01/supreme-court-immunity-trump-ruling-share-your-thoughts/74269805007/
Let's focus on the truth: Inflation isn’t all Biden’s fault. Kody Macaulay,/story/opinion/columns/2024/07/01/us-representative-tom-cole-biden-inflation/74267338007/
Want to expand your comprehension of our state? Okie-centric books can help Russ Florence,/story/opinion/columns/2024/07/01/opinion-reading-books-about-oklahoma-is-a-good-way-to-pass-time-during-summer/74195015007/
Stamp prices set for 7% increase this month: Here’s what to know,/story/news/nation/2024/07/01/forever-stamp-cost-increase-2024/74274985007/
AccuWeather says X added misinformation to hurricane forecast,/story/news/nation/2024/07/01/accuweather-calls-x-community-note-false/74274093007/
Man drowns after helping 'struggling' grandchild stay afloat near dam,/story/news/nation/2024/07/01/grandfather-drowns-in-wisconsin-dam/74240751007/
Take 'A Look Inside' the making of the movie 'Twisters' in Oklahoma,/story/entertainment/2024/07/01/twisters-2024-oklahoma-behind-the-scenes-feature-a-look-inside/74269815007/
"New ownership gifts Nonesuch team excitement, momentum change",/story/lifestyle/food/2024/07/01/change-in-nonesuch-ownership-leads-to-renewed-excitement-experimentation/74270824007/
Consider favorites when contributing food to a neighborhood event,/story/lifestyle/2024/07/01/good-neighbor-wonders-what-to-bring-to-neighborhood-event/74246322007/
,/picture-gallery/sports/2024/07/01/ou-football-southeastern-conference-celebrations-toby-keith-photos/74269005007/
ENTER TODAY!,https://usatoday.gannettcontests.com/Service-Experts-Home-of-the-Future/?itm_campaign=Service%20Experts%20Gordons%20Home%20of%20the%20Future&itm_medium=con&itm_source=secondStreet
"Marches, memories and Mary Poppins: Our best photos in June",/picture-gallery/news/2024/07/01/wcws-okc-zoo-the-oklahoman-best-photos-june-2024/74254922007/
5 notable Oklahoma laws are going into effect today: What to know,/story/news/politics/2024/07/01/new-laws-in-oklahoma-these-bills-go-into-effect-on-july-1/74270078007/
Natural gas companies want lawsuit over 2021 prices dismissed or moved,/story/news/2024/07/01/oklahoma-natural-gas-price-surge-2021-winter-storm-attorney-general-lawsuit/74268711007/
Let's focus on the truth: Inflation isn’t all Biden’s fault.Kody Macaulay,/story/opinion/columns/2024/07/01/us-representative-tom-cole-biden-inflation/74267338007/
"In historic ruling, Supreme Court grants Trump significant presidential immunity",/story/news/politics/elections/2024/07/01/supreme-court-decision-donald-trump-immunity-updates/73702989007/
,https://cm.oklahoman.com/site-feedback/?platform=Tangent-Desktop&url=https%3A%2F%2Fwww.oklahoman.com%2F&marketName=oklahoman&cta=Right-Rail
