headline,href
Why OKC should embrace canoe slalom ahead of 2028 Olympic Games,/story/sports/olympics/2024/07/30/oklahoma-city-canoe-slalom-2028-olympic-games/74593331007/
Oklahoma Corporation Commissioner Todd Hiett accused of groping man,/story/news/2024/07/29/oklahoma-corporation-commission-todd-hiett-accused-groping-conference-minnesota/74583362007/
This OKC favorite made the list of USA TODAY's best bars,/story/lifestyle/food/2024/07/29/ednas-okc-usa-today-best-bars-2024/74283965007/
What is Oklahoma's minimum wage? Is it enough to live on?Todd Pendleton,/story/opinion/2024/07/30/oklahoma-minimum-wage-cost-of-living-comparisons/74589575007/
Latest inmate death at Oklahoma County jail makes five…,/story/news/2024/07/29/latest-inmate-death-at-oklahoma-county-jail-makes-five-this-year/74595550007/
What to know about the new restaurant at The Ambassador…,/story/lifestyle/food/2024/07/30/the-chalkboard-kitchen-bar-opens-ambassador-hotel-okc/74589270007/
The Oklahoman's 2025 Super 30 high school football…,/story/sports/high-school/football/2024/06/22/oklahoma-high-school-football-2025-super-30-recruiting-series/74183734007/
Oklahoma high school spring sports awards 2024 in…,/story/sports/high-school/2024/06/13/oklahoma-high-school-spring-sports-awards-2024-baseball-golf-soccer-slowpitch-tennis-track-field/74081171007/
,
Tips for helping seniors beat the heat,/story/lifestyle/2024/07/30/savvy-senior-how-extreme-heat-affects-seniors-tips-to-stay-safe/74528453007/
Oklahoma Corporation Commissioner Todd Hiett accused of groping man,/story/news/2024/07/29/oklahoma-corporation-commission-todd-hiett-accused-groping-conference-minnesota/74583362007/
"State senator legally allowed to attend closed meeting, AG tells Ryan Walters",/story/news/education/2024/07/30/ryan-walters-oklahoma-state-board-education-senator-mary-boren-closed-meeting/74570311007/
"Why ACLU, other groups support OU in lawsuit filed by white students",/story/news/education/campus/2024/07/30/ou-oklahoma-aclu-federal-lawsuit-financial-discrimination-white-students/74573558007/
Why OKC should embrace canoe slalom ahead of 2028 Olympic Games,/story/sports/olympics/2024/07/30/oklahoma-city-canoe-slalom-2028-olympic-games/74593331007/
"Canada vs Australia score updates, TV channel for 2024 Paris Olympics",/story/sports/olympics/2024/07/30/canada-australia-live-updates-score-highlights-2024-paris-olympics-basketball/74595329007/
Best Oklahoma RBs in 2024 OSSAA season? See our ranking,/story/sports/high-school/football/2024/07/30/oklahoma-high-school-football-rb-rankings-2024/74527870007/
"Gardner Tanenbaum buys Robinson Renaissance, plans more housing",/story/business/real-estate/2024/07/27/downtown-okc-robinson-renaissance-purchased-upscale-housing/74564988007/
Biden rent control plan gets renters' attention and owners' derision,/story/business/real-estate/2024/07/27/joe-biden-president-rent-control-plan-pontential-impacts-oklahoma/74430958007/
Conn's HomePlus stores are closing in Oklahoma: Where they are,/story/business/real-estate/2024/07/26/conns-homes-bankruptcy-oklahoma-store-closures-okc-tulsa/74557716007/
What is Oklahoma's minimum wage? Is it enough to live on? Todd Pendleton,/story/opinion/2024/07/30/oklahoma-minimum-wage-cost-of-living-comparisons/74589575007/
I'm a Christian parent. Let me decide what to teach my kids Janelle Stecklein,/story/opinion/columns/2024/07/29/ryan-walters-oklahoma-state-department-education-bible-curriculum/74589900007/
Who should be president? Readers share who they're voting for,/story/opinion/columns/your-voice/2024/07/29/kamala-harris-vs-donald-trump-chas-oliver-elections-2024-oklahoma/74567362007/
Police: 69-year-old hiker dies near Arizona trailhead,/story/news/nation/2024/07/30/hiker-parsons-trail-arizona/74598533007/
Tropical storm brewing? System could become Tropical Storm Debby,/story/news/weather/2024/07/30/storm-tracker-tropical-storm-debby/74598503007/
Republican Arizona mayor endorses Kamala Harris over Donald Trump,/story/news/politics/elections/2024/07/29/mesa-arizona-mayor-john-giles-endorses-harris/74596202007/
This OKC favorite made the list of USA TODAY's best bars,/story/lifestyle/food/2024/07/29/ednas-okc-usa-today-best-bars-2024/74283965007/
What to know about the new restaurant at The Ambassador Hotel in OKC,/story/lifestyle/food/2024/07/30/the-chalkboard-kitchen-bar-opens-ambassador-hotel-okc/74589270007/
Tips for helping seniors beat the heat,/story/lifestyle/2024/07/30/savvy-senior-how-extreme-heat-affects-seniors-tips-to-stay-safe/74528453007/
,/picture-gallery/entertainment/2024/07/27/olivia-rodrigo-brings-her-guts-world-tour-to-paycom-center-in-okc-in-concert/74572452007/
Crossword & Games,https://puzzles.usatoday.com/?itm_campaign=Crossword%20%26amp%3B%20Games&itm_medium=con&itm_source=secondStreet
"State senator legally allowed to attend closed meeting, AG tells Ryan Walters",/story/news/education/2024/07/30/ryan-walters-oklahoma-state-board-education-senator-mary-boren-closed-meeting/74570311007/
"Why ACLU, other groups support OU in lawsuit filed by white students",/story/news/education/campus/2024/07/30/ou-oklahoma-aclu-federal-lawsuit-financial-discrimination-white-students/74573558007/
Oklahoma's mental health hotline saw a 44% increase in calls this year,/story/news/2024/07/30/988-oklahoma-mental-health-hotline-sees-increase-calls-2024/74557834007/
"Training your future Olympian? OKC places kids can try gymnastics, more",/story/news/2024/07/30/feeling-empowered-kids-can-try-olympic-sports-at-these-places-in-okc/74590129007/
"Canada vs Australia score updates, TV channel for 2024 Paris Olympics",/story/sports/olympics/2024/07/30/canada-australia-live-updates-score-highlights-2024-paris-olympics-basketball/74595329007/
,https://cm.oklahoman.com/site-feedback/?platform=Tangent-Desktop&url=https%3A%2F%2Fwww.oklahoman.com%2F&marketName=oklahoman&cta=Right-Rail
