headline,href
Judge denies bond to former death row inmate Richard Glossip,/story/news/crime/2025/07/23/former-death-row-inmate-richard-glossip-denied-bond-as-he-awaits-retrial/85344481007/
"State public radio, TV stations vow to keep informing, despite cuts",/story/entertainment/2025/07/23/oeta-npr-pbs-oklahoma-plans-after-funding-cuts/85294443007/
Pam Bondi reportedly told Donald Trump he's named in Epstein files,/story/news/politics/2025/07/23/donald-trump-jeffrey-epstein-files-pam-bondi-meeting/85347573007/
Tribal court rules in favor of Muscogee (Creek) Freedmen citizenship,/story/news/tribes/2025/07/23/muscogee-creek-nation-freedmen-are-citizens-tribal-court-ruling/85343863007/
Bryan Kohberger gets life sentence after tearful…,/story/news/nation/2025/07/23/bryan-kohberger-sentencing-hearing-live-updates/85325413007/
Could the new pope fast track Blessed Stanley Rother's…,/story/lifestyle/2025/07/23/could-pope-leo-xiv-fast-track-stanley-rothers-path-to-sainthood/83624838007/
Isaiah Hartenstein report card: How Thunder center…,/story/sports/nba/thunder/2025/07/23/isaiah-hartenstein-report-card-stats-okc-thunder-center-grades-2024-25-nba-season/85324645007/
Trump can't dodge Epstein. Even with silly Obama…,/story/opinion/columnist/2025/07/23/trump-obama-treason-gabbard-epstein-files/85338327007/
,
Vote: Who is best Oklahoma high school quarterback for…,/story/sports/high-school/football/2025/07/15/oklahoma-high-school-football-vote-top-quarterback-2025-season/85195813007/
Judge denies bond to former death row inmate Richard Glossip,/story/news/crime/2025/07/23/former-death-row-inmate-richard-glossip-denied-bond-as-he-awaits-retrial/85344481007/
Pam Bondi reportedly told Donald Trump he's named in Epstein files,/story/news/politics/2025/07/23/donald-trump-jeffrey-epstein-files-pam-bondi-meeting/85347573007/
Tribal court rules in favor of Muscogee (Creek) Freedmen citizenship,/story/news/tribes/2025/07/23/muscogee-creek-nation-freedmen-are-citizens-tribal-court-ruling/85343863007/
Brent Venables ready to 'dig right in' to calling OU's defense,/story/sports/college/sooners/2025/07/23/ou-football-coach-brent-venables-defensive-coordinator-playcalling-2025-oklahoma-sooners/85310666007/
Super 30: Jenks RB Kaydin Jones saw signs pulling to Oklahoma State,/story/sports/high-school/football/2025/07/23/oklahoma-high-school-football-jenks-rb-kaydin-jones-2026-recruiting-profile-osu-cowboys/85296220007/
Alex Caruso stats: OKC Thunder guard's top 10 games on NBA title run,/story/sports/nba/thunder/2025/07/23/alex-caruso-stats-okc-thunder-guards-top-10-games-on-nba-title-run/85316150007/
"ConocoPhillips nears sale of Oklahoma assets, sources say",/story/business/energy-resource/2025/07/22/conocophillips-close-to-selling-oklahoma-assets-what-to-know/85330577007/
Is Oklahoma good for business? This is how it ranks against other states,/story/business/2025/07/21/cnbc-best-states-for-business-2025-oklahoma-ranking/85280284007/
Bankruptcy leads to $212M sale of upscale OKC retail centers,/story/business/real-estate/2025/07/21/trader-joes-okc-whole-foods-nichols-hills-plaza-classen-curve-sale/85199074007/
In-person school isn’t for everyone. Consider online school instead Audra Plummer,/story/opinion/columns/guest/2025/07/23/virtual-public-charter-high-school-option-oklahoma/85325289007/
We carried my dad's ashes to Capitol Lake. It brought us together Adam Cohen,/story/opinion/columns/guest/2025/07/23/death-grief-father-capitol-peak-aspen/85323077007/
OK Highway Patrol says metro-area interstates no longer a priority Janelle Stecklein,/story/opinion/columns/2025/07/22/oklahoma-highway-patrol-says-priorities-no-longer-include-metro-area-interstate-highways/85306741007/
Powerball winning numbers for July 23 drawing: $325 million jackpot,/story/money/lottery/2025/07/23/powerball-winning-numbers/85349309007/
Appeals court rules Trump birthright order unconstitutional,/story/news/politics/2025/07/23/appeals-court-trump-birthright-citizenship-unconstitutional/85350323007/
"National Drive-Thru Day: Get deals, freebies on July 24",/story/money/food/2025/07/23/national-drive-thru-day-2025-deals/85261318007/
🍳 German-made Fissler cookware is up to 25% off right now,/story/shopping/2025/07/23/fissler-cookware-sale-deals/85348287007/
"Arm & Hammer wants to give you a $5,000 laundry room glow-up",/story/shopping/2025/07/22/arm-hammer-offer-laundry-room-makeover/85332031007/
🍂 Joanna Gaines just released new fall Target home essentials from $6,/story/shopping/2025/07/22/target-hearth-and-hand-magnolia-fall-collection/85321636007/
"State public radio, TV stations vow to keep informing, despite cuts",/story/entertainment/2025/07/23/oeta-npr-pbs-oklahoma-plans-after-funding-cuts/85294443007/
Could the new pope fast track Blessed Stanley Rother's path to sainthood?,/story/lifestyle/2025/07/23/could-pope-leo-xiv-fast-track-stanley-rothers-path-to-sainthood/83624838007/
"Nature & You: These 'hummingbirds' are bugs, not birds",/story/lifestyle/2025/07/23/hummingbird-moth-can-be-mistaken-for-the-tiny-hovering-bird/85257892007/
,/picture-gallery/entertainment/2025/07/23/limited-edition/85322359007/
Enter Today!,https://oklahoman.gannettcontests.com/Lyric-Theatre-Oklahoma-Ticket/?itm_campaign=Lyric%20Theatre%20Oklahoma!%20Ticket%20Giveaway&itm_medium=con&itm_source=secondStreet
Summer Athlete Polls,https://www.oklahoman.com/sports/high-school/?itm_campaign=Athlete%20of%20the%20Week%20Landmark%20OKC&itm_medium=con&itm_source=secondStreet
Enter Today!,https://offers.renewalbyandersen.com/esler/sweepstakes/?rba_source=Digital%20Sweepstakes&rba_breakdown=GannettPHI&rba_phone=702-331-9116&utm_source=Gannett_PHI&utm_medium=Digital_Sweepstakes&&itm_campaign=Renewal%20by%20Andersen%20Client%26%2339%3Bs%20site%20contest&itm_medium=con&itm_source=secondStreet
Ryan Walters 'demands' Oklahoma Supreme Court allow Bible purchases,/story/news/education/2025/07/23/ryan-walters-oklahoma-osde-bible-purchases-supreme-court/85343763007/
Brent Venables ready to 'dig right in' to calling OU's defense,/story/sports/college/sooners/2025/07/23/ou-football-coach-brent-venables-defensive-coordinator-playcalling-2025-oklahoma-sooners/85310666007/
Super 30: Jenks RB Kaydin Jones saw signs pulling to Oklahoma State,/story/sports/high-school/football/2025/07/23/oklahoma-high-school-football-jenks-rb-kaydin-jones-2026-recruiting-profile-osu-cowboys/85296220007/
New Oklahoma law bans cell phones in schools: How is your school preparing?,/story/news/education/2025/07/23/oklahoma-cellphone-ban-in-schools-what-to-know/85313187007/
Alex Caruso stats: OKC Thunder guard's top 10 games on NBA title run,/story/sports/nba/thunder/2025/07/23/alex-caruso-stats-okc-thunder-guards-top-10-games-on-nba-title-run/85316150007/
,https://cm.oklahoman.com/site-feedback/?platform=Tangent-Desktop&url=https%3A%2F%2Fwww.oklahoman.com%2F&marketName=oklahoman&cta=Right-Rail
