headline,href
"Couple opened boutique hotel with no experience, now honored by Michelin",/story/business/local/2024/11/29/bradford-house-boutique-hotel-michelin-guide-key/76374314007/
Prairie Artisan Ales is still in the works for downtown Edmond,/story/news/2024/11/28/edmond-ok-brewery-still-in-works-prairie-artisan-ales/76569134007/
What if judge nixes OK County jail site after construction starts?,/story/news/2024/11/29/oklahoma-county-jail-new-site-without-okc-agreement/76619043007/
Janet Yowell to leave Edmond progressing from downtown to interstate,/story/news/2024/11/29/edmond-economic-development-authority-oklahoma-janet-yowell/76119420007/
"Eat this, scrap that: Local chefs' thoughts on 2025…",/story/lifestyle/food/2024/11/28/okc-restaurants-chefs-talk-menu-trend-expectations/76570337007/
"Where is Oklahoma film headed after 'Twisters,' 'Killers…",/story/entertainment/2024/11/26/twisters-movie-2024-reagan-future-film-industry-oklahoma/75353879007/
What channel is OSU football vs Colorado on today? Time…,/story/sports/college/cowboys/2024/11/29/oklahoma-state-colorado-channel-today-time-tv-schedule-streaming-info/76646923007/
"Mike Gundy, Deion Sanders take different routes to team…",/story/sports/college/cowboys/2024/11/28/oklahoma-state-football-coach-mike-gundy-colorado-deion-sanders-transfer-portal/76601784007/
The Oklahoman's HS football picks for every semifinal…,/story/sports/high-school/football/2024/11/28/oklahoma-high-school-football-week-13-predictions-2024-season-state-semifinals/76594271007/
,
Hurry! Apple devices are the lowest prices at Amazon's Black Friday Week sale,/story/shopping/2024/11/29/black-friday-apple-deals-lowest-prices/76639323007/
"Love Free People? Save 50% on jackets, maxi dresses, leggings",/story/shopping/2024/11/29/free-people-black-friday-sale/76647732007/
"Amazon sliced 62% off DeWalt, Leatherman, Milwaukee tools",/story/shopping/2024/11/29/black-friday-tool-deals-amazon/76579296007/
Prairie Artisan Ales is still in the works for downtown Edmond,/story/news/2024/11/28/edmond-ok-brewery-still-in-works-prairie-artisan-ales/76569134007/
What if judge nixes OK County jail site after construction starts?,/story/news/2024/11/29/oklahoma-county-jail-new-site-without-okc-agreement/76619043007/
Janet Yowell to leave Edmond progressing from downtown to interstate,/story/news/2024/11/29/edmond-economic-development-authority-oklahoma-janet-yowell/76119420007/
OSU's recovery may take years. Here's why the road looks long,/story/sports/college/cowboys/2024/11/28/oklahoma-state-football-2024-senior-class-nfl-draft-ollie-gordon-osu-cowboys-rebuild-mike-gundy/76595809007/
"What channel is OSU football vs Colorado on today? Time, TV schedule",/story/sports/college/cowboys/2024/11/29/oklahoma-state-colorado-channel-today-time-tv-schedule-streaming-info/76646923007/
"Mike Gundy, Deion Sanders take different routes to team building",/story/sports/college/cowboys/2024/11/28/oklahoma-state-football-coach-mike-gundy-colorado-deion-sanders-transfer-portal/76601784007/
"Couple opened boutique hotel with no experience, now honored by Michelin",/story/business/local/2024/11/29/bradford-house-boutique-hotel-michelin-guide-key/76374314007/
The Oklahoma Corporation Commission approved a rate hike this week.,/story/business/local/2024/11/28/utility-rate-hikes-approved-by-occ-leaves-residents-with-higher-bills/76591499007/
Layoffs planned for more than 300 UPS workers at Oklahoma City facility,/story/business/local/2024/11/27/ups-layoffs-okc-facility-closing/76575109007/
Think twice before enrolling in Medicare Advantage plan Andre Snodgrass,/story/opinion/columns/guest/2024/11/28/medicare-medicaid-advantage-plan-will-change-the-way-you-receive-care-benefits-insurance-opinion/76572892007/
I'm 84. I found my happily ever after 66 years since high school Helen Ford Howe,/story/opinion/columns/2024/11/28/love-blooms-reunion-66-years-after-high-school-helen-ford-wallace-howe/76569616007/
There's a manipulated false narrative of failing schools in Oklahoma Kyle Reynolds,/story/opinion/columns/guest/2024/11/27/oklahoma-education-schools-accountability-not-failing/76459192007/
Black Friday 2024: Everything you need to know about the shopping holiday,/story/money/shopping/2024/11/29/black-friday-2024/76571356007/
Is the stock market open on Black Friday? See 2024 holiday schedule,/story/money/investing/2024/11/28/stock-market-open-closed-black-friday-2024/76590877007/
"Black Friday 2024 food deals: Hooters, DoorDash, more have discounts",/story/money/food/2024/11/28/black-friday-2024-food-deals/76601890007/
"Eat this, scrap that: Local chefs' thoughts on 2025 restaurant trends",/story/lifestyle/food/2024/11/28/okc-restaurants-chefs-talk-menu-trend-expectations/76570337007/
"Where is Oklahoma film headed after 'Twisters,' 'Killers of Flower Moon'?",/story/entertainment/2024/11/26/twisters-movie-2024-reagan-future-film-industry-oklahoma/75353879007/
Planting a seed: OKC Beautiful's gardening program for schools continues to grow,/story/lifestyle/features/2024/11/28/okc-harvest-program-public-schools-gardening/75636734007/
,/picture-gallery/sports/college/sooners/2024/11/27/ou-vs-duke-see-photos-from-ball-dawgs-classic-womens-basketball/76628976007/
Enter Your Pet Photo Today,https://newsok.gannettcontests.com/USAs-Favorite-Pet/?itm_campaign=2024%20USAs%20Favorite%20Pet%20Photos%20Non-Sponsored&itm_medium=con&itm_source=secondStreet
Enter today!,https://oklahoman.gannettcontests.com/Oklahoma-City-Ballet-2024-The-Nutcracker-Ticket/?itm_campaign=OKC%20Ballet-The%20Nutcracker%20Ticket%20Sweepstakes&itm_medium=con&itm_source=secondStreet
ENTER NOW! ENTER OFTEN!,https://oklahoman.gannettcontests.com/2024-Holiday-Wish-and-Win/?itm_campaign=2024%20Holiday%20Wish%20%26amp%3B%20Win%20Sweepstakes%20-%20Oklahoma%20City&itm_medium=con&itm_source=secondStreet
New chancellor takes over higher ed system as college enrollment grows,/story/news/education/campus/2024/11/29/oklahoma-state-regents-higher-education-new-chancellor-sean-burrage/76297667007/
New program launched by AG recognizes work of law enforcement officers,/story/news/politics/government/2024/11/29/oklahoma-attorney-general-gentner-drummond-program-police-officers/76499643007/
"Recovering from car wreck, Baptist leader expresses faith, gratitude",/story/news/2024/11/29/oklahoma-baptist-todd-fisher-car-wreck/76051642007/
The Oklahoma Corporation Commission approved a rate hike this week.,/story/business/local/2024/11/28/utility-rate-hikes-approved-by-occ-leaves-residents-with-higher-bills/76591499007/
OSU's recovery may take years. Here's why the road looks long,/story/sports/college/cowboys/2024/11/28/oklahoma-state-football-2024-senior-class-nfl-draft-ollie-gordon-osu-cowboys-rebuild-mike-gundy/76595809007/
,https://cm.oklahoman.com/site-feedback/?platform=Tangent-Desktop&url=https%3A%2F%2Fwww.oklahoman.com%2F&marketName=oklahoman&cta=Right-Rail
