headline,href
Who runs Oklahoma's schools: Ryan Walters or state education board?,/story/news/education/2025/08/31/ryan-walters-oklahoma-state-board-education-osbe-tension/85894010007/
Death row inmate Tremane Wood under investigation as execution put on hold,/story/news/2025/08/31/oklahoma-death-row-tremane-wood-accused-distributing-drugs-ordering-hit-inmate/85873401007/
"Dangerous, busy Edmond intersection to be improved over seven months",/story/news/2025/08/31/edmond-ok-traffic-busy-intersection-danforth-and-kelly-construction/85831369007/
Citizens receive training to help former inmates get fines reduced,/story/news/2025/08/31/voice-okc-legal-aid-services-oklahoma-help-former-inmates-fees-fines/85731043007/
Who are OSU's quarterbacks behind Zane Flores? Inside…,/story/sports/college/cowboys/2025/08/30/oklahoma-state-football-quarterbacks-behind-zane-flores-depth-chart-osu-cowboys/85891746007/
"Oklahoma high school football Week 0 scores, live…",/story/sports/high-school/football/2025/08/28/oklahoma-high-school-football-scores-ossaa-week-0-highlights-updates-stats-box-scores-okc/85874647007/
,
Vote: Who is Oklahoma HS football's top defensive back…,/story/sports/high-school/football/2025/08/28/vote-who-is-oklahoma-high-school-football-top-defensive-back-for-2025-season/85856660007/
Taylor Swift and Travis Kelce are getting married. Stay…,/story/opinion/columnist/2025/08/26/taylor-swift-engagement-travis-kelce/85835208007/
What to know about the 2025 OSU football schedule…,/story/sports/college/cowboys/2025/08/26/oklahoma-state-football-schedule-dates-times-tv-streaming-2025-osu-cowboys/85833212007/
Who runs Oklahoma's schools: Ryan Walters or state education board?,/story/news/education/2025/08/31/ryan-walters-oklahoma-state-board-education-osbe-tension/85894010007/
Death row inmate Tremane Wood under investigation as execution put on hold,/story/news/2025/08/31/oklahoma-death-row-tremane-wood-accused-distributing-drugs-ordering-hit-inmate/85873401007/
"Dangerous, busy Edmond intersection to be improved over seven months",/story/news/2025/08/31/edmond-ok-traffic-busy-intersection-danforth-and-kelly-construction/85831369007/
John Mateer's 'joy and passion' led to his record-setting Sooners debut,/story/sports/college/sooners/2025/08/30/john-mateer-stats-ou-football-debut-record-baker-mayfield-oklahoma-illinois-state/85916115007/
"OU's Jaren Kanak looks more like a TE than LB, which is a good thing",/story/sports/college/sooners/2025/08/30/ou-football-vs-illinois-state-week-1-te-jaren-kanak-lb-switch-oklahoma-sooners/85916562007/
Brent Venables says giving back $1 million was 'right thing to do',/story/sports/college/sooners/2025/08/30/ou-football-brent-venables-revenue-sharing-1-million-oklahoma-sooners/85915778007/
Total Wine approved to open Oklahoma store amid long legal battle,/story/business/2025/08/29/moore-liquor-store-total-wine-gets-license-from-able-commission-opening-soon/85887532007/
Oklahoma is getting another Whole Foods Market: What to know,/story/business/2025/08/29/is-whole-foods-coming-to-edmond-ok-what-to-know-about-approved-plans/85865719007/
Oklahoma National Stockyards again up for sale as buyer backs out,/story/business/agricultural/2025/08/28/oklahoma-national-stockyards-buyer-backs-out-whats-next/85859303007/
Oklahoma's future workforce depends on improving education system Daniel Hamlin,/story/opinion/columns/guest/2025/08/31/oklahoma-university-center-educational-policy-strategies-for-improvement-workforce-development/85709282007/
Federal labor changes threaten working families to favor wealthy Leslie Osborn,/story/opinion/columns/guest/2025/08/31/oklahoma-labor-commissioner-leslie-osborn-safety-federal-budget-cuts-donald-trump-osha-child-labor/85821163007/
Oklahoma gubernatorial hopefuls jockey for position,/story/opinion/cartoons/2025/08/30/oklahoma-governor-race-candidates-jockey-position/85885599007/
Did anyone win the Powerball? See results of $1 billion jackpot,/story/money/lottery/2025/08/31/did-anyone-win-powerball/85871813007/
See whether your numbers match Powerball's $1 billion jackpot drawing,/story/money/lottery/2025/08/30/what-are-the-winning-numbers-for-powerballs-1-billion-jackpot/85871786007/
When do Social Security payments for September arrive? See schedule,/story/money/2025/08/30/social-security-payments-schedule-september-2025/85854812007/
Get $450 off on Samsung’s Bespoke Smart Dishwasher this Labor Day,/story/shopping/2025/08/31/shop-labor-day-deal-samsung-smart-dishwasher/85890115007/
HexClad has up to 44% off Gordon Ramsay-approved cookware sets for LDW,https://www.usatoday.com/story/shopping/2025/08/26/exclusive-hexclad-cookware-labor-day-deals/85825407007/
This Walmart Labor Day deal saves you $34 on a Fitbit Charge 6,/story/shopping/2025/08/31/fitbit-charge-6-deal-for-walmart-labor-day-sale/85907181007/
"Find out which books are selling in Edmond, OKC, Tulsa and Norman",/story/lifestyle/2025/08/31/oklahomas-bestsellers-from-book-stores-across-the-state/85867726007/
Check out these book signings and new releases with Oklahoma ties,/story/lifestyle/2025/08/31/oklahomas-book-news-from-releases-to-crafts-and-signing-events/85867735007/
TSO goes on massive holiday tour,/videos/entertainment/2025/08/29/trans-siberian-orchestra-2025-holiday-tour/85894171007/
,/picture-gallery/sports/college/sooners/2025/08/30/oklahoma-vs-illinois-state-our-top-photos-from-ou-sooners-football/85908245007/
Enter Today!,https://palmbeachpost.gannettcontests.com/Ireland-US-Experience-Football-Getaway/?itm_campaign=Ireland%20US%20Experience&itm_medium=con&itm_source=secondStreet
ENTER NOW! ENTER OFTEN!,https://oklahoman.gannettcontests.com/2025-Oklahoma-State-Fair/?itm_campaign=2025%20Oklahoma%20State%20Fair%20Ultimate%20Giveaway&itm_medium=con&itm_source=secondStreet
Winners Announced!,https://oklahoman.gannettcontests.com/2025-Oklahoman-Communitys-Choice-Awards-Winners/?itm_campaign=Oklahoma%20Bob&itm_medium=con&itm_source=secondStreet
Lawmaker who pleaded guilty to domestic abuse announces plan to resign,/story/news/politics/2025/08/30/oklahoma-rep-ty-burns-to-resign-after-domestic-abuse-sentencing/85911419007/
"Oklahoma education news: OU, OSU post record enrollment this fall",/story/news/education/campus/2025/08/31/ou-oklahoma-osu-see-record-enrollment-numbers/85826150007/
John Mateer's 'joy and passion' led to his record-setting Sooners debut,/story/sports/college/sooners/2025/08/30/john-mateer-stats-ou-football-debut-record-baker-mayfield-oklahoma-illinois-state/85916115007/
"OU's Jaren Kanak looks more like a TE than LB, which is a good thing",/story/sports/college/sooners/2025/08/30/ou-football-vs-illinois-state-week-1-te-jaren-kanak-lb-switch-oklahoma-sooners/85916562007/
Brent Venables says giving back $1 million was 'right thing to do',/story/sports/college/sooners/2025/08/30/ou-football-brent-venables-revenue-sharing-1-million-oklahoma-sooners/85915778007/
,https://cm.oklahoman.com/site-feedback/?platform=Tangent-Desktop&url=https%3A%2F%2Fwww.oklahoman.com%2F&marketName=oklahoman&cta=Right-Rail
