headline,href
"Speaker at hearing says Ryan Walters' accreditation rules proposal 'myopic, harmful and misguided'",/story/news/education/campus/2024/02/15/ryan-walters-oklahoma-schools-accreditation-hearing-criticism/72615183007/
This OKC favorite made the list of USA TODAY's best restaurants,/story/lifestyle/food/2024/02/15/ma-der-lao-kitchen-oklahoma-city-usa-today-best-restaurants/72138176007/
OSU's Mike Boynton addresses NIL limitations: 'We gotta play better',/story/sports/college/cowboys/2024/02/15/oklahoma-state-basketball-mike-boynton-nil-name-image-likeness-osu-cowboys-big-12/72606644007/
Oklahoma bill would create database of women who have had an abortion,/story/news/2024/02/15/oklahoma-abortion-law-kevin-west-bill-creates-database-women/72613836007/
6 OKC spots we wish made USA Today's Restaurants of the…,/story/lifestyle/food/2024/02/15/restaurants-of-the-year-5-okc-spots-we-wish-made-usa-today-restaurants-of-the-year-list/72278744007/
Restaurant review: Everything you need to try at Ma Der…,/story/entertainment/dining/2024/02/15/ma-der-lao-kitchen-okc-ok-restaurant-review/71827233007/
Kansas is slumping. A scheduling quirk could help the…,/story/sports/college/big-12/2024/02/15/big-12-power-rankings-mens-college-basketball-kansas-jayhawks-houston-cougars-iowa-sttae-cyclones/72609996007/
,
Kansas City Chiefs parade shooting stemmed from personal…,/story/news/nation/2024/02/15/kansas-city-chiefs-shooting/72610710007/
Oklahoma City girls high school basketball Fab 10…,/story/sports/high-school/basketball/2024/02/15/oklahoma-city-girls-high-school-basketball-fab-10-rankings-for-feb-15/72602166007/
"Speaker at hearing says Ryan Walters' accreditation rules proposal 'myopic, harmful and misguided'",/story/news/education/campus/2024/02/15/ryan-walters-oklahoma-schools-accreditation-hearing-criticism/72615183007/
Oklahoma bill would create database of women who have had an abortion,/story/news/2024/02/15/oklahoma-abortion-law-kevin-west-bill-creates-database-women/72613836007/
Revealed: These 14 OK gun shops sold the most crime guns last year,/story/news/2024/02/15/us-atf-names-oklahoma-gun-stores-in-list-gun-sales-tied-crime/72612219007/
OSU's Mike Boynton addresses NIL limitations: 'We gotta play better',/story/sports/college/cowboys/2024/02/15/oklahoma-state-basketball-mike-boynton-nil-name-image-likeness-osu-cowboys-big-12/72606644007/
"Thunder's SGA isn't yet in NBA 50-point club, but 'it'll come one day'",/story/sports/nba/thunder/2024/02/15/okc-thunder-shai-gilgeous-alexander-nba-scoring-leaders/72604307007/
Kansas is slumping. A scheduling quirk could help the Jayhawks reset.,/story/sports/college/big-12/2024/02/15/big-12-power-rankings-mens-college-basketball-kansas-jayhawks-houston-cougars-iowa-sttae-cyclones/72609996007/
See inside the OKC Metro's very first QuikTrip,/picture-gallery/business/2024/02/15/quiktrip-moore-oklahoma-grand-opening-photos/72614922007/
What happened to the Schwan's food trucks in Oklahoma?,/story/business/2024/02/14/schwans-home-delivery-rebrands-to-yelloh-leaves-oklahoma-red-baron-tonys-pizza-mrs-smiths/72497024007/
"OKC awarded $7.1 million grant from Housing, Urban Development Dept.",/videos/business/local/2024/02/09/oklahoma-city-gets-7-million-grant-for-homeless-aid/72530089007/
Amphitheater not seen as very neighborly as resident anticipates noise Kristen Bruce,/story/opinion/2024/02/15/opinion-noise-pollution-from-planned-amphitheater-not-seen-as-neighborly/72570060007/
We must confront barriers that hinder Multilingual Learners' success Yuseli Freire,/story/opinion/2024/02/15/opinion-multilingual-learners-bring-unique-contributions-to-schools-communities/72582763007/
Should OK schools ban cellphones? Share your thoughts on new bill,/story/opinion/2024/02/14/opinion-should-schools-ban-cellphones-in-oklahoma-weigh-in-on-new-bill/72602346007/
AMC settlement: Streaming subscribers could get awards,/story/money/2024/02/15/amc-class-action-lawsuit-settlement-email/72617976007/
You could save the next Sweetpea: How to adopt from her rescue,/story/news/nation/2024/02/15/sweetpea-dog-rescue-how-to-adopt/72614399007/
"As Target reportedly considers paid-membership program, a look at competitors",/story/money/retail/2024/02/15/target-paid-membership-program-report/72606127007/
This OKC favorite made the list of USA TODAY's best restaurants,/story/lifestyle/food/2024/02/15/ma-der-lao-kitchen-oklahoma-city-usa-today-best-restaurants/72138176007/
6 OKC spots we wish made USA Today's Restaurants of the Year,/story/lifestyle/food/2024/02/15/restaurants-of-the-year-5-okc-spots-we-wish-made-usa-today-restaurants-of-the-year-list/72278744007/
Restaurant review: Everything you need to try at Ma Der Lao Kitchen,/story/entertainment/dining/2024/02/15/ma-der-lao-kitchen-okc-ok-restaurant-review/71827233007/
,/picture-gallery/business/2024/02/15/quiktrip-moore-oklahoma-grand-opening-photos/72614922007/
Vote Today,https://oklahoman.gannettcontests.com/2024-OKC-Metro-High-School-Sports-Awards-School-Spirit/?itm_campaign=HS%20School%20Spirit%20OKC&itm_medium=con&itm_source=secondStreet
NOMINATE TODAY,https://oklahoman.gannettcontests.com/Cardiovascular-Health-Clinic-Amazing-Teachers/rounds/1/gallery?itm_campaign=Cardiovascular%20Health%20Clinic%20Amazing%20Teacher%20Awards&itm_medium=con&itm_source=secondStreet
Vote Every Week!,https://www.oklahoman.com/sports/high-school/?itm_campaign=Athlete%20of%20the%20Week%20Landmark%20OKC&itm_medium=con&itm_source=secondStreet
Revealed: These 14 OK gun shops sold the most crime guns last year,/story/news/2024/02/15/us-atf-names-oklahoma-gun-stores-in-list-gun-sales-tied-crime/72612219007/
"Thunder's SGA isn't yet in NBA 50-point club, but 'it'll come one day'",/story/sports/nba/thunder/2024/02/15/okc-thunder-shai-gilgeous-alexander-nba-scoring-leaders/72604307007/
'Lies': Fani Willis fights push to remove her from Trump Georgia case,/story/news/politics/2024/02/15/live-updates-fani-willis-hearing-donald-trump-election-fraud-case/72605566007/
"State eyes tax cuts at expense of neglected roads, colleges and other infrastructure",/story/news/2024/02/15/oklahoma-roads-colleges-need-repairs-while-legislature-wants-tax-cuts/72338944007/
Bills would give full college scholarships to students with intellectual disabilities,/story/news/2024/02/15/oklahomas-promise-scholarship-funds-may-increase-under-legislative-bills/72603658007/
,https://cm.oklahoman.com/site-feedback/?platform=Tangent-Desktop&url=https%3A%2F%2Fwww.oklahoman.com%2F&marketName=oklahoman&cta=Right-Rail
