headline,href
CFP curse strikes down Sooners yet again in collapse against Alabama,/story/sports/college/sooners/2025/12/20/oklahoma-sooners-football-cfp-curse-collapse-alabama/87852544007/
Methodists commit to unity while other denomination on verge of schism,/story/news/religion/2025/12/17/anglican-communion-schism-oklahoma-methodists-sarah-mullally/87466415007/
"Shai Gilgeous-Alexander, Thunder ‘don’t care’ about false narratives",/story/sports/nba/thunder/2025/12/20/shai-gilgeous-alexander-okc-thunder-timberwolves-free-throw-merchant-ethical-hoops/87859402007/
Critical mistakes end OU football's season against Alabama in CFP,/story/sports/college/sooners/2025/12/20/oklahoma-vs-alabama-football-cfp-score-stats-brent-venables-sooners/87858760007/
Vote: Landmark Fine Homes HS boys athlete of the week…,/story/sports/high-school/athlete-of-the-week/2025/12/15/vote-landmark-fine-homes-high-school-boys-athlete-of-week-dec-8-14/87776768007/
Vote: Landmark Fine Homes HS girls athlete of the week…,/story/sports/high-school/athlete-of-the-week/2025/12/15/vote-landmark-fine-homes-high-school-girls-athlete-of-week-dec-8-14/87782237007/
,
What you need to know about OKC Thunder schedule and how…,/story/sports/nba/thunder/2025/10/21/okc-thunder-schedule-dates-times-tv-streaming/86811489007/
Here's what to expect at the 2025 Coca-Cola's Classic…,/story/entertainment/2025/12/20/heres-what-you-can-find-at-coca-colas-classic-christmas-okc-in-2025/87315403007/
"Check out the bigger Coca-Cola Classic Christmas, back…",/picture-gallery/entertainment/2025/12/20/see-photos-as-coca-colas-classic-christmas-returns-to-okc-for-2025/87484296007/
Shopping,/shopping/
Get Ole Miss vs. Georgia Sugar Bowl College Football Playoff tickets,/story/shopping/2025/12/20/how-to-buy-ole-miss-vs-georgia-sugar-bowl-tickets/87852286007/
Get Miami vs. Ohio State Cotton Bowl College Football Playoff tickets,/story/shopping/2025/12/20/how-to-buy-miami-vs-ohio-state-cotton-bowl-cfp-tickets/87850120007/
Dr. Cocoa children’s acetaminophen is 15% off at Amazon,https://www.usatoday.com/story/shopping/2025/12/15/dr-cocoa-childrens-acetaminophen-amazon-deal/87764646007/
News,/news/
Methodists commit to unity while other denomination on verge of schism,/story/news/religion/2025/12/17/anglican-communion-schism-oklahoma-methodists-sarah-mullally/87466415007/
Oklahoma officials eye $12B budget as estimated revenues increase,/story/news/politics/2025/12/20/gov-kevin-stitt-touts-revenue-increase-in-estimated-12-billion-budget/87831305007/
See photos of Oklahoma State Board of Equalization going over budgets,/picture-gallery/news/2025/12/20/oklahoma-state-board-of-equalization-meeting-photos/87852696007/
Sports,/sports/
CFP curse strikes down Sooners yet again in collapse against Alabama,/story/sports/college/sooners/2025/12/20/oklahoma-sooners-football-cfp-curse-collapse-alabama/87852544007/
"Shai Gilgeous-Alexander, Thunder ‘don’t care’ about false narratives",/story/sports/nba/thunder/2025/12/20/shai-gilgeous-alexander-okc-thunder-timberwolves-free-throw-merchant-ethical-hoops/87859402007/
Critical mistakes end OU football's season against Alabama in CFP,/story/sports/college/sooners/2025/12/20/oklahoma-vs-alabama-football-cfp-score-stats-brent-venables-sooners/87858760007/
Life,/life/
"OKC theater offers a balm for 'bah, humbug' with 'A Christmas Carol'",/story/entertainment/2025/12/20/okc-theaters-christmas-carol-takes-audiences-to-victorian-london/87834264007/
What to know about Midtown's Bar Serra before you go,/story/entertainment/dining/2025/12/20/bar-serra-menu-options-recommendations-and-more/87851289007/
Here's what to expect at the 2025 Coca-Cola's Classic Christmas OKC,/story/entertainment/2025/12/20/heres-what-you-can-find-at-coca-colas-classic-christmas-okc-in-2025/87315403007/
Business,/business/
"Hegseth, Trump release new info on 'warrior dividend.' Who qualifies?",/story/business/economy/2025/12/18/who-qualifies-for-warrior-dividend-trump-details-military-checks-1776/87826309007/
Design changes to bring downtown OKC apartment tower back on track,/story/business/downtown/2025/12/18/construction-to-start-in-2026-on-redesigned-downtown-okc-apartment-tower/87817470007/
Millions are being spent on retail centers surrounding Penn Square Mall,/story/business/real-estate/2025/12/18/belle-isle-station-adjacent-to-penn-square-mall-okc-sold/87784538007/
Opinion,/opinion/
Oklahoma has an alarming rate of teacher attrition. It's a crisis Alexis Bowen,/story/opinion/columns/guest/2025/12/19/crisis-in-oklahoma-too-many-teachers-leaving-profession-too-soon/87660810007/
"This Christmas, stop letting others steal your time Bill Korman",/story/opinion/columns/guest/2025/12/19/during-christmas-season-do-not-let-others-steal-your-time/87818690007/
We need to change how we think about mass shootings Philip Chan and Amy Nunn,/story/opinion/2025/12/19/brown-university-shooting-gun-violence-public-health/87812875007/
Trending,https://www.usatoday.com/news/trending/
When does winter officially start? What to know about winter solstice.,/story/news/nation/2025/12/20/when-is-winter-solstice-2025/87792160007/
Check the Mega Millions winning numbers for Friday's $90M jackpot,/story/money/lottery/2025/12/19/mega-millions-winning-numbers/87851073007/
Use Instacart? You could be owed a refund. Here's why.,/story/money/2025/12/19/instacart-consumer-refunds-ftc-lawsuit/87845653007/
,/picture-gallery/news/2025/12/20/oklahoma-state-board-of-equalization-meeting-photos/87852696007/
ENTER NOW! ENTER OFTEN!,https://oklahoman.gannettcontests.com/2025-Holiday-Wish-and-Win/?itm_campaign=2025%20Holiday%20Wish%20%26amp%3B%20Win%20%20-%20H%20%26amp%3B%20H%20Shooting%20Sports%20%2450k%20Giveaway&itm_medium=con&itm_source=secondStreet
Nominate Today!,https://www.profootballhof.com/news/2025/09/pro-football-hall-of-fame-awards-of-character-recognize-extraordinary-individuals/?utm_source=Localiq&utm_medium=promo&utm_campaign=awards&&itm_campaign=PFHOF%20Awards%20of%20Character&itm_medium=con&itm_source=secondStreet
Winners Announced!,https://oklahoman.gannettcontests.com/2025-Oklahoman-Communitys-Choice-Awards-Winners/?itm_campaign=Oklahoma%20Bob&itm_medium=con&itm_source=secondStreet
Konner Doucet vs AJ Ferrari tops key matchups in OSU-Nebraska dual,/story/sports/college/cowboys/2025/12/20/oklahoma-state-wrestling-vs-nebraska-key-matchups-konner-doucet-aj-ferrari-osu-cowboys/87815543007/
"OKC theater offers a balm for 'bah, humbug' with 'A Christmas Carol'",/story/entertainment/2025/12/20/okc-theaters-christmas-carol-takes-audiences-to-victorian-london/87834264007/
What to know about Midtown's Bar Serra before you go,/story/entertainment/dining/2025/12/20/bar-serra-menu-options-recommendations-and-more/87851289007/
Celebrate the Thunder's first NBA title with this commemorative book,/story/sports/nba/thunder/2025/12/17/celebrate-okc-thunder-nba-championship-commemorative-book/87805943007/
Celebrate Oklahoma high school basketball with 'The Big House' book,/story/sports/high-school/basketball/2025/12/17/celebrate-oklahoma-high-school-basketball-big-house-book/87806019007/
,https://cm.oklahoman.com/site-feedback/?platform=Tangent-Desktop&url=https%3A%2F%2Fwww.oklahoman.com%2F&marketName=oklahoman&cta=Right-Rail
