headline,href
"Veterans, caregivers share struggles with VA amid concerns for workforce cuts",/story/business/economy/2025/02/10/oklahoma-veterans-va-facing-cuts-caregiving/76918426007/
"Oklahoma elections 2025: City, county officials on the ballot Feb. 11",/story/news/politics/elections/2025/02/08/oklahoma-elections-city-county-officials-on-the-ballot-feb-11/78339054007/
OK County jail trust looks for a new CEO; former CEO leaves advice,/story/news/local/2025/02/10/oklahoma-county-jail-new-ceo-search-begins-brandi-gardner/78288328007/
Which NBA team had the best trade deadline? We grade all 30,/story/sports/nba/thunder/2025/02/10/2025-nba-trade-deadline-grades-los-angeles-lakers-luka-doncic-dallas-mavericks/78317467007/
Breaking down the Oklahoma State Cowgirls softball…,/story/sports/college/cowboys/2025/02/02/oklahoma-state-softball-roster-schedule-2025-osu-cowgirls-kenny-gajewski/77980014007/
"Oklahoma high school fall sports All-State, All-City…",/story/sports/high-school/2025/01/12/oklahoma-high-school-football-softball-volleyball-cross-country-2024-all-state-city-teams-ossaa/77581436007/
OKC-area shelter pets would love to have a home for…,/story/lifestyle/2025/02/10/adopt-a-pet-find-your-furever-friend-at-okc-area-shelters/78158179007/
Breaking down the Oklahoma State Cowboys baseball roster…,/story/sports/college/cowboys/2025/02/10/oklahoma-state-baseball-roster-schedule-2025-osu-cowboys-josh-holliday/78250955007/
Oklahoma veteran builds his own home: See inside,/picture-gallery/news/2025/02/10/luther-ok-veteran-iraq-war-builds-his-own-home/78251928007/
,
"Oklahoma elections 2025: City, county officials on the ballot Feb. 11",/story/news/politics/elections/2025/02/08/oklahoma-elections-city-county-officials-on-the-ballot-feb-11/78339054007/
OK County jail trust looks for a new CEO; former CEO leaves advice,/story/news/local/2025/02/10/oklahoma-county-jail-new-ceo-search-begins-brandi-gardner/78288328007/
District 1 OK County commissioner candidates report routine financing,/story/news/2025/02/09/oklahoma-elections-2025-ok-county-commissioner-district-1-reports/78299879007/
Which NBA team had the best trade deadline? We grade all 30,/story/sports/nba/thunder/2025/02/10/2025-nba-trade-deadline-grades-los-angeles-lakers-luka-doncic-dallas-mavericks/78317467007/
Breaking down the Oklahoma State Cowboys baseball roster by position,/story/sports/college/cowboys/2025/02/10/oklahoma-state-baseball-roster-schedule-2025-osu-cowboys-josh-holliday/78250955007/
Breaking down the 2025 Oklahoma Sooners baseball roster by position,/story/sports/college/sooners/2025/02/10/ou-baseball-roster-schedule-2025-oklahoma-sooners-patty-skip-johnson/78171015007/
"Veterans, caregivers share struggles with VA amid concerns for workforce cuts",/story/business/economy/2025/02/10/oklahoma-veterans-va-facing-cuts-caregiving/76918426007/
Vote on sales tax for commuter rail in OKC Metro delayed,/story/business/transportation/2025/02/05/okc-metro-commuter-rail-plans-sales-tax-vote-delayed/78213842007/
"Tariffs on Chinese goods cost Oklahomans, business owners",/story/business/economy/2025/02/04/china-tariffs-will-impact-oklahomans-businesses/78180220007/
RFK Jr.'s nomination is a mistake. Oklahoma senators could correct it. Fahad Khan,/story/opinion/columns/2025/02/10/rfk-jr-nomination-mistake-oklahoma-senators-must-vote-against-confirmation-protect-public-health/78379109007/
Nonpartisan local elections focus on what matters: Our community. Kris Steele,/story/opinion/columns/2025/02/09/oklahoma-elections-partisan-government-divisive-politics/78326790007/
The Constitution limits the powers of U.S. presidents Carla D. Pratt,/story/opinion/columns/2025/02/09/constitutional-limits-only-u-s-supreme-court-can-decide-if-presidents-go-too-far-opinion/78211777007/
Watch Philadelphia celebrate after the Eagles win the Super Bowl,/story/news/nation/2025/02/09/philadelphia-celebrates-after-eagles-win-super-bowl-59/78378435007/
"Who is sitting with Trump at Super Bowl? Politicians, family and more",/story/news/nation/2025/02/09/who-sitting-with-donald-trump-super-bowl/78376409007/
"Majority of US adults 'approve' of Trump's presidency, new poll finds",/story/news/politics/2025/02/09/cbs-news-poll-trump/78372943007/
FLY EAGLES FLY! Get your Jalen Hurts Super Bowl LIX jersey now,/story/shopping/2025/02/09/how-to-buy-jalen-hurts-eagles-2025-super-bowl-lix-jersey/78378951007/
SHOP: Philadelphia Eagles Super Bowl LIX championship gear,https://ftw.usatoday.com/2025/02/how-to-buy-philadelphia-eagles-super-bowl-championship-gear-hat-shirt-hoodie
Touchdown! Save up to $883 on HexClad cookware with these winning deals,/story/shopping/2025/02/06/hexclad-cookware-sale-february/78284472007/
Study: Film incentive law has generated hundreds of millions for state economy,/story/entertainment/2025/02/09/filmed-in-oklahoma-law-brings-millions-economic-impact/78304131007/
"Black national anthem at Super Bowl 2025: Who is singing, what to know",/story/entertainment/2025/02/08/black-national-anthem-at-super-bowl-2025-what-to-know-about-tradition/78245404007/
OKC's longtime Jewel Box Theatre launches last season in its current home,/story/entertainment/2025/02/08/okcs-jewel-box-theatre-opens-its-67th-season-with-swashbuckling-adventure/78323947007/
,/picture-gallery/sports/college/cowboys/2025/02/02/oklahoma-state-cowboys-vs-missouri-tigers-in-big-12-wrestling-photos/78161767007/
ENTER NOW! ENTER OFTEN!,https://oklahoman.gannettcontests.com/Lyric-Theatre-of-Oklahoma---A-Slice-of-Musical-Heaven/?itm_campaign=Lyric%20Theatre%20of%20Oklahoma%20-%20Waitress%20-%20A%20Slice%20of%20Musical%20Heaven%20Ticket%20Giveaway&itm_medium=con&itm_source=secondStreet
Winners Announced!,https://oklahoman.gannettcontests.com/2024-Oklahoman-Communitys-Choice-Awards-Winners/?itm_campaign=Oklahoma%202024%20BOB&itm_medium=con&itm_source=secondStreet
Vote Every Week!,https://www.oklahoman.com/sports/high-school/?itm_campaign=Athlete%20of%20the%20Week%20Landmark%20OKC&itm_medium=con&itm_source=secondStreet
District 1 OK County commissioner candidates report routine financing,/story/news/2025/02/09/oklahoma-elections-2025-ok-county-commissioner-district-1-reports/78299879007/
OKC-area voters to consider school bond proposals,/story/news/politics/2025/02/08/oklahoma-city-metro-voters-consider-election-bond-proposals-cashion-western-heights-putnam-city/78337234007/
My father had dementia. You'd have to laugh to avoid crying.Robin R. Gunn,/story/opinion/columns/2025/02/10/dementia-challenge-oklahoma-family-caregivers-laugh-cry-cherish-happy-moments/78377314007/
"OU softball schedule: Dates, times, TV channels for 2025 Sooners",/story/sports/college/sooners/2025/02/06/ou-softball-schedule-dates-times-tv-streaming-2025-oklahoma-sooners/78024860007/
"Oklahoma State softball schedule: Dates, times, TV for 2025 Cowgirls",/story/sports/college/cowboys/2025/02/06/oklahoma-state-softball-schedule-dates-times-tv-streaming-2025-osu-cowgirls/78024679007/
,https://cm.oklahoman.com/site-feedback/?platform=Tangent-Desktop&url=https%3A%2F%2Fwww.oklahoman.com%2F&marketName=oklahoman&cta=Right-Rail
