headline,href
Oklahoma County commissioner election: Meet candidates for District 1,/story/news/2025/02/03/election-oklahoma-county-commissioner-candidates-sara-bana-jed-green-jason-lowe-anastasia-pittman/78004656007/
"Who is Nate Dreiling, OU football's new inside linebackers coach?",/story/sports/college/sooners/2025/02/03/ou-football-nate-dreiling-utah-state-arkansas-state-moves/78144527007/
Three candidates vie for Oklahoma City schools board chairperson seat,/story/news/education/2025/02/03/three-candidates-vie-for-oklahoma-city-schools-board-chairperson-seat-immigration-bibles-cell-phones/78087208007/
US Justice Department is suing two Oklahoma district attorneys,/story/news/2025/02/03/justice-department-tribes-ask-for-bans-against-two-oklahoma-das/78094492007/
Breaking down the 2025 Oklahoma Sooners softball roster…,/story/sports/college/sooners/2025/02/02/ou-softball-roster-schedule-2025-oklahoma-sooners-patty-gasso/77992738007/
"Oklahoma high school fall sports All-State, All-City…",/story/sports/high-school/2025/01/12/oklahoma-high-school-football-softball-volleyball-cross-country-2024-all-state-city-teams-ossaa/77581436007/
Do you know what to do when disaster strikes?,/story/opinion/columns/guest/2025/02/03/a-fire-tornado-disaster-is-coming-what-key-items-should-i-grab-to-take-with-me-opinion/78061539007/
,
"Luka trade reflects badly on Mavs, but here's one GM who…",/story/sports/nba/thunder/2025/02/03/dallas-mavericks-luka-doncic-trade-los-angeles-lakers-nico-harrison-okc-thunder-sam-presti-genius/78163192007/
"Thunder vs Bucks prediction, picks, odds: Latest news…",/story/sports/nba/thunder/2025/02/03/thunder-bucks-prediction-picks-odds-latest-news-injury-updates/78167743007/
Oklahoma County commissioner election: Meet candidates for District 1,/story/news/2025/02/03/election-oklahoma-county-commissioner-candidates-sara-bana-jed-green-jason-lowe-anastasia-pittman/78004656007/
Three candidates vie for Oklahoma City schools board chairperson seat,/story/news/education/2025/02/03/three-candidates-vie-for-oklahoma-city-schools-board-chairperson-seat-immigration-bibles-cell-phones/78087208007/
US Justice Department is suing two Oklahoma district attorneys,/story/news/2025/02/03/justice-department-tribes-ask-for-bans-against-two-oklahoma-das/78094492007/
"Who is Nate Dreiling, OU football's new inside linebackers coach?",/story/sports/college/sooners/2025/02/03/ou-football-nate-dreiling-utah-state-arkansas-state-moves/78144527007/
Where Aaron Wiggins' 40-point game ranks among surprise performances,/story/sports/nba/thunder/2025/02/03/okc-thunder-aaron-wiggins-40-point-game-nba-history-unlikely-performances/78159548007/
"Luka trade reflects badly on Mavs, but here's one GM who looks great",/story/sports/nba/thunder/2025/02/03/dallas-mavericks-luka-doncic-trade-los-angeles-lakers-nico-harrison-okc-thunder-sam-presti-genius/78163192007/
Oklahoma landowners push back on transmission line projects,/story/business/energy-resource/2025/01/31/oklahoma-energy-landowners-push-back-on-development/78059271007/
"Tax season 2025: Where's my refund, what to know about turnaround",/story/business/finance/2025/01/28/wheres-my-refund-heres-what-to-know-about-filing-taxes-tracking/77996487007/
"Walgreens moving forward with plans to close 1,200 stores nationwide",/story/business/2025/01/28/walgreens-to-close-500-stores-before-august-is-oklahoma-affected/77782155007/
Do you know what to do when disaster strikes? Alice Young,/story/opinion/columns/guest/2025/02/03/a-fire-tornado-disaster-is-coming-what-key-items-should-i-grab-to-take-with-me-opinion/78061539007/
We're living in a Trumpian 'Groundhog Day.' Don't ignore him – do this. Rex Huppke,/story/opinion/columnist/2025/02/02/groundhog-day-trump/78024144007/
"Readers comment on abortion, statehood for Canada and Ryan Walters",/story/opinion/letters/2025/02/01/abortion-rights-the-politics-of-canada-and-energy-sales-ryan-walters-letters/78004755007/
"Valentine's Day 2025: Dining deals, food ideas for holiday",/story/money/food/2025/02/03/valentines-day-2025-deals-food-restaurants/78068303007/
"Toyota, Honda among recalled vehicles: See recent car recalls",/story/money/cars/2025/02/03/recent-car-recalls/78159183007/
"Deadly Los Angeles blazes 100% contained, Cal Fire says",/story/news/nation/2025/02/02/los-angeles-wildfires-palisades-eaton-contained/78162651007/
"V-Day deals: Up to 49% off Beats headphones, wearable blankets, games",/story/shopping/2025/02/02/amazon-valentines-day-deals/78158638007/
Restock alert! Cariuma white leather shoes are back,/story/shopping/2025/02/02/cariuma-white-leather-shoes-restock/78156372007/
New Patagonia deals just dropped! Save up to 50% this weekend,/story/shopping/2025/01/31/shop-new-patagonia-winter-deals/78097038007/
See who was nominated for The Oklahoman's Student of the Week,/story/lifestyle/2025/02/03/the-oklahoman-student-of-the-week-vote-poll/78095773007/
OKC Museum of Art celebrating 80th anniversary this year: What to know,/story/entertainment/2025/02/02/okc-museum-of-art-celebrating-80th-anniversary-this-year-what-to-know/77192325007/
Use your noodle: What we learned at our sneak peek of Bar Sen,/story/lifestyle/food/2025/02/01/what-to-expect-at-plaza-districts-bar-sen-as-it-prepares-to-open/78094769007/
,/picture-gallery/sports/college/cowboys/2025/02/02/oklahoma-state-cowboys-vs-missouri-tigers-in-big-12-wrestling-photos/78161767007/
ENTER NOW! ENTER OFTEN!,https://oklahoman.gannettcontests.com/Lyric-Theatre-of-Oklahoma---A-Slice-of-Musical-Heaven/?itm_campaign=Lyric%20Theatre%20of%20Oklahoma%20-%20Waitress%20-%20A%20Slice%20of%20Musical%20Heaven%20Ticket%20Giveaway&itm_medium=con&itm_source=secondStreet
Winners Announced!,https://oklahoman.gannettcontests.com/2024-Oklahoman-Communitys-Choice-Awards-Winners/?itm_campaign=Oklahoma%202024%20BOB&itm_medium=con&itm_source=secondStreet
Vote Every Week!,https://www.oklahoman.com/sports/high-school/?itm_campaign=Athlete%20of%20the%20Week%20Landmark%20OKC&itm_medium=con&itm_source=secondStreet
From the archives: Friends book sale has lasted more than four decades,/story/news/history/2025/02/02/friends-of-metropolitan-library-system-book-sale-okc-history/77770915007/
Behavioral Care Center breaks ground at new jail site at 1901 E Grand,/story/news/2025/02/01/oklahoma-county-breaks-ground-for-behavioral-care-center-at-new-jail-site-mental-health-detention/78028622007/
Where Aaron Wiggins' 40-point game ranks among surprise performances,/story/sports/nba/thunder/2025/02/03/okc-thunder-aaron-wiggins-40-point-game-nba-history-unlikely-performances/78159548007/
See who was nominated for The Oklahoman's Student of the Week,/story/lifestyle/2025/02/03/the-oklahoman-student-of-the-week-vote-poll/78095773007/
Breaking down the Oklahoma State Cowgirls softball roster by position,/story/sports/college/cowboys/2025/02/02/oklahoma-state-softball-roster-schedule-2025-osu-cowgirls-kenny-gajewski/77980014007/
,https://cm.oklahoman.com/site-feedback/?platform=Tangent-Desktop&url=https%3A%2F%2Fwww.oklahoman.com%2F&marketName=oklahoman&cta=Right-Rail
