headline,href
"Industry experts say AI needs energy, and energy exploration needs AI",/story/business/energy-resource/2025/04/27/ai-energy-resources-oklahoma-city-summit-experts-pitch-coal-nuclear/83211323007/
"Fall of Saigon, 50 years later: Oklahomans share their stories",/story/news/2025/04/23/vietnam-war-fall-of-saigon-50-years-oklahoma-city-refugees/83098446007/
Oklahoma City working to find new funding for Overholser Dam plans,/story/news/politics/government/2025/04/27/fema-cuts-halt-overholser-dam-oklahoma-city-renovation-plans/83230186007/
"2025 OKC Memorial Marathon: Live updates, race winners, results",/story/sports/2025/04/27/okc-memorial-marathon-2025-mens-womens-race-winners-results/83307794007/
"Oklahoma high school winter sports All-State, All-City…",/story/sports/high-school/2025/04/11/oklahoma-high-school-basketball-swimming-wrestling-awards-2025/83043358007/
Celebrate Oklahoma high school basketball with 'The Big…,/story/sports/high-school/basketball/2025/02/27/oklahoma-high-school-basketball-book-the-big-house-state-fair-arena/80708941007/
"Taje McCoy happy to be home, ready to help Oklahoma…",/story/sports/college/cowboys/2025/04/27/oklahoma-state-football-taje-mccoy-colorado-transfer-osu-cowboys-big-12/83230214007/
Why wrestling coaches are excited about National Duals…,/story/sports/college/cowboys/2025/04/27/college-wrestling-national-duals-invitational-tulsa-oklahoma-state-coaches-excited/83113910007/
,
Drummond: Taxpayer-funded indoctrination is not…,/story/opinion/2025/04/27/ag-st-isidore-schools-ok-would-threaten-religious-liberty-opinion/83193358007/
"Fall of Saigon, 50 years later: Oklahomans share their stories",/story/news/2025/04/23/vietnam-war-fall-of-saigon-50-years-oklahoma-city-refugees/83098446007/
Oklahoma City working to find new funding for Overholser Dam plans,/story/news/politics/government/2025/04/27/fema-cuts-halt-overholser-dam-oklahoma-city-renovation-plans/83230186007/
Jury convicts Oklahoma man in 2024 murder involving stolen car,/story/news/crime/2025/04/27/oklahoma-city-man-convicted-2024-shooting-stolen-car/83226890007/
"2025 OKC Memorial Marathon: Live updates, race winners, results",/story/sports/2025/04/27/okc-memorial-marathon-2025-mens-womens-race-winners-results/83307794007/
How SGA shook off shooting woes for a playoff career-high 38 points,/story/sports/nba/thunder/2025/04/26/shai-gilgeous-alexander-stats-mid-range-nba-playoffs-okc-thunder-memphis-grizzlies/83297645007/
His wife was killed in bombing. How he honors her at OKC Marathon,/story/sports/columns/jenni-carlson/2025/04/25/okc-memorial-marathon-volunteer-honors-wife-killed-bombing-murrah-building/83257747007/
"Industry experts say AI needs energy, and energy exploration needs AI",/story/business/energy-resource/2025/04/27/ai-energy-resources-oklahoma-city-summit-experts-pitch-coal-nuclear/83211323007/
"Harold Hamm started small, became leading voice in energy industry",/story/business/energy-resource/2025/04/27/harold-hamm-oklahoma-ai-conference-draws-power-brokers-nation/83276762007/
"OKC Memorial Marathon 2025: Things to do, see downtown after the race",/story/business/local/2025/04/26/memorial-marathon-2025-things-to-do-see-in-downtown-okc-after-race/83275618007/
Drummond: Taxpayer-funded indoctrination is not religious liberty Gentner Drummond,/story/opinion/2025/04/27/ag-st-isidore-schools-ok-would-threaten-religious-liberty-opinion/83193358007/
Bishops: Why we favor state funding of a Catholic charter school Paul S. Coakley and David A. Konderla,/story/opinion/columns/guest/2025/04/27/supreme-court-should-approve-state-funding-for-catholic-school-would-increase-choice-for-many/83088498007/
Letters to the editor,/story/opinion/letters/2025/04/26/letters-how-a-family-narrowly-missed-the-okc-bombing-child-care-needs-senate-bill-251/83216266007/
Powerball winning numbers for April 26: Jackpot rises to $168 million,/story/money/lottery/2025/04/27/powerball-winning-numbers/83283371007/
See photos: Trumps and Bidens attend pope's funeral,/story/news/world/2025/04/26/donald-trump-joe-biden-pope-francis-funeral/83293241007/
Fans spot powerful links between pope's love of soccer and his death,/story/news/world/2025/04/26/pope-francis-soccer-card-number/83291721007/
10 luxe Café kitchen appliances to elevate your home,/story/shopping/2025/04/27/wayfair-spring-way-day-sale-cafe-kitchen-appliances/83254773007/
Stretch your dollar: Save up to 67% on recliners at Wayfair,/story/shopping/2025/04/27/best-recliners-wayfair-april-way-day-sale/83259727007/
A machine washable Serta dog bed is less than $60 at Wayfair,/story/shopping/2025/04/26/wayfair-way-day-2025-serta-dog-bed-deal/82945980007/
Need the perfect brunch spot for Mother's Day in OKC? Here are seven options,/story/lifestyle/food/2025/04/26/mothers-day-2025-brunch-spots-in-okc-dining-guide/83259906007/
"OKC metro dining: Where to eat in The Village, Nichols Hills and more",/story/lifestyle/food/2025/04/26/oklahoma-city-restaurant-guide-the-village-nichols-hills/78635138007/
Did we see you at Millwood High School prom? Find your photos here,/picture-gallery/lifestyle/2025/04/25/oklahoma-prom-2025-millwood-high-school-photos/83157986007/
,/picture-gallery/news/2025/04/27/lake-eufaula-dam-oklahoma-history-photos/83083085007/
Enter Now!,https://usatoday.gannettcontests.com/2025-Project-Home-Improved/?itm_campaign=2025%20Project%20Home%20Improved%20Gen&itm_medium=con&itm_source=secondStreet
ENTER TODAY,https://www.kalahariresorts.com/win?itm_campaign=Get%20Kalaharid%20Away&itm_medium=con&itm_source=secondStreet#//?
Vote Every Week!,https://www.oklahoman.com/sports/high-school/?itm_campaign=Athlete%20of%20the%20Week%20Landmark%20OKC&itm_medium=con&itm_source=secondStreet
How SGA shook off shooting woes for a playoff career-high 38 points,/story/sports/nba/thunder/2025/04/26/shai-gilgeous-alexander-stats-mid-range-nba-playoffs-okc-thunder-memphis-grizzlies/83297645007/
His wife was killed in bombing. How he honors her at OKC Marathon,/story/sports/columns/jenni-carlson/2025/04/25/okc-memorial-marathon-volunteer-honors-wife-killed-bombing-murrah-building/83257747007/
"Report card: SGA, Thunder make the grade in closeout win vs Grizzlies",/story/sports/nba/thunder/2025/04/27/thunder-grizzlies-nba-playoffs-game-4-report-card-okc-memphis-shai-gilgeous-alexander/83297974007/
Vote: Landmark Fine Homes girls HS athlete of the week for April 14-20,/story/sports/high-school/athlete-of-the-week/2025/04/22/vote-landmark-fine-homes-girls-high-school-athlete-of-the-week-for-april-14-20/83196574007/
Vote: Landmark Fine Homes boys HS athlete of the week for April 14-20,/story/sports/high-school/athlete-of-the-week/2025/04/22/vote-landmark-fine-homes-boys-high-school-athlete-of-the-week-for-april-14-20/83196486007/
,https://cm.oklahoman.com/site-feedback/?platform=Tangent-Desktop&url=https%3A%2F%2Fwww.oklahoman.com%2F&marketName=oklahoman&cta=Right-Rail
