headline,href
"Myriad issues facing state tribal leaders, lawmakers next session",/story/news/2025/01/05/oklahoma-tribes-compacts-sports-betting-state-legislative-session-2025/77068988007/
"Oklahoma families struggle under gender-affirming care ban, Trump's promises",/story/news/2025/01/02/oklahoma-trans-gender-affirming-care-ban-minors-trump-election/76772661007/
"Norman nonprofit expands to Moore, provides duplexes for unhoused teens",/story/news/education/2025/01/05/bridges-of-norman-ok-duplexes-help-unhoused-teenagers/76860622007/
"Employees with low vision or blindness find income, support at NewView",/story/business/local/2025/01/05/newview-oklahoma-helps-employees-low-vision-blindness-support/76129882007/
Forget tax rebates — Oklahoma has higher priorities…,/story/opinion/columns/guest/2025/01/05/oklahoma-priority-should-be-spending-on-schools-other-needsnot-tax-relief-opinion/77321279007/
"Chiefs vs. Broncos game today: Time, channel for NFL…",/story/sports/nfl/2025/01/05/chiefs-broncos-channel-today-time-tv-schedule-streaming-info-nfl-week-18/77455789007/
,
Meet The Oklahoman's All-State Football Coach of the…,/story/sports/high-school/football/2025/01/05/oklahoma-high-school-football-2024-all-state-coach-of-the-year-candidates/77356257007/
See inside NewView manufacturing in Oklahoma City,/picture-gallery/business/local/2025/01/05/newview-manufacturing-okc-inside-photos/76410196007/
From the archives: The two first women elected to the…,/story/news/history/2025/01/05/oklahoma-legislature-history-first-women-bessie-mccolgin-lamar-looney/77130329007/
Crest Whitestrips are less than $30 at Amazon's winter sale,/story/shopping/2025/01/02/amazon-crest-whitestrips-winter-deal/77404070007/
"Toss your take-out menus! Save on Home Chef, Purple Carrot, Blue Apron in 2025",/story/shopping/2025/01/02/new-year-meal-kit-offers/77402408007/
"Is snow in your forecast? Save on snow blowers, space heaters, shovels and more today",/story/shopping/2025/01/02/amazon-winter-sale-snow-blowers-space-heaters-generators/77405105007/
"Myriad issues facing state tribal leaders, lawmakers next session",/story/news/2025/01/05/oklahoma-tribes-compacts-sports-betting-state-legislative-session-2025/77068988007/
"Oklahoma families struggle under gender-affirming care ban, Trump's promises",/story/news/2025/01/02/oklahoma-trans-gender-affirming-care-ban-minors-trump-election/76772661007/
"Norman nonprofit expands to Moore, provides duplexes for unhoused teens",/story/news/education/2025/01/05/bridges-of-norman-ok-duplexes-help-unhoused-teenagers/76860622007/
Thunder-Celtics in NBA Finals? If only we could get so lucky,/story/sports/nba/thunder/2025/01/05/okc-thunder-vs-boston-celtics-2025-nba-finals/77356925007/
"OU women’s basketball vs. Tennessee: Predictions, injury updates",/story/sports/college/sooners/2025/01/04/oklahoma-tennessee-womens-basketball-prediction-picks-injury-updates/77456938007/
"Chiefs vs. Broncos game today: Time, channel for NFL Week 18 game",/story/sports/nfl/2025/01/05/chiefs-broncos-channel-today-time-tv-schedule-streaming-info-nfl-week-18/77455789007/
"Employees with low vision or blindness find income, support at NewView",/story/business/local/2025/01/05/newview-oklahoma-helps-employees-low-vision-blindness-support/76129882007/
See inside NewView manufacturing in Oklahoma City,/picture-gallery/business/local/2025/01/05/newview-manufacturing-okc-inside-photos/76410196007/
"ONEOK sells around 1,300 miles of pipeline to a Detroit-based operator.",/story/business/energy-resource/2025/01/04/oneok-sold-hundreds-of-miles-of-pipelines-for-1-2-billion/77453667007/
"Letters from readers on Farm Bill, autism and college football",/story/opinion/letters/2025/01/04/flaw-in-proposed-farm-bill-autism-care-and-college-football-letters/77331805007/
Drummond’s response to use-of-force case involving 71-year-old is shameful,/story/opinion/letters/2025/01/03/oklahoma-attorney-general-gentner-drummond-lich-vu-police-brute-force/77417650007/
Biden honors Liz Cheney. Trump wants to jail her,/story/opinion/op-ed/ej-montini/2025/01/03/liz-cheney-presidential-citizens-medal-biden-trump/77421194007/
579 pet shop animals killed in fire at Dallas shopping center,/story/news/nation/2025/01/04/animals-killed-dallas-fire-shopping-center/77459398007/
Don't miss it: Apple offers free Apple TV+ subscription through Jan. 5,/story/entertainment/tv/2025/01/04/free-apple-tv-this-weekend/77458880007/
"Dad, daughter apparent victims in California plane crash: Reports",/story/news/nation/2025/01/04/fullerton-california-plane-crash-victims-pascal-reid-kelly/77455225007/
"Oklahoma, nation are seeing uptick in stomach virus",/story/lifestyle/2025/01/04/norovirus-outbreaks-across-united-states-oklahoma/77236609007/
TBD Creatives brings in City Care residents for candle making,/picture-gallery/lifestyle/features/2025/01/02/okc-candle-making-tbd-creatives/76945121007/
How about adopting a pet as a New Year's resolution?,/story/lifestyle/2025/01/01/make-it-a-happy-new-year-for-an-okc-area-shelter-pet/77161926007/
,/picture-gallery/sports/nba/thunder/2025/01/02/okc-thunder-vs-l-a-clippers-at-paycom-center-see-our-top-photos/77411304007/
Enter Your Pet Photo Today,https://newsok.gannettcontests.com/USAs-Favorite-Pet/?itm_campaign=2024%20USAs%20Favorite%20Pet%20Photos%20Non-Sponsored&itm_medium=con&itm_source=secondStreet
Check out the Winners!,https://cdn.gatehousemedia.com/gh-sites/global/ads/contests/winners/2024wishwinWINNERS_RV2.pdf?itm_campaign=2024%20Wish%20and%20Win%20winners%20phase%202&itm_medium=con&itm_source=secondStreet
Winners Announced!,https://oklahoman.gannettcontests.com/2024-Oklahoman-Communitys-Choice-Awards-Winners/?itm_campaign=Oklahoma%202024%20BOB&itm_medium=con&itm_source=secondStreet
Thunder-Celtics in NBA Finals? If only we could get so lucky,/story/sports/nba/thunder/2025/01/05/okc-thunder-vs-boston-celtics-2025-nba-finals/77356925007/
"OU women’s basketball vs. Tennessee: Predictions, injury updates",/story/sports/college/sooners/2025/01/04/oklahoma-tennessee-womens-basketball-prediction-picks-injury-updates/77456938007/
Meet The Oklahoman's All-State Offensive Player of the Year candidates,/story/sports/high-school/football/2025/01/05/oklahoma-high-school-football-2024-all-state-offensive-player-of-year-candidates/77354942007/
Vote: Landmark Fine Homes girls HS athlete of the week for Dec. 23-29,/story/sports/high-school/2024/12/31/vote-landmark-fine-homes-girls-high-school-athlete-of-the-week-for-dec-23-29/77331067007/
Vote: Landmark Fine Homes boys athlete of the week for Dec. 23-29,/story/sports/high-school/2024/12/31/vote-landmark-fine-homes-boys-high-school-athlete-of-the-week-for-dec-23-29/77330974007/
,https://cm.oklahoman.com/site-feedback/?platform=Tangent-Desktop&url=https%3A%2F%2Fwww.oklahoman.com%2F&marketName=oklahoman&cta=Right-Rail
