headline,href
'Our past doesn't define us': The children of the Oklahoma City bombing,/story/news/2025/04/13/oklahoma-city-bombing-children-of-victims-symbols-city-growth/81752124007/
"Oklahoma City bombing, 30 years later: What's changed, what's next?",/story/news/2025/04/13/okc-bombing-memorial-30-years-later-remembering-victims-moving-forward/82675924007/
"Pre-order The Oklahoman's book on Oklahoma City bombing, resilience",/story/news/2025/04/13/okc-bombing-book-captures-citys-resilience-at-30th-anniversary-oklahoman/83027946007/
Shai Gilgeous-Alexander has the Thunder to take playoffs by storm,/story/sports/nba/thunder/2025/04/18/shai-gilgeous-alexander-okc-thunder-2025-nba-playoffs-schedule/83143797007/
"Oklahoma high school winter sports All-State, All-City…",/story/sports/high-school/2025/04/11/oklahoma-high-school-basketball-swimming-wrestling-awards-2025/83043358007/
Celebrate Oklahoma high school basketball with 'The Big…,/story/sports/high-school/basketball/2025/02/27/oklahoma-high-school-basketball-book-the-big-house-state-fair-arena/80708941007/
,
"OU softball schedule: Dates, times, TV channels for 2025…",/story/sports/college/sooners/2025/02/06/ou-softball-schedule-dates-times-tv-streaming-2025-oklahoma-sooners/78024860007/
Why Thunder will be an outlier one way or another in the…,/story/sports/nba/thunder/2025/04/18/okc-thunder-nba-playoffs-schedule-mark-daigneault-chet-holmgren-shai-gilgeous-alexander/83145363007/
Does mail run on Good Friday? Is the stock market open…,/story/news/2025/04/18/is-the-stock-market-open-on-good-friday-banks-see-whats-open-closed-oklahoma/83154641007/
'Our past doesn't define us': The children of the Oklahoma City bombing,/story/news/2025/04/13/oklahoma-city-bombing-children-of-victims-symbols-city-growth/81752124007/
"Oklahoma City bombing, 30 years later: What's changed, what's next?",/story/news/2025/04/13/okc-bombing-memorial-30-years-later-remembering-victims-moving-forward/82675924007/
"Pre-order The Oklahoman's book on Oklahoma City bombing, resilience",/story/news/2025/04/13/okc-bombing-book-captures-citys-resilience-at-30th-anniversary-oklahoman/83027946007/
Shai Gilgeous-Alexander has the Thunder to take playoffs by storm,/story/sports/nba/thunder/2025/04/18/shai-gilgeous-alexander-okc-thunder-2025-nba-playoffs-schedule/83143797007/
How Thunder sideline reporter Nick Gallo became an NBA viral sensation,/story/sports/nba/thunder/2025/04/17/okc-thunder-nick-gallo-postgame-interviews-fan-duel-sports-network-nba-playoffs/83135302007/
Why Thunder will be an outlier one way or another in the NBA Playoffs,/story/sports/nba/thunder/2025/04/18/okc-thunder-nba-playoffs-schedule-mark-daigneault-chet-holmgren-shai-gilgeous-alexander/83145363007/
Future is a blank slate for area known for decades as Hub Cap Alley,/story/business/columns/steve-lackmeyer/2025/04/18/hub-cap-alley-okc-demolished-history/82984991007/
Housing sales data showed a healthy real estate market in March,/story/business/real-estate/2025/04/16/oklahoma-city-real-estate-home-prices-sales-2025/83070691007/
Lawmakers fear AI data centers will drive up residents’ power bills,/story/business/energy-resource/2025/04/14/will-ai-raise-my-power-bill-what-to-know/83083361007/
Why a proposed OK bill is an attack on special education students Jared S. Gleaton,/story/opinion/columns/guest/2025/04/18/proposed-oklahoma-law-would-force-disabled-children-out-of-public-schools/83026339007/
"Oklahoma City bombing, 30 years later: A time of reflection",/story/opinion/cartoons/2025/04/18/oklahoma-city-bombing-30-years-later-a-time-of-reflection-cartoon/83138958007/
Foreign aid cuts could jeopardize Oklahoma's export market James Collard,/story/opinion/columns/guest/2025/04/18/foreign-aid-cuts-will-mean-u-s-loses-and-china-wins-will-hurt-main-street-oklahoma-native-communitie/83085889007/
Lowe's puts new tool in its belt with billon-dollar acquistion,/story/money/2025/04/18/lowes-acquisition-artisan-design-group/83154000007/
NASA astronaut to return to Earth with two Russians after ISS stint,/story/news/nation/2025/04/18/nasa-astronaut-don-pettit-return-iss/83113207007/
"Lyrid meteor shower could be spoiled by storm, clouds: What to know",/story/news/nation/2025/04/18/lyrid-meteor-shower-2025-peak-time-forecast/83113292007/
Last day! Get a Boarderie Easter cheese board delivered by Sunday,/story/shopping/2025/04/18/last-chance-easter-delivery-boarderie/83154276007/
"Cut costs with budget-friendly phone plans at Tello, T-Mobile, Visible",/story/shopping/2025/04/18/save-budget-friendly-phone-plans/83123216007/
"📲 Trending now: A $15 Uniqlo mini bag, an iPhone toaster and more",/story/shopping/2025/04/18/viral-tiktok-products-uniqlo-mini-bag-k-beauty-skincare/83138087007/
Director dedicates Netflix OKC bombing film to the 168 people who died,/story/entertainment/2025/04/18/oklahoma-city-bombing-netflix-documentary-release/83111940007/
Netflix film marks Oklahoma City bombing's 30th anniversary: See photos,/picture-gallery/entertainment/2025/04/18/netflix-documentary-marks-30th-anniversary-of-oklahoma-city-bombing-photos/83135316007/
Need a last-minute Easter meal? Here's where to get it in OKC,/story/lifestyle/food/2025/04/17/easter-2025-okc-whiskey-cake-restaurants-meal-pickup/83140468007/
,/picture-gallery/entertainment/2025/04/18/netflix-documentary-marks-30th-anniversary-of-oklahoma-city-bombing-photos/83135316007/
Hurry and Enter!,https://knockaround.com/pages/truist-sweepstakes?itm_campaign=knockaround%20truist%20championship&itm_medium=con&itm_source=secondStreet#//?
Enter Now!,https://usatoday.gannettcontests.com/2025-Project-Home-Improved/?itm_campaign=2025%20Project%20Home%20Improved%20Gen&itm_medium=con&itm_source=secondStreet
ENTER TODAY,https://www.kalahariresorts.com/win?itm_campaign=Get%20Kalaharid%20Away&itm_medium=con&itm_source=secondStreet#//?
Director dedicates Netflix OKC bombing film to the 168 people who died,/story/entertainment/2025/04/18/oklahoma-city-bombing-netflix-documentary-release/83111940007/
"Here's what happened to the OKC bomber, others since the deadly attack",/story/news/2025/04/13/oklahoma-city-bombing-30-years-later-timothy-mcveigh-terry-nicols-bill-clinton/81803192007/
How Thunder sideline reporter Nick Gallo became an NBA viral sensation,/story/sports/nba/thunder/2025/04/17/okc-thunder-nick-gallo-postgame-interviews-fan-duel-sports-network-nba-playoffs/83135302007/
Vote: Landmark Fine Homes boys HS athlete of the week for April 7-13,/story/sports/high-school/athlete-of-the-week/2025/04/14/vote-landmark-fine-homes-boys-high-school-athlete-of-the-week-for-april-7-13/83083918007/
Vote: Landmark Fine Homes girls HS athlete of the week for April 7-13,/story/sports/high-school/athlete-of-the-week/2025/04/14/vote-landmark-fine-homes-girls-high-school-athlete-of-the-week-for-april-7-13/83084065007/
,https://cm.oklahoman.com/site-feedback/?platform=Tangent-Desktop&url=https%3A%2F%2Fwww.oklahoman.com%2F&marketName=oklahoman&cta=Right-Rail
