headline,href
BANNER NIGHTThunder unveils NBA championship banner before opener vs RocketsThe Oklahoma City Thunder is hosting the Houston Rockets on NBA opening night at Paycom Center. Follow live updates.,/live-story/sports/nba/thunder/2025/10/21/thunder-rockets-live-updates-score-nba-opening-night/86819557007/
Jalen Williams injury update: Thunder star 'progressing' since surgery,/story/sports/nba/thunder/2025/10/21/jalen-williams-injury-update-thunder-star-progressing-since-surgery/86824414007/
See the 2025 NBA championship rings and banner for the OKC Thunder,/picture-gallery/sports/nba/thunder/2025/10/21/oklahoma-city-okc-thunder-championship-ring-banner-ceremony-nba-season-opener/86800905007/
See the entrance outfits of OKC Thunder players ahead of NBA season opener,/picture-gallery/sports/nba/thunder/2025/10/21/okc-thunder-shai-gilgeous-alexander-players-entrances-nba-season-opener/86800768007/
"Airport, highways sport signs marking OKC Thunder’s NBA Championship win",/story/news/2025/10/21/okc-thunder-day-nba-opening-night-2025-game-commemorative-signs-championship/86800644007/
New Oklahoma DUI law bringing harsher penalties takes effect Nov. 1,/story/news/politics/2025/10/21/oklahoma-dui-laws-change-nov-1-what-to-know-about-harsher-penalties/86815343007/
"Judge says lawsuit filed against Ryan Walters, ed board can continue",/story/news/education/2025/10/21/court-allows-suit-against-ryan-walters-oklahoma-ed-board-to-continue/86801866007/
Take a look at OKC Thunder unveiling 2024-25 NBA championship banner,/story/sports/nba/thunder/2025/10/21/okc-thunder-unveils-championship-banner-nba-opening-night-vs-rockets/86825290007/
Here are 5 reportedly haunted spots around Oklahoma to…,/story/news/local/2025/10/21/check-out-these-5-haunted-spots-around-oklahoma/86458608007/
Can pot smokers legally own guns? Supreme Court to decide,/story/news/politics/2025/10/20/supreme-court-drugs-weed-guns-trump-justice-department/86602524007/
,
Legend has it: These three houses in Oklahoma City are…,/story/business/2021/10/27/haunted-house-okc-okalahoma-city-overholser-governor-mansion-hatchet-house-carey-place/8365868002/
What you need to know about OKC Thunder schedule and how…,/story/sports/nba/thunder/2025/10/21/okc-thunder-schedule-dates-times-tv-streaming/86811489007/
Vote: Landmark Fine Homes HS boys athlete of the week…,/story/sports/high-school/athlete-of-the-week/2025/10/20/vote-landmark-fine-homes-high-school-okc-area-boys-athlete-of-week-oct-13-19/86806314007/
Save $50 on this automatic toothbrush that kids actually want to use,https://www.usatoday.com/story/shopping/2025/10/15/new-willo-brushbot-kids-toothbrush-deal/86704990007/
"Socks, brick and mortar: Bombas opens first physical stores. See where.",/story/money/retail/2025/10/21/bombas-opening-first-stores-socks/86816774007/
Top gifts for every OKC Thunder fan this holiday season,/story/shopping/2025/10/21/oklahoma-city-thunder-gift-guide/86805754007/
"Airport, highways sport signs marking OKC Thunder’s NBA Championship win",/story/news/2025/10/21/okc-thunder-day-nba-opening-night-2025-game-commemorative-signs-championship/86800644007/
New Oklahoma DUI law bringing harsher penalties takes effect Nov. 1,/story/news/politics/2025/10/21/oklahoma-dui-laws-change-nov-1-what-to-know-about-harsher-penalties/86815343007/
"Judge says lawsuit filed against Ryan Walters, ed board can continue",/story/news/education/2025/10/21/court-allows-suit-against-ryan-walters-oklahoma-ed-board-to-continue/86801866007/
Thunder unveils NBA championship banner before opener vs Rockets,/live-story/sports/nba/thunder/2025/10/21/thunder-rockets-live-updates-score-nba-opening-night/86819557007/
Take a look at OKC Thunder unveiling 2024-25 NBA championship banner,/story/sports/nba/thunder/2025/10/21/okc-thunder-unveils-championship-banner-nba-opening-night-vs-rockets/86825290007/
Take a look at OKC Thunder players receiving NBA championship rings,/story/sports/nba/thunder/2025/10/21/okc-thunder-nba-championship-rings-shai-gilgeous-alexander/86825135007/
Legend has it: These three houses in Oklahoma City are haunted,/story/business/2021/10/27/haunted-house-okc-okalahoma-city-overholser-governor-mansion-hatchet-house-carey-place/8365868002/
Long-delayed development in OKC's Deep Deuce neighborhood now under way,/story/business/real-estate/2025/10/21/long-stalled-development-in-okcs-deep-deuce-restarts-with-new-builder/86799684007/
Renovation into micro-apartment community gives former Holiday Inn new life,/story/business/real-estate/2025/10/20/the-pulse-okc-oklahoma-city-micro-apartments-leasing/86565868007/
Raise a snuff glass of iced tea that things line up for Oklahoma schools Mark McBride,/story/opinion/columns/guest/2025/10/21/oklahoma-education-advisory-committee-stitt-stability-transparency/86563970007/
Scary times ahead. What frightens you most?,/story/opinion/columns/your-voice/2025/10/21/halloween-scares-fun-real-life-events-can-be-frightening-for-adults-what-scares-you/86805752007/
"As a conservative, drowning out 'No Kings' protesters raises red flags Brandon Holmes",/story/opinion/columns/guest/2025/10/21/okc-no-kings-protesters-drowned-construction-noise/86800103007/
HBO Max prices are going up. See the streamer's new cost,/story/entertainment/2025/10/21/hbo-max-price-hikes-october-2025/86822625007/
Winn-Dixie Company to sell or close over 30 stores in strategic shift,/story/money/2025/10/21/winn-dixie-sells-closes-stores/86821447007/
"Socks, brick and mortar: Bombas opens first physical stores. See where.",/story/money/retail/2025/10/21/bombas-opening-first-stores-socks/86816774007/
Empire Slice announces closure of OKC slice shop location. What to know,/story/entertainment/dining/2025/10/21/empire-slice-okc-closing-slice-shop-location-what-to-know/86823190007/
"What time is 'Dancing with the Stars' on? How to watch live, vote",/story/entertainment/2025/10/21/where-to-watch-dancing-with-the-stars-live-vote-dwts/86802242007/
"Paul McCartney tour hits Tulsa's BOK Center. See setlist, time",/story/entertainment/music/2025/10/21/paul-mccartney-tour-2025-setlist-doors-open-at-tulsa-bok-center/86805040007/
,/picture-gallery/sports/nba/thunder/2025/10/21/okc-thunder-vs-houston-rockets-nba-season-opener-game-fan-photos/86800847007/
ENTER TODAY,https://usatoday.gannettcontests.com/Empire-Today-Floor-to-Door-Makeover/?itm_campaign=Empire%20Today&itm_medium=con&itm_source=secondStreet
ENTER NOW! ENTER OFTEN!,https://oklahoman.gannettcontests.com/OKC-Broadway-Elf-The-Musical/?itm_campaign=OKC%20Broadway%20-%20Elf%20The%20Musical%20VIP%20Experience%20Giveaway&itm_medium=con&itm_source=secondStreet
WIN AN ENCHANTED ESCAPE,https://usatoday.gannettcontests.com/The-North-Carolina-Arboretum-Enchanted-Escape/?itm_campaign=Enchanted%20Escape&itm_medium=con&itm_source=secondStreet
Take a look at OKC Thunder players receiving NBA championship rings,/story/sports/nba/thunder/2025/10/21/okc-thunder-nba-championship-rings-shai-gilgeous-alexander/86825135007/
Mussatto: Will Thunder repeat? 10 bold predictions for OKC this season,/story/sports/nba/thunder/2025/10/21/okc-thunder-bold-predictions-2025-26-nba-season-shai-gilgeous-alexander-chet-holmgren/86820586007/
Empire Slice announces closure of OKC slice shop location. What to know,/story/entertainment/dining/2025/10/21/empire-slice-okc-closing-slice-shop-location-what-to-know/86823190007/
Could Thunder keep together this Big Three longer than the last time?,/story/sports/nba/thunder/2025/10/21/okc-thunder-big-three-shai-gilgeous-alexander-chet-holmgren-jalen-williams-2025-26-nba-season/86789953007/
Why Reggie Miller has a strong comparison for the Thunder,/story/sports/nba/thunder/2025/10/21/reggie-miller-nba-on-nbc-okc-thunder-vs-rockets-2025-26-season-opener/86805856007/
,https://cm.oklahoman.com/site-feedback/?platform=Tangent-Desktop&url=https%3A%2F%2Fwww.oklahoman.com%2F&marketName=oklahoman&cta=Right-Rail
