headline,href
Prison company plan would move all inmates out of Lawton facility by Sept. 30,/story/news/politics/government/2024/06/22/lawton-correctional-facility-oklahoma-shutdown-contract-extension-agreement/74168302007/
"OKC on track to host 2028 Olympic softball, canoeing events",/story/news/2024/06/21/2028-olympics-oklahoma-city-on-track-to-host-softball-canoeing-events/74165057007/
"Culinary world promotes bicycle helmet safety locally, nationally",/story/lifestyle/food/2024/06/22/vast-okc-bicycle-safety-gordon-ramsay-helmet-drive/74170037007/
OU regents increase tuition 3% for 2024-25 academic year,/story/news/education/campus/2024/06/22/university-oklahoma-ou-approves-tuition-hike-2024-25-year/74169144007/
"Spark signing tracker: OU stars Rylie Boone, Jayda…",/story/sports/2024/06/15/okc-spark-signing-tracker-former-ou-softball-sooners-osu-cowgirls/74109214007/
Celebrate OU softball's fourth straight WCWS title with…,/story/sports/college/sooners/2024/06/14/ou-softball-book-wcws-championship-four-peat-oklahoma-sooners/74094737007/
,
Oklahoma high school spring sports awards 2024 in…,/story/sports/high-school/2024/06/13/oklahoma-high-school-spring-sports-awards-2024-baseball-golf-soccer-slowpitch-tennis-track-field/74081171007/
OSU softball transfer tracker 2024: Latest portal news…,/story/sports/college/cowboys/2024/06/11/oklahoma-state-softball-transfer-portal-tracker-2024-offseason-osu-cowgirls/74052968007/
OU softball transfer tracker 2024: Latest portal news…,/story/sports/college/sooners/2024/06/10/ou-softball-transfer-portal-tracker-2024-offseason-oklahoma-sooners/74051939007/
Prison company plan would move all inmates out of Lawton facility by Sept. 30,/story/news/politics/government/2024/06/22/lawton-correctional-facility-oklahoma-shutdown-contract-extension-agreement/74168302007/
"OKC on track to host 2028 Olympic softball, canoeing events",/story/news/2024/06/21/2028-olympics-oklahoma-city-on-track-to-host-softball-canoeing-events/74165057007/
OU regents increase tuition 3% for 2024-25 academic year,/story/news/education/campus/2024/06/22/university-oklahoma-ou-approves-tuition-hike-2024-25-year/74169144007/
Thunder mailbag: Will Presti target a tradition big man in NBA Draft?,/story/sports/nba/thunder/2024/06/22/okc-thunder-sam-presti-nba-draft-center-prospects-free-agency/74161932007/
Josh Giddey bids farewell to Thunder after getting traded to Bulls,/story/sports/nba/thunder/2024/06/21/josh-giddey-farewell-to-okc-thunder-bulls-trade/74175973007/
OKC reaffirms Softball Capital of the World status with 2028 Olympics,/story/sports/olympics/2024/06/21/oklahoma-city-host-softball-olympics-2028-los-angeles-games/74175952007/
Arts Institute ready for space at Edmond park after plans finalized,/story/business/real-estate/2024/06/14/edmond-fine-arts-institute-ready-for-space-at-new-art-park-oklahoma-okc-oklahoma-city/74083792007/
"Oklahoma wheat harvest is more than half complete, with varying yields",/story/business/agricultural/2024/06/14/oklahoma-hard-red-winter-wheat-harvest-more-than-half-done-despite-weather-rain-challenges/74084467007/
"OKC arena transit hub, commuter rail system dependent on 2025 election",/story/business/transportation/2024/06/10/okc-thunder-nba-arena-elections-transit-network-tax-approval-plans/73991225007/
Christian faith of Sooner softball team prompts question of acceptance,/story/opinion/letters/2024/06/22/opinion-ou-softball-fan-questions-if-nonbelievers-others-would-be-accepted-letters/74085586007/
"If this happens in Oklahoma, Ten Commandments should include Trump disclaimer Rex Huppke",/story/opinion/columns/2024/06/21/ten-commandments-poster-should-note-trump-broke-several-do-oklahomans-care/74171442007/
Prison reform will grow Oklahoma’s workforce Noah Berry and Conor Norris,/story/opinion/columns/2024/06/21/opinion-training-prisoners-for-meaningful-jobs-will-help-states-labor-shortage/74086476007/
Mega Millions winning numbers for June 21: Jackpot worth $80 million,/story/money/lottery/2024/06/21/mega-millions-winning-numbers/74175622007/
Hackers demand millions to end cyberattack crippling car dealers: Report,/story/money/cars/2024/06/21/cdk-cyberattack-ransom-demands-report/74175607007/
Massive haboob makes 'unbelievable' 200-mile journey in seconds: Watch,/story/news/nation/2024/06/21/new-mexico-haboob-dust-storm-video/74172740007/
"Culinary world promotes bicycle helmet safety locally, nationally",/story/lifestyle/food/2024/06/22/vast-okc-bicycle-safety-gordon-ramsay-helmet-drive/74170037007/
"Oklahoma Film Icon Paul Sparks talks 'The Bikeriders,' 'Boardwalk Empire'",/story/entertainment/2024/06/22/actor-paul-sparks-honored-as-oklahoma-film-icon-talks-the-bikeriders/73891163007/
OKC theater stages outdoor 'Midsummer Night's Dream' with 1960s flair,/story/entertainment/2024/06/21/oklahoma-shakespeares-new-a-midsummer-nights-dream-gets-groovy/73918400007/
,/picture-gallery/sports/nba/thunder/2024/06/21/alex-caruso-okc-thunder-guard-photos/74166672007/
ENTER TODAY!,https://usatoday.gannettcontests.com/Service-Experts-Home-of-the-Future/?itm_campaign=Service%20Experts%20Gordons%20Home%20of%20the%20Future&itm_medium=con&itm_source=secondStreet
Check Out the Big Winners!,https://cdn.gatehousemedia.com/gh-sites/global/ads/contests/winners/STIHL10X10_winnerad_HG_Spring2024.pdf?itm_campaign=2024%20Spring%20Home%20%26amp%3B%20Garden%20Refresh%20Winners&itm_medium=con&itm_source=secondStreet
OU Board of Regents votes to remove McClendon name from Honors College,/story/news/education/campus/2024/06/22/ou-honors-college-mcclendon-removed-from-name-board-regents/74171788007/
Cleveland County budget adopted amid tensions with reelected sheriff,/story/news/local/norman/2024/06/22/cleveland-county-oklahoma-2025-budget-battle-ends-sheriff/74162063007/
"Oklahoma Film Icon Paul Sparks talks 'The Bikeriders,' 'Boardwalk Empire'",/story/entertainment/2024/06/22/actor-paul-sparks-honored-as-oklahoma-film-icon-talks-the-bikeriders/73891163007/
Oklahoma has become a battleground to challenge religious liberty,/story/news/2024/06/20/oklahoma-religious-liberty-battleground-governor-kevin-stitt-aclu-bills/73909227007/
Christian faith of Sooner softball team prompts question of acceptance,/story/opinion/letters/2024/06/22/opinion-ou-softball-fan-questions-if-nonbelievers-others-would-be-accepted-letters/74085586007/
,https://cm.oklahoman.com/site-feedback/?platform=Tangent-Desktop&url=https%3A%2F%2Fwww.oklahoman.com%2F&marketName=oklahoman&cta=Right-Rail
