headline,href
Gov. Stitt declares emergency after wildfires destroy more than 200 homes,/story/news/2025/03/15/oklahoma-wildfires-destroy-more-than-200-homes-one-dead-governor-stitt-declares-emergency/82442461007/
"Live: More than 200 homes destroyed; winds calming across Oklahoma, but wildfire risk remains",/story/weather/2025/03/15/oklahoma-wildfire-2025-live-updates/82369212007/
"As Myriad Convention Center comes down, memories linger with Oklahomans",/story/business/downtown/2025/03/13/cox-convention-center-okc-history-elvis-presley-journey-aerosmith/77511780007/
SGA scores 48 points as Thunder holds off Pistons for 55th victory,/story/sports/nba/thunder/2025/03/15/thunder-pistons-score-nba-standings-game-live-updates-highlights-stats/82448572007/
Why all classes together for state basketball could…,/story/sports/high-school/basketball/2025/03/15/oklahoma-high-school-basketball-state-tournaments-ossaa-all-classifications-oge-coliseum-2026/82413562007/
Oklahoma HS basketball scoreboard: Today's schedule…,/story/sports/high-school/basketball/2025/03/10/oklahoma-high-school-basketball-2025-ossaa-class-6a-5a-4a-3a-state-tournament-scores-schedule/82205948007/
Celebrate Oklahoma high school basketball with 'The Big…,/story/sports/high-school/basketball/2025/02/27/oklahoma-high-school-basketball-book-the-big-house-state-fair-arena/80708941007/
,
OSSAA basketball state tournament 2025: Everything you…,/story/sports/high-school/basketball/2025/03/04/oklahoma-high-school-basketball-2025-ossaa-state-tournament-previews-results/81198708007/
"OU softball schedule: Dates, times, TV channels for 2025…",/story/sports/college/sooners/2025/02/06/ou-softball-schedule-dates-times-tv-streaming-2025-oklahoma-sooners/78024860007/
Gov. Stitt declares emergency after wildfires destroy more than 200 homes,/story/news/2025/03/15/oklahoma-wildfires-destroy-more-than-200-homes-one-dead-governor-stitt-declares-emergency/82442461007/
"Live: More than 200 homes destroyed; winds calming across Oklahoma, but wildfire risk remains",/story/weather/2025/03/15/oklahoma-wildfire-2025-live-updates/82369212007/
Photos from aftermath in Stillwater from Wildfires,/picture-gallery/news/2025/03/15/aftermath-of-oklahoma-wildfires-in-stillwater-neighborhood/82449657007/
SGA scores 48 points as OKC Thunder holds off Pistons for 55th win,/story/sports/nba/thunder/2025/03/15/thunder-pistons-score-nba-standings-game-live-updates-highlights-stats/82448572007/
Lu Dort injury update: OKC Thunder guard exits game vs Detroit Pistons,/story/sports/nba/thunder/2025/03/15/luguentz-dort-injury-update-okc-thunder-guard-exits-game-vs-detroit-pistons/82456777007/
Class 3A girls basketball: Washington routs Sequoyah Tahlequah for title,/story/sports/high-school/basketball/2025/03/15/washington-sequoyah-tahlequah-oklahoma-high-school-basketball-ossaa-class-3a-girls-championship/82449750007/
"As Myriad Convention Center comes down, memories linger with Oklahomans",/story/business/downtown/2025/03/13/cox-convention-center-okc-history-elvis-presley-journey-aerosmith/77511780007/
"Dogs, owners happy about new OKC Midtown Mutts Dog Park opening",/story/business/downtown/2025/03/15/upgraded-oklahoma-city-dog-park-attracts-canines-owners-to-midtown/80066392007/
Bill focuses on shopping cart thefts; critics say it targets homeless,/story/business/2025/03/13/shopping-cart-legislation-sparks-discussion-on-thefts-homelessness/82363916007/
"Letters on OSU audit, Trump tariffs, problems in mental health care",/story/opinion/letters/2025/03/15/readers-weigh-osu-audit-trump-tariffs-shortage-mental-health-workers-social-security-congress/82239104007/
$3 million blessing? Court curbs Ryan Walters' school Bibles plan,/story/opinion/cartoons/2025/03/14/ryan-walters-court-roadblock-bibles-oklahoma-schools-3-million-cartoon/82376329007/
"Despite sales tax cut, Oklahoma is top 10 for high groceries cost James Davenport and Samantha Johnson",/story/opinion/columns/2025/03/14/oklahoma-groceries-sales-tax-cut-relief-high-prices/82363209007/
Multiple wildfires consume thousands of acres across Texas,/story/news/nation/2025/03/15/texas-fredericksburg-wildfires/82453453007/
These 7 federal agencies just lost funding following a Trump order,/story/news/politics/2025/03/15/trump-executive-order-federal-agencies-funding-cut/82448071007/
What are the odds? Earthquake strikes MS town near site of multiple tornadoes,/story/news/nation/2025/03/15/earthquake-magee-mississippi-tornadoes/82450943007/
"REI Co-op members get 20% off Coleman, Patagonia, Blundstone",/story/shopping/2025/03/14/rei-co-op-member-sale-2025/82376215007/
Streaming deal: Get Disney+ and Hulu for $2.99 a month for four months,/story/shopping/2025/03/12/disney-streaming-bundle-disney-and-hulu/82275730007/
"Get up to $643 off Gordon Ramsay-backed HexClad cookware, grill sets",/story/shopping/2025/03/14/hexclad-cookware-deals-spring-2025/82402930007/
"From dinosaurs to SpongeBob, spring break 2025 activities abound in OKC",/story/entertainment/2025/03/15/25-things-to-do-in-okc-for-spring-break-from-peter-pan-to-cowboy-boots/82299718007/
Photos: Oklahoma City's Midtown Dog Park relocates,/picture-gallery/lifestyle/features/2025/03/15/okc-dog-park-in-midtown-opens-in-new-location-see-photos/80696659007/
The Avett Brothers and Dawes are coming to OKC: What you need to know,/story/entertainment/2025/03/14/the-avett-brothers-are-planning-a-summer-okc-show-how-to-get-tickets/82403873007/
,/picture-gallery/news/2025/03/14/best-of-feb/78388967007/
Enter Today!,https://usatoday.gannettcontests.com/Kansas-City-Steak-Company-Spring-SweepSteaks/?itm_campaign=Kansas%20City%20Steak%20Company%20Spring%20SweepSteaks&itm_medium=con&itm_source=secondStreet
Nominate Today!,https://oklahoman.gannettcontests.com/2025-Oklahoman-Communitys-Choice-Awards/?itm_campaign=Oklahoma%20Bob&itm_medium=con&itm_source=secondStreet
ENTER TODAY,https://www.kalahariresorts.com/win?itm_campaign=Get%20Kalaharid%20Away&itm_medium=con&itm_source=secondStreet#//?
Lu Dort injury update: OKC Thunder guard exits game vs Detroit Pistons,/story/sports/nba/thunder/2025/03/15/luguentz-dort-injury-update-okc-thunder-guard-exits-game-vs-detroit-pistons/82456777007/
Class 3A girls basketball: Washington routs Sequoyah Tahlequah for title,/story/sports/high-school/basketball/2025/03/15/washington-sequoyah-tahlequah-oklahoma-high-school-basketball-ossaa-class-3a-girls-championship/82449750007/
Class 5A boys basketball: Booker T. Washington tops Lawton for title,/story/sports/high-school/basketball/2025/03/15/lawton-booker-t-washington-score-oklahoma-high-school-basketball-ossaa-class-5a-boys-championship/82447704007/
Class 4A boys basketball: Weatherford wins first state championship,/story/sports/high-school/basketball/2025/03/15/crossings-christian-weatherford-score-oklahoma-high-school-basketball-ossaa-class-4a-boys-final/82443570007/
"OU softball sweeps Arkansas as Pickering, Sooners rally in Game 2",/story/sports/college/sooners/2025/03/15/ou-arkansas-score-updates-college-softball-today-oklahoma-sooners/82444972007/
,https://cm.oklahoman.com/site-feedback/?platform=Tangent-Desktop&url=https%3A%2F%2Fwww.oklahoman.com%2F&marketName=oklahoman&cta=Right-Rail
