headline,href
"Exclusive: See trailer for 'The Jewel,' new film to save OKC's last Black cinema",/story/lifestyle/2023/09/20/the-jewel-okc-trailer-prairie-surf-media-see-trailer/70127466007/
SBC ousts Oklahoma church for racism after pastor wears blackface,/story/news/religion/2023/09/19/southern-baptist-convention-ousts-oklahoma-church-matoaka-baptist-for-racism-pastor-wears-blackface/70900075007/
"Amazon is hiring in Oklahoma, full-time, part-time, and seasonal jobs",/story/business/employment/2023/09/20/amazon-jobs-hiring-in-oklahoma-okc-christmas-holiday-season/70902963007/
"Officials seize thousands of pounds of marijuana, shut down 5 businesses",/story/news/crime/2023/09/20/oklahoma-medical-marijuana-authority-seize-untraceable-marijuana-5-shut-down/70901957007/
"With new tax credit, Oklahoma religious private schools…",/story/news/education/2023/09/19/oklahoma-private-school-tax-credit-catholic-schools-look-expansion/70899615007/
How El Coyote in OKC is turning up the heat for its…,/story/lifestyle/food/2023/09/19/el-coyote-okc-one-year-celebration-hatch-chile-pepper/70820612007/
Vote now on the Final Four of our Best Barbecue Bracket,/story/lifestyle/food/2023/09/19/oklahoma-bbq-the-oklahoman-best-barbecue-bracket-final-four-vote/70895137007/
,
Grading Oklahoma: A look at domestic violence in Oklahoma,/story/opinion/2023/09/17/grading-oklahoma-a-look-at-domestic-violence-in-oklahoma/70868135007/
Barry Sanders statue shows Lions great in middle of one…,/story/sports/nfl/2023/09/16/barry-sanders-statue-unveiled-at-ford-field/70877500007/
SBC ousts Oklahoma church for racism after pastor wears blackface,/story/news/religion/2023/09/19/southern-baptist-convention-ousts-oklahoma-church-matoaka-baptist-for-racism-pastor-wears-blackface/70900075007/
"Officials seize thousands of pounds of marijuana, shut down 5 businesses",/story/news/crime/2023/09/20/oklahoma-medical-marijuana-authority-seize-untraceable-marijuana-5-shut-down/70901957007/
Could industrial hemp be the next major industry for Oklahoma?,/story/news/politics/2023/09/20/oklahoma-legislature-industrial-hemp-expanding-rural-economy/70899612007/
Barry Sanders statue shows Lions great in middle of one of his iconic runs,/story/sports/nfl/2023/09/16/barry-sanders-statue-unveiled-at-ford-field/70877500007/
Gabriel 'operating with a real edge' as OU finds offensive groove,/story/sports/college/sooners/2023/09/20/ou-football-dillon-gabriel-lifted-oklahoma-sooners-offense-ncaa-rankings/70903668007/
Will offensive line's starters-only meeting reboot OSU blockers?,/story/sports/college/cowboys/2023/09/20/oklahoma-state-football-offensive-line-hold-starters-only-meeting-2023-osu-cowboys/70900563007/
"Amazon is hiring in Oklahoma, full-time, part-time, and seasonal jobs",/story/business/employment/2023/09/20/amazon-jobs-hiring-in-oklahoma-okc-christmas-holiday-season/70902963007/
Summertime slip: Oklahoma City-area home prices dip July to August,/story/business/real-estate/2023/09/20/okc-real-estate-homes-for-sale-august-prices-slipped-mortgage-rates/70842274007/
"Pioneer Telephone, Oklahoma's first phone co-op, stays on cutting edge",/story/business/real-estate/2023/09/16/pioneer-telephone-kingfisher-oklahoma-telecommunications-70-years/70614330007/
Grading Oklahoma: A look at domestic violence in Oklahoma Todd Pendleton,/story/opinion/2023/09/17/grading-oklahoma-a-look-at-domestic-violence-in-oklahoma/70868135007/
"During disasters, pandemics, Health Centers continue providing care Leigh Ann Albers",/story/opinion/2023/09/19/guest-oklahomas-health-centers-are-pioneers-and-problem-solvers/70836985007/
How venture capital growth is transforming Oklahoma's identity Mike Moradi,/story/opinion/2023/09/18/oklahomas-venture-capital-renaissance-must-continue/70893802007/
"Swarm of bees attack, kill 59-year-old man in southeast Kentucky",/story/news/nation/2023/09/20/swarm-of-bees-kill-59-year-old-man-in-kentucky/70907698007/
"Fortnite players, parents can claim part of $245 million settlement",/story/tech/gaming/2023/09/20/fortnite-ftc-refund/70907580007/
"Recall: Kraft American cheese singles could cause gagging, choking hazard",/story/money/food/2023/09/20/kraft-american-cheese-slices-recall/70907579007/
"Exclusive: See trailer for 'The Jewel,' new film to save OKC's last Black cinema",/story/lifestyle/2023/09/20/the-jewel-okc-trailer-prairie-surf-media-see-trailer/70127466007/
1492 restaurant to close its Midtown location. What's next for the building?,/story/lifestyle/food/2023/09/19/1492-new-world-latin-cuisine-okc-midtown-closing/70898032007/
How El Coyote in OKC is turning up the heat for its one-year anniversary,/story/lifestyle/food/2023/09/19/el-coyote-okc-one-year-celebration-hatch-chile-pepper/70820612007/
,/picture-gallery/lifestyle/2023/09/19/okc-black-history-jewel-theater-restoration-project/11948489002/
ENTER TODAY,https://usatoday.gannettcontests.com/Cayman-Islands-Dept-of-Tourism-Dream-Getaway/?itm_campaign=Cayman%20Islands%20Dream%20Getaway&itm_medium=con&itm_source=secondStreet
NOMINATE TODAY,https://oklahoman.gannettcontests.com/Cardiovascular-Health-Clinic-Amazing-Teachers/rounds/1/gallery?itm_campaign=Cardiovascular%20Health%20Clinic%20Amazing%20Teacher%20Awards&itm_medium=con&itm_source=secondStreet
Vote Every Week!,https://www.oklahoman.com/sports/high-school/?itm_campaign=Athlete%20of%20the%20Week%20Landmark%20OKC&itm_medium=con&itm_source=secondStreet
Could industrial hemp be the next major industry for Oklahoma?,/story/news/politics/2023/09/20/oklahoma-legislature-industrial-hemp-expanding-rural-economy/70899612007/
Summertime slip: Oklahoma City-area home prices dip July to August,/story/business/real-estate/2023/09/20/okc-real-estate-homes-for-sale-august-prices-slipped-mortgage-rates/70842274007/
Anthony Sanchez scheduled for execution Thursday in Oklahoma,/story/news/crime/2023/09/20/anthony-sanchez-oklahoma-state-penitentiary-execution-scheduled-thursday/70894473007/
Oklahoma judge formally dismisses murder case after man spent 48 years in prison,/story/news/local/2023/09/19/oklahoma-judge-formally-dismisses-1974-murder-case-against-glynn-simmons/70840183007/
1492 restaurant to close its Midtown location. What's next for the building?,/story/lifestyle/food/2023/09/19/1492-new-world-latin-cuisine-okc-midtown-closing/70898032007/
,https://cm.oklahoman.com/site-feedback/?platform=Tangent-Desktop&url=https%3A%2F%2Fwww.oklahoman.com%2F&marketName=oklahoman&cta=Right-Rail
