headline,href
Public Eye: Why aren't owners forced to immediately clean up debris?,/story/news/2023/08/08/okc-blighted-properties-fire-why-aa-scissortail-park-is-not-cleaned/70465952007/
Grading Oklahoma: how do our state's schools stack up?,/story/news/education/2023/08/07/oklahoma-school-grades-performance-students-quality-life/70533102007/
What parents need to know for back-to-school in the OKC metro,/story/news/education/2023/08/02/okc-back-to-school-oklahoma-guide-when-does-school-start-tax-free-weekend-vaccines/70439474007/
"Peak time to see Perseids in Oklahoma, other meteor shows this summer",/story/lifestyle/things-to-do/2023/08/08/perseid-meteor-shower-oklahoma-how-to-see-delta-aquariid/70544090007/
Public Eye here to help Oklahomans with problems,/story/news/2023/08/06/public-eye-the-oklahoman-okc-investigating-problems-state/70525447007/
"The changes, challenges and emotions heading into the…",/in-depth/news/2023/08/06/oklahoma-public-school-year-2023-guide-free-lunches-performance/70505019007/
,
Oklahoma school districts are struggling with student…,/story/news/education/2023/08/06/oklahoma-schools-free-lunch-programs-end-covid-parents-administrators-struggling/70441819007/
Oklahoma Congressman Lucas hospitalized after injury on…,/story/news/2023/08/05/oklahoma-congressman-hospitalized-after-being-injured-on-ranch/70535373007/
What should an Oklahoma college freshman pack? 15 dorm…,/story/news/education/campus/2023/08/03/what-to-bring-dorm-15-essentials-oklahoma-universities/70505290007/
Public Eye: Why aren't owners forced to immediately clean up debris?,/story/news/2023/08/08/okc-blighted-properties-fire-why-aa-scissortail-park-is-not-cleaned/70465952007/
Grading Oklahoma: how do our state's schools stack up?,/story/news/education/2023/08/07/oklahoma-school-grades-performance-students-quality-life/70533102007/
What parents need to know for back-to-school in the OKC metro,/story/news/education/2023/08/02/okc-back-to-school-oklahoma-guide-when-does-school-start-tax-free-weekend-vaccines/70439474007/
"How Jaden Nickens chose top 8 football programs including OU, OSU",/story/sports/high-school/football/2023/08/08/oklahoma-high-school-football-jaden-nickens-millwood-receiver-2025-recruiting-class/70546120007/
"Not a day into the Big 12, Arizona State starts ripping West Virginia",/story/sports/college/big-12/2023/08/08/big-12-expansion-arizona-state-ray-anderson-pac-12-west-virginia-wren-baker/70543003007/
"Injury behind him, Jovantae Barnes ready for expanded role with OU",/story/sports/college/sooners/2023/08/07/ou-football-jovantae-barnes-foot-surgery-2023-oklahoma-sooners-running-back-depth-chart/70543257007/
Local investors pay millions for Memorial Square in north OKC,/story/business/real-estate/2023/08/04/mazaheri-properties-buys-retail-power-centers-in-okc-fort-worth-texas-marshalls-p-f-changs-qdoba/70498649007/
Yellow Corp.'s idled orange trucks first took off in OKC in 1924 — now they've shut down,/story/business/real-estate/2023/08/03/yellow-corp-trucking-company-okc-shuts-down-200-jobs-lost/70504884007/
What's driving a potential renaissance in OKC's Historic Capitol Hill,/story/business/local/2023/07/30/okc-historic-capitol-hill-calle-dos-cinco-history-revitalization/70411642007/
OKC student unplugged this summer by plugging into others' needs Abigail DeSpain,/story/opinion/2023/08/07/unplugged-okc-student-traveled-to-uganda-this-summer-to-serve-others/70495448007/
Guest: The facts you don't hear about Tulsa Public Schools John Croisant,/story/opinion/2023/08/07/opinion-guest-the-facts-you-dont-hear-about-tulsa-public-schools/70540438007/
"Rookie teacher: This school year, I am aiming for the stars K. John Lee",/story/opinion/2023/08/07/teacher-team-effort-needed-to-fix-oklahomas-broken-school-system/70495394007/
Powerball jackpot: See winning numbers for Aug. 7 drawing,/story/money/2023/08/07/powerball-jackpot-winning-numbers-august-7/70547520007/
"Syrian newborn found alive under earthquake rubble is not up for adoption, family says",/story/news/world/2023/08/07/syrian-earthquake-newborn-afraaa-happy-healthy/70547283007/
"'Heartwarming': Mom's donation of 350,000 ounces of breastmilk helps kids worldwide",/story/news/nation/2023/08/07/elisabeth-anderson-sierra-oregon-mom-breastmilk-record/70512655007/
"Peak time to see Perseids in Oklahoma, other meteor shows this summer",/story/lifestyle/things-to-do/2023/08/08/perseid-meteor-shower-oklahoma-how-to-see-delta-aquariid/70544090007/
Genes may not have as much to do with longevity as previously thought,/story/lifestyle/2023/08/08/longevity-doesnt-have-as-much-to-do-with-genes-as-thought/70526969007/
"Venus reports yield surprising find, controversy",/story/lifestyle/2023/08/07/questionable-phosphine-detections-on-venus-become-more-solid/70516673007/
,/picture-gallery/sports/college/sooners/2023/08/07/ou-football-team-brent-venables-monday-preseason-practice-photos/70544378007/
Enter Today!,https://oklahoman.gannettcontests.com/OKCMOA-Auguste-Rodin-Exhibitition-Giveaway/?itm_campaign=OCKMOA%20Rodin%20Exihbition&itm_medium=con&itm_source=secondStreet
Enter Now!,https://health.truecoverage.site/?itm_campaign=TrueCoverage&itm_medium=con&itm_source=secondStreet
Enter to WIN!,https://oklahoman.gannettcontests.com/Jellystone-Park-Wichita-Falls-2-Night-Luxury-Glamping-Giveaway/?itm_campaign=Jellystone%20Park%20Wichita%20Falls&itm_medium=con&itm_source=secondStreet
Attorneys won't reimburse after wrongly naming electrician in lawsuit,/story/news/2023/08/08/canton-fire-lawsuit-okc-red-dirt-electric-wrongly-named-no-reimbursement/70543631007/
AG won't reprocess DNA in Anthony Sanchez's death penalty case,/story/news/crime/2023/08/08/anthony-sanchez-death-row-oklahoma-attorney-general-gentner-drummond-dna/70541802007/
What we know about Oklahoma United Methodist disaffiliation court cases,/story/news/2023/08/08/united-methodist-church-oklahoma-disaffiliation-first-church-okc-church-servant/70527810007/
"Oklahoma is 6th in lightning strikes, but how often are people injured?",/story/weather/2023/08/07/oklahoma-lightning-strikes-injuries-frequency-how-common-cdc/70542911007/
What's next for OKC's new police oversight advisory board?,/story/news/local/oklahoma-city/2023/08/07/okc-police-oversight-advisory-board-revamped-what-to-know/70513147007/
,https://cm.oklahoman.com/site-feedback/?platform=Tangent-Desktop&url=https%3A%2F%2Fwww.oklahoman.com%2F&marketName=oklahoman&cta=Right-Rail
