headline,href
What does Isaiah Hartenstein's injury mean for OKC frontcourt options?,/story/sports/nba/thunder/2024/10/17/isaiah-hartenstein-hand-injury-okc-thunder-lineup-options-2024-25-season/75721055007/
"Opinion: As a conservative, I'll cross my fingers and vote for HarrisJim Young",/story/opinion/columns/guest/2024/10/17/oklahoma-conservative-vote-harris-trump-lies-capitol/75555438007/
Oklahoma HS volleyball: Takeaways from 2024 Class 4A-3A quarterfinals,/story/sports/high-school/volleyball/2024/10/17/oklahoma-high-school-volleyball-takeaways-from-2024-ossaa-class-4a-3a-state-quarterfinals/75723476007/
2nd lawsuit targets Walters' Bible mandate: Here are the details,/story/news/courts/2024/10/17/lawsuit-in-state-supreme-court-seeks-to-stop-walters-bible-mandate/75718031007/
What to know about the latest COVID-19 strain…,/story/news/healthcare/2024/10/17/covid-19-xec-variant-what-to-know-in-oklahoma-covid-19-symptoms/75701586007/
Oklahoma National Stockyards owners hope to sell company…,/story/business/real-estate/2024/10/17/oklahoma-national-stockyards-okc-for-sale/75695994007/
Results: Brady Morgeson is the Student of the Week,/story/news/2024/10/14/the-oklahoman-student-of-the-week-poll-october-14-17/75610298007/
Jalen Williams injury update: OKC Thunder forward exits…,/story/sports/nba/thunder/2024/10/17/jalen-williams-injury-update-okc-thunder-forward-ankle-nba-preseason/75725711007/
Where did the idea to start an OU football team begin…,/story/sports/college/sooners/2024/10/17/ou-football-team-origin-oklahoma-sooners-origin-norman-historical-marker/75720138007/
,
2nd lawsuit targets Walters' Bible mandate: Here are the details,/story/news/courts/2024/10/17/lawsuit-in-state-supreme-court-seeks-to-stop-walters-bible-mandate/75718031007/
Grandmother sentenced to life in prison for 3-year-old's death,/story/news/2024/10/17/cleveland-county-ok-grandmother-sentenced-life-prison-death-3-year-old-granddaughter/75703716007/
What to know about the latest COVID-19 strain circulating US,/story/news/healthcare/2024/10/17/covid-19-xec-variant-what-to-know-in-oklahoma-covid-19-symptoms/75701586007/
What does Isaiah Hartenstein's injury mean for OKC frontcourt options?,/story/sports/nba/thunder/2024/10/17/isaiah-hartenstein-hand-injury-okc-thunder-lineup-options-2024-25-season/75721055007/
Oklahoma HS volleyball: Takeaways from 2024 Class 4A-3A quarterfinals,/story/sports/high-school/volleyball/2024/10/17/oklahoma-high-school-volleyball-takeaways-from-2024-ossaa-class-4a-3a-state-quarterfinals/75723476007/
Jalen Williams injury update: OKC Thunder forward exits preseason game,/story/sports/nba/thunder/2024/10/17/jalen-williams-injury-update-okc-thunder-forward-ankle-nba-preseason/75725711007/
Downtown OKC is undergoing a major transformation,/story/business/downtown/2024/10/17/downtown-oklahoma-city-real-estate-businesses-apartments-transformation/75163646007/
"The rise and fall and rise of people living, working and playing downtown",/story/business/downtown/2024/10/17/downtown-okc-history-housing-retail/75434613007/
Oklahoma National Stockyards owners hope to sell company to in-state buyer,/story/business/real-estate/2024/10/17/oklahoma-national-stockyards-okc-for-sale/75695994007/
"Opinion: As a conservative, I'll cross my fingers and vote for Harris Jim Young",/story/opinion/columns/guest/2024/10/17/oklahoma-conservative-vote-harris-trump-lies-capitol/75555438007/
Opinion: We shouldn't take right to vote for granted Melissa Abdo,/story/opinion/columns/guest/2024/10/17/opinion-we-should-take-full-advantage-of-our-national-right-to-vote/75595103007/
Opinion: Oklahomans share their plans to vote in November elections,/story/opinion/columns/your-voice/2024/10/16/presidential-election-oklahomans-share-thoughts/75690249007/
FDA approves drug to ease Parkinson's disease symptoms,/story/news/health/2024/10/17/parkinsons-disease-therapy-drug-vyalev-approved/75721333007/
Kroshik the cat weighed in at a whopping 38 pounds. Watch him shed weight,/story/life/animalkind/2024/10/17/fat-cat-kroshik-weight-loss-journey-video/75721561007/
Arizona grandma of mistaken Thanksgiving text fame fights cancer,/story/news/nation/2024/10/17/jamal-hinton-wanda-dench-share-cancer-diagnosis-before-thanksgiving/75722123007/
Mental health support goes high tech through Hope chatbot,/story/lifestyle/2024/10/17/hope-chatbot-mental-health-help-catholic-charities-okc/75467934007/
"How horror films, Care Bears led to a job and new book for James Cooper",/story/lifestyle/2024/10/17/okc-council-james-cooper-debuts-novel-moonlit-massacre/75615359007/
Here's everything we know about Reba McEntire's new TV comedy series,/story/entertainment/2024/10/17/reba-mcentires-new-comedy-series-happys-place-debuts-what-to-know/75670520007/
,/picture-gallery/sports/college/sooners/2024/10/12/ou-football-vs-texas-our-best-photos-from-the-sooners-week-6-game/75635194007/
Winners Announced!,https://oklahoman.gannettcontests.com/2024-Oklahoman-Communitys-Choice-Awards-Winners/?itm_campaign=Oklahoma%202024%20BOB&itm_medium=con&itm_source=secondStreet
Vote Every Week!,https://www.oklahoman.com/sports/high-school/?itm_campaign=Athlete%20of%20the%20Week%20Landmark%20OKC&itm_medium=con&itm_source=secondStreet
Mental health support goes high tech through Hope chatbot,/story/lifestyle/2024/10/17/hope-chatbot-mental-health-help-catholic-charities-okc/75467934007/
Downtown OKC is undergoing a major transformation,/story/business/downtown/2024/10/17/downtown-oklahoma-city-real-estate-businesses-apartments-transformation/75163646007/
Grandmother sentenced to life in prison for 3-year-old's death,/story/news/2024/10/17/cleveland-county-ok-grandmother-sentenced-life-prison-death-3-year-old-granddaughter/75703716007/
"How horror films, Care Bears led to a job and new book for James Cooper",/story/lifestyle/2024/10/17/okc-council-james-cooper-debuts-novel-moonlit-massacre/75615359007/
"The rise and fall and rise of people living, working and playing downtown",/story/business/downtown/2024/10/17/downtown-okc-history-housing-retail/75434613007/
,https://cm.oklahoman.com/site-feedback/?platform=Tangent-Desktop&url=https%3A%2F%2Fwww.oklahoman.com%2F&marketName=oklahoman&cta=Right-Rail
