headline,href
"Comedian, writer: Okla-HOME-a is more than OK to meKelsey Humphreys",/story/opinion/columns/guest/2025/09/04/oklahoma-pan-shaped-slice-of-the-world-that-molded-my-career-comedian-writer/85874126007/
Who are the best NFL players with Oklahoma ties? Here's our list.,/story/sports/columns/joe-mussatto/2025/09/04/oklahoma-all-nfl-teams-ou-sooners-osu-cowboys-tulsa-golden-hurricane/85949767007/
Murder case against Richard Glossip is now in legal limbo,/story/news/2025/09/04/murder-case-against-former-death-row-inmate-richard-glossip-on-hold/85978054007/
Gateway Church founder Robert Morris waives hearing in lewd act case,/story/news/2025/09/04/gateway-megachurch-founder-robert-morris-waives-preliminary-hearing-in-lewd-act-with-child-case/85976339007/
What's behind Gov. Stitt's 'Operation SAFE' targeting…,/story/news/politics/2025/09/04/tulsa-mayor-pushes-back-against-oklahoma-governors-push-to-target-city/85979925007/
"Oklahoma high school football Week 1 scores, live…",/story/sports/high-school/football/2025/09/04/oklahoma-high-school-football-week-1-scores-live-updates-highlights-ossaa-2025-stats-schedule-photos/85975918007/
College football uniform ranking: Who has the best…,/story/sports/college/football/2025/09/04/college-football-uniform-ranking-best-traditional-jersey/85961093007/
"Cowboys vs. Eagles game today: Time, channel for NFL…",/story/sports/nfl/2025/09/04/cowboys-eagles-channel-today-time-tv-schedule-streaming-info-nfl-thursday-night-football-week-1/85966381007/
How OU's defense is preparing for Michigan QB Bryce…,/story/sports/college/sooners/2025/09/04/ou-football-defense-vs-michigan-qb-bryce-underwood-oklahoma-sooners-wolverines/85944866007/
,
Murder case against Richard Glossip is now in legal limbo,/story/news/2025/09/04/murder-case-against-former-death-row-inmate-richard-glossip-on-hold/85978054007/
Gateway Church founder Robert Morris waives hearing in lewd act case,/story/news/2025/09/04/gateway-megachurch-founder-robert-morris-waives-preliminary-hearing-in-lewd-act-with-child-case/85976339007/
Farmers Market business owners worry about harm from new homeless services,/story/news/2025/09/04/farmers-market-district-okc-new-homeless-shelter-plans/85944451007/
Who are the best NFL players with Oklahoma ties? Here's our list.,/story/sports/columns/joe-mussatto/2025/09/04/oklahoma-all-nfl-teams-ou-sooners-osu-cowboys-tulsa-golden-hurricane/85949767007/
"OU-Michigan, OSU-Oregon spotlight college football uniform differences",/story/sports/columns/jenni-carlson/2025/09/04/ou-michigan-osu-oregon-college-football-uniform-differences-similarities-tradition-alternates/85949560007/
Why OSU AD Chad Weiberg has a new perspective on college athletics,/story/sports/college/cowboys/2025/09/04/oklahoma-state-athletic-director-chad-weiberg-open-heart-surgery-recovery-osu-cowboys-football/85927567007/
Could Edmond get its own Wheeler District? What to know about plans,/story/business/real-estate/2025/09/02/edmond-city-council-approves-rough-plan-for-liberty-park-development/85865670007/
State's workers' compensation provider seeks to become holding company,/story/business/2025/09/02/oklahoma-workers-comp-carrier-reorganization-compsource/85866584007/
OG&E request for more power units may mean higher bills for customers,/story/business/energy-resource/2025/09/01/oge-bill-increases-oklahoma-corporation-commission-approval-power-generation-units/85892677007/
"Comedian, writer: Okla-HOME-a is more than OK to me Kelsey Humphreys",/story/opinion/columns/guest/2025/09/04/oklahoma-pan-shaped-slice-of-the-world-that-molded-my-career-comedian-writer/85874126007/
Langston University gains momentum in STEM Ruth Ray Jackson,/story/opinion/columns/guest/2025/09/04/langston-university-cyber-ai-agriculture-games-washington-dc/85946707007/
OK civics teachers are afraid. We're failing them in their classrooms Liam Julian,/story/opinion/columns/guest/2025/09/04/oklahoma-civics-teachers-fear-disciplinary-action/85947146007/
Minnesota shooting victim's mother calls for ban on semi-auto rifles,/story/news/nation/2025/09/04/minnesota-school-shooting-parents-semi-auto-rifle-ban/85978990007/
Spirit Airlines cancels 11 routes amid bankruptcy woes,/story/travel/2025/09/04/spirit-airlines-cancels-routes/85978111007/
Missing painting reportedly sold by force to Nazis found in Argentina,/story/news/nation/2025/09/04/missing-painting-stolen-by-nazis-recovered-argentina/85974455007/
Shop Amazon's newest baby onesies for fall 2025,https://lvnta.com/lv_X70Tgge65hq3DYXUvb
Nike’s 2025 NFL Pegasus 41 sneakers are here—shop your team's shoe,/story/shopping/2025/09/04/nike-releases-nfl-team-running-shoes-how-to-buy-nfl-nike-sneakers/85969654007/
Here are the best Amazon deals to shop this September,/story/shopping/2025/09/04/best-amazon-deals-september-2025/85970559007/
The Oklahoman's McDonnell earns top national award for arts coverage,/story/lifestyle/2025/09/04/the-oklahoman-brandy-mcdonnell-is-one-of-eight-national-winners-of-the-rabkin-prize/85825772007/
OKC church holding special mass for those affected by suicide loss,/story/lifestyle/features/2025/09/04/francis-of-assisi-catholic-church-okc-mass-for-suicide-affected/85634453007/
"5 things to do in Oklahoma: See Weird Al, Blind Melon and more",/story/lifestyle/2025/09/04/things-to-do-in-okc-see-goo-goo-dolls-weird-al-cirque-de-soleil/85954188007/
,/picture-gallery/news/2025/09/04/oklahoma-best-photos-bryan-terry-high-school-football-ryan-walters/85956891007/
Nominate Today!,https://www.profootballhof.com/news/2025/09/pro-football-hall-of-fame-awards-of-character-recognize-extraordinary-individuals/?utm_source=Localiq&utm_medium=promo&utm_campaign=awards&&itm_campaign=PFHOF%20Awards%20of%20Character&itm_medium=con&itm_source=secondStreet
ENTER NOW! ENTER OFTEN!,https://oklahoman.gannettcontests.com/2025-Oklahoma-State-Fair/?itm_campaign=2025%20Oklahoma%20State%20Fair%20Ultimate%20Giveaway&itm_medium=con&itm_source=secondStreet
Winners Announced!,https://oklahoman.gannettcontests.com/2025-Oklahoman-Communitys-Choice-Awards-Winners/?itm_campaign=Oklahoma%20Bob&itm_medium=con&itm_source=secondStreet
"OU-Michigan, OSU-Oregon spotlight college football uniform differences",/story/sports/columns/jenni-carlson/2025/09/04/ou-michigan-osu-oregon-college-football-uniform-differences-similarities-tradition-alternates/85949560007/
Why OSU AD Chad Weiberg has a new perspective on college athletics,/story/sports/college/cowboys/2025/09/04/oklahoma-state-athletic-director-chad-weiberg-open-heart-surgery-recovery-osu-cowboys-football/85927567007/
Farmers Market business owners worry about harm from new homeless services,/story/news/2025/09/04/farmers-market-district-okc-new-homeless-shelter-plans/85944451007/
Is an unimpressive run game OSU's biggest concern heading to Oregon?,/story/sports/college/cowboys/2025/09/04/oklahoma-state-football-run-game-biggest-concern-oregon-ducks-osu-cowboys/85957473007/
This is who spent the most on lobbying efforts at the Oklahoma Capitol in 2025,/story/news/politics/2025/09/03/oklahoma-legislative-session-2025-lobbying-dollars-spent-oge-lawmakers/85257829007/
,https://cm.oklahoman.com/site-feedback/?platform=Tangent-Desktop&url=https%3A%2F%2Fwww.oklahoman.com%2F&marketName=oklahoman&cta=Right-Rail
