headline,href
"From prehistoric sea to wildlife refuge, dig into Oklahoma's salt flats",/story/news/environment/2023/08/13/great-salt-plains-enid-oklahoma-crystal-hunting-history-conservation/70470018007/
Why the Cherokee Nation is expanding its film opportunities,/story/entertainment/2023/08/13/cherokee-nation-oklahoma-film-infrastructure-telling-native-stories/70011315007/
Oklahoma tax collections down from prior July after oil revenue drops,/story/news/politics/government/2023/08/14/oklahoma-tax-revenue-july-2023-oil-prices-consumer-strength/70578388007/
11 Oklahoma City metro-area vegan restaurants to check out,/story/lifestyle/food/2023/08/14/okc-restaurants-vegan-friendly-cafe-420-bettys-beet-box/70548294007/
Experts discuss best practices for safe supportive…,/story/news/education/2023/08/14/school-safety-parents-questions-answered/70501689007/
How does OSU receiver depth chart change without Arland…,/story/sports/college/cowboys/2023/08/13/oklahoma-state-football-jaden-bray-brennan-presley-2023-osu-cowboys-receiver-depth-chart/70581943007/
Cancer patients in rural Oklahoma face higher cancer…,/story/lifestyle/2023/08/12/cancer-treatments-rural-oklahoma-patients-higher-mortality-rates/70403252007/
"Peak time to see Perseids in Oklahoma, other meteor…",/story/lifestyle/things-to-do/2023/08/08/perseid-meteor-shower-oklahoma-how-to-see-delta-aquariid/70544090007/
When does school start in Oklahoma? Here's when area…,/story/news/education/2023/07/21/when-does-school-start-in-oklahoma-2023-okc-edmond-epic-charter-schools/70437115007/
,
"From prehistoric sea to wildlife refuge, dig into Oklahoma's salt flats",/story/news/environment/2023/08/13/great-salt-plains-enid-oklahoma-crystal-hunting-history-conservation/70470018007/
Oklahoma tax collections down from prior July after oil revenue drops,/story/news/politics/government/2023/08/14/oklahoma-tax-revenue-july-2023-oil-prices-consumer-strength/70578388007/
Tornado aftermath is time for a 'repair and refresh' at OBU,/story/news/2023/08/13/oklahoma-baptist-university-fall-semester-shawnee-tornado-april-2023/70506524007/
How does OSU receiver depth chart change without Arland Bruce IV?,/story/sports/college/cowboys/2023/08/13/oklahoma-state-football-jaden-bray-brennan-presley-2023-osu-cowboys-receiver-depth-chart/70581943007/
How OSU's Xavier Ross creating buzz after move to defensive end,/story/sports/college/cowboys/2023/08/14/oklahoma-state-football-xavier-ross-2023-osu-cowboys-defensive-end-depth-chart/70584652007/
"Back with OU, Stogner is playing with 'an urgency' in final season",/story/sports/college/sooners/2023/08/14/ou-football-austin-stogner-2023-oklahoma-sooners-tight-end-depth-chart/70577328007/
OKC apartment rents fall across all types while studio rents plummet,/story/business/real-estate/2023/08/11/apartments-okc-rent-studio-apartments-plummeting-analysis/70560554007/
Commercial real estate deals from around the Oklahoma City metro area,/story/business/real-estate/2023/08/10/okc-commercial-real-estate-transactions-august-2023/70561843007/
"OKC retailers are projected to grow, but some still on the downturn",/story/business/real-estate/2023/08/09/retail-recovery-in-oklahoma-city-andretti-indoor-karting-and-games-dicks-house-of-sport-oak-stacks/70546575007/
Guest: We cannot be silent while others are discriminated against Elder Markus Tovstiga,/story/opinion/2023/08/13/guest-we-cannot-be-silent-while-others-are-discriminated-against/70545060007/
Social structures that taught courtesy in the past have broken down Nancy E. Snow,/story/opinion/2023/08/13/a-return-to-civility-means-each-individual-must-reverse-the-trend/70495119007/
Guest: How OKC sit-ins helped my parents teach me about racism Michael Korenblit,/story/opinion/2023/08/13/guest-13-okc-kids-helped-change-oklahoma-us-history-for-the-better/70554509007/
16 injured after boat explodes at Lake of the Ozarks in Missouri,/story/news/nation/2023/08/14/lake-of-the-ozarks-boat-explosion/70586824007/
"Toyota, Chrysler among nearly 270,000 vehicles recalled: Check here",/story/money/cars/recalls/2023/08/14/recall-check-toyota-chrysler-subaru/70581400007/
How to watch the next episode of 'Only Murders in the Building',/story/entertainment/tv/2023/08/13/only-murders-in-the-building-season-3-how-to-watch/70575111007/
11 Oklahoma City metro-area vegan restaurants to check out,/story/lifestyle/food/2023/08/14/okc-restaurants-vegan-friendly-cafe-420-bettys-beet-box/70548294007/
"From Hobbit hideaway to a caboose, visit these unique Oklahoma Airbnbs",/story/lifestyle/things-to-do/2023/08/14/airbnb-oklahoma-strangest-rentals-in-the-state-treehouse-hobbit-hole-caboose/70488221007/
Cancer patients in rural Oklahoma face higher cancer mortality rates,/story/lifestyle/2023/08/12/cancer-treatments-rural-oklahoma-patients-higher-mortality-rates/70403252007/
,/picture-gallery/news/2023/08/10/okcps-first-day-of-school-august-2023-photos/70568879007/
Enter Today!,https://oklahoman.gannettcontests.com/OKCMOA-Auguste-Rodin-Exhibitition-Giveaway/?itm_campaign=OCKMOA%20Rodin%20Exihbition&itm_medium=con&itm_source=secondStreet
Enter Now!,https://health.truecoverage.site/?itm_campaign=TrueCoverage&itm_medium=con&itm_source=secondStreet
Enter to WIN!,https://oklahoman.gannettcontests.com/Jellystone-Park-Wichita-Falls-2-Night-Luxury-Glamping-Giveaway/?itm_campaign=Jellystone%20Park%20Wichita%20Falls&itm_medium=con&itm_source=secondStreet
"From Hobbit hideaway to a caboose, visit these unique Oklahoma Airbnbs",/story/lifestyle/things-to-do/2023/08/14/airbnb-oklahoma-strangest-rentals-in-the-state-treehouse-hobbit-hole-caboose/70488221007/
Tornado aftermath is time for a 'repair and refresh' at OBU,/story/news/2023/08/13/oklahoma-baptist-university-fall-semester-shawnee-tornado-april-2023/70506524007/
"Once blighted industrial district set to be new home for KOSU, The Spy",/story/news/local/2023/08/11/kosu-okc-the-spy-joining-once-blighted-industrial-district-oklahoma-city/70562038007/
FBI investigating misspending of Oklahoma education funds,/story/news/2023/08/10/fbi-investigation-misspent-education-covid-money-ryan-walters-nonprofit/70570734007/
'Farmers' Almanac' predicts a soggy winter in Oklahoma this year,/story/news/state/2023/08/10/oklahoma-farmers-almanac-2023-winter-forecast-soggy-cold-weather/70553162007/
,https://cm.oklahoman.com/site-feedback/?platform=Tangent-Desktop&url=https%3A%2F%2Fwww.oklahoman.com%2F&marketName=oklahoman&cta=Right-Rail
