headline,href
Maduro and wife land in New York after whirlwind capture in Venezuela,/story/news/world/2026/01/03/jets-and-blasts-shake-venezuelan-capital/87244708007/
Behind the work to improve access to mental health care in Oklahoma,/story/news/healthcare/2025/12/30/oklahoma-mental-health-care-access-improvements/86224235007/
OSU football lands Drew Mestemaker from North Texas in transfer portal,/story/sports/college/cowboys/2026/01/03/drew-mestemaker-transfer-portal-oklahoma-state-football/88009846007/
"Defensive letdown, selfish offense dooms OSU at Texas Tech",/story/sports/college/cowboys/2026/01/03/oklahoma-state-basketball-vs-texas-tech-score-stats-big-12/88009189007/
"Where to watch Seahawks-49ers game live today: Time, TV…",/story/sports/nfl/2026/01/03/seahawks-49ers-channel-today-nfl-live-time-tv-streaming-info-week-18/88006988007/
OSU vs Texas Tech recap: Cowboys blasted in Big 12…,/story/sports/college/cowboys/2026/01/03/oklahoma-state-texas-tech-score-live-updates-mens-college-basketball-osu-cowboys/88000829007/
Not since Courtney Paris has OU had a star like this…,/story/sports/college/sooners/2026/01/03/aaliyah-chavez-ou-womens-basketball-attendance-courtney-paris-stacey-dales/87999052007/
OSU football transfer portal tracker: Live updates…,/story/sports/college/cowboys/2026/01/02/oklahoma-state-football-transfer-portal-tracker-2026-osu-cowgirls/87989075007/
Celebrate the Thunder's first NBA title with this…,/story/sports/nba/thunder/2025/12/17/celebrate-okc-thunder-nba-championship-commemorative-book/87805943007/
,
Shopping,/shopping/
Travel just got more glamorous with TSA-approved makeup essentials,/story/shopping/popular-tsa-approved-beauty-products/87994194007/
Save 62% on a lifetime subscription to Rosetta Stone,/story/shopping/2026/01/03/rosetta-stone-new-year-deal-2026/87995015007/
How to buy USMNT vs. Australia 2026 World Cup tickets in Seattle,/story/shopping/2026/01/03/how-to-buy-usa-vs-australia-2026-mens-soccer-world-cup-tickets/87995095007/
News,/news/
Maduro and wife land in New York after whirlwind capture in Venezuela,/story/news/world/2026/01/03/jets-and-blasts-shake-venezuelan-capital/87244708007/
Behind the work to improve access to mental health care in Oklahoma,/story/news/healthcare/2025/12/30/oklahoma-mental-health-care-access-improvements/86224235007/
Oklahoma GOP lawmakers praise Trump after U.S. captures Venezuelan leader,/story/news/politics/2026/01/03/oklahoma-republican-lawmakers-praise-trump-after-u-s-captures-venezuelan-leader-nicolas-maduro/88008171007/
Sports,/sports/
OSU football lands Drew Mestemaker from North Texas in transfer portal,/story/sports/college/cowboys/2026/01/03/drew-mestemaker-transfer-portal-oklahoma-state-football/88009846007/
"Defensive letdown, selfish offense dooms OSU at Texas Tech",/story/sports/college/cowboys/2026/01/03/oklahoma-state-basketball-vs-texas-tech-score-stats-big-12/88009189007/
OU cruises past Ole Miss as Xzayvier Brown shines in SEC opener,/story/sports/college/sooners/2026/01/03/ou-basketball-vs-ole-miss-score-sec-opener-xzayvier-brown-stats/88010037007/
Life,/life/
Take a peek at 'The Cowboy: An Immersive Journey' starting in OKC in 2026,/videos/entertainment/2026/01/02/check-out-okcs-new-cutting-edge-exhibit-the-cowboy-an-immersive-journey/87973444007/
Cowboy museum gets new look with first-of-its-kind exhibit,/story/entertainment/2026/01/01/national-cowboy-western-heritage-museum-gets-new-immersive-exhibit/87974370007/
Look at photos of the new OKC exhibit 'The Cowboy: An Immersive Journey',/picture-gallery/entertainment/2026/01/01/see-photos-of-okcs-national-cowboy-museums-new-immersive-journey/87974389007/
Business,/business/
BancFirst seeks foreclosure on major Edmond TIF project,/story/business/real-estate/2026/01/02/bancfirst-seeks-foreclosure-receiver-on-downtown-edmond-developer-tif-tax-increment-financing/87993037007/
Minimum wage in Oklahoma could change with June 2026 vote,/story/business/economy/2026/01/02/what-is-minimum-wage-in-oklahoma-june-2026-vote-could-change-pay/87960575007/
Resolution approved by council halts 2017 bond project for bike lanes,/story/business/transportation/2025/12/31/oklahoma-city-council-vote-halts-bicycle-lanes-on-classen-boulevard/87975898007/
Opinion,/opinion/
"U.S. seizes Maduro, says it will ""run"" country. Good idea? Bad?",/story/opinion/columns/more-voices/2026/01/03/was-venezuelan-seizure-good-or-bad-idea-whats-your-opinion-survey/88006869007/
We need schools to balance safety with human connection Kuwantu Cammon,/story/opinion/columns/guest/2026/01/03/school-policy-needs-balance-liability-concerns-can-complicate-educational-process/87962928007/
How we can help students figure out what they want to be when they grow up Sheri Bray,/story/opinion/columns/guest/2026/01/03/students-need-help-navigating-plans-for-the-future/87885281007/
Trending,https://www.usatoday.com/news/trending/
Mega Millions winning numbers for Jan. 2 drawing: $157M jackpot,/story/money/lottery/2026/01/02/mega-millions-winning-numbers-january-2-jackpot-drawing/87999298007/
Is 6-7 cooked? See trends the internet wants to leave in 2025.,/story/news/nation/2026/01/02/labubus-6-7-dubai-chocolate-internet-trends-ending-2025/87997340007/
When are 2026's federal holidays? See the list.,/story/news/nation/2026/01/01/2026-federal-holiday-schedule-list/87969814007/
,/picture-gallery/sports/college/cowboys/2026/01/03/oklahoma-state-vs-houston-in-big-12-womens-basketball-see-top-photos/87997491007/
Nominate Today!,https://www.profootballhof.com/news/2025/09/pro-football-hall-of-fame-awards-of-character-recognize-extraordinary-individuals/?utm_source=Localiq&utm_medium=promo&utm_campaign=awards&&itm_campaign=PFHOF%20Awards%20of%20Character&itm_medium=con&itm_source=secondStreet
Vote Each Week!,https://www.oklahoman.com/sports/high-school/?itm_campaign=Athlete%20of%20the%20Week%20Landmark%20OKC&itm_medium=con&itm_source=secondStreet
Enter Now,https://www.kalahariresorts.com/win?itm_campaign=Get%20Kalaharid%20Away%20Winter%202026&itm_medium=con&itm_source=secondStreet#//?
Oklahoma GOP lawmakers praise Trump after U.S. captures Venezuelan leader,/story/news/politics/2026/01/03/oklahoma-republican-lawmakers-praise-trump-after-u-s-captures-venezuelan-leader-nicolas-maduro/88008171007/
"U.S. seizes Maduro, says it will ""run"" country. Good idea? Bad?",/story/opinion/columns/more-voices/2026/01/03/was-venezuelan-seizure-good-or-bad-idea-whats-your-opinion-survey/88006869007/
"US conducted strike on Venezuela, captured Maduro, Trump says",/story/news/politics/2026/01/03/trump-strike-venezuela-maduro/88004393007/
Top photos of 2025: See The Oklahoman's Pictures of the Year,/story/news/state/2026/01/01/the-oklahoman-newspaper-best-photos-2025-okc-thunder-wcws-protests/87814184007/
OU cruises past Ole Miss as Xzayvier Brown shines in SEC opener,/story/sports/college/sooners/2026/01/03/ou-basketball-vs-ole-miss-score-sec-opener-xzayvier-brown-stats/88010037007/
,https://cm.oklahoman.com/site-feedback/?platform=Tangent-Desktop&url=https%3A%2F%2Fwww.oklahoman.com%2F&marketName=oklahoman&cta=Right-Rail
