headline,href
Former Owasso LGBTQ+ students remember history of unchecked bullying,/story/news/2024/02/29/nex-benedict-death-has-owasso-scrutinzed-treatment-lgbtq-students/72685776007/
"Tim Gatz resigns as OTA director, transportation secretary following AG opinion",/story/news/2024/02/28/oklahoma-turnpike-authority-director-tim-gatz-resigns-attorney-general-opinion/72779546007/
Oklahoma death penalty could pause as moratorium bill moves forward,/story/news/politics/government/2024/02/29/oklahoma-death-penalty-could-pause-as-5-year-moratorium-bill-advances-to-house-floor-hb-3138/72774807007/
This top shelf OKC bartender is crafting cocktails and a legacy,/story/lifestyle/food/2024/02/29/okc-bartender-loretha-kirk-us-bartending-guild-2024-world-class-top-100/72605526007/
Oklahoma man faces felony charges in alleged child…,/story/news/2024/02/29/weatherford-oklahoma-employee-volunteer-accused-soliciting-minors-sexual-images/72760908007/
Great Wolf Lodge offering a Leap Day $29 sale: What to…,/story/news/2024/02/29/great-wolf-lodge-is-doing-a-29-sale-for-leap-day-heres-what-to-know/72660696007/
How 'iconic' scoreboard at Love's Field came to be for…,/story/sports/college/sooners/2024/02/29/ou-softball-loves-field-oklahoma-scoreboard-daktronics-sooners-patty-gasso-joe-castiglione/72776874007/
"A look at each team, schedule for Class A boys…",/story/sports/high-school/basketball/2024/02/28/oklahoma-high-school-basketball-2024-class-a-boys-state-tournament-teams/72758896007/
A look at each team in the Class A girls basketball…,/story/sports/high-school/basketball/2024/02/28/oklahoma-high-school-girls-basketball-playoffs-a-look-at-each-team-in-the-class-a-state-tournament/72760236007/
,
Former Owasso LGBTQ+ students remember history of unchecked bullying,/story/news/2024/02/29/nex-benedict-death-has-owasso-scrutinzed-treatment-lgbtq-students/72685776007/
"Tim Gatz resigns as OTA director, transportation secretary following AG opinion",/story/news/2024/02/28/oklahoma-turnpike-authority-director-tim-gatz-resigns-attorney-general-opinion/72779546007/
Oklahoma death penalty could pause as moratorium bill moves forward,/story/news/politics/government/2024/02/29/oklahoma-death-penalty-could-pause-as-5-year-moratorium-bill-advances-to-house-floor-hb-3138/72774807007/
How 'iconic' scoreboard at Love's Field came to be for OU softball,/story/sports/college/sooners/2024/02/29/ou-softball-loves-field-oklahoma-scoreboard-daktronics-sooners-patty-gasso-joe-castiglione/72776874007/
"A look at each team, schedule for Class A boys basketball tournament",/story/sports/high-school/basketball/2024/02/28/oklahoma-high-school-basketball-2024-class-a-boys-state-tournament-teams/72758896007/
A look at each team in the Class A girls basketball state tournament,/story/sports/high-school/basketball/2024/02/28/oklahoma-high-school-girls-basketball-playoffs-a-look-at-each-team-in-the-class-a-state-tournament/72760236007/
Tips for preparing and protecting your home from wildfires,/story/business/real-estate/2024/02/29/how-to-prepare-and-protect-your-home-from-wildfires/72773271007/
Macy's is closing over 50 stores this year. Is your store closing?,/story/business/local/2024/02/28/macys-to-shut-down-150-locations-how-many-oklahoma-locations-remain/72774810007/
Realtors weigh in on what to expect from spring home sales in OKC area,/story/business/real-estate/2024/02/28/okc-real-estate-spring-housing-market-realtors-weigh-in/72676066007/
What should Christians think of Nex Benedict? | Letters to the Editor,/story/opinion/2024/02/28/christians-react-to-sen-tom-woods-nex-benedict-death-oklahoma-lgbtq-letters-to-the-editor/72762309007/
"GOP, Ryan Walter's toxic rhetoric needs to stop | Editorial Clytie Bunyan",/story/opinion/2024/02/28/ryan-walters-republican-toxic-rhetoric-in-oklahoma-needs-to-stop/72759517007/
"Nation mourns Nex Benedict: Teen's life a conduit for outrage, healing Cheyenne Derksen",/story/opinion/2024/02/28/nex-benedict-oklahoma-teens-life-a-conduit-for-lgbtq-outrage-call-to-action/72762601007/
"One dead and multiple injured in Orlando shooting, police say",/story/news/nation/2024/02/29/orlando-florida-shooting/72786142007/
These major moments in history happened on a Leap Day,/story/news/nation/2024/02/29/on-this-day-in-history-feb-29-events-happened-leap-day/72602111007/
"Everything you need to know about leap day 2024, including why it exists",/story/news/nation/2024/02/29/leap-day-2024/72773290007/
This top shelf OKC bartender is crafting cocktails and a legacy,/story/lifestyle/food/2024/02/29/okc-bartender-loretha-kirk-us-bartending-guild-2024-world-class-top-100/72605526007/
Celebrate a Leap Day birthday with these kid-at-heart OKC specials,/story/entertainment/2024/02/29/celebrate-your-leap-day-birthday-with-kid-at-heart-deals-factory-obscura-okc-up-down-arcade/72630961007/
"CBS to air 'Tulsa King' Season 1, which was made primarily in Oklahoma",/story/entertainment/2024/02/28/tulsa-king-season-1-debut-cbs-how-to-watch/72779920007/
,/picture-gallery/entertainment/2024/02/29/with-vietgone-an-okc-theater-tells-a-vietnamese-refugee-love-story/72739843007/
NOMINATE TODAY,https://oklahoman.gannettcontests.com/Cardiovascular-Health-Clinic-Amazing-Teachers/rounds/1/gallery?itm_campaign=Cardiovascular%20Health%20Clinic%20Amazing%20Teacher%20Awards&itm_medium=con&itm_source=secondStreet
Vote Every Week!,https://www.oklahoman.com/sports/high-school/?itm_campaign=Athlete%20of%20the%20Week%20Landmark%20OKC&itm_medium=con&itm_source=secondStreet
Enter Today!,https://www.kalahariresorts.com/win/?utm_source=rl&utm_medium=xmo&utm_campaign=tx_sweeps_usatoday_promobanner&&itm_campaign=kalahari%20create%20adventure%20round%20rock%20tx&itm_medium=con&itm_source=secondStreet
Four Oklahoma men plead guilty to $100M contract bidding scheme,/story/news/2024/02/29/oklahoma-executives-plead-guilty-100-million-price-fixing-scheme/72773940007/
"Public schools are being 'inappropriately attacked,' AG says",/story/news/2024/02/29/oklahoma-ag-gentner-drummond-says-public-schools-being-attacked/72778091007/
"Higher ed, CareerTech reach agreement on credit for nursing students",/story/news/education/campus/2024/02/29/career-tech-oklahoma-nursing-students-easy-path-college-degree/72776985007/
Oklahoma primaries: Everything to know before Super Tuesday 2024,/story/news/politics/elections/2024/02/29/election-day-2024-voters-guide-oklahoma-presidential-primary-donald-trump-nikki-haley-joe-biden/72772010007/
Leadership and academics: Vote here for The Oklahoman's Student of the Week,/story/news/2024/02/26/vote-in-the-poll-for-the-oklahomans-student-of-the-week/72741388007/
,https://cm.oklahoman.com/site-feedback/?platform=Tangent-Desktop&url=https%3A%2F%2Fwww.oklahoman.com%2F&marketName=oklahoman&cta=Right-Rail
