headline,href
Jail fixes after shoe hits sprinkler won't cost county out of pocket,/story/news/2025/07/05/oklahoma-county-jail-flip-flop-thousands-in-damage-wont-be-paid-out-of-pocket/84139471007/
New law: OK County sheriff plans to take foreclosure sales back online,/story/news/2025/07/05/oklahoma-county-sheriff-foreclosure-auctions-return-to-online-bid4assets/84438540007/
"New TEEM contract says one thing, forms say another, about marijuana",/story/news/2025/07/05/medical-marijuana-oklahoma-users-not-disqualified-pretrial-release-program/84434421007/
Company claims new Oklahoma law targeting drug prices is unconstitutional,/story/news/politics/courts/2025/07/05/abbvie-files-lawsuit-oklahoma-hb-2048-drug-price-discounts/84459370007/
Vote: The Oklahoman's Fans' Choice Super 30 All-Time…,/story/sports/high-school/football/2025/06/26/vote-the-oklahomans-fans-choice-super-30-all-time-defensive-player/84341549007/
Celebrate Thunder's NBA title with our page prints…,/story/sports/nba/thunder/2025/06/22/thunder-nba-championship-gear-books-posters/84279482007/
Oklahoma high school spring sports awards 2025 in…,/story/sports/high-school/2025/06/16/oklahoma-high-school-spring-sports-awards-2025-baseball-golf-soccer-slowpitch-tennis-track-field/84214331007/
Celebrate Oklahoma high school basketball with 'The Big…,/story/sports/high-school/basketball/2025/02/27/oklahoma-high-school-basketball-book-the-big-house-state-fair-arena/80708941007/
Guest columnist argues why US bombing of Iran is…,/story/opinion/columns/guest/2025/07/05/iran-nuclear-weapons-us-bombing/84435686007/
,
Jail fixes after shoe hits sprinkler won't cost county out of pocket,/story/news/2025/07/05/oklahoma-county-jail-flip-flop-thousands-in-damage-wont-be-paid-out-of-pocket/84139471007/
New law: OK County sheriff plans to take foreclosure sales back online,/story/news/2025/07/05/oklahoma-county-sheriff-foreclosure-auctions-return-to-online-bid4assets/84438540007/
"New TEEM contract says one thing, forms say another, about marijuana",/story/news/2025/07/05/medical-marijuana-oklahoma-users-not-disqualified-pretrial-release-program/84434421007/
"Thunder NBA free agency 2025: Tracking latest rumors, updates",/story/sports/nba/thunder/2025/06/29/okc-thunder-nba-free-agency-2025-tracking-latest-rumors-updates/84408839007/
Celebrate the Thunder's amazing season with our commemorative book,/story/sports/nba/thunder/2025/05/28/commemorate-okc-thunder-historic-season-with-our-collectors-book/83893354007/
See top OKC Thunder photos during 2024-25 season from Nathan Fish,/picture-gallery/sports/nba/thunder/2025/07/05/see-top-okc-thunder-photos-during-2024-25-season-from-nathan-fish/84420540007/
"Apartments, retail set to be built along former OKC's Hubcap Alley",/story/business/downtown/2025/07/04/scissortail-park-oklahoma-city-housing-retail-developments/84439370007/
A Chickasaw Nation casino proposal seeks to transform Coney Island in NY,/story/business/2025/07/01/coney-island-ny-developments-proposal-chickasaw-nation-oklahoma-tribe/84416347007/
Proposed Oklahoma alumina plant designed to compete with China,/story/business/manufacturing/2025/06/30/alumina-plant-oklahoma-vs-china-plans/84386012007/
Guest columnist argues why US bombing of Iran is justified David Deming,/story/opinion/columns/guest/2025/07/05/iran-nuclear-weapons-us-bombing/84435686007/
How can we keep this feeling of unity in OKC?,/story/opinion/letters/2025/07/05/readers-feeling-unified-finding-safe-haven-and-good-jobs/84442466007/
Spending to skyrocket. Oklahoma senators on board.,/story/opinion/cartoons/2025/07/03/big-beautiful-bill-skyrocketing-spending-oklahoma-senators-support/84452195007/
"'Do it lady!': Meet Chit, the internet's favorite awkward coworker",/story/entertainment/2025/07/05/chit-show-social-media-sketch-comedy/84447761007/
"National Fried Chicken Day: Get deals on sandwiches, wings and more",/story/money/food/2025/07/05/national-fried-chicken-day-2025-deals-free-food/84430391007/
Mega Millions winning numbers for July 4: $60 million jackpot,/story/money/lottery/2025/07/04/mega-millions-winning-numbers/84465700007/
🇺🇸 10 most popular Amazon deals to shop this 4th of July weekend,/story/shopping/2025/07/04/popular-fourth-of-july-amazon-deals/84475001007/
Coleman 4th of July sale: 8 camping and outdoor deals to shop,/story/shopping/2025/07/04/coleman-fourth-of-july-sale-camping-outdoor-must-haves-up-to-35-off/84470511007/
Get free AirPods with Apple’s 2025 student discount 🍎,/story/shopping/2025/07/01/apple-back-to-school-student-deals/84361561007/
Seven decades of flavor: Florence Kemp's historic restaurant success,/story/lifestyle/food/2025/07/02/florences-okc-restaurant-legacy-owner-florence-kemp/83949547007/
Odyssey de Culinaire set to return to OKC's Skirvin hotel,/story/lifestyle/2025/07/05/culinary-students-top-oklahoma-chefs-partner-up-for-fundraising/84465008007/
"Tamashii turns 10, 39 is back and Trisha Yearwood's nachos: Food news",/story/lifestyle/food/2025/07/05/okc-tulsa-norman-and-yukon-bites-food-news-you-might-have-missed/84449230007/
,/picture-gallery/sports/nba/thunder/2025/07/05/see-top-okc-thunder-photos-during-2024-25-season-from-nathan-fish/84420540007/
Enter Today!,https://usatoday.gannettcontests.com/The-Kansas-City-Steak-Company-Sizzling-Summer/?itm_campaign=The%20Kansas%20City%20Steak%20Company%20Sizzling%20Summer%20Sweepsteaks&itm_medium=con&itm_source=secondStreet
Summer Athlete Polls,https://www.oklahoman.com/sports/high-school/?itm_campaign=Athlete%20of%20the%20Week%20Landmark%20OKC&itm_medium=con&itm_source=secondStreet
Enter Today!,https://offers.renewalbyandersen.com/esler/sweepstakes/?rba_source=Digital%20Sweepstakes&rba_breakdown=GannettPHI&rba_phone=702-331-9116&utm_source=Gannett_PHI&utm_medium=Digital_Sweepstakes&&itm_campaign=Renewal%20by%20Andersen%20Client%26%2339%3Bs%20site%20contest&itm_medium=con&itm_source=secondStreet
Program putting counselors in rural Oklahoma schools devastated by Trump cuts,/story/news/education/2025/07/05/ou-oklahoma-prime-program-school-counselors-trump-budget-cuts/84461096007/
Seven decades of flavor: Florence Kemp's historic restaurant success,/story/lifestyle/food/2025/07/02/florences-okc-restaurant-legacy-owner-florence-kemp/83949547007/
"Thunder NBA free agency 2025: Tracking latest rumors, updates",/story/sports/nba/thunder/2025/06/29/okc-thunder-nba-free-agency-2025-tracking-latest-rumors-updates/84408839007/
Celebrate the Thunder's amazing season with our commemorative book,/story/sports/nba/thunder/2025/05/28/commemorate-okc-thunder-historic-season-with-our-collectors-book/83893354007/
"Undrafted NBA free agents tracker: Signings for Thunder, local players",/story/sports/nba/thunder/2025/06/27/undrafted-nba-free-agents-tracker-okc-thunder-signing-updates/84381387007/
,https://cm.oklahoman.com/site-feedback/?platform=Tangent-Desktop&url=https%3A%2F%2Fwww.oklahoman.com%2F&marketName=oklahoman&cta=Right-Rail
