headline,href
"Shawnee wants extra $1,500 a year from dispensaries it calls 'growers'",/story/news/state/2024/09/14/shawnee-oklahoma-medical-marijuana-dispensary-licenses/75172587007/
Readers offer opinions about Freedom Caucus,/story/opinion/columns/your-voice/2024/09/14/what-do-readers-think-about-the-far-right-freedom-caucus-in-oklahoma-opinion/75089092007/
Why settlement talks in a defamation lawsuit against Walters ended,/story/news/courts/2024/09/14/oklahoma-ryan-walters-defamation-lawsuit-settlement-talks-end/75206229007/
Worry about Christian nationalism pushes groups to raise awareness,/story/lifestyle/2024/09/14/good-faith-media-film-bad-faith-screening-oklahoma/75160095007/
"Oklahoma high school football: Week 2 schedule, scores…",/story/sports/high-school/football/2024/09/12/oklahoma-high-school-football-scores-schedule-stats-for-2024-ossaa-week-2/75185721007/
Oklahoma State Fair guide: What you need to know,/story/news/state/2024/09/02/oklahoma-state-fair-2024-guide-tickets-dates-schedule-parking/75013347007/
"OKC is set to see over 1,000 people living along the…",/story/news/2024/09/14/wheeler-okc-oklahoma-river-first-apartments/75163701007/
Vote: Landmark Fine Homes girls HS athletes of the week…,/story/sports/high-school/2024/09/08/vote-landmark-fine-homes-girls-high-school-athletes-of-the-week-sept-1-7/75132694007/
Vote: Landmark Fine Homes boys HS athletes of the week…,/story/sports/high-school/2024/09/08/vote-landmark-fine-homes-boys-high-school-athletes-of-the-week-sept-1-7/75124909007/
,
"Shawnee wants extra $1,500 a year from dispensaries it calls 'growers'",/story/news/state/2024/09/14/shawnee-oklahoma-medical-marijuana-dispensary-licenses/75172587007/
Why settlement talks in a defamation lawsuit against Walters ended,/story/news/courts/2024/09/14/oklahoma-ryan-walters-defamation-lawsuit-settlement-talks-end/75206229007/
Who are Oklahoma City's most influential faith leaders? A comprehensive list,/story/news/2024/09/12/oklahoma-church-influential-spiritual-leaders-to-know/74605469007/
Who has edge in OU vs Tulane game? Breaking down key matchups,/story/sports/college/sooners/2024/09/13/oklahoma-tulane-football-scouting-report-matchup-breakdown-week-3-sooners-green-wave/75196259007/
Who has edge in Oklahoma State football vs Tulsa game in Week 3?,/story/sports/college/cowboys/2024/09/13/oklahoma-state-tulsa-football-matchup-breakdown-week-3-game/75193769007/
"Oklahoma high school football: Week 2 schedule, scores, highlights",/story/sports/high-school/football/2024/09/12/oklahoma-high-school-football-scores-schedule-stats-for-2024-ossaa-week-2/75185721007/
Oklahoma-based energy company Kimray layoffs to hit 16% of workforce,/story/business/energy-resource/2024/09/13/kimray-layoffs-majority-workforce-reduction-oklahoma-city/75190659007/
Looking for a Friday the 13th tattoo deal? Here's where to find shops,/story/business/local/2024/09/11/friday-the-13th-tattoo-deals-oklahoma-city-area-shops-featuring-flash/75159745007/
"American Airlines grows its workforce across US, including Oklahoma",/story/business/2024/09/11/american-airlines-jobs-tulsa-ok-maintenance-facility/75162567007/
"Abortion, open primaries, 2nd Amendment rights in this week's letters",/story/opinion/letters/2024/09/14/abortion-open-primaries-2nd-amendment-rights-jim-young-oklahoma-letters-to-the-editor-opinion/75071760007/
Are you registered to vote? It's time to make a plan to make yours count Lynn Staggs,/story/opinion/columns/2024/09/13/league-of-women-voters-suppression-legislation-oklahoma-registered/75181331007/
Oklahoma needs moratorium on executions until changes made Andy Lester,/story/opinion/columns/2024/09/12/governor-should-consider-clemency-for-emmanuel-littlejohn/75160097007/
Keep Halloween affordable by shopping these discount store deals,/story/money/2024/09/14/cheap-halloween-decoration-costume-ideas/75205090007/
Winning numbers for Mega Millions on September 13; $20 million jackpot,/story/money/lottery/2024/09/13/mega-millions-winning-numbers/75214633007/
Starlink satellites to send crisis alerts to areas without cell towers,/story/tech/news/2024/09/13/starlink-satellites-tmobile-emergency-alerrts/75210434007/
Worry about Christian nationalism pushes groups to raise awareness,/story/lifestyle/2024/09/14/good-faith-media-film-bad-faith-screening-oklahoma/75160095007/
"'Tulsa King' season 2 premiers Sunday: Where to watch, stream",/story/entertainment/television/2024/09/13/when-does-season-2-of-tulsa-king-come-out-how-to-watch-stream/75210374007/
Garth Brooks sets Vegas residency to end next year: What to know,/story/entertainment/music/2024/09/13/oklahoma-native-garth-brooks-ending-vegas-residency-next-year/75208811007/
,/picture-gallery/sports/college/sooners/2024/09/13/ou-softball-honors-patty-gasso-with-statue-dedication-at-loves-field/75213355007/
Winners Announced!,https://oklahoman.gannettcontests.com/2024-Oklahoman-Communitys-Choice-Awards-Winners/?itm_campaign=Oklahoma%202024%20BOB&itm_medium=con&itm_source=secondStreet
Vote Every Week!,https://www.oklahoman.com/sports/high-school/?itm_campaign=Athlete%20of%20the%20Week%20Landmark%20OKC&itm_medium=con&itm_source=secondStreet
Who are Oklahoma City's most influential faith leaders? A comprehensive list,/story/news/2024/09/12/oklahoma-church-influential-spiritual-leaders-to-know/74605469007/
"Abortion, open primaries, 2nd Amendment rights in this week's letters",/story/opinion/letters/2024/09/14/abortion-open-primaries-2nd-amendment-rights-jim-young-oklahoma-letters-to-the-editor-opinion/75071760007/
Who has edge in OU vs Tulane game? Breaking down key matchups,/story/sports/college/sooners/2024/09/13/oklahoma-tulane-football-scouting-report-matchup-breakdown-week-3-sooners-green-wave/75196259007/
Who has edge in Oklahoma State football vs Tulsa game in Week 3?,/story/sports/college/cowboys/2024/09/13/oklahoma-state-tulsa-football-matchup-breakdown-week-3-game/75193769007/
Our favorite moments from Oklahoma State Fair opening day,/picture-gallery/news/2024/09/12/olahoma-state-fair-2024-photos-opening-day/75194572007/
,https://cm.oklahoman.com/site-feedback/?platform=Tangent-Desktop&url=https%3A%2F%2Fwww.oklahoman.com%2F&marketName=oklahoman&cta=Right-Rail
