headline,href
Stitt turns to political outsider to score key goal in U.S. Senate,/story/news/politics/2026/03/25/alan-armstrong-stitt-energy-sector-senate/89298997007/
"Anti-Muslim rhetoric rising in Oklahoma, impacting mosque construction, legislation",/story/news/religion/2026/03/25/mosques-oklahoma-okc-edmond-muslim-sharia-law-us-religious-freedom-islamophobia/88626391007/
Mussatto's Minutes: Is Thunder-Celtics an NBA Finals preview?,/story/sports/nba/thunder/2026/03/25/okc-thunder-boston-celtics-nba-finals-odds-jayston-tatum-shai-gilgeous-alexander/89305671007/
Oklahoma ranks third in hail damage list amid home insurance debate,/story/business/2026/03/25/does-hail-damage-ranking-impact-oklahoma-high-homeowners-costs/89305483007/
OSSAA basketball state tournament 2026: Everything you…,/story/sports/high-school/basketball/2026/03/03/oklahoma-high-school-basketball-2026-ossaa-state-tournament-previews-results/88952670007/
Vote: Homeland OKC-area high school team of week for…,/story/sports/high-school/baseball/2026/03/23/vote-homeland-okc-area-high-school-team-of-week-march-16-22/89293543007/
Vote: Landmark Fine Homes HS boys athlete of week for…,/story/sports/high-school/athlete-of-the-week/2026/03/23/vote-landmark-fine-homes-high-school-boys-athlete-of-week-march-16-22/89293172007/
Celebrate the Thunder's first NBA title with this…,/story/sports/nba/thunder/2025/12/17/celebrate-okc-thunder-nba-championship-commemorative-book/87805943007/
,
Celebrate Oklahoma high school basketball with 'The Big…,/story/sports/high-school/basketball/2025/12/17/celebrate-oklahoma-high-school-basketball-big-house-book/87806019007/
News,/news/
Stitt turns to political outsider to score key goal in U.S. Senate,/story/news/politics/2026/03/25/alan-armstrong-stitt-energy-sector-senate/89298997007/
"Anti-Muslim rhetoric rising in Oklahoma, impacting mosque construction, legislation",/story/news/religion/2026/03/25/mosques-oklahoma-okc-edmond-muslim-sharia-law-us-religious-freedom-islamophobia/88626391007/
"Oklahoma AG, charter school board sued by Jewish group",/story/news/politics/state/2026/03/24/jewish-ben-gamla-accuse-oklahoma-ag-charter-school-board-of-religious-discrimination-federal-lawsuit/89306163007/
Sports,/sports/
Mussatto's Minutes: Is Thunder-Celtics an NBA Finals preview?,/story/sports/nba/thunder/2026/03/25/okc-thunder-boston-celtics-nba-finals-odds-jayston-tatum-shai-gilgeous-alexander/89305671007/
"Eight for OKC: Isabela Emerling's HR, Ruby Meylan's perfection dominate week",/story/sports/college/softball/2026/03/25/ou-softball-isabela-emerling-stats-home-run-oklahoma-sooners-osu-cowgirls-ruby-meylan-perfect-game/89306001007/
"OSSAA coaching carousel news: Minco hires Kevin Witt, Brett Sanders",/story/sports/high-school/2026/03/25/oklahoma-high-school-football-girls-basketball-minco-hires-kevin-witt-brett-sanders-ossaa/89292847007/
Life,/life/
Caffeine Crawl 2026 includes 15 shops across OKC and Norman,/story/lifestyle/food/2026/03/25/okc-caffeine-crawl-2026-participating-shops-list/89304713007/
Why does Easter Sunday change each year? See when it is this year,/story/lifestyle/2026/03/25/when-is-easter-sunday-2026-date-what-to-expect-holiday/89298666007/
"Cupcake, Glad at OKC-area shelters ready for homes",/story/lifestyle/2026/03/25/adopt-a-pet-adoptions-okc-animal-shelters-furever-friend/89166889007/
Business,/business/
Oklahoma ranks third in hail damage list amid home insurance debate,/story/business/2026/03/25/does-hail-damage-ranking-impact-oklahoma-high-homeowners-costs/89305483007/
What is Harold Hamm's net worth? Billionaire partners with OKC Thunder,/story/business/economy/2026/03/24/harold-hamm-net-worth-okc-thunder-continental-coliseum-partnership/89301714007/
Dozens of Oklahoma truck training providers removed from registry,/story/business/transportation/2026/03/24/non-domiciled-cdl-new-rules-oklahoma-truck-training-removed-national-registry/89003267007/
Opinion,/opinion/
Was spending $1 million to keep this man in prison worthwhile? Sue Hinton,/story/opinion/columns/guest/2026/03/25/strange-justice-system-oklahoma-mans-vcr-theft-costs-taxpayers-1-million-opinion/89299353007/
Oklahoma's education future is personal to me. It should be to lawmakers Nathan Sanders,/story/opinion/columns/guest/2026/03/25/oklahoma-legislators-should-pass-school-choice-improvements/89227481007/
These members of our community are making a difference,/story/opinion/2026/03/25/meet-people-featured-in-the-oklahoman-who-are-helping-make-community-better/89136768007/
Trending,https://www.usatoday.com/news/trending/
Mega Millions jackpot $60M: March 24 winning numbers,/story/money/lottery/2026/03/24/mega-millions-jackpot-60-million/89308755007/
Is ICE getting paid? Officers report to airports amid DHS shutdown,/story/news/nation/2026/03/24/are-ice-officers-getting-paid-dhs-shutdown/89299314007/
Public health alert issued for this ground beef product. Here's why.,/story/money/2026/03/24/ground-beef-public-health-alert/89305037007/
Shopping,/shopping/
World Cup ready: Shop Nike's latest 2026 World Cup jerseys releases,/story/shopping/sports/fan-gear/soccer/2026/03/25/buy-2026-fifa-world-cup-nike-jerseys-usa-soccer-gear-england-france/89298246007/
Where can you find authentic team gear online? Shop top 10 retailers,/story/shopping/sports/fan-gear/where-to-buy-sports-team-gear/89292007007/
"5 best earbuds with up to 51% off: JBL, Samsung, Apple",/story/shopping/deals/tech/wireless-earbuds/2026/03/25/best-tech-deals-earbuds-spring/89295770007/
,/picture-gallery/news/local/2026/03/25/see-inside-around-some-of-oklahomas-mosques/89085031007/
ENTER to WIN!,https://oklahoman.gannettcontests.com/Pella-Oklahoma-2026-Spring-Project-Home-Improved-with-Ty-Pennington/?itm_campaign=Pella%20of%20Oklahoma%20City%20Project%20Home%20Improved%20Spring%202026&itm_medium=con&itm_source=secondStreet
ENTER NOW,https://usatoday.gannettcontests.com/Reagan-Gold-Group-Spring-Gold-Rush/?itm_campaign=Reagan%20Gold%20Group%20Spring%20Gold%20Rush%20Sweepstakes&itm_medium=con&itm_source=secondStreet
NOMINATE TODAY!,https://oklahoman.gannettcontests.com/2026-Oklahoman-Communitys-Choice-Awards/?itm_campaign=2026%20Oklahoma%20Community%26%2339%3Bs%20Choice&itm_medium=con&itm_source=secondStreet
"Oklahoma AG, charter school board sued by Jewish group",/story/news/politics/state/2026/03/24/jewish-ben-gamla-accuse-oklahoma-ag-charter-school-board-of-religious-discrimination-federal-lawsuit/89306163007/
Oklahoma AG agrees to turn over voter data to feds,/story/news/state/2026/03/24/oklahoma-attorney-general-drummond-to-share-voter-data-with-department-of-justice-bondi/89306922007/
Oklahoma Supreme Court won't rule on tribal hunting dispute,/story/news/courts/2026/03/24/oklahoma-supreme-court-wont-rule-on-tribal-hunting-lawsuit-drummond-stitt/89305558007/
"Eight for OKC: Isabela Emerling's HR, Ruby Meylan's perfection dominate week",/story/sports/college/softball/2026/03/25/ou-softball-isabela-emerling-stats-home-run-oklahoma-sooners-osu-cowgirls-ruby-meylan-perfect-game/89306001007/
What is Harold Hamm's net worth? Billionaire partners with OKC Thunder,/story/business/economy/2026/03/24/harold-hamm-net-worth-okc-thunder-continental-coliseum-partnership/89301714007/
,https://cm.oklahoman.com/site-feedback/?platform=Tangent-Desktop&url=https%3A%2F%2Fwww.oklahoman.com%2F&marketName=oklahoman&cta=Right-Rail
