headline,href
Moore tornado 25 years later: Survivors turn experience into support,/story/news/state/2024/05/04/moore-1999-tornado-anniversary-survivors-remember-devastation-turn-support-to-sulphur-marietta/73555844007/
Why did top lawyer at the OSBI leave after only months on the job?,/story/news/2024/05/03/oklahoma-state-bureau-investigation-general-counsel-jana-wallace-resigns-over-slur-email/73557086007/
Car tag bill introduced by Sen. Treat following son's accident signed into law,/story/news/politics/government/2024/05/04/oklahoma-car-tag-sb-2035-greg-treat-signed-into-law-kevin-stitt/73555267007/
Governor expected to continue push for tax cuts at budget meeting,/story/news/politics/state/2024/05/04/oklahoma-legislative-session-2024-kevin-stitt-greg-treat-budget-talks/73553348007/
Vote: Who was the best OKC-area girls high school…,/story/sports/high-school/2024/04/30/vote-landmark-fine-homes-oklahoma-high-school-girls-athlete-of-week-april-22-29/73500010007/
Vote: Who was the best boys high school athlete in OKC…,/story/sports/high-school/2024/04/30/vote-landmark-fine-homes-oklahoma-high-school-boys-athlete-of-week-april-22-29/73499966007/
Which players are committed to OSU in the 2025…,/story/sports/college/cowboys/2024/02/04/oklahoma-state-football-recruiting-osu-cowboys-2025-commitments/72474529007/
'Unhoused' person is someone's family | Letters to the…,/story/opinion/letters/2024/05/04/republican-leaders-foster-families-remembering-a-granddaughter-letters/73473371007/
,
Oklahoma HS track & field state championship results for…,/story/sports/high-school/track-field/2024/05/04/oklahoma-high-school-track-and-field-2024-state-championship-results-for-classes-4a-3a-2a-a/73562714007/
Moore tornado 25 years later: Survivors turn experience into support,/story/news/state/2024/05/04/moore-1999-tornado-anniversary-survivors-remember-devastation-turn-support-to-sulphur-marietta/73555844007/
Why did top lawyer at the OSBI leave after only months on the job?,/story/news/2024/05/03/oklahoma-state-bureau-investigation-general-counsel-jana-wallace-resigns-over-slur-email/73557086007/
Car tag bill introduced by Sen. Treat following son's accident signed into law,/story/news/politics/government/2024/05/04/oklahoma-car-tag-sb-2035-greg-treat-signed-into-law-kevin-stitt/73555267007/
Wrongs are being righted for Jim Thorpe with Medal of Freedom,/story/sports/olympics/2024/05/03/oklahoma-celebrates-jim-thorpe-presidential-medal-of-freedom-from-president-joe-biden-2024/73561043007/
Oklahoma HS track & field state championship results for Classes 4A-A,/story/sports/high-school/track-field/2024/05/04/oklahoma-high-school-track-and-field-2024-state-championship-results-for-classes-4a-3a-2a-a/73562714007/
Oklahoma high school tennis girls state championship results,/story/sports/high-school/tennis/2024/05/04/oklahoma-high-school-2024-ossaa-tennis-girls-state-championship-class-6a-5a-4a-results/73561963007/
What to know before you go to the OKC Symphony Show House fundraiser,/story/business/real-estate/2024/05/01/okc-symphony-designer-show-house-raises-money-for-oklahoma-city-philharmonic-music-education/73181091007/
'Black mass' stays in Atoka for processing at battery recycling plant,/story/business/2024/04/29/atoka-ok-lithium-ion-battery-recycling-plant-black-mass/73347080007/
Builders of warehouses for rent in OKC take a post-boom breather,/story/business/real-estate/2024/04/27/okc-real-estate-warehouse-market-slowing-down-after-boom/73456041007/
'Unhoused' person is someone's family | Letters to the editor,/story/opinion/letters/2024/05/04/republican-leaders-foster-families-remembering-a-granddaughter-letters/73473371007/
Marjorie Taylor Greene clown show just the thing to unite a divided America Jay Bookman,/story/opinion/columns/2024/05/03/marjorie-taylor-green-can-united-a-divided-republican-democrat-us/73552845007/
"'Bad faith arguments' are blatant power grabs, control of information Nancy E. Snow",/story/opinion/columns/2024/05/03/banning-books-is-a-bad-faith-argument-from-school-authorities/73494746007/
Why do we celebrate Cinco de Mayo? Know the history of May 5,/story/news/nation/2024/05/04/what-is-cinco-de-mayo/73526083007/
May the 4th: Here are 7 ideas 'Star Wars' borrowed from 'Dune' novels,/story/entertainment/movies/2024/05/04/star-wars-day-dune-science-fiction/73452399007/
Mega Millions May 3 winning numbers: Jackpot rises to $284M,/story/money/lottery/2024/05/03/mega-millions-winning-numbers/73559582007/
Oklahoma's Passport is your road map to fun on Route 66,/story/lifestyle/2024/05/04/route-66-passport-is-your-road-map-to-fun-travelok/73413188007/
These Oklahoma shows and artists are up for Tony Awards,/story/entertainment/2024/05/03/tony-awards-2024-nominations-from-oklahoma-the-outsiders/73518274007/
Cimarron Songbird Monica Taylor to be honored at Bob Childers' Gypsy Café,/story/entertainment/2024/05/02/oklahoma-songwriters-flock-to-stillwater-for-bob-childers-gypsy-caf/73415962007/
,/picture-gallery/sports/college/big-12/2024/05/03/ou-hosts-osu-in-game-1-of-bedlam-softball-series-see-our-top-photos/73562117007/
ENTER TODAY!,https://usatoday.gannettcontests.com/Service-Experts-Home-of-the-Future/?itm_campaign=Service%20Experts%20Gordons%20Home%20of%20the%20Future&itm_medium=con&itm_source=secondStreet
Don’t Miss Out!,https://oklahoman.gannettcontests.com/2024-Home-and-Garden-Refresh/?itm_campaign=2024%20Home%20%26amp%3B%20Garden%20Refresh%20-%20The%20Oklahoman&itm_medium=con&itm_source=secondStreet
ENTER TODAY,https://usatoday.gannettcontests.com/Bourbon-and-Beyond-VIP-Experience-2024/?itm_campaign=Bourbon%20and%20Beyond%202024&itm_medium=con&itm_source=secondStreet
Landowners Bill of Rights seeks to address OTA use of eminent domain,/story/news/2024/05/04/oklahoma-turnpike-authority-eminent-domain-challenge-kevin-stitt-law/73556987007/
Plans for downtown Edmond brewery get new life following lease deal,/story/news/local/2024/05/04/edmond-oklahoma-brewery-festival-market-place-plans-new-lease/73264240007/
Oklahoma leaders react to issues with publication's school rankings,/story/news/education/2024/05/04/us-world-news-high-school-rankings-oklahoma-missing-data/73559121007/
Wrongs are being righted for Jim Thorpe with Medal of Freedom,/story/sports/olympics/2024/05/03/oklahoma-celebrates-jim-thorpe-presidential-medal-of-freedom-from-president-joe-biden-2024/73561043007/
How Oklahoma's Republican attorney general is separating himself from his party,/story/news/2024/05/02/oklahoma-religious-charter-school-attorney-general-gentner-drummond-gop/70995908007/
,https://cm.oklahoman.com/site-feedback/?platform=Tangent-Desktop&url=https%3A%2F%2Fwww.oklahoman.com%2F&marketName=oklahoman&cta=Right-Rail
