headline,href
"OSU vs UT Martin live updates, score from Cowboys' season opener",/story/sports/college/cowboys/2025/08/28/oklahoma-state-ut-martin-game-score-updates-highlights-college-football/85871184007/
Education board calls special meeting after previous meeting canceled,/story/news/education/2025/08/28/oklahoma-ed-board-members-call-special-meeting-after-walters-canceled/85875078007/
"Oklahoma high school football: Week 0 schedule, scores, highlights",/story/sports/high-school/football/2025/08/28/oklahoma-high-school-football-scores-ossaa-week-0-highlights-updates-stats-box-scores-okc/85874647007/
"After canceled meeting, Ryan Walters' opponents brainstorm on next steps",/story/news/education/2025/08/28/ryan-walters-oklahoma-state-board-education-meeting-cancellation-protests/85872378007/
Protestors at Oklahoma Capitol after OSBE meeting…,/picture-gallery/news/education/2025/08/28/ryan-walters-oklahoma-state-board-of-education-meeting-canceled-protest/85867567007/
Inside John Mateer's journey to OU football and 'bigger…,/story/sports/college/sooners/2025/08/28/ou-football-john-mateer-stats-hometown-transfer-portal-oklahoma-sooners/85807961007/
The Oklahoman's picks for 2025 high school football…,/story/sports/high-school/football/2025/08/28/oklahoma-high-school-football-ossaa-2025-state-championship-predictions/85833558007/
The Oklahoman's 2025 preseason All-State high school…,/story/sports/high-school/football/2025/08/28/oklahoma-high-school-football-ossaa-2025-preseason-all-state-team/85844379007/
,
Class B-II football district previews 2025: Polls…,/story/sports/high-school/football/2025/08/28/oklahoma-high-school-football-ossaa-2025-class-b-ii-district-previews/85821161007/
Education board calls special meeting after previous meeting canceled,/story/news/education/2025/08/28/oklahoma-ed-board-members-call-special-meeting-after-walters-canceled/85875078007/
"After canceled meeting, Ryan Walters' opponents brainstorm on next steps",/story/news/education/2025/08/28/ryan-walters-oklahoma-state-board-education-meeting-cancellation-protests/85872378007/
"Rep. Ty Burns, R-Pawnee, pleads guilty to domestic abuse and assault",/story/news/politics/2025/08/28/pawnee-ok-ty-burns-lawmaker-pleads-guilty-assault-domestic-abuse/85872172007/
"OSU vs UT Martin live updates, score from Cowboys' season opener",/story/sports/college/cowboys/2025/08/28/oklahoma-state-ut-martin-game-score-updates-highlights-college-football/85871184007/
"Oklahoma high school football: Week 0 schedule, scores, highlights",/story/sports/high-school/football/2025/08/28/oklahoma-high-school-football-scores-ossaa-week-0-highlights-updates-stats-box-scores-okc/85874647007/
Inside John Mateer's journey to OU football and 'bigger stage' of SEC,/story/sports/college/sooners/2025/08/28/ou-football-john-mateer-stats-hometown-transfer-portal-oklahoma-sooners/85807961007/
Oklahoma National Stockyards again up for sale as buyer backs out,/story/business/agricultural/2025/08/28/oklahoma-national-stockyards-buyer-backs-out-whats-next/85859303007/
Screwworm reports in Mexico increase Oklahoma concerns for parasite,/story/business/agricultural/2025/08/27/screwworm-in-human-report-how-oklahoma-might-respond-rise/85839032007/
Harold Hamm's daughter named board chair at Continental Resources,/story/business/energy-resource/2025/08/26/continental-resources-oklahoma-shelly-lambertz-joins-dad-harold-hamm-executive-board/85835394007/
Oklahoma's poorest families would benefit from higher wages,/story/opinion/editorials/2025/08/28/higher-wages-needed-to-move-oklahoma-out-of-poverty-editorial/85822082007/
Thank you for trusting me with your voices Clytie Bunyan,/story/opinion/columns/2025/08/28/oklahoman-opinion-platform-politics-education-healthcare-dei-racism/85851858007/
Worried about teens and AI? Teach them news literacy Hannah Covington,/story/opinion/columns/guest/2025/08/27/oklahoma-teens-education-news-literacy-duped-ai/85824871007/
"Lowe's debuts its own, 20-foot take on Home Depot 'Skelly'",/story/money/shopping/2025/08/28/lowes-home-depot-halloween-skelly-skeletion/85870165007/
NTSB releases report on B-52 bomber that nearly hit passenger plane,/story/news/nation/2025/08/28/ntsb-report-b52-bomber-hit-delta-flight/85871590007/
Watch: Drone video shows huge blaze at recycling plant,/story/news/nation/2025/08/28/drone-footage-fire-windfield-recycling-lawrence-massachusetts/85868124007/
"14 can’t-miss Labor Day sales at REI, HexClad, Amazon",/story/shopping/2025/08/28/shop-best-labor-day-2025-sales-deals/85863058007/
Save more than 50% on DIY + home improvement tools at Amazon 🧰,/story/shopping/2025/08/28/amazon-labor-day-diy-home-improvement-tool-deals/85857725007/
Get tickets for Ariana Grande's The Eternal Sunshine tour in 2026,/story/shopping/2025/08/28/how-to-buy-tickets-for-ariana-grande-the-eternal-sunshine-2026-tour-concert-schedule/85866801007/
Here's how to get tickets for Cross Canadian Ragweed's Stillwater show,/story/entertainment/2025/08/28/boys-from-oklahoma-2026-cross-canadian-ragweed-what-to-know-about-ticket-sales/85862891007/
New OCCC exhibit shines spotlight on opera star Leona Mitchell,/story/entertainment/2025/08/28/new-occc-exhibit-shines-spotlight-on-world-renowned-opera-singer-and-oklahoma-native-leona-mitchell/85717403007/
See Leona Mitchell open new exhibit in her honor at OCCC,/picture-gallery/lifestyle/2025/08/28/leona-mitchell-exhibit-including-dresses-and-photos-opens-at-occc/85735463007/
,/picture-gallery/sports/college/cowboys/2025/08/28/oklahoma-state-vs-ut-martin-our-top-photos-from-osu-cowboys-football/85849826007/
Enter Today!,https://palmbeachpost.gannettcontests.com/Ireland-US-Experience-Football-Getaway/?itm_campaign=Ireland%20US%20Experience&itm_medium=con&itm_source=secondStreet
ENTER NOW! ENTER OFTEN!,https://oklahoman.gannettcontests.com/2025-Oklahoma-State-Fair/?itm_campaign=2025%20Oklahoma%20State%20Fair%20Ultimate%20Giveaway&itm_medium=con&itm_source=secondStreet
Winners Announced!,https://oklahoman.gannettcontests.com/2025-Oklahoman-Communitys-Choice-Awards-Winners/?itm_campaign=Oklahoma%20Bob&itm_medium=con&itm_source=secondStreet
"Daughter feared Rep. Burns would kill her and grandmother, filing says",/story/news/politics/2025/08/28/pawnee-ok-ty-burns-lawmaker-pleads-guilty-assault-domestic-abuse/85872172007/
Here's how to get tickets for Cross Canadian Ragweed's Stillwater show,/story/entertainment/2025/08/28/boys-from-oklahoma-2026-cross-canadian-ragweed-what-to-know-about-ticket-sales/85862891007/
Oklahoma National Stockyards again up for sale as buyer backs out,/story/business/agricultural/2025/08/28/oklahoma-national-stockyards-buyer-backs-out-whats-next/85859303007/
Screwworm reports in Mexico increase Oklahoma concerns for parasite,/story/business/agricultural/2025/08/27/screwworm-in-human-report-how-oklahoma-might-respond-rise/85839032007/
State votes to build new Oklahoma governor's mansion with private funds,/story/news/politics/2025/08/28/commission-votes-to-construct-new-oklahoma-governors-mansion/85874319007/
,https://cm.oklahoman.com/site-feedback/?platform=Tangent-Desktop&url=https%3A%2F%2Fwww.oklahoman.com%2F&marketName=oklahoman&cta=Right-Rail
