headline,href
Oklahoma's disturbing spike in school threats reflects national trend,/story/news/education/2024/09/19/oklahoma-schools-reflect-growing-national-trend-of-gun-bomb-threats-at-schools/75277420007/
Heupel's ex-teammates won't forget how he reignited 'Sooner Magic',/story/sports/college/sooners/2024/09/19/josh-heupel-ou-football-return-oklahoma-vs-tennessee-sec-debut/75280870007/
OK prosecutor accused of undermining abuse victims charged with crimes,/story/news/2024/09/19/tulsa-county-stephen-kunzweiler-accused-undermining-abuse-victims-oklahoma-survivors-act/75291289007/
OPINION: Lies about Haitians are offensive to all immigrantsAlex Seojoon Kim,/story/opinion/columns/2024/09/19/haitian-immigrants-eating-pets-dogs-cats-trump-jd-vance-ohio/75271281007/
"New online Toby Keith store features foods, sauces, 'Big…",/story/entertainment/2024/09/19/toby-keith-premium-foods-country-singer-developed-sauces-burgers-catfish/75277978007/
Results: Hannah Whitaker is the Student of the Week,/story/news/2024/09/16/student-of-the-week-the-oklahoman-vote/75132767007/
"Oklahoma high school football: Week 3 schedule, scores…",/story/sports/high-school/football/2024/09/19/oklahoma-high-school-football-scores-schedule-stats-for-2024-ossaa-week-3/75283443007/
"Walk-On's matches Danny Stutsman's $50,000 donation to…",/story/sports/college/sooners/2024/09/19/ou-football-danny-stutsman-walk-ons-matches-nil-donation-oklahoma-sooners/75296092007/
,
Tishomingo cancels Friday football game after students'…,/story/news/2024/09/19/tishomingo-oklahoma-students-disciplined-after-racial-slur-shown-in-viral-image/75294249007/
Oklahoma's disturbing spike in school threats reflects national trend,/story/news/education/2024/09/19/oklahoma-schools-reflect-growing-national-trend-of-gun-bomb-threats-at-schools/75277420007/
OK prosecutor accused of undermining abuse victims charged with crimes,/story/news/2024/09/19/tulsa-county-stephen-kunzweiler-accused-undermining-abuse-victims-oklahoma-survivors-act/75291289007/
"OAK, new retail, shopping and lodging called 'a reason to gather'",/story/news/2024/09/19/oak-development-oklahoma-city-opens-hotel-art-installation/75169873007/
Heupel's ex-teammates won't forget how he reignited 'Sooner Magic',/story/sports/college/sooners/2024/09/19/josh-heupel-ou-football-return-oklahoma-vs-tennessee-sec-debut/75280870007/
"Oklahoma high school football: Week 3 schedule, scores, highlights",/story/sports/high-school/football/2024/09/19/oklahoma-high-school-football-scores-schedule-stats-for-2024-ossaa-week-3/75283443007/
"Walk-On's matches Danny Stutsman's $50,000 donation to OU teammates",/story/sports/college/sooners/2024/09/19/ou-football-danny-stutsman-walk-ons-matches-nil-donation-oklahoma-sooners/75296092007/
Restaurant owned by local rapper Jabee closing down after two years,/story/business/local/2024/09/17/eastside-pizza-house-okc-jabee-announces-closure/75266549007/
Legacy at Covell in Edmond likely spot for a new Whole Foods store,/story/business/local/2024/09/17/whole-foods-looking-to-open-second-okc-area-store-in-edmond/75260157007/
Starbucks has avoided downtown OKC ― until now,/story/business/downtown/2024/09/16/starbucks-coffee-shop-coming-to-downtown-oklahoma-city-in-the-spring/75103288007/
OPINION: Lies about Haitians are offensive to all immigrants Alex Seojoon Kim,/story/opinion/columns/2024/09/19/haitian-immigrants-eating-pets-dogs-cats-trump-jd-vance-ohio/75271281007/
OPINION: Long-term approach to mental health care is critically needed Kati Malicoate,/story/opinion/columns/2024/09/19/oklahoma-mental-illness-clinics-treatment-medicaid-insurance-housing/75260312007/
The parole board voted for Littlejohn clemency. Stitt should grant it Rev. Jon Middendorf,/story/opinion/columns/2024/09/18/gov-stitt-clemency-emanuel-littlejohn-execution-oklahoma-guest-opinion/75189723007/
Who is Mark Robinson? NC candidate denies racist remarks report,/story/news/politics/elections/2024/09/19/mark-robinson-nc-governor-candidate/75296369007/
"Over 137,000 Lucid beds sold on Amazon, Walmart recalled",/story/money/retail/2024/09/19/lucid-beds-recalled/75297137007/
Scam alert: Beware of fake QR codes when you pay to park,/story/money/2024/09/19/fake-qr-code-scam-parking/75294446007/
Prayer connection: 12-year-old makes Missouri link through prayer,/story/lifestyle/features/2024/09/19/okc-preteen-bonds-faith-community-bible-church-st-louis/75089215007/
"New online Toby Keith store features foods, sauces, 'Big Daddy' cups",/story/entertainment/2024/09/19/toby-keith-premium-foods-country-singer-developed-sauces-burgers-catfish/75277978007/
"What time is 'Big Brother' on tonight? How to watch, stream Thursday",/story/entertainment/television/2024/09/19/what-time-is-big-brother-on-tonight-how-to-watch-stream-thursday/75290121007/
,/picture-gallery/sports/college/cowboys/2024/09/14/osu-football-vs-tulsa-our-best-photos-from-cowboys-week-3-game/75223611007/
Winners Announced!,https://oklahoman.gannettcontests.com/2024-Oklahoman-Communitys-Choice-Awards-Winners/?itm_campaign=Oklahoma%202024%20BOB&itm_medium=con&itm_source=secondStreet
Vote Every Week!,https://www.oklahoman.com/sports/high-school/?itm_campaign=Athlete%20of%20the%20Week%20Landmark%20OKC&itm_medium=con&itm_source=secondStreet
"OAK, new retail, shopping and lodging called 'a reason to gather'",/story/news/2024/09/19/oak-development-oklahoma-city-opens-hotel-art-installation/75169873007/
"As Oklahoma GOP shifts to the right, is there any room for moderates?",/story/news/politics/government/2024/09/19/oklahoma-elections-2024-politics-republican-party-vs-moderates/74944148007/
"Designers have property in mind for MAPS 4 mental health, addiction facility",/story/news/local/oklahoma-city/2024/09/19/maps-4-okc-mental-health-addiction-facility/75086439007/
'A safe space': Jewish community breaks ground on new Hillel,/story/news/2024/09/19/ou-oklahoma-hillel-building-jewish-collegiate-program/75177471007/
Prayer connection: 12-year-old makes Missouri link through prayer,/story/lifestyle/features/2024/09/19/okc-preteen-bonds-faith-community-bible-church-st-louis/75089215007/
,https://cm.oklahoman.com/site-feedback/?platform=Tangent-Desktop&url=https%3A%2F%2Fwww.oklahoman.com%2F&marketName=oklahoman&cta=Right-Rail
