headline,href
"Stitt, legislative leaders announce tax cut deal: What to know",/story/news/politics/2025/05/14/oklahoma-legislative-session-2025-budget-deal-income-tax-cuts-tort/83629781007/
How Jalen Williams fought through nagging wrist injury in Game 5 win,/story/sports/nba/thunder/2025/05/14/jalen-williams-injury-update-okc-thunder-nba-playoffs-denver-nuggets/83631449007/
"How did SGA, Thunder grade out in Game 5? Here is our report card",/story/sports/nba/thunder/2025/05/14/okc-thunder-vs-denver-nuggets-report-card-game-5-nba-playoffs/83610197007/
"Storylines, players to watch at Class 6A through 2A-II state tournaments",/story/sports/high-school/baseball/2025/05/14/oklahoma-high-school-baseball-storylines-players-to-watch-at-2025-class-6a-2a-ii-state-tournaments/83628444007/
Meet the Oklahoma State softball team's 50 best players…,/story/sports/college/cowboys/2025/05/11/oklahoma-state-softball-50-greatest-players-osu-cowgirls-50th-anniversary-michele-smith/83492890007/
Vote: Landmark Fine Homes girls athlete of the week for…,/story/sports/high-school/athlete-of-the-week/2025/05/12/vote-landmark-fine-homes-girls-high-school-athlete-of-week-may-5-11/83580906007/
,
Vote: Landmark Fine Homes boys athlete of the week for…,/story/sports/high-school/athlete-of-the-week/2025/05/12/vote-landmark-fine-homes-boys-high-school-athlete-of-week-may-5-11/83580793007/
Celebrate Oklahoma high school basketball with 'The Big…,/story/sports/high-school/basketball/2025/02/27/oklahoma-high-school-basketball-book-the-big-house-state-fair-arena/80708941007/
"Gov. Kevin Stitt, Oklahoma lawmakers announce budget…",/picture-gallery/news/2025/05/14/oklahoma-legislative-session-2025-budget-deal-tax-cuts-stitt/83633338007/
"Stitt, legislative leaders announce tax cut deal: What to know",/story/news/politics/2025/05/14/oklahoma-legislative-session-2025-budget-deal-income-tax-cuts-tort/83629781007/
Trump official confirms 9 detainee deaths in ICE custody,/story/news/politics/2025/05/14/ice-detainee-deaths-custody-spending/83619379007/
"ACLU, civil rights groups renew attempt to block anti-immigration law",/story/news/politics/2025/05/14/oklahoma-hb-4156-anti-immigration-law-aclu-lawsuit/83604627007/
How Jalen Williams fought through nagging wrist injury in Game 5 win,/story/sports/nba/thunder/2025/05/14/jalen-williams-injury-update-okc-thunder-nba-playoffs-denver-nuggets/83631449007/
"How did SGA, Thunder grade out in Game 5? Here is our report card",/story/sports/nba/thunder/2025/05/14/okc-thunder-vs-denver-nuggets-report-card-game-5-nba-playoffs/83610197007/
"Storylines, players to watch at Class 6A through 2A-II state tournaments",/story/sports/high-school/baseball/2025/05/14/oklahoma-high-school-baseball-storylines-players-to-watch-at-2025-class-6a-2a-ii-state-tournaments/83628444007/
"Oklahomans ready for REAL ID deadline at Will Rogers airport, data shows",/story/business/travel/2025/05/14/real-id-only-2-of-travelers-didnt-have-real-id-okc-airport-says/83600689007/
"Top 5 real estate trends sweeping Oklahoma, from tech to paint colors",/story/business/real-estate/2025/05/13/top-5-real-estate-trends-sweeping-oklahoma-from-new-tech-to-amenities/83390147007/
$300 million ammunition plant coming to Pryor will employ 350,/story/business/manufacturing/2025/05/12/cbc-global-ammunition-building-plant-pryor-ok-jobs/83586458007/
"This senator blocks an important nomination, and these students lose Erika Wright",/story/opinion/columns/guest/2025/05/14/oklahoma-senate-education-walters-tinney-standridge/83599777007/
Here's how Oklahoma City took a bold step for mental health Jessica Hawkins,/story/opinion/columns/guest/2025/05/14/oklahoma-city-mobile-mental-health-unit-crisis-response/83596671007/
Gov. Stitt vetoed mammogram bill leaving more women's lives at risk Marek Cornett,/story/opinion/columns/guest/2025/05/14/oklahoma-womens-health-mammogram-bill-breast-cancer/83602126007/
Answers demanded after 50 birds die on street in California suburb,/story/news/nation/2025/05/14/50-birds-die-california-suburb/83610805007/
"Chinese-made faucets sold on Amazon can leach lead, CPSC warns",/story/money/2025/05/14/amazon-chinese-faucets-lead-risk/83632997007/
What is the Lopez v. Apple lawsuit? Who can get part of $95M payout,/story/tech/2025/05/14/lopez-v-apple-lawsuit-settlement-claims/83621869007/
Get your Dallas Cowboys 2025 NFL tickets now,/story/shopping/2025/05/14/how-to-buy-dallas-cowboys-nfl-tickets-cowboys-2025-schedule/83541357007/
Snag your Detroit Lions 2025 tickets now,/story/shopping/2025/05/14/how-to-buy-2025-detroit-lions-nfl-tickets-full-schedule/83496030007/
Amazon's Memorial Day sale has more than 50% off summer essentials,/story/shopping/2025/05/14/amazon-memorial-day-2025-sale/83630078007/
These Oklahoma movies will be celebrated at OKC's deadCenter Film Festival,/story/entertainment/2025/05/14/deadcenter-film-festival-2025-lineup-oklahoma-filmmakers/83113019007/
Sterlin Harjo's new 'Tulsa noir' series with Ethan Hawke gets a new name,/story/entertainment/2025/05/14/the-lowdown-disney-plus-premiere-tulsa-oklahoma-ethan-hawke/83613575007/
'Serendipity': A sober OKC chef is fundraising for recovery,/story/lifestyle/food/2025/05/14/the-crown-okc-fundraiser-the-recovery-center/83522422007/
,/picture-gallery/sports/high-school/golf/2025/05/14/oklahoma-high-school-boys-golf-ossaa-class-6a-state-tournament-championships-top-photos/83622609007/
Vote Now!,https://oklahoman.gannettcontests.com/2025-Oklahoman-Communitys-Choice-Awards/?itm_campaign=Oklahoma%20Bob&itm_medium=con&itm_source=secondStreet
WIN 4 TICKETS!,https://oklahoman.gannettcontests.com/Lyric-Theatre-Joseph-and-the-Amazing-Technicolor-Dreamcoat/?itm_campaign=Joseph%20and%20the%20Amazing%20Technicolor%20Dreamcoat%20-%20Lyric%20Theatre&itm_medium=con&itm_source=secondStreet
Vote Every Week!,https://www.oklahoman.com/sports/high-school/?itm_campaign=Athlete%20of%20the%20Week%20Landmark%20OKC&itm_medium=con&itm_source=secondStreet
Trump official confirms 9 detainee deaths in ICE custody,/story/news/politics/2025/05/14/ice-detainee-deaths-custody-spending/83619379007/
Predicting every 2025 NCAA softball tournament regional winner & WCWS,/story/sports/college/softball/2025/05/14/2025-ncaa-softball-tournament-regional-predictions-wcws-champion/83617851007/
"SGA delivers in clutch as Thunder takes down Jokic, Nuggets in Game 5",/story/sports/nba/thunder/2025/05/14/shai-gilgeous-alexander-stats-okc-thunder-score-vs-denver-nuggets-game-5-nba-playoffs/83618182007/
"ACLU, civil rights groups renew attempt to block anti-immigration law",/story/news/politics/2025/05/14/oklahoma-hb-4156-anti-immigration-law-aclu-lawsuit/83604627007/
How 'Big Game Lu' Dort powered Thunder comeback past Nuggets,/story/sports/nba/thunder/2025/05/14/nba-playoffs-2025-luguentz-dort-stats-oklahoma-city-thunder-denver-nuggets-game-5-result/83610163007/
,https://cm.oklahoman.com/site-feedback/?platform=Tangent-Desktop&url=https%3A%2F%2Fwww.oklahoman.com%2F&marketName=oklahoman&cta=Right-Rail
