headline,href
OU softball wins series vs Kentucky thanks to Lexi McDaniel's 5 RBIs,/story/sports/college/sooners/2026/04/03/ou-softball-score-vs-kentucky-lexi-mcdaniel-sooners-run-rule-win/89457758007/
Severe thunderstorm warning issued across Oklahoma City area,/story/weather/2026/04/03/severe-thunderstorm-warning-issued-across-oklahoma-see-live-radar-alerts/89458257007/
Surprise competitor enters race to unseat Oklahoma treasurer,/story/news/politics/2026/04/03/cindy-byrd-treasurer-todd-russ-campaign/89453149007/
See photos of Via Crucis (Way of the Cross) reenactment on Good Friday,/picture-gallery/news/2026/04/03/good-friday-stanley-rother-shrine-okc-way-of-the-cross-reenactment/89455309007/
Thunder stomped Lakers by 43 points: Here's the beatdown…,/story/sports/nba/thunder/2026/04/03/thunder-lakers-stats-score-lebron-james-worst-losses-luka-doncic-injury/89446920007/
OU softball run-rules Kentucky again as Kendall Wells…,/story/sports/college/sooners/2026/04/03/oklahoma-kentucky-score-live-updates-college-softball-today-ou-sooners/89451549007/
"Friday storms in Oklahoma bring hail, wind and flooding",/story/weather/2026/04/03/oklahoma-severe-weather-live-radar-damaging-hail-flash-flooding/89449418007/
Mike Boynton finds new joy with Michigan basketball on…,/story/sports/college/cowboys/2026/04/03/mike-boynton-michigan-basketball-final-four-oklahoma-state-cowboys/89439301007/
Lon Kruger coached in two Final Fours. Now it's his…,/story/sports/college/sooners/2026/04/03/illinois-basketball-kevin-kruger-assistant-coach-father-lon-kruger/89439527007/
,
News,/news/
Severe thunderstorm warning issued across Oklahoma City area,/story/weather/2026/04/03/severe-thunderstorm-warning-issued-across-oklahoma-see-live-radar-alerts/89458257007/
Surprise competitor enters race to unseat Oklahoma treasurer,/story/news/politics/2026/04/03/cindy-byrd-treasurer-todd-russ-campaign/89453149007/
See photos of Via Crucis (Way of the Cross) reenactment on Good Friday,/picture-gallery/news/2026/04/03/good-friday-stanley-rother-shrine-okc-way-of-the-cross-reenactment/89455309007/
Sports,/sports/
OU softball wins series vs Kentucky thanks to Lexi McDaniel's 5 RBIs,/story/sports/college/sooners/2026/04/03/ou-softball-score-vs-kentucky-lexi-mcdaniel-sooners-run-rule-win/89457758007/
How basketball power couple Cason Wallace and Kiki Rice met,/story/sports/nba/thunder/2026/04/03/cason-wallace-kiki-rice-basketball-power-couple-okc-thunder-ucla-womens-basketball/89451032007/
Thunder stomped Lakers by 43 points: Here's the beatdown by the numbers,/story/sports/nba/thunder/2026/04/03/thunder-lakers-stats-score-lebron-james-worst-losses-luka-doncic-injury/89446920007/
Life,/life/
How OKC's National Cowboy Museum is wrangling high-tech immersive exhibits,/story/entertainment/events/2026/04/01/national-cowboy-museum-okc-oklahoma-city-events-exhibits-history-future/88025677007/
Zach Bryan's Friday night Tulsa concert canceled due to possible storms,/story/entertainment/music/2026/04/03/zach-bryan-concert-canceled-tulsa-ok/89457438007/
"From Chickasha to OKC, Oklahoma spring film festivals are coming soon",/story/entertainment/movies/2026/04/03/oklahoma-things-to-do-2026-spring-film-festivals-to-watch/89329251007/
Business,/business/
See holiday closures for Nasdaq and New York Stock Exchange,/videos/business/2026/04/02/is-stock-market-closed-nasdaq-nyse-new-york-stock-exchange-holiday-schedule/89441155007/
"David Simon, owner of company that owns Penn Square Mall, dies at 64",/story/business/local/2026/04/02/david-simon-ceo-of-simon-property-group-penn-square-mall-owner-dies/89438305007/
Where is the best place to live in Oklahoma? Survey names this suburb,/videos/business/real-estate/2026/04/02/where-is-the-best-place-to-live-in-oklahoma-2026-survey-names-this-suburb/89438334007/
Opinion,/opinion/
How to submit letters and guest columns to The Oklahoman,/story/opinion/letters/2026/03/24/easy-guide-to-submitting-letters-and-guest-columns-to-the-oklahoman/89230405007/
Reflecting Oklahoma's politics: See our cartoons Todd Pendleton,/picture-gallery/opinion/cartoons/2025/06/20/reflecting-oklahomas-politics-see-our-cartoons/84285958007/
Do not raise pharmacy fees by fiat. Oklahomans will pay the price Chad Warmington,/story/opinion/columns/guest/2026/04/03/oklahomans-will-pay-the-price-for-pharmacy-bills-opinion/89449160007/
Trending,https://www.usatoday.com/news/trending/
Mega Millions jackpot $90M: April 3 winning numbers,/story/money/lottery/2026/04/03/mega-millions-jackpot-90-million/89442589007/
Moment man tries to push stranger into train captured on video,/story/news/crime/2026/04/03/man-pushes-train-seattle-charged-attempted-murder/89447655007/
Canadian citizenship law change offers new path for passport,/story/news/world/2026/04/03/canada-citizenship-law-eligibility/89407833007/
Shopping,/shopping/
Why do people love Bandolier hands-free phone cases?,/story/shopping/style/accessories/2026/04/03/bandolier-hands-free-phone-cases/89459985007/
Why Skechers Kids shoes are the affordable option for growing feet,https://go.linkby.com/BUGUULEG
Taylor Swift’s Halara skirt just got a Smiley makeover—shop new styles,/story/shopping/style/apparel/2026/04/03/shop-the-halara-x-smiley-collection/89459273007/
,/picture-gallery/opinion/cartoons/2025/06/20/reflecting-oklahomas-politics-see-our-cartoons/84285958007/
ENTER to WIN!,https://oklahoman.gannettcontests.com/Pella-Oklahoma-2026-Spring-Project-Home-Improved-with-Ty-Pennington/?itm_campaign=Pella%20of%20Oklahoma%20City%20Project%20Home%20Improved%20Spring%202026&itm_medium=con&itm_source=secondStreet
ENTER NOW,https://usatoday.gannettcontests.com/Reagan-Gold-Group-Spring-Gold-Rush/?itm_campaign=Reagan%20Gold%20Group%20Spring%20Gold%20Rush%20Sweepstakes&itm_medium=con&itm_source=secondStreet
Vote Each Week!,https://www.oklahoman.com/sports/high-school/?itm_campaign=Team%20of%20the%20Week%20OKC&itm_medium=con&itm_source=secondStreet
"Second US military jet goes down near Iran, pilot rescued",/story/news/world/2026/04/03/iran-war-donald-trump-gas-prices-live-updates--live/89445702007/
How OKC's National Cowboy Museum is wrangling high-tech immersive exhibits,/story/entertainment/events/2026/04/01/national-cowboy-museum-okc-oklahoma-city-events-exhibits-history-future/88025677007/
Zach Bryan's Friday night Tulsa concert canceled due to possible storms,/story/entertainment/music/2026/04/03/zach-bryan-concert-canceled-tulsa-ok/89457438007/
"From Chickasha to OKC, Oklahoma spring film festivals are coming soon",/story/entertainment/movies/2026/04/03/oklahoma-things-to-do-2026-spring-film-festivals-to-watch/89329251007/
How basketball power couple Cason Wallace and Kiki Rice met,/story/sports/nba/thunder/2026/04/03/cason-wallace-kiki-rice-basketball-power-couple-okc-thunder-ucla-womens-basketball/89451032007/
,https://cm.oklahoman.com/site-feedback/?platform=Tangent-Desktop&url=https%3A%2F%2Fwww.oklahoman.com%2F&marketName=oklahoman&cta=Right-Rail
