headline,href
"Oklahoma County jail inmates miss court appearances amid sheriff, trust dispute",/story/news/local/2026/05/11/oklahoma-county-courts-shut-down-as-jail-trust-sheriff-argue-over-transport-of-inmates/90001174007/
Mark Daigneault found early mentor in ex-Thunder coach now with Lakers,/story/sports/nba/thunder/2026/05/11/okc-thunder-coach-mark-daigneault-mentor-scott-brooks-los-angeles-lakers/90034494007/
"Oklahoma sues Temu, accusing app of illegal data collection",/story/news/courts/2026/05/11/temu-lawsuit-oklahoma-gentner-drummond-illegal-data-collection-deceptive-practices/90028838007/
NCAA softball bracket regional predictions: Picks for all 16 winners,/story/sports/college/softball/2026/05/11/ncaa-softball-tournament-bracket-2026-wcws-regional-predictions-picks/90031997007/
Oklahoma City-based Kimray makes move to employee…,/story/business/2026/05/11/kimray-okc-switches-employee-stock-ownership-plan-esop/90031458007/
OSSAA releases baseball state tournament brackets for…,/story/sports/high-school/baseball/2026/05/11/oklahoma-high-school-baseball-2026-ossaa-class-6a-5a-4a-3a-2ai-2aii-state-tournament-brackets/90026215007/
TJ Shanahan's tennis journey inspired by his father at…,/story/sports/high-school/tennis/2026/05/11/oklahoma-high-school-tennis-tj-shanahan-father-mcguinness/89908221007/
,
"OSSAA boys golf storylines, golfers to watch at 2026…",/story/sports/high-school/golf/2026/05/11/oklahoma-high-school-boys-golf-storylines-golfers-watch-2026-ossaa-state-tournaments/90021990007/
SGA is scoring less but Thunder is still too much for…,/story/sports/nba/thunder/2026/05/11/okc-thunder-vs-los-angeles-lakers-stats-shai-gilgeous-alexander-scoring/90019053007/
News,/news/
"Oklahoma County jail inmates miss court appearances amid sheriff, trust dispute",/story/news/local/2026/05/11/oklahoma-county-courts-shut-down-as-jail-trust-sheriff-argue-over-transport-of-inmates/90001174007/
"Oklahoma sues Temu, accusing app of illegal data collection",/story/news/courts/2026/05/11/temu-lawsuit-oklahoma-gentner-drummond-illegal-data-collection-deceptive-practices/90028838007/
"Polston got expedited transfers, Chick-fil-A while in custody, report says",/story/news/courts/2026/05/08/sara-polston-norman-ok-kevin-stitt-cleveland-county-jail-report/89996698007/
Sports,/sports/
Mark Daigneault found early mentor in ex-Thunder coach now with Lakers,/story/sports/nba/thunder/2026/05/11/okc-thunder-coach-mark-daigneault-mentor-scott-brooks-los-angeles-lakers/90034494007/
NCAA softball bracket regional predictions: Picks for all 16 winners,/story/sports/college/softball/2026/05/11/ncaa-softball-tournament-bracket-2026-wcws-regional-predictions-picks/90031997007/
Who will start for OSU football? A post-spring depth chart projection,/story/sports/college/cowboys/2026/05/11/oklahoma-state-football-2026-season-depth-chart-prediction-osu-cowboys/89968611007/
Life,/life/
Corny musical 'Shucked' has an OU grad popping back up in Oklahoma,/story/entertainment/arts/2026/05/11/ou-grad-ryan-fitzgerald-is-cropping-back-up-in-oklahoma-with-shucked/89816277007/
"See a corny sneak peek of the acclaimed musical 'Shucked,' coming to OKC",/videos/entertainment/theater/2026/05/11/the-corny-musical-comedy-shucked-is-coming-to-okc-heres-a-sneak-peek/90025832007/
Food Network's BBQ Brawl will feature OKC resident Tung Nguyen,/story/entertainment/dining/2026/05/10/food-networks-bbq-brawl-will-feature-okc-transplant-tung-nguyen/89996946007/
Business,/business/
Oklahoma City-based Kimray makes move to employee ownership,/story/business/2026/05/11/kimray-okc-switches-employee-stock-ownership-plan-esop/90031458007/
Black Seminole art finds new Oklahoma home,/videos/business/economy/2026/05/07/black-seminole-art-finds-new-oklahoma-home-in-okc/89967351007/
Former Expand Energy exec named CEO of competitor Gulfport Energy,/story/business/energy-resource/2026/05/06/domenic-dellosso-named-ceo-gulfport-energy-former-expand-energy-ceo/89962346007/
Opinion,/opinion/
Oklahoma lawmakers should demand their colleagues show up for work Janelle Stecklein,/story/opinion/columns/guest/2026/05/11/oklahoma-lawmakers-should-hold-their-own-accountable/90029763007/
Tell your legislators you want them to override veto of OETA funding,/story/opinion/letters/2026/05/11/oeta-at-risk-oklahomans-tell-legislators-to-override-veto-letter/90024692007/
Here's what you need to know about Democratic hopefuls for governor,/story/opinion/columns/2026/05/10/oklahoma-elections-2026-governor-race-meet-democratic-primary-candidates/89950771007/
Trending,https://www.usatoday.com/news/trending/
Public health alert issued for this headcheese over listeria risk,/story/news/health/2026/05/11/headcheese-listeria-contamination-usda-public-health-alert/90034660007/
Powerball jackpot hits $57 million,/story/money/lottery/2026/05/11/powerball-jackpot-57-million-monday-may-11/90036404007/
Trump administration sued over Lincoln Memorial Reflecting Pool,/story/news/politics/2026/05/11/trump-lincoln-memorial-reflecting-pool-lawsuit/90032680007/
Your Daily PLAY,https://play.usatoday.com/
Need a news break? USA TODAY's PLAY has what you need.,/story/entertainment/2025/11/25/puzzles-games-horoscopes-usa-today-play/87454927007/
Can You Crack Every Clue in Today’s Puzzle?,https://play.usatoday.com/crossword
"Love movies, history, music? Put your brain to the test with Quizzes",https://play.usatoday.com/quizzes
Shopping,/shopping/
What is Everyday Dose? Meet the coffee made with mushrooms + nootropics,https://www.usatoday.com/story/shopping/deals/retailers/target/2026/05/02/everyday-dose-protein-coffee-at-target/89905048007/
"Bills vs. Lions to play Week 2 Thursday Night Football, get tickets",/story/shopping/sports/tickets/2026/05/11/how-to-buy-buffalo-bills-vs-detroit-lions-2026-nfl-tickets-thursday-night-football/90037275007/
Flight attendants reveal the top travel items they never fly without,https://10best.usatoday.com/travel/flight-attendant-approved-travel-items/
,/picture-gallery/news/local/2026/05/11/crossroads-mall-in-oklahoma-city-now-and-through-the-years/89979321007/
ENTER NOW,https://www.oattravel.com/marketing/giveaway?itm_campaign=Overseas%20Adventure%20Travel&itm_medium=con&itm_source=secondStreet
ENTER — A CRUISE FOR 2!,https://usatoday.gannettcontests.com/Victory-Cruise-Lines-Discover-the-Great-Lakes/?itm_campaign=Victory%20Cruises%20Getaway&itm_medium=con&itm_source=secondStreet
Hurry and Enter!,https://newsok.gannettcontests.com/2026-Spring-Project-Home-Improved-with-Ty-Pennington/?itm_campaign=Non%20sponsored%202026%20Ty%20Pennington%20PHI&itm_medium=con&itm_source=secondStreet
Who will start for OSU football? A post-spring depth chart projection,/story/sports/college/cowboys/2026/05/11/oklahoma-state-football-2026-season-depth-chart-prediction-osu-cowboys/89968611007/
Who will start for OU football? A post-spring depth chart projection,/story/sports/college/sooners/2026/05/11/ou-football-2026-season-depth-chart-prediction-oklahoma-sooners/89965618007/
"Polston got expedited transfers, Chick-fil-A while in custody, report says",/story/news/courts/2026/05/08/sara-polston-norman-ok-kevin-stitt-cleveland-county-jail-report/89996698007/
Leaders mute after jurors find Stitt helped free friend from prison,/story/news/politics/2026/05/08/sara-polston-oklahoma-grand-jury-report-republicans-no-comment-kevin-stitt/89998577007/
"Thunder vs Lakers live updates: SGA, OKC visit LeBron James, Los Angeles",/story/sports/nba/thunder/2026/05/11/thunder-lakers-score-live-updates-nba-playoffs-game-4-highlights-stats-injury-report/90037121007/
,https://cm.oklahoman.com/site-feedback/?platform=Tangent-Desktop&url=https%3A%2F%2Fwww.oklahoman.com%2F&marketName=oklahoman&cta=Right-Rail
