headline,href
"Flu continues to spike in OK, with Oklahoma County seeing high rates",/story/news/2025/02/01/how-bad-is-the-flu-in-oklahoma-cases-hospitalizations-keep-rising/78083703007/
Use your noodle: What we learned at our sneak peek of Bar Sen,/story/lifestyle/food/2025/02/01/what-to-expect-at-plaza-districts-bar-sen-as-it-prepares-to-open/78094769007/
Minister urges Oklahomans to come together against hate,/story/news/2025/02/01/lutheran-minister-nadia-bolz-weber-preaches-red-state-revival-in-okc/78023350007/
OU women's gymnastics rolls past Arkansas to remain undefeated,/story/sports/college/sooners/2025/01/31/oklahoma-arkansas-womens-gymnastics-score-live-updates-highlights/78104799007/
Can Oklahoma State basketball halt turnover issues…,/story/sports/college/cowboys/2025/01/31/oklahoma-state-mens-basketball-turnover-issues-utah-osu-cowboys/78088642007/
"How did SGA, Thunder grade out in first half of 2024-25…",/story/sports/nba/thunder/2025/02/01/okc-thunder-midseason-report-card-2024-25-nba-season-shai-gilgeous-alexander/78105943007/
Oklahoma producer Kitt Wakeley nabs Grammy nominations…,/story/entertainment/2025/02/01/oklahoma-producer-kitt-wakeley-helped-make-3-grammy-nominated-albums/77982189007/
Vote: Landmark Fine Homes girls HS athlete of the week…,/story/sports/high-school/2025/01/27/vote-landmark-fine-homes-girls-high-school-athlete-of-the-week-jan-20-26/77976864007/
Vote for Landmark Fine Homes boys athlete of the week…,/story/sports/high-school/2025/01/27/vote-landmark-fine-homes-boys-high-school-athlete-of-the-week-jan-20-26/77976402007/
,
"Flu continues to spike in OK, with Oklahoma County seeing high rates",/story/news/2025/02/01/how-bad-is-the-flu-in-oklahoma-cases-hospitalizations-keep-rising/78083703007/
Minister urges Oklahomans to come together against hate,/story/news/2025/02/01/lutheran-minister-nadia-bolz-weber-preaches-red-state-revival-in-okc/78023350007/
Plane crash victim ties to Oklahoma: 'We will forever feel this loss',/story/news/2025/01/31/washington-dc-plane-crash-victims-oklahoma-ties/78086652007/
OU women's gymnastics rolls past Arkansas to remain undefeated,/story/sports/college/sooners/2025/01/31/oklahoma-arkansas-womens-gymnastics-score-live-updates-highlights/78104799007/
Bridge Creek 'heartbroken' after death of softball star Nataly Metheny,/story/sports/high-school/softball/2025/02/01/nataly-metheny-bridge-creek-oklahoma-high-school-softball-player-dies/78107046007/
OU basketball aiming to fix rebounding issues ahead of Vanderbilt game,/story/sports/college/sooners/2025/01/31/ou-basketball-rebounding-issues-vanderbilt-game/78095557007/
Oklahoma landowners push back on transmission line projects,/story/business/energy-resource/2025/01/31/oklahoma-energy-landowners-push-back-on-development/78059271007/
"Tax season 2025: Where's my refund, what to know about turnaround",/story/business/finance/2025/01/28/wheres-my-refund-heres-what-to-know-about-filing-taxes-tracking/77996487007/
"Walgreens moving forward with plans to close 1,200 stores nationwide",/story/business/2025/01/28/walgreens-to-close-500-stores-before-august-is-oklahoma-affected/77782155007/
"Readers comment on abortion, statehood for Canada and Ryan Walters",/story/opinion/letters/2025/02/01/abortion-rights-the-politics-of-canada-and-energy-sales-ryan-walters-letters/78004755007/
Oklahoma Legislature finally tackling 'forever chemicals' problem Mike Altshuler,/story/opinion/columns/2025/01/31/chemical-pollution-forever-chemicals-pfas-oklahomans-health-legislation-regulate-opinion/78085901007/
"Three predictions about the wireless industry for 2025 Laurent ""LT"" Therivel",/story/opinion/columns/guest/2025/01/31/rural-wireless-development-in-2025-more-global-competition-fcc-spectrum-authority-opinion/77994941007/
When is McDonald's bringing back the Shamrock Shake?,/story/money/food/2025/02/01/mcdonalds-shamrock-shake-mcflurry-oreo-dessert/78029884007/
Value meals still on order in 2025: Where to get deals,/story/money/food/2025/02/01/value-meals-deals-mcdonalds-taco-bell-burger-king-wendys/77946307007/
What's the worst month of the year? Americans say it just ended,/story/news/nation/2025/02/01/january-least-favorite-month-depression-winter/77909852007/
New Patagonia deals just dropped! Save up to 50% this weekend,/story/shopping/2025/01/31/shop-new-patagonia-winter-deals/78097038007/
Your ultimate Super Bowl party shopping list,/story/shopping/2025/01/31/super-bowl-party-essentials/78102040007/
Want a $25 Sam's Club membership? Deal ends tonight,/story/shopping/2025/01/01/sams-club-january-membership-deal/77263642007/
Oklahoma producer Kitt Wakeley nabs Grammy nominations for 3 albums,/story/entertainment/2025/02/01/oklahoma-producer-kitt-wakeley-helped-make-3-grammy-nominated-albums/77982189007/
"Making it personal: Martin Sheen, cast of 'The One' discuss filming in Oklahoma",/story/entertainment/2025/01/31/martin-sheen-films-oklahoma-the-one-film/77908182007/
Martin Sheen films Oklahoma-made holiday movie 'The One',/picture-gallery/entertainment/2025/01/31/martin-sheen-the-one-filming-okc-photos/77933063007/
,/picture-gallery/news/nation-world/2025/01/30/dc-plane-crash-memorial-wichita-kansas-photos/78043152007/
ENTER NOW! ENTER OFTEN!,https://oklahoman.gannettcontests.com/Lyric-Theatre-of-Oklahoma---A-Slice-of-Musical-Heaven/?itm_campaign=Lyric%20Theatre%20of%20Oklahoma%20-%20Waitress%20-%20A%20Slice%20of%20Musical%20Heaven%20Ticket%20Giveaway&itm_medium=con&itm_source=secondStreet
Winners Announced!,https://oklahoman.gannettcontests.com/2024-Oklahoman-Communitys-Choice-Awards-Winners/?itm_campaign=Oklahoma%202024%20BOB&itm_medium=con&itm_source=secondStreet
Vote Every Week!,https://www.oklahoman.com/sports/high-school/?itm_campaign=Athlete%20of%20the%20Week%20Landmark%20OKC&itm_medium=con&itm_source=secondStreet
Plane crash victim ties to Oklahoma: 'We will forever feel this loss',/story/news/2025/01/31/washington-dc-plane-crash-victims-oklahoma-ties/78086652007/
"New legislative leaders, Gov. Stitt facing change in 2025 session",/story/news/politics/government/2025/01/30/oklahoma-legislature-2025-session-new-leaders-challenges-lonnie-paxton-kyle-hilbert/77585323007/
OU Polytechnic Institute to offer four-year degrees in Norman,/story/news/education/2025/02/01/ou-polytechnic-institute-to-offer-four-year-degrees-in-norman/78023005007/
Bridge Creek 'heartbroken' after death of softball star Nataly Metheny,/story/sports/high-school/softball/2025/02/01/nataly-metheny-bridge-creek-oklahoma-high-school-softball-player-dies/78107046007/
OU basketball aiming to fix rebounding issues ahead of Vanderbilt game,/story/sports/college/sooners/2025/01/31/ou-basketball-rebounding-issues-vanderbilt-game/78095557007/
,https://cm.oklahoman.com/site-feedback/?platform=Tangent-Desktop&url=https%3A%2F%2Fwww.oklahoman.com%2F&marketName=oklahoman&cta=Right-Rail
