headline,href
Who will be on the Southern Baptist sex abusers database? See the criteria,/story/news/2023/05/30/southern-baptist-convention-sex-abuse-database-criteria-changes/70261046007/
Oklahoma City Public Schools hopes summer program grows participation,/story/sports/high-school/2023/05/30/summer-program-looks-to-improve-okcps-sports-participation-academics-graduation-rates/70260474007/
Oklahoma teachers need an ally. Ryan Walters is not up to the job.Clytie Bunyan,/story/opinion/2023/05/30/oklahoma-legislators-should-remove-ryan-walters-from-office/70259467007/
Owners of Plaza Inn dispute details of OKC lawsuit,/story/news/crime/2023/05/30/plaza-inn-motel-owner-responds-to-public-nuisance-southeast-okc-lawsuit-disputes-details/70251841007/
"What's on tap for Memorial Day? Modelo, tequila and…",/story/money/food/2023/05/26/most-popular-american-alcoholic-drinks/11522841002/
"4 dead, teen charged with murder after bodies found at…",/story/news/nation/2023/05/24/cesar-olalde-nash-texas-family-killed/70251529007/
How Jordy Bahl showed why she's the ace of OU softball…,/story/sports/college/sooners/2023/05/30/ou-softball-jordy-bahl-sooners-pitching-staff-wcws-2023-womens-college-world-series/70266697007/
Oklahoma Senate confirms first woman to head Human…,/story/news/politics/government/2023/05/30/oklahoma-senate-confirms-first-woman-to-lead-human-services-department/70261285007/
,
Gajewski's tears remind us how difficult it can be to…,/story/sports/college/cowboys/2023/05/30/oklahoma-state-softball-kenny-gajewski-womens-college-world-series-2023-wcws-osu-cowgirls/70263045007/
Who will be on the Southern Baptist sex abusers database? See the criteria,/story/news/2023/05/30/southern-baptist-convention-sex-abuse-database-criteria-changes/70261046007/
Owners of Plaza Inn dispute details of OKC lawsuit,/story/news/crime/2023/05/30/plaza-inn-motel-owner-responds-to-public-nuisance-southeast-okc-lawsuit-disputes-details/70251841007/
Winners and losers from the 2023 Oklahoma legislative session,/story/news/politics/government/2023/05/26/oklahoma-legislature-2023-session-ryan-walters-tax-credits-winners-losers/70258714007/
Oklahoma City Public Schools hopes summer program grows participation,/story/sports/high-school/2023/05/30/summer-program-looks-to-improve-okcps-sports-participation-academics-graduation-rates/70260474007/
Meet The Oklahoman's 2023 All-City high school girls golf roster,/story/sports/high-school/golf/2023/05/30/oklahoma-high-school-boys-golf-the-oklahomans-2023-all-city-roster/70250408007/
How Jordy Bahl showed why she's the ace of OU softball pitching staff,/story/sports/college/sooners/2023/05/30/ou-softball-jordy-bahl-sooners-pitching-staff-wcws-2023-womens-college-world-series/70266697007/
Here's where Sovereign Bank's newest branch will open in OKC,/story/business/local/2023/05/29/sovereign-bank-okc-new-branch-open-2025-northwest-expressway/70158881007/
Meet the local Latino entrepreneurs succeeding through StitchCrew,/story/business/local/2023/05/29/stitchcrew-okc-business-accelerator-latino-entrepreneurs-vida-bars-arenas-sports-center/70238306007/
"With design, you can go home again",/story/business/real-estate/2023/05/28/marni-jameson-we-should-reflect-homes-we-knew-growing-up/70249045007/
Oklahoma teachers need an ally. Ryan Walters is not up to the job. Clytie Bunyan,/story/opinion/2023/05/30/oklahoma-legislators-should-remove-ryan-walters-from-office/70259467007/
"Guest: During WCWS, we can help make OKC a hit with visitors Russ Florence",/story/opinion/2023/05/28/oklahoma-city-hosts-the-womens-college-world-series-make-sure-visitors-leave-as-ambassadors/70244806007/
Guest: Foster care can help families be whole again Katherine Craig,/story/opinion/2023/05/28/oklahoma-foster-care-homes-continues-to-rise/70250101007/
In town for softball? We've got the bases covered with dining options,/story/lifestyle/food/2023/05/28/wcws-2023-oklahoma-city-restaurant-guide-fans-visitors/70213083007/
"That bite can do more than bug you, it can turn into a serious issue",/story/lifestyle/health-fitness/2023/05/30/understanding-a-staph-infection-after-a-bug-bite/70261877007/
Get a grasp on how to properly hold a wine glass,/story/lifestyle/2023/05/29/practical-reasons-are-behind-advice-on-how-to-hold-a-wine-glass/70254286007/
,/picture-gallery/sports/college/sooners/2023/05/27/photos-oklahoma-vs-clemson-game-2-ncaa-softball-super-regionals/11979793002/
Enter Now!,https://health.truecoverage.site/?itm_campaign=TrueCoverage&itm_medium=con&itm_source=secondStreet
Winners Announced!,https://cdn.gatehousemedia.com/gh-sites/global/ads/contests/winners/2023SpringHomeMakeover_WINNERAD__494x10_newlogo.pdf?itm_campaign=2023%20Spring%20Home%20Winners&itm_medium=con&itm_source=secondStreet
In town for softball? We've got the bases covered with dining options,/story/lifestyle/food/2023/05/28/wcws-2023-oklahoma-city-restaurant-guide-fans-visitors/70213083007/
Winners and losers from the 2023 Oklahoma legislative session,/story/news/politics/government/2023/05/26/oklahoma-legislature-2023-session-ryan-walters-tax-credits-winners-losers/70258714007/
Meet The Oklahoman's 2023 All-City high school girls golf roster,/story/sports/high-school/golf/2023/05/30/oklahoma-high-school-boys-golf-the-oklahomans-2023-all-city-roster/70250408007/
"WCWS: Game times, scores, TV schedule for NCAA softball world series",/story/sports/college/softball/2023/05/28/ncaa-softball-2023-womens-college-world-series-schedule-results-wcws-times-tv-streaming/70265436007/
How has WCWS become a spectacle? 'It was little steps along the way',/story/sports/college/softball/2023/05/28/wcws-2023-espn-michele-smith-okc-growth-gradual-profound-softball/70247569007/
,https://cm.oklahoman.com/site-feedback/?platform=Tangent-Desktop&url=https%3A%2F%2Fwww.oklahoman.com%2F&marketName=oklahoman&cta=Right-Rail
