headline,href
"Former Northpark Cinema being converted into pickleball, restaurant, bar",/story/business/2025/03/03/northpark-mall-okc-pickleball-courts-plans/80368887007/
Why AG Gentner Drummond declined to provide opinion for Ryan Walters,/story/news/politics/state/2025/03/03/ryan-walters-oklahoma-trump-executive-order-immigration-gentner-drummond/81173250007/
A look at each Class A girls basketball team in 2025 state tournament,/story/sports/high-school/basketball/2025/03/03/oklahoma-high-school-basketball-2025-ossaa-state-tournament-class-a-girls-roster-schedule/81162222007/
OKC fire dept. investigating blaze at popular southside OKC bakery,/story/news/2025/03/03/la-oaxaquea-bakery-okc-fire-department-investigating/81158485007/
"Best (and worst) Oscar moments, from 'Anora' to 'Defying…",/story/entertainment/movies/2025/03/03/best-worst-oscars-2025-highlights/80523729007/
Oklahoma HS basketball candidates for Super 5 boys…,/story/sports/high-school/basketball/2025/02/28/oklahoma-hs-basketball-candidates-for-2025-super-5-boys-player-of-year/78359387007/
,
Celebrate Oklahoma high school basketball with 'The Big…,/story/sports/high-school/basketball/2025/02/27/oklahoma-high-school-basketball-book-the-big-house-state-fair-arena/80708941007/
Oklahoma HS basketball candidates for Super 5 girls…,/story/sports/high-school/basketball/2025/02/26/oklahoma-high-school-basketball-candidates-2025-super-5-girls-player-of-year/80313712007/
"OU softball schedule: Dates, times, TV channels for 2025…",/story/sports/college/sooners/2025/02/06/ou-softball-schedule-dates-times-tv-streaming-2025-oklahoma-sooners/78024860007/
Why AG Gentner Drummond declined to provide opinion for Ryan Walters,/story/news/politics/state/2025/03/03/ryan-walters-oklahoma-trump-executive-order-immigration-gentner-drummond/81173250007/
OKC fire dept. investigating blaze at popular southside OKC bakery,/story/news/2025/03/03/la-oaxaquea-bakery-okc-fire-department-investigating/81158485007/
Oklahoma judge tosses lawsuit over Gov. Stitt's return-to-office orders,/story/news/politics/state/2025/03/03/oklahoma-return-to-office-kevin-stitt-governor/81147483007/
A look at each Class A girls basketball team in 2025 state tournament,/story/sports/high-school/basketball/2025/03/03/oklahoma-high-school-basketball-2025-ossaa-state-tournament-class-a-girls-roster-schedule/81162222007/
Deer Creek girls of 1966 were first to win basketball title at Big House,/story/sports/high-school/2025/03/03/oklahoma-high-school-girls-basketball-deer-creek-1966-state-championship-ossaa/80019029007/
A look at each Class A boys basketball team in 2025 state tournament,/story/sports/high-school/basketball/2025/03/03/oklahoma-high-school-basketball-2025-ossaa-class-a-boys-state-tournament-roster-schedule/81094372007/
"Former Northpark Cinema being converted into pickleball, restaurant, bar",/story/business/2025/03/03/northpark-mall-okc-pickleball-courts-plans/80368887007/
"This Oklahoma suburb is among the best to move to in 2025, study shows",/story/business/real-estate/2025/03/03/okc-suburb-named-one-of-the-best-suburbs-to-move-to-in-2025-see-rankings-edmond-oklahoma/80723455007/
Home values in OKC suburbs are on the rise: Here's how 5 compare,/story/business/real-estate/2025/03/03/home-values-in-okc-suburbs-on-the-rise-heres-how-5-communities-stack-upoklahoma-city-suburbs-ranked/77456573007/
We’re driving good teachers away. We must do better. Brian Busey,/story/opinion/columns/2025/03/03/oklahoma-education-schools-employment-jobs-teachers/80729990007/
She couldn’t wait to get out of Tullahassee. Now she's back the mayor Kimberly Burk,/story/opinion/columns/2024/12/15/tullahassee-ok-history-growing-historic-black-towns/75291590007/
"Firing people, abandoning Ukraine ― Is this what we asked from Trump? Nancy E. Snow",/story/opinion/columns/guest/2025/03/03/farmers-suffer-donald-trump-elon-musk-firing-workers-vance-lawsuits/80251879007/
Inmate sent to Oklahoma for federal execution in wake of Trump order,/story/news/nation/2025/03/03/john-fitzgerald-hanson-oklahoma-federal-execution-trump-order/81186333007/
"State police investigate another NY inmate death, 11 officers on leave",/story/news/nation/2025/03/03/new-york-inmate-killed-officials/81155246007/
Son of Buc-ee's co-founder released on bond after child pornography charges,/story/news/nation/2025/03/03/mitchell-wasek-child-pornography-charges-texas/81145951007/
Cariuma x Peanuts sneakers are on sale for $26 just in time for spring,/story/shopping/2025/03/02/cariuma-shoe-deals-march-2025/81079539007/
Get 30% off this LED beanie for hunters and hikers,/story/shopping/2025/03/01/panther-vision-outdoor-led-beanies-sale-deals/80964511007/
"Save up to $1,300 on Frame TVs, S25 Galaxy devices, Odyssey monitors",/story/shopping/2025/03/03/discover-samsung-spring-sale-deals/81143606007/
"Best (and worst) Oscar moments, from 'Anora' to 'Defying Gravity'",/story/entertainment/movies/2025/03/03/best-worst-oscars-2025-highlights/80523729007/
Here are 5 events to celebrate Mardi Gras in Oklahoma City,/story/entertainment/events/2025/03/03/mardi-gras-2025-in-okc-heres-5-fat-tuesday-events-with-food-music/81175220007/
Carrie Underwood is returning to 'American Idol' as judge: How to watch,/story/entertainment/television/2025/03/03/carrie-underwood-returns-to-american-idol-season-23how-to-watch-stream-oklahoma/81159062007/
,/picture-gallery/sports/high-school/wrestling/2025/03/01/oklahoma-high-school-state-wrestling-champions-photos-ossaa/80029119007/
ENTER TODAY,https://www.kalahariresorts.com/win?itm_campaign=Get%20Kalaharid%20Away&itm_medium=con&itm_source=secondStreet#//?
Vote Now!,https://newsok.gannettcontests.com/2025-Halftime-Show/?itm_campaign=Halftime%20Show%20Arizona&itm_medium=con&itm_source=secondStreet
Enter Now!,https://usatoday.gannettcontests.com/scrub-dub-Sweepstakes/?itm_campaign=scrub-dub%20Sweepstakes&itm_medium=con&itm_source=secondStreet
Deer Creek girls of 1966 were first to win basketball title at Big House,/story/sports/high-school/2025/03/03/oklahoma-high-school-girls-basketball-deer-creek-1966-state-championship-ossaa/80019029007/
We’re driving good teachers away. We must do better.Brian Busey,/story/opinion/columns/2025/03/03/oklahoma-education-schools-employment-jobs-teachers/80729990007/
A look at each Class A boys basketball team in 2025 state tournament,/story/sports/high-school/basketball/2025/03/03/oklahoma-high-school-basketball-2025-ossaa-class-a-boys-state-tournament-roster-schedule/81094372007/
Big 12 softball power rankings: Arizona takes top spot with big wins,/story/sports/college/big-12/2025/03/03/big-12-softball-power-rankings-arizona-oklahoma-state-texas-tech-nijaree-canady/81142609007/
"SEC softball power rankings: OU, Texas rolling into league play",/story/sports/college/sec/2025/03/03/sec-softball-power-rankings-oklahoma-sooners-texas-longhorns-rolling-into-league-play/81156353007/
,https://cm.oklahoman.com/site-feedback/?platform=Tangent-Desktop&url=https%3A%2F%2Fwww.oklahoman.com%2F&marketName=oklahoman&cta=Right-Rail
