headline,href
Bagworms are back. Here's how to manage infestations,/story/news/2023/07/10/bagworm-treatment-options-oklahoma-how-to-kill-bagworms/70397653007/
90 Flock license plate reading cameras to soon stand watch across OKC,/story/news/2023/07/10/oklahoma-city-police-flock-license-plate-cameras-okc/70347425007/
Mid-Del principal accused of abuse in lawsuit,/story/news/education/2023/07/10/midwest-city-del-public-schools-principal-parkview-elementary-lawsuit-abuse/70399978007/
"Madonna's North American tour postponed, including Oklahoma show",/story/entertainment/2023/07/10/madonna-tour-postponed-tulsa-oklahoma-paycom-center-update/70399473007/
OKC residents line the sidewalk to say 'Goodbye' to…,/story/lifestyle/food/2023/07/08/browns-bakery-holds-final-day-of-sales-at-current-location/70391891007/
"Edmond Wingstop shooting brings Sirloin Stockade, other…",/story/business/real-estate/2023/07/08/edmond-oklahoma-wingstop-killings-sirloin-stockade-murders-retail-impact/70380626007/
OKC police left man on roadside before his death,/story/news/2023/07/08/oklahoma-city-police-response-mental-health-crisis-fatal-crash-lawsuit/70384602007/
Judge: Court may decide church exit dispute,/story/news/2023/07/08/judge-rules-that-courts-may-decide-united-methodist-churchs-exit-suit/70362935007/
Arrests made in weekend OKC homicides,/story/news/crime/2023/07/10/oklahoma-city-police-homicides-two-arrested/70398436007/
,
Bagworms are back. Here's how to manage infestations,/story/news/2023/07/10/bagworm-treatment-options-oklahoma-how-to-kill-bagworms/70397653007/
90 Flock license plate reading cameras to soon stand watch across OKC,/story/news/2023/07/10/oklahoma-city-police-flock-license-plate-cameras-okc/70347425007/
Mid-Del principal accused of abuse in lawsuit,/story/news/education/2023/07/10/midwest-city-del-public-schools-principal-parkview-elementary-lawsuit-abuse/70399978007/
Thunder's use of cap space is all about sustaining its future,/story/sports/nba/thunder/2023/07/10/okc-thunder-offseason-salary-cap-space-roster-sam-presti/70395666007/
Softball has taken this OKC Spark coach on 'such a beautiful ride',/story/sports/2023/07/10/okc-spark-softball-journey-takes-assistant-coach-alex-flores-far-from-us-mexico-border-town/70390810007/
Super 30: How Del City's River Warren became 'hidden gem' at QB,/story/sports/high-school/football/2023/07/10/the-oklahomans-2024-super-30-del-city-quarterback-river-warren-hidden-gem-in-recruiting-class/70388634007/
"Edmond Wingstop shooting brings Sirloin Stockade, other deaths to mind",/story/business/real-estate/2023/07/08/edmond-oklahoma-wingstop-killings-sirloin-stockade-murders-retail-impact/70380626007/
Commercial real estate deals from across the Oklahoma City metro area,/story/business/real-estate/2023/07/07/commercial-real-estate-deals-from-across-the-oklahoma-city-metro-area/70383913007/
How OKC ranks in construction for the past decade? It's a powerhouse,/story/business/real-estate/2023/06/30/storagecafe-okc-powerhouse-home-construction-retail-real-estate/70308142007/
Federal permitting reform will boost economic development in Oklahoma Scooter Park,/story/opinion/2023/07/10/federal-permitting-reform-will-boost-economic-development-in-oklahoma/70338617007/
All is not lost with postpartum depression Brandi Gibson,/story/opinion/2023/07/10/postpartum-depression-can-happen-to-any-new-mother/70384503007/
"Guest: Oversight agencies should not tolerate turnpike authority's actions Amy Cerato, Katherine Hirschfeld and Richard Labarthe",/story/opinion/2023/07/09/state-oversight-agencies-have-consistently-refused-to-address-ota-activities/70379398007/
"Sriracha bottles selling as high as $80 on ebay, Amazon amid shortage",/story/money/food/2023/07/10/huy-fong-sriracha-sauce-shortage-ebay-bottles-price/70397038007/
"James Lewis, prime suspect in 1982 Tylenol murders, dead at 72",/story/news/nation/2023/07/10/1982-tylenol-poisonings-suspect-james-lewis-dead/70400266007/
Bud Light sales continue to lose to Modelo in June,/story/money/2023/07/10/bud-light-sales-lose-modelo-especial-second-consecutive-month/70398376007/
"OKC residents line the sidewalk to say 'Goodbye' to Brown's, for now",/story/lifestyle/food/2023/07/08/browns-bakery-holds-final-day-of-sales-at-current-location/70391891007/
Have a cool National Ice Cream Day and visit these 14 shops,/story/lifestyle/food/2023/07/10/national-ice-cream-day-2023-okc-boomtown-creamery-roxys-capitals-kaisers-wondervan-pops/70385089007/
Iconic OKC bakery slated for Saturday closure will see eventual revival,/story/lifestyle/food/2023/07/05/browns-bakery-okc-closed-one-owner-plans-reopen-new-location/70383966007/
,/picture-gallery/news/2023/07/04/photos-annual-libertyfest-fourth-july-parade-edmond/12206877002/
Crossword & Games,https://puzzles.usatoday.com/?itm_campaign=Crossword%20%26amp%3B%20Games&itm_medium=con&itm_source=secondStreet
Oklahoma elementary teacher accused of abusing six children,/story/news/education/2023/07/10/stilwell-elementary-oklahoma-teacher-charges-sexual-abuse-children/70399639007/
"Trump's 2024 election odds look like 2016, but here are key differences",/story/news/politics/2023/07/10/who-will-win-2024-election-odds/70383288007/
OKC theater celebrates LGBTQ+ community with new musical 'The Prom',/story/entertainment/2023/07/09/the-prom-play-okc-lyric-theatre-oklahoma-tickets-celebrates-lgbtq-community/70344477007/
What it's actually like for tribal police on the Muscogee reservation,/story/news/2023/07/09/muscogee-lighthorse-police-three-years-after-mcgirt-decision-us-supreme-court/70365754007/
How Afghan refugees are restarting their educations through new program,/story/news/education/2023/07/09/epic-charter-school-pathways-oklahoma-afghan-refugees-education/70176013007/
,https://cm.oklahoman.com/site-feedback/?platform=Tangent-Desktop&url=https%3A%2F%2Fwww.oklahoman.com%2F&marketName=oklahoman&cta=Right-Rail
