headline,href
"After abortion bans in Oklahoma, thousands seek care in other states",/story/news/politics/government/2023/07/03/dobbs-oklahoma-abortion-laws-women-2100-seek-care-kansas-colorado/70368491007/
Lawsuit claims that new cannabis business fees are unconstitutional,/story/news/politics/state/2023/07/03/medical-marijuana-oklahoma-businesses-sue-licensing-fee-increases/70373875007/
"Water tower replacement, move of another approved by Edmond council",/story/news/local/2023/07/03/edmond-oklahoma-water-tower-approval-water-supply-without-okc/70362151007/
Bees vital to Oklahoma crops on path to extinciton. What can be done?,/story/news/state/2023/07/02/oklahoma-agriculture-bees-vital-crop-production-experts-say/70365865007/
How to keep your pets safe during fireworks around the…,/story/business/real-estate/2023/06/28/dogs-and-fireworks-anxiety-safety-tips-independence-day/70361724007/
Don't call 911 to report illegal fireworks in OKC,/story/news/2023/06/28/why-are-fireworks-illegal-okc-how-to-report/70364431007/
"Festivals, fireworks and fun for Fourth of July across…",/story/lifestyle/2023/06/28/fireworks-festivals-fourth-of-july-events-okc-tulsa-moore-oklahoma/70326620007/
Muslim congregations hope OKC Eid celebration will prove…,/story/lifestyle/2023/06/27/eid-festival-scissortail-park-okc-muslim-congregations/70347515007/
,
Oklahoma high school spring sports awards 2023 in…,/story/sports/high-school/2023/06/02/oklahoma-high-school-spring-sports-awards-2023-baseball-golf-soccer-slowpitch-tennis-track-field/70267666007/
"After abortion bans in Oklahoma, thousands seek care in other states",/story/news/politics/government/2023/07/03/dobbs-oklahoma-abortion-laws-women-2100-seek-care-kansas-colorado/70368491007/
Lawsuit claims that new cannabis business fees are unconstitutional,/story/news/politics/state/2023/07/03/medical-marijuana-oklahoma-businesses-sue-licensing-fee-increases/70373875007/
"Water tower replacement, move of another approved by Edmond council",/story/news/local/2023/07/03/edmond-oklahoma-water-tower-approval-water-supply-without-okc/70362151007/
Why Dieng is the Thunder player to watch in NBA Summer League,/story/sports/nba/thunder/2023/07/03/okc-thunder-ousmane-dieng-player-to-watch-nba-summer-league/70377222007/
The Oklahoman's Super 30: Tulsa Union's Boyd has knack for big plays,/story/sports/high-school/football/2023/07/03/oklahoma-high-school-football-jino-boyd-tulsa-union-recruiting-profile/70376907007/
Oklahoma high school football radio show calls it quits after 35 years,/story/sports/high-school/football/2023/07/03/oklahoma-high-school-football-radio-show-ends-after-35-years-friday-night-finals/70375742007/
How OKC ranks in construction for the past decade? It's a powerhouse,/story/business/real-estate/2023/06/30/storagecafe-okc-powerhouse-home-construction-retail-real-estate/70308142007/
How to keep your pets safe during fireworks around the Fourth of July,/story/business/real-estate/2023/06/28/dogs-and-fireworks-anxiety-safety-tips-independence-day/70361724007/
Commercial real estate transactions from around the Oklahoma City area,/story/business/real-estate/2023/06/30/commercial-real-estate-transactions-from-around-the-oklahoma-city-area/70365904007/
DACA recipients and their loved ones are nervous. So are employers Kelli J. Stump,/story/opinion/2023/07/02/daca-recipients-and-their-loved-ones-are-nervous-so-are-employers/70363206007/
"Guest: Considering safety concerns, fireworks can go out with a bang Andrea Chancellor",/story/opinion/2023/07/02/guest-fireworks-can-be-fun-but-they-are-just-too-dangerous/70364824007/
Fiestas de las Americas creates sense of community Brenda Hernandez,/story/opinion/2023/07/02/fiestas-de-las-americas-has-become-one-of-the-largest-longest-lasting-outdoor-festivals-in-oklahoma/70360486007/
Man who sought hitman to kill 14-year-old boy sentenced to prison,/story/news/nation/2023/07/03/nj-man-hitman-plot-kill-teen/70378312007/
See rare deep-sea octopus nursery discovered in Costa Rica,/story/news/world/2023/07/03/rare-deep-sea-octopus-nursery-discovered-costa-rica/70378154007/
"Child dies falling off ferry in Baltic Sea, mother dies trying to save him",/story/news/world/2023/07/03/polish-mother-child-die-overboard-ferry/70378273007/
"Festivals, fireworks and fun for Fourth of July across Oklahoma",/story/lifestyle/2023/06/28/fireworks-festivals-fourth-of-july-events-okc-tulsa-moore-oklahoma/70326620007/
Muslim congregations hope OKC Eid celebration will prove unifying,/story/lifestyle/2023/06/27/eid-festival-scissortail-park-okc-muslim-congregations/70347515007/
Adopt a pet for July 5,/story/lifestyle/2023/07/03/dogs-and-cats-are-available-for-adoption-at-okc-area-animal-shelters/70354217007/
,/picture-gallery/news/2023/07/01/blue-angels-headline-tinker-airshow-photos/12198205002/
Crossword & Games,https://puzzles.usatoday.com/?itm_campaign=Crossword%20%26amp%3B%20Games&itm_medium=con&itm_source=secondStreet
'We've got to live in community.' New community and justice center leader relishes role,/story/news/2023/07/02/oklahoma-center-community-justice-phil-armstrong-former-tulsa-race-massacre-commissioner/70347663007/
9 places in the OKC metro where you can see fireworks for July Fourth,/story/entertainment/2023/06/29/fireworks-in-oklahoma-city-independence-day-shows/70344443007/
OKC summer art installation 'Cosmic Callback' is a starry trip,/story/entertainment/2023/07/03/factory-obscura-ok-cosmic-callback-exhibit/70274275007/
How OKC ranks in construction for the past decade? It's a powerhouse,/story/business/real-estate/2023/06/30/storagecafe-okc-powerhouse-home-construction-retail-real-estate/70308142007/
Cool off at one of these water parks around OKC,/story/news/local/2023/06/28/water-parks-oklahoma-city-tulsa-hurricane-harbor-h2o-water-park/70361782007/
,https://cm.oklahoman.com/site-feedback/?platform=Tangent-Desktop&url=https%3A%2F%2Fwww.oklahoman.com%2F&marketName=oklahoman&cta=Right-Rail
