headline,href
Education agency had influence over state's testing standards despite call for neutrality,/story/news/2025/03/18/ryan-walters-oklahoma-state-department-education-test-standards/82515421007/
Oklahoma high school basketball gives State Fair Arena perfect sendoff,/story/sports/high-school/basketball/2025/03/18/2oklahoma-high-school-state-basketball-tournaments-2025-send-off-state-fair-arena-in-style-ossaa/82471120007/
"Oklahoma State basketball vs Wichita State score, live updates in NIT",/story/sports/college/cowboys/2025/03/18/oklahoma-state-wichita-state-score-live-updates-mens-college-basketball-osu-cowboys-nit/82521918007/
They're back: Starliner astronauts at long last return to Earth,/story/news/nation/2025/03/18/starliner-astronauts-return-space/82491110007/
Mussatto: Who will cut down nets in San Antonio? Here…,/story/sports/college/basketball/2025/03/18/final-four-predictions-ncaa-bracket-picks-mens-college-basketball/82495418007/
Super 16 college softball rankings: Top 8 solidifies…,/story/sports/college/softball/2025/03/18/college-softball-super-16-rankings-oklahoma-texas-ou-sooners-ut-longhorns/82493885007/
Big 12 softball power rankings: OSU's shortened series…,/story/sports/college/big-12/2025/03/18/big-12-softball-power-rankings-texas-tech-arizona-oklahoma-state-wildfire-cancellation/82489385007/
Israeli launches 'extensive' strikes in Gaza that…,/story/news/world/2025/03/17/israel-hamas-gaza-military-airstrikes/82505920007/
,
Oklahoma Senate to people — stay out of our business,/story/opinion/columns/2025/03/11/senate-aims-to-make-initiative-petitions-harder-to-propose-threat-to-direct-democracy/81944420007/
Education agency had influence over state's testing standards despite call for neutrality,/story/news/2025/03/18/ryan-walters-oklahoma-state-department-education-test-standards/82515421007/
They're back: Starliner astronauts at long last return to Earth,/story/news/nation/2025/03/18/starliner-astronauts-return-space/82491110007/
DOGE blocked from more USAID firings as judge questions lawfulness,/story/news/politics/2025/03/18/doge-usaid-preliminary-injunction/82522018007/
Oklahoma high school basketball gives State Fair Arena perfect sendoff,/story/sports/high-school/basketball/2025/03/18/2oklahoma-high-school-state-basketball-tournaments-2025-send-off-state-fair-arena-in-style-ossaa/82471120007/
"Oklahoma State basketball vs Wichita State score, live updates in NIT",/story/sports/college/cowboys/2025/03/18/oklahoma-state-wichita-state-score-live-updates-mens-college-basketball-osu-cowboys-nit/82521918007/
SEC softball power rankings: OU's sweep of Arkansas keeps it at top,/story/sports/college/sec/2025/03/18/sec-softball-power-rankings-oklahoma-at-top-texas-lsu-nipping-on-ou-sooners-heels/82512562007/
"Dogs, owners happy about new OKC Midtown Mutts Dog Park opening",/story/business/downtown/2025/03/15/upgraded-oklahoma-city-dog-park-attracts-canines-owners-to-midtown/80066392007/
Bill focuses on shopping cart thefts; critics say it targets homeless,/story/business/2025/03/13/shopping-cart-legislation-sparks-discussion-on-thefts-homelessness/82363916007/
"As Myriad Convention Center comes down, memories linger with Oklahomans",/story/business/downtown/2025/03/13/cox-convention-center-okc-history-elvis-presley-journey-aerosmith/77511780007/
Oklahoma Senate to people — stay out of our business William C. Wertz,/story/opinion/columns/2025/03/11/senate-aims-to-make-initiative-petitions-harder-to-propose-threat-to-direct-democracy/81944420007/
Our schools are lagging behind those in China. That has to change. Larry Parman,/story/opinion/columns/2025/03/18/five-ways-we-can-improve-our-oklahoma-public-schools-opinion/82268689007/
The economy isn't working for most Americans. What is Trump doing? Daniel Morrissey,/story/opinion/columns/guest/2025/03/18/trump-musk-americans-struggle-economy-tax-rich-medicare/81171722007/
Mega Millions winning numbers for March 18: $301 million jackpot,/story/money/lottery/2025/03/18/mega-millions-winning-numbers/82528909007/
Volunteer firefighter accused of sharing photos of Georgia death scene,/story/news/nation/2025/03/18/georgia-firefighter-photos-qaadir-naazir-lewis/82527754007/
What health effects will Starliner astronauts face once back on Earth?,/story/news/nation/2025/03/18/starliner-astronauts-health-effects-earth/82521975007/
"60,000 shoppers bought this $13 meat thermometer last month",/story/shopping/2025/03/18/amazon-spring-deal-digital-meat-thermometer/82518783007/
When does Amazon's Big Spring Sale start? Here's what you need to know,/story/shopping/2025/03/18/amazon-big-spring-sale-dates-2025/82471032007/
How to watch the 2025 men's NCAA tournament's First Four games,/story/shopping/2025/03/18/how-to-watch-stream-first-four-march-madness-tournament-trutv-sling/82499653007/
Oklahoma gymnast Bart Conner's 1980s BMX movie 'Rad' returns to theaters,/story/entertainment/2025/03/18/rad-movie-1876-oklahoma-gymnast-bart-conner/82491681007/
Photos: The 1986 BMX racing movie 'Rad' is zipping back to theaters,/picture-gallery/entertainment/2025/03/18/rad-1986-bmx-movie-returns-to-theaters-photos/82507686007/
The cult-classic 1986 BMX movie 'Rad' is racing back into theaters,/videos/entertainment/2025/03/18/rad-movie-1986-returns-theaters-rad-day-2025/82516823007/
,/picture-gallery/entertainment/2025/03/18/rad-1986-bmx-movie-returns-to-theaters-photos/82507686007/
Enter Today!,https://usatoday.gannettcontests.com/Kansas-City-Steak-Company-Spring-SweepSteaks/?itm_campaign=Kansas%20City%20Steak%20Company%20Spring%20SweepSteaks&itm_medium=con&itm_source=secondStreet
Nominate Today!,https://oklahoman.gannettcontests.com/2025-Oklahoman-Communitys-Choice-Awards/?itm_campaign=Oklahoma%20Bob&itm_medium=con&itm_source=secondStreet
ENTER TODAY,https://www.kalahariresorts.com/win?itm_campaign=Get%20Kalaharid%20Away&itm_medium=con&itm_source=secondStreet#//?
DOGE blocked from more USAID firings as judge questions lawfulness,/story/news/politics/2025/03/18/doge-usaid-preliminary-injunction/82522018007/
SEC softball power rankings: OU's sweep of Arkansas keeps it at top,/story/sports/college/sec/2025/03/18/sec-softball-power-rankings-oklahoma-at-top-texas-lsu-nipping-on-ou-sooners-heels/82512562007/
Chief Justice John Roberts rebukes Trump over impeachment calls,/story/news/politics/2025/03/18/chief-justice-john-roberts-trump-impeachment/82516448007/
Thousands of fired federal employees are being reinstated,/story/news/politics/2025/03/18/trump-administration-reinstates-probationary-employees-court-orders/82512430007/
It's 'a blessing' for Trey Alexander to play with Russell Westbrook,/story/sports/nba/thunder/2025/03/18/trey-alexander-russell-westbrook-bond-oklahoma-city-thunder-nba-denver-nuggets-teammates/82350911007/
,https://cm.oklahoman.com/site-feedback/?platform=Tangent-Desktop&url=https%3A%2F%2Fwww.oklahoman.com%2F&marketName=oklahoman&cta=Right-Rail
