headline,href
"Why Gasso says OU, A&M should be top two seeds in NCAA Tournament",/story/sports/college/sooners/2025/05/10/ou-softball-vs-texas-am-sec-softball-championship-rained-out-ncaa-tournament-top-seeds-patty-gasso/83557413007/
"Despite threats of DOGE cuts, Oklahoma's weather scientists ready for tornado season",/story/news/2025/05/07/national-weather-service-doge-cuts-tornado-season-2025-nws-norman-ok/83080554007/
"How Jalen Williams, Thunder graded out in Game 3 loss to Nuggets",/story/sports/nba/thunder/2025/05/10/thunder-vs-nuggets-report-card-game-3-nba-playoffs/83546925007/
Sam Jackson V's career comes full circle with Oklahoma State football,/story/sports/college/cowboys/2025/05/10/oklahoma-state-football-sam-jackson-transfer-portal-doug-meacham-osu-cowboys/83494792007/
Inside former OU pitcher Cade Horton's journey to…,/story/sports/college/sooners/2025/05/10/cade-horton-mlb-debut-chicago-cubs-top-prospect-oklahoma-sooners/83548845007/
SGA hasn't lost his smile with OKC down 2-1: 'The series…,/story/sports/nba/thunder/2025/05/10/nuggets-vs-thunder-score-nba-playoffs-game-3-western-conference-semifinals-sga-stats/83549009007/
Oklahoma high school baseball: AI-B state tournament…,/story/sports/high-school/baseball/2025/05/08/oklahoma-high-school-baseball-2025-ossaa-class-ai-aii-b-state-tournament-schedule-scores/83512619007/
,
Vote: Landmark Fine Homes boys HS athlete of week for…,/story/sports/high-school/athlete-of-the-week/2025/05/06/vote-landmark-fine-homes-boys-high-school-athlete-of-the-week-for-april-28-may-4/83464732007/
Vote: Landmark Fine Homes girls athlete of week for…,/story/sports/high-school/athlete-of-the-week/2025/05/06/vote-landmark-fine-homes-girls-high-school-athlete-of-the-week-for-april-28-may-4/83464632007/
"Despite threats of DOGE cuts, Oklahoma's weather scientists ready for tornado season",/story/news/2025/05/07/national-weather-service-doge-cuts-tornado-season-2025-nws-norman-ok/83080554007/
"New OKC art piece reflects Vietnamese Americans' courage, resilience",/story/news/2025/05/10/military-park-refugee-sculpture-honors-refugees-vietnam-war/83462079007/
Mobile Integrated Health launched in OKC after calls for police reform,/story/news/healthcare/2025/05/10/oklahoma-city-mental-health-care-help-mobile-integrated-healthcare/83140614007/
"Why Gasso says OU, A&M should be top two seeds in NCAA Tournament",/story/sports/college/sooners/2025/05/10/ou-softball-vs-texas-am-sec-softball-championship-rained-out-ncaa-tournament-top-seeds-patty-gasso/83557413007/
"How Jalen Williams, Thunder graded out in Game 3 loss to Nuggets",/story/sports/nba/thunder/2025/05/10/thunder-vs-nuggets-report-card-game-3-nba-playoffs/83546925007/
Sam Jackson V's career comes full circle with Oklahoma State football,/story/sports/college/cowboys/2025/05/10/oklahoma-state-football-sam-jackson-transfer-portal-doug-meacham-osu-cowboys/83494792007/
These one-of-a-kind townhomes got an incredible new look for Symphony Show House,/story/business/real-estate/2025/05/09/okc-philarmonic-symphony-show-house-2025-townhomes-decorations/82652132007/
Symphony Designer Showhouse Townhomes ready for May 10-25 reveal,/picture-gallery/business/2025/05/09/symphony-show-house-okc-townhomes-decor-photos-2025/83389722007/
Townhomes focus of 2025 Symphony Show House: See them before the decor,/picture-gallery/business/2025/05/09/symphony-show-house-2025-townhomes-before-decor/83223770007/
"State, national budget cuts are targeting disability services Meske Owens",/story/opinion/columns/guest/2025/05/10/budget-cuts-disability-programs-vulnerable-oklahomans/83533214007/
Oklahoma Senate missed an opportunity to block Ryan Walters,/story/opinion/letters/2025/05/10/readers-on-ryan-walters-comprehensive-education-and-how-republicans-see-themselves-letters/83473685007/
"Amid Trump's moves, Oklahoma's delegation remains silent",/story/opinion/cartoons/2025/05/10/oklahoma-delegation-remains-silent-on-trump-moves-cartoon/83518695007/
Some old pennies are valuable. But maybe less than you think,/story/money/2025/05/10/are-old-pennies-worth-anything/83553351007/
Soviet spacecraft returns to Earth. Crashes into Indian Ocean,/story/news/2025/05/10/cosmos-482-soviet-spacecraft-returns-to-earth/83553393007/
Would you carry a purse made of T. rex 'leather'? It could be coming.,/story/news/nation/2025/05/10/dinosaur-purses-tyrannosaurs-rex-leather/83494555007/
"Hot travel deal! Save 25% on trips to Hawaii, Cancun through Expedia",/story/shopping/2025/05/09/expedia-travel-deals/83532232007/
"15 early Memorial Day mattress sales at Tempur-Pedic, DreamCloud, Saatva",/story/shopping/2025/05/10/early-memorial-day-mattress-sales-2025/83502824007/
"🐾 50% off The Farmer's Dog: Order personalized, fresh dog food today",/story/shopping/2025/05/10/the-farmers-dog-memorial-day-deal-2025/83543019007/
See OKC sculpture honoring Vietnamese refugees who escaped by boat,/picture-gallery/lifestyle/features/2025/05/10/military-park-okc-vietnamese-boat-refugees/83502300007/
Did we see you at the Katy Perry concert? See our favorite fan photos,/picture-gallery/lifestyle/2025/05/09/katy-perry-okc-crowd-photos-may-9/83540942007/
See Katy Perry perform her first concert in Oklahoma City photos,/picture-gallery/lifestyle/2025/05/09/katy-perry-okc-coconcert-photos-paycom-center/83540881007/
,/picture-gallery/sports/high-school/baseball/2025/05/10/wister-vs-wright-city-2025-oklahoma-high-school-baseball-class-a1-championship/83559190007/
WIN 4 TICKETS!,https://oklahoman.gannettcontests.com/Lyric-Theatre-Joseph-and-the-Amazing-Technicolor-Dreamcoat/?itm_campaign=Joseph%20and%20the%20Amazing%20Technicolor%20Dreamcoat%20-%20Lyric%20Theatre&itm_medium=con&itm_source=secondStreet
Vote Every Week!,https://www.oklahoman.com/sports/high-school/?itm_campaign=Athlete%20of%20the%20Week%20Landmark%20OKC&itm_medium=con&itm_source=secondStreet
ENTER TODAY,https://usatoday.gannettcontests.com/Bourbon--Beyond-Fly-Away-2025/?itm_campaign=Bourbon%20and%20Beyond%202025&itm_medium=con&itm_source=secondStreet
Oklahoma HS track & field: Washington girls defend Class 3A state title,/story/sports/high-school/track-field/2025/05/10/oklahoma-high-school-track-field-washington-girls-win-state-titles-class-4a-3a/83558042007/
Oklahoma HS track & field: OSSAA Class 4A-A state championship results,/story/sports/high-school/track-field/2025/05/10/oklahoma-high-school-track-and-field-2025-ossaa-class-4a-3a-2a-a-state-championship-results/83537298007/
Oklahoma high school tennis OSSAA girls state championship results,/story/sports/high-school/tennis/2025/05/10/oklahoma-high-school-girls-tennis-2025-ossaa-class-6a-5a-4a-state-championship-results/83536965007/
"Mussatto: Thunder knows how to win easy, but the NBA Playoffs are hard",/story/sports/nba/thunder/2025/05/10/okc-thunder-denver-nuggets-nba-playoffs-game-3-western-conference-semifinals/83546911007/
Thunder made a mess of OT in Game 3. Another case of inexperience?,/story/sports/nba/thunder/2025/05/10/okc-thunder-vs-denver-nuggets-nba-playoffs-experience-nikola-jokic-jamal-murray/83545156007/
,https://cm.oklahoman.com/site-feedback/?platform=Tangent-Desktop&url=https%3A%2F%2Fwww.oklahoman.com%2F&marketName=oklahoman&cta=Right-Rail
