headline,href
Quincy Bake Shop to grow after acquisition by popular local coffee chain,/story/lifestyle/food/2025/12/01/quincy-bake-shop-okc-acquired-not-your-average-joe-nonprofit/87553491007/
AUSL Draft live updates: OKC Spark selects Maya Brady first overall,/story/sports/2025/12/01/ausl-expansion-draft-2025-live-tracker-order/87538056007/
Teachers have mixed opinions on the OU essay controversy,/story/opinion/letters/2025/12/01/samantha-fulnecky-essay-oklahoma-teachers-reaction/87554654007/
How Thunder keeps 'figuring out' ways to win during historic start,/story/sports/nba/thunder/2025/12/01/okc-thunder-historic-start-2025-26-nba-season-win-total/87546013007/
OKC Thunder's Lu Dort out vs. Golden State Warriors with…,/story/sports/nba/thunder/2025/12/01/lu-dort-injury-update-okc-thunder-vs-golden-state-warriors-adductor-strain/87559972007/
How to prepare your home for winter according to the…,/story/weather/2025/12/01/oklahoma-weather-how-to-winterize-my-home-experts-insurance/87556883007/
Where to watch Giants-Patriots Monday Night Football…,/story/sports/nfl/2025/12/01/giants-patriots-channel-today-nfl-games-live-time-tv-streaming-monday-night-football/87550322007/
See who was nominated for The Oklahoman's Student of the…,/story/news/2025/12/01/the-oklahoman-student-of-the-week-vote-poll-dec-1/87359600007/
,
Former OU softball star Sam Landry reflects on pro debut…,/story/sports/columns/jenni-carlson/2025/12/01/ou-softball-pitcher-sam-landry-ausl-draft-expansion-oklahoma-city-spark-volts/87465941007/
The Wolfbox jump starter + air compressor is under $95 today,/story/shopping/2025/12/01/cyber-monday-wolfbox-3000a-jump-starter/87558855007/
Save 20% on all purchases at Bluemercury's Cyber Monday sale,/story/shopping/2025/12/01/bluemercury-cyber-monday-beauty-deals/87558508007/
"Shop Cyber Monday beauty deals from Charlotte Tilbury, Ulta and more",/story/shopping/2025/12/01/cyber-monday-2025-deals-on-makeup-skincare/87557207007/
Instructor on leave amid controversial OU essay: Everything to know,/story/news/education/2025/12/01/samantha-fulnecky-ou-oklahoma-essay-transgender-bible-what-we-know/87556408007/
Oklahoma lawsuits accuse State Farm of billion-dollar hail scheme,/story/news/state/2025/12/01/state-farm-hail-damage-lawsuits-oklahoma/87551117007/
'The real impact': Volunteering at local nonprofits is cost-free option,/story/news/2025/12/01/volunteering-in-okc-animal-shelter-homeless-alliance-list/87375182007/
AUSL Draft live updates: OKC Spark selects Maya Brady first overall,/story/sports/2025/12/01/ausl-expansion-draft-2025-live-tracker-order/87538056007/
How Thunder keeps 'figuring out' ways to win during historic start,/story/sports/nba/thunder/2025/12/01/okc-thunder-historic-start-2025-26-nba-season-win-total/87546013007/
"Grading college football coaching carousel: How did OSU, LSU fare?",/story/sports/columns/joe-mussatto/2025/12/01/college-football-coaching-hires-grades-eric-morris-oklahoma-state-cowboys/87542060007/
"Look inside these 9 celebrity mansions, historic homes in Oklahoma",/story/business/real-estate/2025/12/01/peek-inside-9-incredible-oklahoma-celebrity-homes-historic-mansions/87509964007/
Chickasha's giant leg lamp still standing over growing tourism,/story/business/2025/11/30/chickasha-ok-leg-lamp-still-standing/85416540007/
Two groups make case for modification of OG&E order approving new projects,/story/business/energy-resource/2025/11/30/aarp-oiec-oklahoma-corporation-commission-oge-order/87470873007/
Teachers have mixed opinions on the OU essay controversy,/story/opinion/letters/2025/12/01/samantha-fulnecky-essay-oklahoma-teachers-reaction/87554654007/
Let's remember how many remain poor when making spending decisions William C. Wertz,/story/opinion/columns/2025/11/30/raising-state-officials-salaries-tone-deaf-after-snap-cut-and-large-number-of-residents-in-poverty/87481316007/
Youth homelessness is increasing in Oklahoma. Human connection needed Rachel Bradley,/story/opinion/columns/guest/2025/11/30/okc-youth-need-guidance-and-support-not-just-place-to-shelter-for-night-or-two/87342973007/
See if your numbers match Powerball's $740 million jackpot drawing,/story/money/lottery/2025/12/01/powerball-winning-numbers-lottery/87489041007/
"Yankee Candle, Rubbermaid parent company announces 900 layoffs",/story/money/2025/12/01/yankee-candle-store-closures-newell-brands-layoffs/87557829007/
"What's happening in December? See religious, federal holiday schedule",/story/news/nation/2025/12/01/december-2025-holidays-winter-solstice/87510481007/
Quincy Bake Shop to grow after acquisition by popular local coffee chain,/story/lifestyle/food/2025/12/01/quincy-bake-shop-okc-acquired-not-your-average-joe-nonprofit/87553491007/
"Experts say don't use blankets, towels for wintertime animal shelters",/story/lifestyle/pets/2025/12/01/how-to-build-a-safe-winter-shelter-for-outdoor-dogs-feral-cats/86313279007/
See the OKC Animal Welfare volunteer program work with shelter animals,/picture-gallery/lifestyle/features/2025/12/01/okc-animal-welfare-volunteer-program-photos/87403631007/
,/picture-gallery/sports/college/softball/2025/12/01/maya-brady-ucla-bruins-softball-okc-spark-ausl-draft-pick-tom-brady-niece/87559312007/
ENTER TODAY!,https://usatoday.gannettcontests.com/New-Years-Eve-Live-Nashvilles-Big-Bash-2025/?itm_campaign=2025%20Nashville%20New%20Years%20Eve%20Sweepstake&itm_medium=con&itm_source=secondStreet
Enter Today!,https://oklahoman.gannettcontests.com/2025-The-Great-Holiday-Grocery/?itm_campaign=Homeland%20Great%20Holiday%20Grocery%20Giveaway&itm_medium=con&itm_source=secondStreet
ENTER TODAY!,https://oklahoman.gannettcontests.com/Oklahoma-City-Ballet-2025-The-Nutcracker/?itm_campaign=OKC%20Ballet%202025%20The%20Nutcracker%20Sweepstakes&itm_medium=con&itm_source=secondStreet
Instructor on leave amid controversial OU essay: Everything to know,/story/news/education/2025/12/01/samantha-fulnecky-ou-oklahoma-essay-transgender-bible-what-we-know/87556408007/
Oklahoma lawsuits accuse State Farm of billion-dollar hail scheme,/story/news/state/2025/12/01/state-farm-hail-damage-lawsuits-oklahoma/87551117007/
"Grading college football coaching carousel: How did OSU, LSU fare?",/story/sports/columns/joe-mussatto/2025/12/01/college-football-coaching-hires-grades-eric-morris-oklahoma-state-cowboys/87542060007/
"Why Isaiah Sategna III, OU's most consistent player, 'needed' Sooners",/story/sports/college/sooners/2025/12/01/ou-football-isaiah-sategna-stats-sooners/87541126007/
'The real impact': Volunteering at local nonprofits is cost-free option,/story/news/2025/12/01/volunteering-in-okc-animal-shelter-homeless-alliance-list/87375182007/
,https://cm.oklahoman.com/site-feedback/?platform=Tangent-Desktop&url=https%3A%2F%2Fwww.oklahoman.com%2F&marketName=oklahoman&cta=Right-Rail
