headline,href
"Confinement issues bring questions about pork prices, ethics to light",/story/news/2024/09/26/pork-industry-oklahoma-rule-changes-gestation-crates/71168990007/
Stitt says he's returned to work as he recovers from heart surgery,/story/news/politics/government/2024/09/25/oklahoma-kevin-stitt-recovering-heart-surgery-stent-placement/75375227007/
"Regional leaders voice challenges faced with infrastructure, growth",/story/business/2024/09/26/state-of-the-region-greater-okc-chamber-infrastructure-growth/75370555007/
Inmates at women's prison welcome Calm Waters' grief support program,/story/lifestyle/features/2024/09/26/oklahoma-calm-waters-womens-prison-mcloud-ok/75164743007/
"Darci Lynne, Point of Grace among groups to perform in…",/story/lifestyle/features/2024/09/26/darci-lynne-oklahoma-concert-contemporary-christian-show-schedule/74782657007/
Oklahoma restaurant makes New York Times' 50 best dining…,/story/lifestyle/2024/09/24/noche-woodfired-grill-and-agave-bar-was-honored-by-the-new-york-times/75363703007/
"Whether you're Republican or Democrat, retirement saving…",/story/money/2024/09/21/republicans-democrats-agree-retirement-crisis/75246270007/
,
Vote: Landmark Fine Homes girls HS athletes of the week…,/story/sports/high-school/2024/09/22/vote-landmark-fine-homes-girls-high-school-athletes-of-the-week-for-sept-15-21/75337593007/
Vote: Landmark Fine Homes boys HS athletes of the week…,/story/sports/high-school/2024/09/22/vote-landmark-fine-homes-boys-high-school-athletes-of-the-week-for-sept-15-21/75337324007/
"Confinement issues bring questions about pork prices, ethics to light",/story/news/2024/09/26/pork-industry-oklahoma-rule-changes-gestation-crates/71168990007/
Stitt says he's returned to work as he recovers from heart surgery,/story/news/politics/government/2024/09/25/oklahoma-kevin-stitt-recovering-heart-surgery-stent-placement/75375227007/
"Judge issues ruling about restraining order against Walters, spokesman",/story/news/courts/2024/09/25/ryan-walters-oklahoma-kfor-lawsuit-hearing/75379814007/
"OKC is West favorite, but Presti says there are 'no silver platters'",/story/sports/nba/thunder/2024/09/26/okc-thunder-sam-presti-expectations-2024-25-nba-season-western-conference/75383805007/
OSU's game at Kansas State is one final homecoming for Joe Michalski,/story/sports/college/cowboys/2024/09/26/oklahoma-state-football-vs-kansas-state-week-5-big-12-joe-michalski/75381093007/
Can Sooners' offense improve enough to win SEC games?,/story/sports/college/sooners/2024/09/26/ou-football-offense-vs-auburn-week-5-oklahoma-sooners-tigers/75379772007/
"Regional leaders voice challenges faced with infrastructure, growth",/story/business/2024/09/26/state-of-the-region-greater-okc-chamber-infrastructure-growth/75370555007/
Apple retail workers at Penn Square Mall vote 'Yes' to new contract,/story/business/local/2024/09/25/okc-apple-union-workers-ratify-new-contract/75351734007/
Canoo EV facility officially becomes a Foreign Trade Zone,/story/business/briefs/2024/09/24/oklahoma-jobs-canoo-ev-manufacturing-mental-health-care/75338078007/
OPINION: Reclaiming my identity was my greatest challenge Srijita Ghosh,/story/opinion/2024/09/26/oklahoma-venture-adviser-name-identity-challenge/75072352007/
OPINION: Dancing has magical benefits. Let's make it accessible for all Larry Keigwin,/story/opinion/columns/2024/09/26/oklahoma-dance-initiative-accessibility-fosters-community-connections/75367757007/
OPINION: It's Hispanic Heritage Month. Let's celebrate bilingual teachers Mary Melon-Tully,/story/opinion/columns/2024/09/25/oklahoma-bilingual-language-program-teachers-students-diversity-hispanic-heritage-month/75352536007/
Free COVID tests are now available. Here's how you can get them.,/story/news/health/2024/09/26/free-covid-19-tests/75363433007/
"6 people shot during Los Angeles drive-by shooting, suspects at large",/story/news/nation/2024/09/26/los-angeles-shooting/75389411007/
Target Circle Week: Retailers' biggest sale runs Oct. 6-12,/story/money/shopping/2024/09/26/target-circle-week-2024/75383277007/
Inmates at women's prison welcome Calm Waters' grief support program,/story/lifestyle/features/2024/09/26/oklahoma-calm-waters-womens-prison-mcloud-ok/75164743007/
It's the Brewery Bracket Finals. Who will win it all?,/story/lifestyle/food/2024/09/23/oklahoma-things-to-do-vote-best-brewery-stonecloud-vs-skydance/75349940007/
"Darci Lynne, Point of Grace among groups to perform in OKC this fall",/story/lifestyle/features/2024/09/26/darci-lynne-oklahoma-concert-contemporary-christian-show-schedule/74782657007/
,/picture-gallery/sports/college/cowboys/2024/09/21/oklahoma-state-vs-utah-football-game-photos/75308738007/
Winners Announced!,https://oklahoman.gannettcontests.com/2024-Oklahoman-Communitys-Choice-Awards-Winners/?itm_campaign=Oklahoma%202024%20BOB&itm_medium=con&itm_source=secondStreet
Vote Every Week!,https://www.oklahoman.com/sports/high-school/?itm_campaign=Athlete%20of%20the%20Week%20Landmark%20OKC&itm_medium=con&itm_source=secondStreet
"OKC is West favorite, but Presti says there are 'no silver platters'",/story/sports/nba/thunder/2024/09/26/okc-thunder-sam-presti-expectations-2024-25-nba-season-western-conference/75383805007/
"Judge issues ruling about restraining order against Walters, spokesman",/story/news/courts/2024/09/25/ryan-walters-oklahoma-kfor-lawsuit-hearing/75379814007/
It's the Brewery Bracket Finals. Who will win it all?,/story/lifestyle/food/2024/09/23/oklahoma-things-to-do-vote-best-brewery-stonecloud-vs-skydance/75349940007/
OPINION: Dancing has magical benefits. Let's make it accessible for allLarry Keigwin,/story/opinion/columns/2024/09/26/oklahoma-dance-initiative-accessibility-fosters-community-connections/75367757007/
"Dispute leads to deadly shooting, OKC police release suspected gunman",/story/news/2024/09/26/okc-police-investigate-homicide-release-man-custody/75376855007/
,https://cm.oklahoman.com/site-feedback/?platform=Tangent-Desktop&url=https%3A%2F%2Fwww.oklahoman.com%2F&marketName=oklahoman&cta=Right-Rail
