headline,href
Mobile Integrated Health launched in OKC after calls for police reform,/story/news/healthcare/2025/05/10/oklahoma-city-mental-health-care-help-mobile-integrated-healthcare/83140614007/
Thunder made a mess of OT in Game 3. Another case of inexperience?,/story/sports/nba/thunder/2025/05/10/okc-thunder-vs-denver-nuggets-nba-playoffs-experience-nikola-jokic-jamal-murray/83545156007/
"New OKC art piece reflects Vietnamese Americans' courage, resilience",/story/news/2025/05/10/military-park-refugee-sculpture-honors-refugees-vietnam-war/83462079007/
"What the new Edmond City Council, with three new members, aims to do",/story/news/politics/2025/05/10/edmond-city-council-oklahoma-new-members-reform/83463723007/
SGA hasn't lost his smile with OKC down 2-1: 'The series…,/story/sports/nba/thunder/2025/05/10/nuggets-vs-thunder-score-nba-playoffs-game-3-western-conference-semifinals-sga-stats/83549009007/
Cashion freshman Khloe Kastner wins Class 2A long jump…,/story/sports/high-school/track-field/2025/05/09/oklahoma-high-school-track-field-day-1-results-class-4a-a-state-meets/83542604007/
,
Oklahoma State women's tennis feeling confident in NCAA…,/story/sports/college/cowboys/2025/05/09/oklahoma-state-womens-tennis-ncaa-championships-schedule-osu-cowgirls/83539871007/
Oklahoma high school baseball: AI-B state tournament…,/story/sports/high-school/baseball/2025/05/08/oklahoma-high-school-baseball-2025-ossaa-class-ai-aii-b-state-tournament-schedule-scores/83512619007/
Big 12 Softball Tournament bracket: TV and streaming…,/story/sports/college/softball/2025/05/07/big-12-softball-tournament-bracket-tv-scores-scores/83459987007/
Mobile Integrated Health launched in OKC after calls for police reform,/story/news/healthcare/2025/05/10/oklahoma-city-mental-health-care-help-mobile-integrated-healthcare/83140614007/
"New OKC art piece reflects Vietnamese Americans' courage, resilience",/story/news/2025/05/10/military-park-refugee-sculpture-honors-refugees-vietnam-war/83462079007/
"What the new Edmond City Council, with three new members, aims to do",/story/news/politics/2025/05/10/edmond-city-council-oklahoma-new-members-reform/83463723007/
Thunder made a mess of OT in Game 3. Another case of inexperience?,/story/sports/nba/thunder/2025/05/10/okc-thunder-vs-denver-nuggets-nba-playoffs-experience-nikola-jokic-jamal-murray/83545156007/
OU softball team credits faith for 'calmness' in SEC-record comeback,/story/sports/college/sooners/2025/05/10/ou-softball-team-credits-faith-for-calmness-in-sec-record-comeback/83549421007/
Inside former OU pitcher Cade Horton's journey to Chicago Cubs,/story/sports/college/sooners/2025/05/10/cade-horton-mlb-debut-chicago-cubs-top-prospect-oklahoma-sooners/83548845007/
These one-of-a-kind townhomes got an incredible new look for Symphony Show House,/story/business/real-estate/2025/05/09/okc-philarmonic-symphony-show-house-2025-townhomes-decorations/82652132007/
Symphony Designer Showhouse Townhomes ready for May 10-25 reveal,/picture-gallery/business/2025/05/09/symphony-show-house-okc-townhomes-decor-photos-2025/83389722007/
Townhomes focus of 2025 Symphony Show House: See them before the decor,/picture-gallery/business/2025/05/09/symphony-show-house-2025-townhomes-before-decor/83223770007/
Oklahoma Senate missed an opportunity to block Ryan Walters,/story/opinion/letters/2025/05/10/readers-on-ryan-walters-comprehensive-education-and-how-republicans-see-themselves-letters/83473685007/
"Amid Trump's moves, Oklahoma's delegation remains silent",/story/opinion/cartoons/2025/05/10/oklahoma-delegation-remains-silent-on-trump-moves-cartoon/83518695007/
Customers bear the hidden costs of dining out. A legislative fix is needed James Como,/story/opinion/2025/05/09/oklahoma-restaurants-credit-card-swipe-fee-opinion/83390104007/
Would you carry a purse made of T. rex 'leather'? It could be coming.,/story/news/nation/2025/05/10/dinosaur-purses-tyrannosaurs-rex-leather/83494555007/
Mega Millions winning numbers for May 9: $100 million jackpot,/story/money/lottery/2025/05/09/mega-millions-winning-numbers/83544748007/
Most popular baby names released: Two names reign for 6th straight year,/story/news/nation/2025/05/09/most-popular-baby-names-2024-girl-boy/83539625007/
"15 early Memorial Day mattress sales at Tempur-Pedic, DreamCloud, Saatva",/story/shopping/2025/05/10/early-memorial-day-mattress-sales-2025/83502824007/
"🐾 50% off The Farmer's Dog: Order personalized, fresh dog food today",/story/shopping/2025/05/10/the-farmers-dog-memorial-day-deal-2025/83543019007/
💐 Get fast flower delivery services for Mother's Day 2025,/story/shopping/2025/04/22/best-flower-delivery-services-mothers-day/83199411007/
Did we see you at the Katy Perry concert? See our favorite fan photos,/picture-gallery/lifestyle/2025/05/09/katy-perry-okc-crowd-photos-may-9/83540942007/
See Katy Perry perform her first concert in Oklahoma City photos,/picture-gallery/lifestyle/2025/05/09/katy-perry-okc-coconcert-photos-paycom-center/83540881007/
See OKC sculpture honoring Vietnamese refugees who escaped by boat,/picture-gallery/lifestyle/features/2025/05/10/military-park-okc-vietnamese-boat-refugees/83502300007/
,/picture-gallery/lifestyle/features/2025/05/10/military-park-okc-vietnamese-boat-refugees/83502300007/
WIN 4 TICKETS!,https://oklahoman.gannettcontests.com/Lyric-Theatre-Joseph-and-the-Amazing-Technicolor-Dreamcoat/?itm_campaign=Joseph%20and%20the%20Amazing%20Technicolor%20Dreamcoat%20-%20Lyric%20Theatre&itm_medium=con&itm_source=secondStreet
Vote Every Week!,https://www.oklahoman.com/sports/high-school/?itm_campaign=Athlete%20of%20the%20Week%20Landmark%20OKC&itm_medium=con&itm_source=secondStreet
ENTER TODAY,https://usatoday.gannettcontests.com/Bourbon--Beyond-Fly-Away-2025/?itm_campaign=Bourbon%20and%20Beyond%202025&itm_medium=con&itm_source=secondStreet
Did we see you at the Katy Perry concert? See our favorite fan photos,/picture-gallery/lifestyle/2025/05/09/katy-perry-okc-crowd-photos-may-9/83540942007/
See Katy Perry perform her first concert in Oklahoma City photos,/picture-gallery/lifestyle/2025/05/09/katy-perry-okc-coconcert-photos-paycom-center/83540881007/
OU softball team credits faith for 'calmness' in SEC-record comeback,/story/sports/college/sooners/2025/05/10/ou-softball-team-credits-faith-for-calmness-in-sec-record-comeback/83549421007/
Inside former OU pitcher Cade Horton's journey to Chicago Cubs,/story/sports/college/sooners/2025/05/10/cade-horton-mlb-debut-chicago-cubs-top-prospect-oklahoma-sooners/83548845007/
5 takeaways: Thunder fails to take reins of West semifinals vs Nuggets,/story/sports/nba/thunder/2025/05/10/okc-thunder-denver-nuggets-score-nba-playoffs-game-3-shai-gilgeous-alexander-stats/83546134007/
,https://cm.oklahoman.com/site-feedback/?platform=Tangent-Desktop&url=https%3A%2F%2Fwww.oklahoman.com%2F&marketName=oklahoman&cta=Right-Rail
