headline,href
Large crowd protests controversial anti-immigration law at Oklahoma Capitol,/story/news/politics/government/2024/05/15/oklahoma-protest-wednesday-capitol-okc-hb-4156-anti-immigration-law/73689424007/
Why were McCurtain County officials scheduled to hold a meeting in OKC?,/story/news/state/2024/05/15/mccurtain-county-commissioners-cancel-meeting-okc-potential-open-meeting-act-violation/73704233007/
30+ restaurants close to allow employees to go to Capitol,/story/lifestyle/food/2024/05/15/oklahoma-immigration-bill-hb-4156-hal-smith-group-closes-restaurants-rally/73702480007/
Crowd gathers at Capitol to support immigrant community,/picture-gallery/news/2024/05/15/hispanic-cultural-day-oklahoma-capitol-okc-immigration-bill-protest/73701429007/
Flaming Lips' OKC summer shows: From tickets to costumes…,/story/entertainment/2024/05/15/the-flaming-lips-reveal-ticket-details-for-free-okc-oklahoma-city-summer-shows/73690613007/
"Freaks, friends and fame: The Flaming Lips keep their…",/story/entertainment/2024/05/15/the-flaming-lips-40-years-weird-relationship-with-oklahoma-city/71586325007/
,
Pittsburg County Sheriff charged with embezzlement,/story/news/2024/05/15/pittsburg-county-oklahoma-sheriff-chris-morris-embezzlement-charge/73688765007/
Texas businessman with few ties to Oklahoma running to…,/story/news/politics/government/2024/05/15/oklahoma-elections-2024-texas-businessman-paul-bondar-running-against-tom-cole/73687905007/
"Executive: Despite delay and lien, American Heartland…",/story/business/real-estate/2024/05/15/american-heartland-theme-park-vinita-oklahoma-lien-update/73646446007/
Large crowd protests controversial anti-immigration law at Oklahoma Capitol,/story/news/politics/government/2024/05/15/oklahoma-protest-wednesday-capitol-okc-hb-4156-anti-immigration-law/73689424007/
Why were McCurtain County officials scheduled to hold a meeting in OKC?,/story/news/state/2024/05/15/mccurtain-county-commissioners-cancel-meeting-okc-potential-open-meeting-act-violation/73704233007/
Crowd gathers at Capitol to support immigrant community,/picture-gallery/news/2024/05/15/hispanic-cultural-day-oklahoma-capitol-okc-immigration-bill-protest/73701429007/
"Thunder-Mavericks: How to watch, TV odds for Game 5 in NBA playoffs",/story/sports/nba/thunder/2024/05/15/thunder-mavericks-score-updates-game-5-nba-playoffs-today-western-conference-semifinals/73699649007/
"Why Wallace-Lively draft-day trade was win-win for Thunder, Mavericks",/story/sports/nba/thunder/2024/05/15/cason-wallace-dereck-lively-2023-nba-draft-trade-benefits-thunder-mavericks/73689379007/
Here's the real reason why Caroline Wang transferred to Oklahoma State,/story/sports/college/cowboys/2024/05/15/oklahoma-state-softball-caroline-wang-liberty-transfer-portal-osu-cowgirls-speech-pathology/73686532007/
"Executive: Despite delay and lien, American Heartland Theme Park could expand",/story/business/real-estate/2024/05/15/american-heartland-theme-park-vinita-oklahoma-lien-update/73646446007/
Highball hardball: Total Wine & More is poised to fight Oklahoma law,/story/business/2024/05/14/total-wine-and-more-oklahoma-store-against-strict-liquor-laws/73598805007/
"Oklahoma Baptists buy former Sonic HQ in OKC, plus more realty deals",/story/business/real-estate/2024/05/10/okc-real-estate-baptists-buy-former-sonic-headquarters/73604734007/
Did the courts fail Lyft driver? Repeat offenders should face repercussions Tommie Johnson III,/story/opinion/columns/2024/05/15/oklahoma-county-sheriff-tommie-johnson-opinion-lyft-driver-case/73687960007/
Do you experience 'weather-alert fatigue'? Share your thoughts Yesenia Jimenez,/story/opinion/2024/05/15/are-you-overwhelmed-by-oklahoma-severe-weather-alerts-weigh-in/73673032007/
Final ARPA funds will be used to boost small businesses Kenton Tsoodle,/story/opinion/columns/2024/05/15/opinion-oklahoma-city-small-businesses-apply-arpa-funds-outside-repairs/73581286007/
An Illinois baby born at 1 pound is finally going home after a long fight,/story/news/nation/2024/05/15/micropreemie-born-1-pound-leaves-illinois-hospital/73702159007/
See how to get a free non-alcoholic Athletic Brewing beer,/story/money/food/2024/05/15/free-non-alcoholic-beer-athletic-brewing/73706753007/
Watch bear caught on video stealing a snack from California man's fridge,/story/life/animalkind/2024/05/15/watch-video-bear-stealing-watermelon-fridge-california/73692416007/
30+ restaurants close to allow employees to go to Capitol,/story/lifestyle/food/2024/05/15/oklahoma-immigration-bill-hb-4156-hal-smith-group-closes-restaurants-rally/73702480007/
"Flaming Lips' OKC summer shows: From tickets to costumes, what to know",/story/entertainment/2024/05/15/the-flaming-lips-reveal-ticket-details-for-free-okc-oklahoma-city-summer-shows/73690613007/
"Freaks, friends and fame: The Flaming Lips keep their cool in OKC for 40 years",/story/entertainment/2024/05/15/the-flaming-lips-40-years-weird-relationship-with-oklahoma-city/71586325007/
,/picture-gallery/sports/nba/thunder/2024/05/13/okc-thunder-faces-dallas-mavericks-in-game-4-of-nba-playoff-series/73679801007/
Vote Today!,https://oklahoman.gannettcontests.com/2024-Oklahoman-Communitys-Choice-Awards/?itm_campaign=Oklahoma%202024%20BOB&itm_medium=con&itm_source=secondStreet
ENTER TODAY!,https://usatoday.gannettcontests.com/Service-Experts-Home-of-the-Future/?itm_campaign=Service%20Experts%20Gordons%20Home%20of%20the%20Future&itm_medium=con&itm_source=secondStreet
Don’t Miss Out!,https://oklahoman.gannettcontests.com/2024-Home-and-Garden-Refresh/?itm_campaign=2024%20Home%20%26amp%3B%20Garden%20Refresh%20-%20The%20Oklahoman&itm_medium=con&itm_source=secondStreet
What to know about poison hemlock in Oklahoma,/story/news/2024/05/15/poison-hemlock-in-oklahoma-what-to-know-about-the-deadly-plant/73698346007/
"Thunder-Mavericks: How to watch, TV odds for Game 5 in NBA playoffs",/story/sports/nba/thunder/2024/05/15/thunder-mavericks-score-updates-game-5-nba-playoffs-today-western-conference-semifinals/73699649007/
Oklahoma parental choice tax credits still a work in progress,/story/news/2024/05/15/oklahoma-parental-choice-tax-credit-applications-remain-under-review-commission/73699210007/
Oklahoma treasurer adds another bank to blacklist,/story/news/2024/05/15/barclays-firm-added-to-oklahoma-bank-blacklist-state-treasurer/73698683007/
Did the courts fail Lyft driver? Repeat offenders should face repercussionsTommie Johnson III,/story/opinion/columns/2024/05/15/oklahoma-county-sheriff-tommie-johnson-opinion-lyft-driver-case/73687960007/
,https://cm.oklahoman.com/site-feedback/?platform=Tangent-Desktop&url=https%3A%2F%2Fwww.oklahoman.com%2F&marketName=oklahoman&cta=Right-Rail
