headline,href
"3 takeaways: Thunder survives late scare to beat Deni Avdija, Blazers",/story/sports/nba/thunder/2025/11/30/thunder-vs-trail-blazers-score-shai-gilgeous-alexander-jalen-williams-nba-stats/87542791007/
OU suspends grad student teacher after Bible-based essay complaint,/story/news/politics/2025/11/30/ou-suspends-grad-student-for-failing-student-who-cited-bible-in-essay/87540981007/
How John Mateer carried offensive burden to likely punch CFP ticket,/story/sports/college/sooners/2025/11/30/ou-football-vs-lsu-qb-john-mateer-stats-oklahoma-sooners-cfp-race/87533046007/
How Oklahoma State football earned respect despite dismal 1-11 season,/story/sports/college/cowboys/2025/11/29/oklahoma-state-football-vs-iowa-state-osu-cowboys-effort-never-faded/87527335007/
Democrats are sweeping key races. What does that mean in…,/story/news/politics/2025/11/30/oklahoma-democratic-republican-party-gop-election-voter-frustration/87402886007/
"OSSAA Week 13 is in the books. Now, it's time for snap…",/story/sports/high-school/football/2025/11/30/oklahoma-high-school-football-playoffs-ossaa-week-13-bixby-owasso-advance-class-6a-i-championship/87533329007/
,
How Barry Switzer came to own one of Norman's…,/story/sports/college/sooners/2025/11/26/ou-football-coach-barry-switzer-airbnb-norman-oklahoma-switzer-pigskin-palace/87394693007/
"Thunder vs Trail Blazers recap: SGA, OKC win to improve…",/story/sports/nba/thunder/2025/11/30/thunder-trail-blazers-score-live-updates-nba-game-highlights-stats-injury-report/87540245007/
OU football podcast: Sooners are 10-2 and likely headed…,/story/sports/college/sooners/2025/11/30/ou-football-podcast-sooners-are-10-2-and-likely-headed-to-cfp-oklahoma-sooners/87534036007/
10 finds from lululemon's Cyber Monday sale—including viral belt bags,/story/shopping/2025/11/30/lululemon-cyber-week-deals-on-athleticwear/87543310007/
"Stanley tumblers, Bose earbuds + more viral Cyber Monday deals",/story/shopping/2025/11/30/cyber-monday-deals-on-viral-products/87540780007/
Shop popular Cyber Monday deals on gifts for Denver Broncos fans,/story/shopping/2025/11/30/cyber-monday-deals-denver-broncos-gifts/87464161007/
OU suspends grad student teacher after Bible-based essay complaint,/story/news/politics/2025/11/30/ou-suspends-grad-student-for-failing-student-who-cited-bible-in-essay/87540981007/
"Oklahoma Santas tell stories that will warm your heart, or break it",/story/news/2025/11/26/santa-claus-is-coming-to-town-oklahoma-okc-christmas-2025/87072787007/
OU student says Bible-based essay grade violated free-speech rights,/story/news/politics/2025/11/25/ou-oklahoma-student-bible-essay-free-speech-gender-roles/87376745007/
"3 takeaways: Thunder survives late scare to beat Deni Avdija, Blazers",/story/sports/nba/thunder/2025/11/30/thunder-vs-trail-blazers-score-shai-gilgeous-alexander-jalen-williams-nba-stats/87542791007/
How John Mateer carried offensive burden to likely punch CFP ticket,/story/sports/college/sooners/2025/11/30/ou-football-vs-lsu-qb-john-mateer-stats-oklahoma-sooners-cfp-race/87533046007/
How Oklahoma State football earned respect despite dismal 1-11 season,/story/sports/college/cowboys/2025/11/29/oklahoma-state-football-vs-iowa-state-osu-cowboys-effort-never-faded/87527335007/
Chickasha's giant leg lamp still standing over growing tourism,/story/business/2025/11/30/chickasha-ok-leg-lamp-still-standing/85416540007/
Two groups make case for modification of OG&E order approving new projects,/story/business/energy-resource/2025/11/30/aarp-oiec-oklahoma-corporation-commission-oge-order/87470873007/
"Frank Lloyd Wright buildings, mansions in Oklahoma: See inside",/picture-gallery/business/real-estate/2025/11/28/see-inside-these-frank-lloyd-wright-buildings-mansions-in-oklahoma/87509504007/
Let's remember how many remain poor when making spending decisions William C. Wertz,/story/opinion/columns/2025/11/30/raising-state-officials-salaries-tone-deaf-after-snap-cut-and-large-number-of-residents-in-poverty/87481316007/
Youth homelessness is increasing in Oklahoma. Human connection needed Rachel Bradley,/story/opinion/columns/guest/2025/11/30/okc-youth-need-guidance-and-support-not-just-place-to-shelter-for-night-or-two/87342973007/
OKC program provides mental health outreach to the homeless Patrick Clowe,/story/opinion/columns/guest/2025/11/30/research-is-clear-that-rehousing-and-mental-health-support-both-needed-for-homeless/86696082007/
See where In-N-Out is opening 3 new locations this year,/story/money/food/2025/11/30/in-n-out-tennessee-new-locations/87488270007/
"Senate to hold hearing on 'kill everybody' strike, Sen. Kelly says",/story/news/politics/2025/11/30/mark-kelly-senate-hearing-boat-strike/87539121007/
See if your numbers match Powerball's $719 million jackpot drawing,/story/money/lottery/2025/11/29/powerball-winning-numbers-lottery/87488543007/
"From Tapwerks to Molly Murphy's, see 18 restaurants OKC misses the most",/story/entertainment/dining/2025/11/29/12-closed-oklahoma-restaurants-that-left-their-mark/87451092007/
Can I take my Thanksgiving leftovers on the plane? See what TSA allows,/story/lifestyle/travel/2025/11/29/can-i-bring-thanksgiving-leftovers-plane-carryon-tsa-rules/87511754007/
Longtime OKC actor is playing Scrooge again in Lyric's 'A Christmas Carol',/story/entertainment/2025/11/29/an-okc-actor-is-scrooge-for-the-10th-time-in-lyrics-a-christmas-carol/87332304007/
,/picture-gallery/sports/college/cowboys/2025/11/30/mason-rudolph-oklahoma-state-cowboys-football-nfl-pittsburgh-steelers/87543140007/
Hurry and Enter!,https://usatoday.gannettcontests.com/USA-Today-Shopping/?itm_campaign=USA%20Today%20SHopping%20Giveaway&itm_medium=con&itm_source=secondStreet
ENTER TODAY!,https://usatoday.gannettcontests.com/New-Years-Eve-Live-Nashvilles-Big-Bash-2025/?itm_campaign=2025%20Nashville%20New%20Years%20Eve%20Sweepstake&itm_medium=con&itm_source=secondStreet
Enter Today!,https://oklahoman.gannettcontests.com/2025-The-Great-Holiday-Grocery/?itm_campaign=Homeland%20Great%20Holiday%20Grocery%20Giveaway&itm_medium=con&itm_source=secondStreet
"Oklahoma Santas tell stories that will warm your heart, or break it",/story/news/2025/11/26/santa-claus-is-coming-to-town-oklahoma-okc-christmas-2025/87072787007/
OU student says Bible-based essay grade violated free-speech rights,/story/news/politics/2025/11/25/ou-oklahoma-student-bible-essay-free-speech-gender-roles/87376745007/
Why Thunder guard Ajay Mitchell is no longer NBA's best-kept secret,/story/sports/nba/thunder/2025/11/30/okc-thunder-ajay-mitchell-stats-2025-26-nba-season/87475615007/
Chickasha's giant leg lamp still standing over growing tourism,/story/business/2025/11/30/chickasha-ok-leg-lamp-still-standing/85416540007/
Doug Meacham would 'love to' stay on OSU football staff under Eric Morris,/story/sports/college/cowboys/2025/11/30/oklahoma-state-football-interim-coach-doug-meacham-future-eric-morris-osu-cowboys-coaching-staff/87530668007/
,https://cm.oklahoman.com/site-feedback/?platform=Tangent-Desktop&url=https%3A%2F%2Fwww.oklahoman.com%2F&marketName=oklahoman&cta=Right-Rail
