headline,href
Delay in revealing latest OK County jail death angers critics,/story/news/2026/01/30/first-2026-oklahoma-county-jail-death-jeremiah-coffey/88435753007/
Teen arrested in connection with adoptive mother's murder in Logan County,/story/news/crime/2026/01/30/spring-weems-edmond-ok-murder-charges-adopted-son-jordan-weems/88436225007/
State SoonerCare agency says it needs $495M lifeline to make payroll,/story/news/politics/2026/01/30/oklahoma-soonercare-medicaid-agency-says-it-needs-495m-lifeline/88416701007/
"OSU wrestling vs Northern Iowa live updates, start time, TV, streaming",/story/sports/college/cowboys/2026/01/30/oklahoma-state-northern-iowa-score-live-updates-college-wrestling-osu-cowboys/88439338007/
Help us honor 250 women who shaped the United States,/story/news/local/2026/01/20/usa-today-women-who-shaped-the-nation-nomination-form-oklahoma-city/88264855007/
Thunder vs Nuggets injury update: Will Nikola Jokic play…,/story/sports/nba/thunder/2026/01/30/nikola-jokic-injury-update-nuggets-thunder-nba/88440700007/
,
"How much will new AD, OU football assistant coaches make…",/story/sports/college/sooners/2026/01/30/ou-board-of-regents-approves-contracts-jason-witten-roger-denny-sooners/88434348007/
OU athletic department reports losses of $43.7 million…,/story/sports/college/sooners/2026/01/30/ou-athletics-2025-fiscal-year-finances-revenue-oklahoma-sooners/88318434007/
What will Roger Denny bring to OU? Hear from AD who…,/story/sports/college/sooners/2026/01/30/ou-hiring-roger-denny-athletic-director-illinois-josh-whitman-oklahoma-sooners-fighting-illini/88417731007/
News,/news/
Delay in revealing latest OK County jail death angers critics,/story/news/2026/01/30/first-2026-oklahoma-county-jail-death-jeremiah-coffey/88435753007/
Teen arrested in connection with adoptive mother's murder in Logan County,/story/news/crime/2026/01/30/spring-weems-edmond-ok-murder-charges-adopted-son-jordan-weems/88436225007/
State SoonerCare agency says it needs $495M lifeline to make payroll,/story/news/politics/2026/01/30/oklahoma-soonercare-medicaid-agency-says-it-needs-495m-lifeline/88416701007/
Sports,/sports/
"OSU wrestling vs Northern Iowa live updates, start time, TV, streaming",/story/sports/college/cowboys/2026/01/30/oklahoma-state-northern-iowa-score-live-updates-college-wrestling-osu-cowboys/88439338007/
Chet Holmgren finally landing NBA All-Star bid should be 'no-brainer',/story/sports/nba/thunder/2026/01/30/chet-holmgren-nba-all-star-roster-odds-okc-thunder/88420593007/
Thunder vs Nuggets injury update: Will Nikola Jokic play Sunday night?,/story/sports/nba/thunder/2026/01/30/nikola-jokic-injury-update-nuggets-thunder-nba/88440700007/
Life,/life/
"Catherine O'Hara, 'Beetlejuice' and 'Schitt's Creek' star, dies at 71",/story/entertainment/celebrities/2026/01/30/catherine-ohara-death-age-71/88434443007/
Zach Bryan goes on new world tour with two Tulsa dates,/story/entertainment/2026/01/30/zach-bryan-tickets-tulsa-ok-ha-chapman-stadium/88432909007/
"OKC archbishop calls for 'calm, restraint and respect' in Minneapolis",/story/lifestyle/2026/01/28/okc-archbishop-who-is-national-leader-calls-for-calm-in-minneapolis/88382230007/
Business,/business/
Devon-Coterra merger agreement could come as early as next week,/story/business/2026/01/30/devon-energy-oklahoma-merger-coterra-energy/88436592007/
Developers set to start Roosevelt school renovations by April 2027,/story/business/downtown/2026/01/30/roosevelt-school-okc-redevelopment-contract-approved-april-2027/88420112007/
NATO-grade drone defense company to open offices in downtown OKC,/story/business/manufacturing/2026/01/29/mydefence-oklahoma-defense-drone-okc-renovate-downtown-warehouse-offices/88396990007/
Opinion,/opinion/
Immigration strategy isn't what Americans want. Time for a reset,/story/opinion/cartoons/2026/01/30/its-time-to-push-reset-button-on-immigration-stitt-says-cartoon/88420565007/
Protecting initiative petition process shouldn't be partisan issue,/story/opinion/letters/2026/01/30/oklahoma-hjr-1048-safeguards-our-right-to-petition/88352795007/
Oklahoma should be the state that proves homelessness can be solved Veronica Spark,/story/opinion/columns/guest/2026/01/29/oklahoma-like-finland-can-be-a-model-on-solving-homelessness-crisis/88384839007/
Trending,https://www.usatoday.com/news/trending/
'Vile and putrid' sewage floods East Coast river after pipe break,/story/news/nation/2026/01/30/potomac-river-flooded-with-raw-sewage/88435446007/
Watch: British Airways plane loses wheel after take-off from Vegas,/story/travel/news/2026/01/30/british-airways-plane-loses-wheel-vegas/88432136007/
Mike Johnson says government will 'inevitably' face short shut down,/story/news/politics/2026/01/29/mike-johnson-logisitics-shutdown/88422922007/
Shopping,/shopping/
"Don't miss the Australian Open women's final, watch live with Sling",/story/shopping/2026/01/30/how-to-watch-australian-open-womens-final-live-stream-sling/88413437007/
Shop 2026 engagement ring trends for Valentine's Day and beyond 💍,/story/shopping/2026/01/30/shop-engagement-ring-trends-2026/88435373007/
Timebeam NAD+ boosters and cryo tools are 15% off for winter,/story/shopping/2026/01/30/winter-skincare-sale-timebeam-nad-boosters/88438174007/
,/picture-gallery/sports/college/sooners/2026/01/29/oklahoma-sooners-vs-texas-am-aggies-in-sec-womens-basketball/88420429007/
ENTER NOW,https://usatoday.gannettcontests.com/State-Farm-Big-Game-/?itm_campaign=State%20Farm%20Big%20Game%20Sweepstakes&itm_medium=con&itm_source=secondStreet
Nominate Today!,https://www.profootballhof.com/news/2025/09/pro-football-hall-of-fame-awards-of-character-recognize-extraordinary-individuals/?utm_source=Localiq&utm_medium=promo&utm_campaign=awards&&itm_campaign=PFHOF%20Awards%20of%20Character&itm_medium=con&itm_source=secondStreet
Vote Each Week!,https://www.oklahoman.com/sports/high-school/?itm_campaign=Athlete%20of%20the%20Week%20Landmark%20OKC&itm_medium=con&itm_source=secondStreet
Devon-Coterra merger agreement could come as early as next week,/story/business/2026/01/30/devon-energy-oklahoma-merger-coterra-energy/88436592007/
Oklahoma Supreme Court declined to hear Bryce Drummond's appeal,/story/news/state/2026/01/30/oklahoma-supreme-court-declines-appeal-bryce-drummond-drivers-license/88431553007/
Chet Holmgren finally landing NBA All-Star bid should be 'no-brainer',/story/sports/nba/thunder/2026/01/30/chet-holmgren-nba-all-star-roster-odds-okc-thunder/88420593007/
"OK County: Jail housing deal done, but OKC Council has to approve it",/story/news/2026/01/30/okc-city-council-oklahoma-county-close-to-deal-housing-arrestees-county-jail/88413908007/
Four important things to watch this legislative session,/story/news/politics/2026/01/28/oklahoma-legislature-2026-legislative-session-what-to-watch/88067636007/
,https://cm.oklahoman.com/site-feedback/?platform=Tangent-Desktop&url=https%3A%2F%2Fwww.oklahoman.com%2F&marketName=oklahoman&cta=Right-Rail
