headline,href
Which central Oklahoma districts had A and F schools on report card?,/story/news/education/2025/01/06/oklahoma-school-report-cards-2023-2024-grades-how-did-districts-do/77429717007/
"Elite defense overwhelms Celtics, delivers Thunder a statement win",/story/sports/nba/thunder/2025/01/05/okc-thunder-vs-boston-celtics-defense-shai-gilgeous-alexander/77475298007/
What's the future of OKC's development? Join us for panel,/story/business/columns/steve-lackmeyer/2025/01/02/dick-tanenbaum-mark-beffort-christian-kanady-okc-develoment-panel-the-oklahoman/77348852007/
Questions remain in OK County's lawsuit against OKC over jail site,/story/news/2025/01/06/oklahoma-county-jail-site-lawsuit-against-okc-questions-remain/77363578007/
"Visual guide to Jimmy Carter's funeral, from Washington…",/in-depth/graphics/2024/12/30/jimmy-carter-funeral-plans-president-death-washington/5810636001/
Vote: Landmark Fine Homes girls HS athlete of the week…,/story/sports/high-school/2024/12/31/vote-landmark-fine-homes-girls-high-school-athlete-of-the-week-for-dec-23-29/77331067007/
Vote: Landmark Fine Homes boys athlete of the week for…,/story/sports/high-school/2024/12/31/vote-landmark-fine-homes-boys-high-school-athlete-of-the-week-for-dec-23-29/77330974007/
"When does tax season 2025 start? Deadlines, what to know",/story/business/finance/2025/01/06/when-does-tax-season-start-deadline-to-file-changes-in-2025-season/77432850007/
We said goodbye to these OKC-area restaurants in 2024…,/story/lifestyle/food/2025/01/06/8-okc-metro-area-restaurants-that-closed-in-2024/77270753007/
,
"Toss your take-out menus! Save on Home Chef, Purple Carrot, Blue Apron in 2025",/story/shopping/2025/01/02/new-year-meal-kit-offers/77402408007/
Crest Whitestrips are less than $30 at Amazon's winter sale,/story/shopping/2025/01/02/amazon-crest-whitestrips-winter-deal/77404070007/
$20 Sam's Club memberships are back! Join this January,/story/shopping/2025/01/01/sams-club-january-membership-deal/77263642007/
Which central Oklahoma districts had A and F schools on report card?,/story/news/education/2025/01/06/oklahoma-school-report-cards-2023-2024-grades-how-did-districts-do/77429717007/
Questions remain in OK County's lawsuit against OKC over jail site,/story/news/2025/01/06/oklahoma-county-jail-site-lawsuit-against-okc-questions-remain/77363578007/
Warming stations across OKC provide shelter from arctic blast,/story/news/2025/01/05/these-are-some-of-the-warming-stations-in-okc-for-cold-weather-shelter/77474195007/
"Elite defense overwhelms Celtics, delivers Thunder a statement win",/story/sports/nba/thunder/2025/01/05/okc-thunder-vs-boston-celtics-defense-shai-gilgeous-alexander/77475298007/
Barry Sanders' rushing record is intact and OSU faithful is relieved,/story/sports/college/cowboys/2025/01/06/oklahoma-state-football-rb-barry-sanders-1988-rushing-record-ashton-jeanty-boise-state/77432303007/
"Ohio State, you're now the College Football Playoff favorite. Deal with it.",/story/sports/ncaaf/2025/01/06/ohio-state-football-college-football-playoff-favorite/77319671007/
What's the future of OKC's development? Join us for panel,/story/business/columns/steve-lackmeyer/2025/01/02/dick-tanenbaum-mark-beffort-christian-kanady-okc-develoment-panel-the-oklahoman/77348852007/
"When does tax season 2025 start? Deadlines, what to know",/story/business/finance/2025/01/06/when-does-tax-season-start-deadline-to-file-changes-in-2025-season/77432850007/
"Employees with low vision or blindness find income, support at NewView",/story/business/local/2025/01/05/newview-oklahoma-helps-employees-low-vision-blindness-support/76129882007/
Gov. Sitt: Oklahoma is the land of opportunity. The world is taking notice. Gov. Kevin Stitt,/story/opinion/columns/2025/01/06/oklahoma-business-job-growth-kevin-stitt-2025/77434546007/
What grade would you give School Superintendent Ryan Walters for 2024?,/story/opinion/columns/your-voice/2025/01/06/ryan-walters-oklahoma-report-card-poll/76049036007/
Jimmy Carter left this world a better place Gene Rainbolt,/story/opinion/columns/2025/01/05/jimmy-carter-was-a-good-man-in-every-respect-of-the-word-opinion/77336957007/
"Ford, Tesla among nearly 400K vehicles recalled: See recent recalls",/story/money/cars/recalls/2025/01/06/car-recall-check-ford-tesla-gem/77435705007/
"Krispy Kreme, Pop-Tarts collaborate on new doughnut collection",/story/money/food/2025/01/06/krispy-kreme-pop-tart-doughnuts/77433291007/
Over 60 million affected by 'disruptive' winter storm: See photos,/story/news/weather/2025/01/05/winter-snow-storm-photos/77475609007/
We said goodbye to these OKC-area restaurants in 2024: See our list,/story/lifestyle/food/2025/01/06/8-okc-metro-area-restaurants-that-closed-in-2024/77270753007/
'Yellowstone' experience in Oklahoma: Here's 5 ranches to visit,/story/lifestyle/travel/2025/01/06/yellowstone-in-oklahoma-5-ranches-to-visit/77406645007/
Where to eat in and around Midtown OKC,/story/lifestyle/food/2025/01/06/best-restaurants-midtown-okc-list/76921945007/
,/picture-gallery/sports/nba/thunder/2025/01/02/okc-thunder-vs-l-a-clippers-at-paycom-center-see-our-top-photos/77411304007/
Enter Your Pet Photo Today,https://newsok.gannettcontests.com/USAs-Favorite-Pet/?itm_campaign=2024%20USAs%20Favorite%20Pet%20Photos%20Non-Sponsored&itm_medium=con&itm_source=secondStreet
Check out the Winners!,https://cdn.gatehousemedia.com/gh-sites/global/ads/contests/winners/2024wishwinWINNERS_RV2.pdf?itm_campaign=2024%20Wish%20and%20Win%20winners%20phase%202&itm_medium=con&itm_source=secondStreet
Winners Announced!,https://oklahoman.gannettcontests.com/2024-Oklahoman-Communitys-Choice-Awards-Winners/?itm_campaign=Oklahoma%202024%20BOB&itm_medium=con&itm_source=secondStreet
Gov. Sitt: Oklahoma is the land of opportunity. The world is taking notice.Gov. Kevin Stitt,/story/opinion/columns/2025/01/06/oklahoma-business-job-growth-kevin-stitt-2025/77434546007/
What grade would you give School Superintendent Ryan Walters for 2024?,/story/opinion/columns/your-voice/2025/01/06/ryan-walters-oklahoma-report-card-poll/76049036007/
Polar vortex explained: What causes the deep chill?,/story/weather/2025/01/06/polar-vortex-explained-what-causes-arctic-blasts-of-air-in-oklahoma/77433536007/
Barry Sanders' rushing record is intact and OSU faithful is relieved,/story/sports/college/cowboys/2025/01/06/oklahoma-state-football-rb-barry-sanders-1988-rushing-record-ashton-jeanty-boise-state/77432303007/
Cold weather updates: Oklahoma's frigid temperatures can be dangerous,/story/weather/2025/01/05/live-weather-updates-as-oklahoma-temperatures-dip-below-freezing/77473151007/
,https://cm.oklahoman.com/site-feedback/?platform=Tangent-Desktop&url=https%3A%2F%2Fwww.oklahoman.com%2F&marketName=oklahoman&cta=Right-Rail
