headline,href
Woman claims OK County Commissioner Myles Davidson tried to force her to have sex,/story/news/crime/2025/09/08/oklahoma-county-commissioner-myles-davidson-accusations-sexual-assault/86045215007/
Catholic church in Oklahoma to open an online school after SCOTUS ruling,/story/news/education/2025/09/08/oklahoma-catholic-church-plans-to-open-online-school-after-supreme-court-ruling/86047996007/
"Hail, very low risk of tornadoes possible Monday in Oklahoma. See radar",/story/weather/2025/09/08/severe-weather-storms-oklahoma-kansas-texas-radar-tornadoes-hail/86042891007/
Who are the state's best high school DLs? We examine the top 10,/story/sports/high-school/football/2025/09/08/oklahoma-high-school-football-top-defensive-linemen-2025-ossaa-season/86011898007/
"Why OU's OL, Bill Bedenbaugh received the game ball vs…",/story/sports/college/sooners/2025/09/08/ou-football-offensive-line-coach-bill-bedebuagh-awarded-game-ball-vs-michigan-oklahoma-sooners/86027231007/
Amy Coney Barrett says 'I'm nobody's justice.' That…,/story/news/politics/2025/09/08/amy-coney-barrett-trump-supreme-court-book/85935418007/
Public schools are the great equalizer. Parents can't…,/story/opinion/voices/2025/09/02/public-schools-meal-snap-benefits-hunger/85870693007/
Everything you need to know about the 2025 Oklahoma HS…,/story/sports/high-school/football/2025/08/26/oklahoma-high-school-football-2025-season-preview-ossaa-top-players/85827180007/
,
I know why Gen Z has become antisocial. But how do we…,/story/opinion/columnist/2025/08/19/alcohol-decline-drinking-gen-z-social/85667717007/
Woman claims OK County Commissioner Myles Davidson tried to force her to have sex,/story/news/crime/2025/09/08/oklahoma-county-commissioner-myles-davidson-accusations-sexual-assault/86045215007/
Catholic church in Oklahoma to open an online school after SCOTUS ruling,/story/news/education/2025/09/08/oklahoma-catholic-church-plans-to-open-online-school-after-supreme-court-ruling/86047996007/
"Hail, very low risk of tornadoes possible Monday in Oklahoma. See radar",/story/weather/2025/09/08/severe-weather-storms-oklahoma-kansas-texas-radar-tornadoes-hail/86042891007/
Who are the state's best high school DLs? We examine the top 10,/story/sports/high-school/football/2025/09/08/oklahoma-high-school-football-top-defensive-linemen-2025-ossaa-season/86011898007/
Where to watch Monday Night Football Vikings-Bears NFL game live today,/story/sports/nfl/2025/09/08/watch-monday-night-football-tonight-nfl-games-live-bears-vikings-game-today-time-tv-stream/86047515007/
Vote: Landmark Fine Homes HS boys athlete of the week for Sept. 1-6,/story/sports/high-school/athlete-of-the-week/2025/09/08/vote-landmark-fine-homes-okc-area-high-sschool-boys-athlete-of-week-sept-1-6/86042580007/
Oklahoma Corporation Commission study may shape nuclear energy future,/story/business/energy-resource/2025/09/07/oklahoma-corporation-commission-studying-nuclear-energy/85962973007/
Broadway Flex storage has buyers interested in non-traditional uses,/story/business/real-estate/2025/09/06/storage-space-okc-broadway-flex-opening-soon-construction/85972402007/
Could Edmond get a Shake Shack and Ruth's Chris? Officials weigh tax incentive,/story/business/2025/09/06/edmond-ok-sales-tax-ruths-chris-shake-shack-petsmart/85997931007/
AG Drummond should answer some questions about new Glossip trial Patrick Ryan,/story/opinion/columns/guest/2025/09/08/attorney-general-gentner-drummond-should-answer-questions-about-reasons-for-new-glossip-trial/85990328007/
An untold story from the 1921 Tulsa Race Massacre Jeffrey Myers,/story/opinion/columns/guest/2025/09/08/tulsa-oklahoma-race-massacre-1921-suicide-death-pioneer-tate-brady/85943128007/
Don't be fooled. UCO's control of student newspaper is about censorship Amy Hall,/story/opinion/letters/2025/09/07/university-of-central-oklahoma-journalism-newspaper-vista/85942529007/
Banksy mural at London's High Court shows judge striking protester,/story/news/world/2025/09/08/banksy-london-judge-protester-mural/86048179007/
7 Brew opens walk-thru location at Ohio State. What to know,/story/money/food/2025/09/08/7-brew-coffee-ohio-state-university/86044733007/
'Terrifying': Oregon Duck dresses up as Labubu in viral video,/story/sports/2025/09/08/oregon-duck-labubu-video/86042531007/
Vikings vs. Bears: How to watch Monday Night Football on Sling,/story/shopping/2025/09/08/how-to-watch-minnesota-vikings-vs-chicago-bears-monday-night-football-on-sling/85996313007/
Shop Gap's exclusive The Nightmare Before Christmas collection now,/story/shopping/2025/09/08/gap-the-nightmare-before-christmas-collection-launch/86044359007/
"We found a $20 promo code at Champs Sports: Save on New Balance, Nike",/story/shopping/2025/09/05/shop-sneaker-deals-champs-sports/85999347007/
Dining at OKANA: Every restaurant and what to eat,/story/lifestyle/food/2025/09/08/sample-the-dining-options-at-okana-tips-on-what-to-try/85380585007/
Jack Rabbit at OKANA Resort & Indoor Waterpark,/picture-gallery/lifestyle/food/2025/09/08/jack-rabbit-at-okana-resort-indoor-waterpark/85827122007/
Smokehouse Social at OKANA Resort & Indoor Waterpark,/picture-gallery/lifestyle/food/2025/09/08/smokehouse-social-at-okana-resort-indoor-waterpark/85827198007/
,/picture-gallery/sports/high-school/football/2025/09/08/oklahoma-high-school-football-ossaa-week-1-top-photos/86041214007/
Nominate Today!,https://www.profootballhof.com/news/2025/09/pro-football-hall-of-fame-awards-of-character-recognize-extraordinary-individuals/?utm_source=Localiq&utm_medium=promo&utm_campaign=awards&&itm_campaign=PFHOF%20Awards%20of%20Character&itm_medium=con&itm_source=secondStreet
Winners Announced!,https://oklahoman.gannettcontests.com/2025-Oklahoman-Communitys-Choice-Awards-Winners/?itm_campaign=Oklahoma%20Bob&itm_medium=con&itm_source=secondStreet
Vote Each Week!,https://www.oklahoman.com/sports/high-school/?itm_campaign=Athlete%20of%20the%20Week%20Landmark%20OKC&itm_medium=con&itm_source=secondStreet
Stitt's call to Make Oklahoma Healthy Again spurs little action so far,/story/news/politics/2025/09/08/rfk-jr-make-oklahoma-healthy-again-shows-little-progress/85962771007/
Where to watch Monday Night Football Vikings-Bears NFL game live today,/story/sports/nfl/2025/09/08/watch-monday-night-football-tonight-nfl-games-live-bears-vikings-game-today-time-tv-stream/86047515007/
Vote: Landmark Fine Homes HS boys athlete of the week for Sept. 1-6,/story/sports/high-school/athlete-of-the-week/2025/09/08/vote-landmark-fine-homes-okc-area-high-sschool-boys-athlete-of-week-sept-1-6/86042580007/
Lewd Epstein letter allegedly signed by Trump goes public,/story/news/politics/2025/09/08/donald-trump-jeffrey-epstein-birthday-letter-wonderful-secret/86046973007/
The Oklahoman's Class 6A-I to C football rankings for Week 2,/story/sports/high-school/football/2025/09/08/oklahoma-high-school-football-the-oklahomans-week-2-ossaa-state-rankings/86018154007/
,https://cm.oklahoman.com/site-feedback/?platform=Tangent-Desktop&url=https%3A%2F%2Fwww.oklahoman.com%2F&marketName=oklahoman&cta=Right-Rail
