headline,href
How proposed law would limit access to IVF treatments for OklahomansTodd Pendleton,/story/opinion/2024/03/25/ivf-treatments-oklahoma-may-be-limited-house-bill-3013-alabama/73077350007/
Lawsuit says Swadley's cheated state out of more than $4.7M,/story/news/2024/03/25/swadleys-lawsuit-cheated-oklahoma-tourism-out-of-millions/73070496007/
"Amid national turmoil, Oklahoma Baptist church has its own reckoning",/story/news/2024/03/24/broken-arrow-southern-baptist-church-oklahoma-investigates-former-minister-history-abuse/72248956007/
"OU women's basketball vs Indiana: NCAA live score updates, highlights",/story/sports/college/sooners/2024/03/25/oklahoma-womens-basketball-vs-indiana-live-score-updates-ncaa-march-madness/73096956007/
Investors paying for solar panels at Norman North…,/story/news/education/campus/2024/03/25/norman-public-schools-ok-solar-panel-installation-through-tax-credit/73070566007/
Nine OKC options for preordering or eating out on Easter…,/story/lifestyle/food/2024/03/23/easter-2024-sunday-food-preorders-reservations-in-oklahoma-city/73055082007/
Vote: Who was the best Oklahoma high school athlete last…,/story/sports/high-school/2024/03/25/vote-landmark-fine-homes-oklahoma-high-school-athlete-of-week-march-19-25/73095775007/
,
OSU basketball coach big board: Who tops latest list of…,/story/sports/college/cowboys/2024/03/25/oklahoma-state-basketball-coaching-search-kellen-sampson-bryce-drew-amir-abdur-rahim/73091086007/
"After investing in Oklahoma marijuana, Asian immigrants…",/story/news/2024/03/25/oklahoma-marijuana-farm-crime-crackdown-targets-asians-immigrants-say/73091011007/
Lawsuit says Swadley's cheated state out of more than $4.7M,/story/news/2024/03/25/swadleys-lawsuit-cheated-oklahoma-tourism-out-of-millions/73070496007/
"Amid national turmoil, Oklahoma Baptist church has its own reckoning",/story/news/2024/03/24/broken-arrow-southern-baptist-church-oklahoma-investigates-former-minister-history-abuse/72248956007/
"Live music, film and fun at the Film and Music Day at the Capitol",/picture-gallery/news/2024/03/25/reservation-dogs-oklahoma-city-film-music-day-capitol/73095770007/
"OU women's basketball vs Indiana: NCAA live score updates, highlights",/story/sports/college/sooners/2024/03/25/oklahoma-womens-basketball-vs-indiana-live-score-updates-ncaa-march-madness/73096956007/
Photos: OU hosts Big 12 women's gymnastics championships,/picture-gallery/sports/college/big-12/2024/03/23/ou-womens-gymnastics-host-big-12-championships-see-our-best-photos/73081708007/
Vote: Who was the best Oklahoma high school athlete last week?,/story/sports/high-school/2024/03/25/vote-landmark-fine-homes-oklahoma-high-school-athlete-of-week-march-19-25/73095775007/
Realtors' lawsuit settlement could reduce Oklahoma agents' commissions,/story/business/real-estate/2024/03/25/oklahoma-real-estate-realtors-lawsuit-could-rattle-home-market/73032462007/
Are accessory dwelling units the solution to OKC's housing shortage?,/story/business/real-estate/2024/03/24/okc-real-estate-accessory-dwelling-units-may-be-approved/72992180007/
Oklahoma joins feds in Apple iPhone antitrust lawsuit,/story/business/2024/03/22/oklahoma-joins-apple-iphone-antitrust-lawsuit/73064659007/
How proposed law would limit access to IVF treatments for Oklahomans Todd Pendleton,/story/opinion/2024/03/25/ivf-treatments-oklahoma-may-be-limited-house-bill-3013-alabama/73077350007/
Oklahoma politicians have a nasty habit of questioning the will of the voters Janelle Strecklein,/story/opinion/2024/03/25/oklahoma-politicians-voters-initiative-petition/73092111007/
This commission breaks down barriers for Oklahoma women. Here’s how. Brenda Jones Barwick,/story/opinion/columns/2024/03/25/womens-history-month-oklahoma-commission-equity-justice/73057773007/
"FAA issues advisory to aircraft, airmen before total solar eclipse",/story/travel/2024/03/25/faa-solar-eclipse-advisory/73095937007/
2 NYC teens fatally shot within 20 minutes in separate incidents: Police,/story/news/nation/2024/03/25/nyc-shootings-teens-killed-harlem-brooklyn/73094005007/
'Fallout' coming to TV: Details on the 'gleefully weird' post-apocalyptic show,/story/entertainment/tv/2024/03/25/fallout-tv-show-release-date/73089960007/
Nine OKC options for preordering or eating out on Easter Sunday,/story/lifestyle/food/2024/03/23/easter-2024-sunday-food-preorders-reservations-in-oklahoma-city/73055082007/
"If your teens say they don't want their stories shared, listen",/story/lifestyle/2024/03/25/20-40-60-etiquette-listen-to-your-teens-if-they-say-they-dont-want-stories-shared/72971162007/
Find a friend like Simon and others at OKC-area shelters | Adopt a pet,/story/lifestyle/2024/03/25/provide-a-furever-home-to-animals-at-okc-area-shelters-adopt-a-pet/73022042007/
,/picture-gallery/sports/college/big-12/2024/03/23/ou-womens-gymnastics-host-big-12-championships-see-our-best-photos/73081708007/
Don’t Miss Out!,https://oklahoman.gannettcontests.com/2024-Home-and-Garden-Refresh/?itm_campaign=2024%20Home%20%26amp%3B%20Garden%20Refresh%20-%20The%20Oklahoman&itm_medium=con&itm_source=secondStreet
ENTER TODAY,https://usatoday.gannettcontests.com/Bourbon-and-Beyond-VIP-Experience-2024/?itm_campaign=Bourbon%20and%20Beyond%202024&itm_medium=con&itm_source=secondStreet
Vote Today,https://oklahoman.gannettcontests.com/2024-OKC-Metro-High-School-Sports-Awards-School-Spirit/?itm_campaign=HS%20School%20Spirit%20OKC&itm_medium=con&itm_source=secondStreet
"Live music, film and fun at the Film and Music Day at the Capitol",/picture-gallery/news/2024/03/25/reservation-dogs-oklahoma-city-film-music-day-capitol/73095770007/
Here's a look at how many tornadoes Oklahoma saw in 2023,/story/news/2024/03/25/tornado-season-oklahoma-how-many-tornadoes-did-we-get-last-year/73067899007/
Oklahoma politicians have a nasty habit of questioning the will of the votersJanelle Strecklein,/story/opinion/2024/03/25/oklahoma-politicians-voters-initiative-petition/73092111007/
Chinese diplomat's visits to Oklahoma crime groups concern officials,/story/news/2024/03/25/chinese-embassy-diplomat-visits-oklahoma-marijuana-organized-crime-groups/73091127007/
Realtors' lawsuit settlement could reduce Oklahoma agents' commissions,/story/business/real-estate/2024/03/25/oklahoma-real-estate-realtors-lawsuit-could-rattle-home-market/73032462007/
,https://cm.oklahoman.com/site-feedback/?platform=Tangent-Desktop&url=https%3A%2F%2Fwww.oklahoman.com%2F&marketName=oklahoman&cta=Right-Rail
