headline,href
How 'National Blue' and 'Corn Gold' led to Oklahoma's iconic sausage,/story/lifestyle/food/2025/09/17/blue-and-gold-sausage-oklahoma-history/85431458007/
Nonprofit calls for county jail to be returned to sheriff after shakeup,/story/news/2025/09/17/oklahoma-county-jail-shakeup-interim-ceo-paul-timmons-resigns-peoples-council-justice-reform/86179683007/
Mussatto: Time to come to terms with what Jaydn Ott is: a 4th-teamer,/story/sports/college/sooners/2025/09/17/ou-football-rb-jaydn-ott-playing-time-depth-chart-oklahoma-sooners/86186439007/
Push to change primary election system scores state Supreme Court win,/story/news/politics/2025/09/16/oklahoma-supreme-court-rules-state-question-846-open-primaries/86185719007/
ICE's 'Speedway Slammer' propaganda gets IndyCar – and…,/story/opinion/2025/08/12/ice-speedway-slammer-indycar-dhs/85611456007/
My Gen Z friends are having doubts about Trump. Here's…,/story/opinion/voices/2025/08/06/trump-jeffrey-epstein-gen-z-republican-voters/85513159007/
"No, Trump's immigration crackdown isn't focused on 'the…",/story/opinion/columnist/2025/08/04/trump-ice-immigrants-rogan-popularity/85445010007/
Coaches confidential: Should OSSAA be disbanded? Coaches…,/story/sports/high-school/football/2025/09/17/oklahoma-high-school-coaches-confidential-should-ossaa-be-disbanded/86183412007/
,
"Loki, Uno, Zues, others at OKC-area shelters ready for…",/story/lifestyle/2025/09/17/your-furever-friend-is-available-at-okc-area-shelters-adopt-a-pet/86043013007/
Nonprofit calls for county jail to be returned to sheriff after shakeup,/story/news/2025/09/17/oklahoma-county-jail-shakeup-interim-ceo-paul-timmons-resigns-peoples-council-justice-reform/86179683007/
Push to change primary election system scores state Supreme Court win,/story/news/politics/2025/09/16/oklahoma-supreme-court-rules-state-question-846-open-primaries/86185719007/
Terrorism charges dismissed against accused CEO killer Luigi Mangione,/story/news/nation/2025/09/16/accused-ceo-killer-luigi-mangione-court-appearance/86164846007/
Mussatto: Time to come to terms with what Jaydn Ott is: a 4th-teamer,/story/sports/college/sooners/2025/09/17/ou-football-rb-jaydn-ott-playing-time-depth-chart-oklahoma-sooners/86186439007/
Coaches confidential: Should OSSAA be disbanded? Coaches weigh in,/story/sports/high-school/football/2025/09/17/oklahoma-high-school-coaches-confidential-should-ossaa-be-disbanded/86183412007/
"OKC Thunder isn't affected by Kawhi Leonard, Clippers investigation",/story/sports/nba/thunder/2025/09/17/okc-thunder-impact-nba-investigation-kawhi-leonard-los-angeles-clippers-salary-cap/86185373007/
"First-time home ownership is still possible, Oklahoma agents say",/story/business/real-estate/2025/09/14/oklahoma-homes-sale-first-time-home-buyer-trends/86115814007/
This former OKC office building is getting new life. Here's what renovations are planned,/story/business/real-estate/2025/09/11/former-baptist-building-in-oklahoma-city-undergoes-storage-conversion/86081687007/
See latest progress on Myriad Convention Center demolition,/picture-gallery/business/local/2025/09/10/see-the-latest-photos-of-okc-myriad-convention-center-demolition/86080583007/
"Readers share thoughts on Kirk death, how we ease political discourse",/story/opinion/2025/09/17/charlie-kirk-death-oklahoma-political-discourse/86117256007/
Threats of prosecution and punishment can chill free speech Joseph Thai,/story/opinion/columns/guest/2025/09/17/free-speech-first-amendment-scotus-support/86180526007/
Oklahoma's last place in the rankings that matter most Chad Warmington,/story/opinion/columns/guest/2025/09/16/oklahoma-reading-scores-bottom-no-public-outcry/86135263007/
"2 shootings occur in 1 day in Minneapolis, leaving multiple injured",/story/news/nation/2025/09/17/minneapolis-homeless-encampment-shootings/86187084007/
"Tropical depression forms in Atlantic: See path, tracker, forecast",/story/news/weather/2025/09/17/tropical-storm-gabrielle-path-tracker-atlantic/86195198007/
Ben & Jerry's co-founder quits over clash with parent company,/story/money/2025/09/17/ben-jerrys-jerry-greenfield-quits-unilever-silenced-brand/86195269007/
Don't wait for October! Shop early tech deals at Amazon now,/story/shopping/2025/09/17/shop-early-amazon-prime-big-deal-days-tech-deals/86111486007/
Amazon’s Prime Big Deal Days sale is confirmed! Shop early deals here,https://www.usatoday.com/story/shopping/2025/09/16/amazon-october-prime-day-sale-date-announcement/85959578007/
Paige Bueckers named WNBA Rookie of the Year. Shop Paige Nike gear now,/story/shopping/2025/09/16/how-to-buy-paige-bueckers-dallas-wings-wnba-jersey-nike-gear-rookie-of-the-year/86185343007/
How 'National Blue' and 'Corn Gold' led to Oklahoma's iconic sausage,/story/lifestyle/food/2025/09/17/blue-and-gold-sausage-oklahoma-history/85431458007/
"Loki, Uno, Zues, others at OKC-area shelters ready for homes",/story/lifestyle/2025/09/17/your-furever-friend-is-available-at-okc-area-shelters-adopt-a-pet/86043013007/
How do you use your Blue & Gold? Here are our favorite recipes,/story/lifestyle/food/2025/09/17/blue-and-gold-sausage-recipes-the-oklahoman-readers/85973129007/
,/picture-gallery/news/2025/09/17/blue-and-gold-sausage-factory-photos/85530663007/
Enter Every Day!,https://newsok.gannettcontests.com/2025-Fall-50K-Project-Home-Improved-FPHI/?itm_campaign=2025%20Fall%20Home%20Improved%20NON-Sponsored&itm_medium=con&itm_source=secondStreet
Nominate Today!,https://www.profootballhof.com/news/2025/09/pro-football-hall-of-fame-awards-of-character-recognize-extraordinary-individuals/?utm_source=Localiq&utm_medium=promo&utm_campaign=awards&&itm_campaign=PFHOF%20Awards%20of%20Character&itm_medium=con&itm_source=secondStreet
Winners Announced!,https://oklahoman.gannettcontests.com/2025-Oklahoman-Communitys-Choice-Awards-Winners/?itm_campaign=Oklahoma%20Bob&itm_medium=con&itm_source=secondStreet
"Readers share thoughts on Kirk death, how we ease political discourse",/story/opinion/2025/09/17/charlie-kirk-death-oklahoma-political-discourse/86117256007/
Terrorism charges dismissed against accused CEO killer Luigi Mangione,/story/news/nation/2025/09/16/accused-ceo-killer-luigi-mangione-court-appearance/86164846007/
Threats of prosecution and punishment can chill free speechJoseph Thai,/story/opinion/columns/guest/2025/09/17/free-speech-first-amendment-scotus-support/86180526007/
Everything you need to know about the 2025 Oklahoma HS football season,/story/sports/high-school/football/2025/08/26/oklahoma-high-school-football-2025-season-preview-ossaa-top-players/85827180007/
I know why Gen Z has become antisocial. But how do we fix it?Dace Potas,/story/opinion/columnist/2025/08/19/alcohol-decline-drinking-gen-z-social/85667717007/
,https://cm.oklahoman.com/site-feedback/?platform=Tangent-Desktop&url=https%3A%2F%2Fwww.oklahoman.com%2F&marketName=oklahoman&cta=Right-Rail
