headline,href
"Summer heat retreats as heavy rains cross US, Oklahoma: What to expect",/story/weather/2025/08/25/heavy-rain-flooding-in-oklahoma-this-week-will-it-rain-on-labor-day/85815094007/
Why George Nigh interrupted a Caribbean vacation to return to OklahomaMichael Korenblit,/story/opinion/columns/guest/2025/08/24/former-governor-george-nigh-caribbean-vacation-clara-luper/85715747007/
"OU QB John Mateer achieved 'goal' of captain, prepared for opener",/story/sports/college/sooners/2025/08/25/ou-football-john-mateer-sooners-team-captain/85825984007/
Brent Venables on RBs: Jovantae Barnes had his best camp 'by far',/story/sports/college/sooners/2025/08/25/ou-football-injury-updates-jaydn-ott-taylor-tatum-status-week-1-sooners/85823801007/
Dual detention: How the Oklahoma County jail will work…,/story/news/2025/08/25/oklahoma-county-jail-will-operate-two-locations/85729678007/
OKC police arrest teen connected to a deadly shooting,/story/news/crime/2025/08/25/okc-police-arrest-teen-fatal-shooting-northeast-oklahoma-city/85815653007/
,
One dead in late Saturday stabbing at OKC homeless…,/story/news/crime/2025/08/25/northwest-okc-stabbing-homeless-encampment-death/85823043007/
Vote: Landmark Fine Homes HS athlete of the week for Aug…,/story/sports/high-school/athlete-of-the-week/2025/08/25/vote-landmark-fine-homes-okc-area-high-school-athlete-of-the-week-august-18-24/85817349007/
OSU football reveals 2025 depth chart: See full roster…,/story/sports/college/cowboys/2025/08/25/oklahoma-state-football-depth-chart-roster-update-osu-cowboys/85820697007/
"Summer heat retreats as heavy rains cross US, Oklahoma: What to expect",/story/weather/2025/08/25/heavy-rain-flooding-in-oklahoma-this-week-will-it-rain-on-labor-day/85815094007/
"Insurance scheme targeted Oklahomans seeking drug treatment, lawsuit says",/story/news/2025/08/25/blue-cross-blue-shield-oklahoma-sues-california-drug-treatment-facilities/85820137007/
An investigation has led to a change in execution plans in Oklahoma,/story/news/2025/08/25/hurricane-katrina-evacuee-could-be-executed-in-oklahoma-in-october/85786168007/
Brent Venables on RBs: Jovantae Barnes had his best camp 'by far',/story/sports/college/sooners/2025/08/25/ou-football-injury-updates-jaydn-ott-taylor-tatum-status-week-1-sooners/85823801007/
Oklahoma high school football 2025 Class 3A preseason rankings,/story/sports/high-school/football/2025/08/25/oklahoma-high-school-football-2025-ossaa-class-3a-preseason-rankings/85802953007/
Oklahoma high school football 2025 Class 4A preseason rankings,/story/sports/high-school/football/2025/08/25/oklahoma-high-school-football-2025-ossaa-class-4a-preseason-rankings/85709868007/
Google's data center expansion in Oklahoma is setting investment record,/story/business/economy/2025/08/19/oklahoma-google-data-center-sets-investment-record-oklahoma/85700838007/
Google's $9 billion plan for Oklahoma expands data center presence,/story/business/2025/08/13/google-announces-new-data-center-in-stillwater-expansion-in-pryor/85640825007/
New $50 million light pole manufacturing plant to be built at OKC 577,/story/business/manufacturing/2025/08/13/okc-council-approves-incentive-deal-kearney-national-inc-plant/85631144007/
Why George Nigh interrupted a Caribbean vacation to return to Oklahoma Michael Korenblit,/story/opinion/columns/guest/2025/08/24/former-governor-george-nigh-caribbean-vacation-clara-luper/85715747007/
"We should commend Hunter Biden for his addiction honesty, not mock him K. John Lee",/story/opinion/columns/guest/2025/08/25/hunter-biden-addiction-honesty-deserves-support-not-mocking/85724371007/
"Stitt, Walters and Drummond are circumventing our Legislature Janelle Stecklein",/story/opinion/columns/guest/2025/08/25/ryan-walters-oklahoma-governor-kevin-stitt-executive-branch-unconstitutional-power/85816119007/
St. Louis County explosion destruction caught on video,/story/news/nation/2025/08/25/st-louis-county-explosion-video/85824465007/
See if your numbers match Powerball's $750 million jackpot drawing,/story/money/lottery/2025/08/25/powerball-winning-numbers-august-25-2025/85825167007/
Evacuation ordered for California's Pickett Fire,/story/news/nation/2025/08/25/pickett-fire-evacuation-napa-county-california/85815494007/
Get new Allbirds shoes for as low as $60 right now,/story/shopping/2025/08/25/allbirds-labor-day-shoe-sale/85800370007/
Adults-only: Save up to 70% at Lovehoney's Labor Day sale,/story/shopping/2025/08/25/lovehoney-labor-day-sale/85815724007/
New Wilson tennis apparel debuting at 2025 U.S. Open,/story/shopping/2025/08/25/shop-wilson-us-open-tennis-apparel-sport-professional-collection/85822147007/
See Cross Canadian Ragweed hint at a 2026 Stillwater show,/videos/entertainment/2025/08/25/watch-cross-canadian-ragweed-tease-a-2026-stillwater-concert/85819219007/
"What time does 'Love Island' reunion come out? Stream, watch in OKC",/story/entertainment/television/2025/08/25/when-does-love-island-reunion-air-stream-watch-parties-in-okc/85815243007/
"Visitor spending, tax receipts bloomed with 'Boys from Oklahoma' OSU shows",/story/entertainment/2025/08/25/stillwater-economy-bloomed-with-cross-canadian-ragweeds-osu-reunion-shows/83493754007/
,/picture-gallery/news/2025/08/25/horace-mann-prek-okcps-photos/85781890007/
Enter Today!,https://palmbeachpost.gannettcontests.com/Ireland-US-Experience-Football-Getaway/?itm_campaign=Ireland%20US%20Experience&itm_medium=con&itm_source=secondStreet
ENTER NOW! ENTER OFTEN!,https://oklahoman.gannettcontests.com/2025-Oklahoma-State-Fair/?itm_campaign=2025%20Oklahoma%20State%20Fair%20Ultimate%20Giveaway&itm_medium=con&itm_source=secondStreet
Winners Announced!,https://oklahoman.gannettcontests.com/2025-Oklahoman-Communitys-Choice-Awards-Winners/?itm_campaign=Oklahoma%20Bob&itm_medium=con&itm_source=secondStreet
"Insurance scheme targeted Oklahomans seeking drug treatment, lawsuit says",/story/news/2025/08/25/blue-cross-blue-shield-oklahoma-sues-california-drug-treatment-facilities/85820137007/
Oklahoma high school football 2025 Class 3A preseason rankings,/story/sports/high-school/football/2025/08/25/oklahoma-high-school-football-2025-ossaa-class-3a-preseason-rankings/85802953007/
Oklahoma high school football 2025 Class 4A preseason rankings,/story/sports/high-school/football/2025/08/25/oklahoma-high-school-football-2025-ossaa-class-4a-preseason-rankings/85709868007/
"Class A-I football district previews 2025: Polls, storylines & more",/story/sports/high-school/football/2025/08/25/oklahoma-high-school-football-ossaa-2025-class-a-i-district-previews/85714819007/
An investigation has led to a change in execution plans in Oklahoma,/story/news/2025/08/25/hurricane-katrina-evacuee-could-be-executed-in-oklahoma-in-october/85786168007/
,https://cm.oklahoman.com/site-feedback/?platform=Tangent-Desktop&url=https%3A%2F%2Fwww.oklahoman.com%2F&marketName=oklahoman&cta=Right-Rail
