headline,href
"Bill Clinton, others pay tribute to George Nigh at his memorial",/story/news/politics/2025/08/14/bill-clinton-remembers-george-nigh-oklahoma-governor-memorial-service/85647903007/
"Thunder NBA schedule: See all 82 games, dates for 2025-26 season",/story/sports/nba/thunder/2025/08/14/okc-thunder-schedule-2025-26-nba-release-game-times-dates/85652073007/
Commission allows lawmakers to use campaign funds for security systems,/story/news/politics/2025/08/14/oklahoma-lawmakers-private-security-melissa-hortman-mn/85656983007/
Judge overseeing Richard Glossip's murder case steps down,/story/news/2025/08/14/richard-glossip-case-oklahoma-new-trial-judge/85660623007/
See photos from the first day of school at Heartland…,/picture-gallery/news/2025/08/14/edmond-ok-heartland-middle-first-day-of-school-photos/85659723007/
Oklahoma schools continue to charge for lunches despite…,/story/news/education/2025/08/14/ryan-walters-oklahoma/85658146007/
Oklahoma high school football: Class 6A-I football…,/story/sports/high-school/football/2025/08/14/oklahoma-high-school-football-class-6a-i-football-district-previews-2025/85646537007/
Oklahoma HS football takeaways from Day 3 of preseason…,/story/sports/high-school/football/2025/08/14/oklahoma-high-school-football-takeaways-third-day-2025-practices/85651814007/
,
Vote: Who is best Oklahoma high school offensive lineman…,/story/sports/high-school/football/2025/08/14/oklahoma-high-school-football-vote-top-offensive-lineman-2025-season/85626397007/
"Bill Clinton, others pay tribute to George Nigh at his memorial",/story/news/politics/2025/08/14/bill-clinton-remembers-george-nigh-oklahoma-governor-memorial-service/85647903007/
Commission allows lawmakers to use campaign funds for security systems,/story/news/politics/2025/08/14/oklahoma-lawmakers-private-security-melissa-hortman-mn/85656983007/
Judge overseeing Richard Glossip's murder case steps down,/story/news/2025/08/14/richard-glossip-case-oklahoma-new-trial-judge/85660623007/
"Thunder NBA schedule: See all 82 games, dates for 2025-26 season",/story/sports/nba/thunder/2025/08/14/okc-thunder-schedule-2025-26-nba-release-game-times-dates/85652073007/
Most impressive during OU football camp? Start with this Sooner coach,/story/sports/college/sooners/2025/08/14/ou-football-bill-bedenbaugh-sooners-offensive-line-coach-weight-loss-health/85646624007/
Taje McCoy 'jack of all trades' for OSU football at outside linebacker,/story/sports/college/cowboys/2025/08/14/oklahoma-state-football-taje-mccoy-jack-of-all-trades-todd-grantham-defense-osu-cowboys/85648464007/
Google's $9 billion plan for Oklahoma expands data center presence,/story/business/2025/08/13/google-announces-new-data-center-in-stillwater-expansion-in-pryor/85640825007/
New $50 million light pole manufacturing plant to be built at OKC 577,/story/business/manufacturing/2025/08/13/okc-council-approves-incentive-deal-kearney-national-inc-plant/85631144007/
Conversion of Cotton Exchange into housing to proceed with tax credits,/story/business/downtown/2025/08/13/okc-apartments-cotton-exchange-building-court-plaza-conversion/85532574007/
Let's be welcoming to those who want to be Oklahomans,/story/opinion/editorials/2025/08/14/oklahoma-immigration-law-in-state-tuition-for-students/85608300007/
Let's keep national school performance rankings in perspective John Thompson,/story/opinion/columns/guest/2025/08/14/oklahoma-public-schools-reading-scores-national-assessment-educational-progress-misleading/85648096007/
Maybe Oklahoma has to go back to basics to fix our schools Mark McBride,/story/opinion/columns/2025/08/14/oklahoma-schools-education-scores-decline-nations-report-card/85617930007/
Here's the tea: Why AriZona may raise price of famous 99-cent cans,/story/money/2025/08/14/arizona-iced-tea-99-cent-tariffs-trump/85656285007/
Taco Bell menu sees return of Cheesy Street Chalupas,/story/money/food/2025/08/14/taco-bell-cheesy-street-chalupas/85660350007/
Walmart employees now get 10% off most items after discount expansion,/story/money/shopping/2025/08/14/walmart-employee-discount-groceries-expanded/85656732007/
Get the new Millie Bobby Brown x Crocs Unfurgettable Clog for fall,/story/shopping/2025/08/14/new-crocs-unfurgettable-collection-millie-bobby-brown/85667152007/
"With the NBA schedule drop, here's how to get your team's tickets",/story/shopping/2025/08/14/shop-nba-tickets-2025-26-full-schedule-release/85649229007/
Taylor Swift's Life of a Showgirl era: Shop her viral orange lipstick,/story/shopping/2025/08/14/taylor-swift-life-of-a-showgirl-era-orange-lipstick/85657964007/
These 19 restaurants are serving up Ten Buck Lunch Week specials,/story/lifestyle/food/2025/08/14/ten-buck-lunch-week-2025-restaurants-midtown-oklahoma-city/85577722007/
What time is 'Big Brother' on? How to watch Thursday's eviction,/story/entertainment/television/2025/08/14/what-time-is-big-brother-on-how-to-watch-thursdays-eviction/85657125007/
"'Landman' season 2 release date announced: How to watch, stream",/story/entertainment/television/2025/08/14/landman-season-2-date-announced-heres-when-to-stream-on-paramount/85655868007/
,/picture-gallery/news/2025/08/14/george-nigh-oklahoma-memorial-services-photos-crossings-community-church/85641903007/
Enter Today!,https://palmbeachpost.gannettcontests.com/Ireland-US-Experience-Football-Getaway/?itm_campaign=Ireland%20US%20Experience&itm_medium=con&itm_source=secondStreet
ENTER NOW! ENTER OFTEN!,https://oklahoman.gannettcontests.com/2025-Oklahoma-State-Fair/?itm_campaign=2025%20Oklahoma%20State%20Fair%20Ultimate%20Giveaway&itm_medium=con&itm_source=secondStreet
Winners Announced!,https://oklahoman.gannettcontests.com/2025-Oklahoman-Communitys-Choice-Awards-Winners/?itm_campaign=Oklahoma%20Bob&itm_medium=con&itm_source=secondStreet
Most impressive during OU football camp? Start with this Sooner coach,/story/sports/college/sooners/2025/08/14/ou-football-bill-bedenbaugh-sooners-offensive-line-coach-weight-loss-health/85646624007/
Taje McCoy 'jack of all trades' for OSU football at outside linebacker,/story/sports/college/cowboys/2025/08/14/oklahoma-state-football-taje-mccoy-jack-of-all-trades-todd-grantham-defense-osu-cowboys/85648464007/
Why were OK agencies offline for hours? Here's what officials said,/story/news/politics/2025/08/14/oklahoma-internet-outage-state-agencies-software-bug/85663921007/
Let's be welcoming to those who want to be Oklahomans,/story/opinion/editorials/2025/08/14/oklahoma-immigration-law-in-state-tuition-for-students/85608300007/
"How to watch, stream Team USA softball vs China in World Games",/story/sports/college/softball/2025/08/14/team-usa-softball-china-channel-today-world-games-time-tv-schedule-streaming-info/85657717007/
,https://cm.oklahoman.com/site-feedback/?platform=Tangent-Desktop&url=https%3A%2F%2Fwww.oklahoman.com%2F&marketName=oklahoman&cta=Right-Rail
