headline,href
Ryan Walters says Tulsa schools taking Chinese money; district says untrue,/story/news/politics/government/2023/08/03/ryan-walters-oklahoma-tulsa-public-schools-confucius-classrooms-claim/70520563007/
Coming soon: The Oklahoman's Public Eye is looking out for you,/story/news/local/2023/07/27/the-oklahoman-okc-public-eye-how-to-submit-problem/70464561007/
Oklahoma's tax free weekend begins Aug. 4: How to save for back-to-school,/story/news/local/2023/07/21/tax-free-weekend-oklahoma-2023-back-to-school-what-to-know/70437238007/
Oklahoma woman who forced boy into washing machine sentenced to prison,/story/news/crime/2023/08/03/midwest-city-oklahoma-woman-prison-sentence-abuse-washing-machine/70522366007/
Yellow Corp.'s idled orange trucks first took off in OKC…,/story/business/real-estate/2023/08/03/yellow-corp-trucking-company-okc-shuts-down-200-jobs-lost/70504884007/
Gov. Stitt signs 'women's rights' executive order…,/story/news/state/2023/08/02/oklahoma-governor-kevin-stitt-womens-bill-rights-executie-order-political-stunt/70507206007/
'Reservation Dogs' final season debuts: What to know…,/story/entertainment/2023/08/02/reservation-dogs-season-3-what-to-know-oklahoma-made-show/70506172007/
,
New art displays coming as part of changes at 21c Museum…,/story/news/2023/08/02/21c-museum-hotel-okc-hyatt-changes-fordson-hotel/70504705007/
What parents need to know for back-to-school in the OKC…,/story/news/education/2023/08/02/okc-back-to-school-oklahoma-guide-when-does-school-start-tax-free-weekend-vaccines/70439474007/
Ryan Walters says Tulsa schools taking Chinese money; district says untrue,/story/news/politics/government/2023/08/03/ryan-walters-oklahoma-tulsa-public-schools-confucius-classrooms-claim/70520563007/
Coming soon: The Oklahoman's Public Eye is looking out for you,/story/news/local/2023/07/27/the-oklahoman-okc-public-eye-how-to-submit-problem/70464561007/
Oklahoma's tax free weekend begins Aug. 4: How to save for back-to-school,/story/news/local/2023/07/21/tax-free-weekend-oklahoma-2023-back-to-school-what-to-know/70437238007/
A look at underrated senior rising stars in Oklahoma HS football,/story/sports/high-school/football/2023/08/03/oklahoma-high-school-football-top-under-the-radar-seniors-in-ossaa/70509716007/
OU softball as the Evil Empire? Kelly Maxwell's transfer solidifies it,/story/sports/college/sooners/2023/08/03/ou-softball-kelly-maxwell-transfer-oklahoma-state-cowgirls-sooners-patty-gasso-evil-empire/70521127007/
Bob Bowlsby's quick move on 2021 expansion set up Big 12 for success,/story/sports/college/big-12/2023/08/03/big-12-expansion-pac-12-didnt-follow-commissioner-bob-bowlsby-blueprint/70519386007/
Yellow Corp.'s idled orange trucks first took off in OKC in 1924 — now they've shut down,/story/business/real-estate/2023/08/03/yellow-corp-trucking-company-okc-shuts-down-200-jobs-lost/70504884007/
What's driving a potential renaissance in OKC's Historic Capitol Hill,/story/business/local/2023/07/30/okc-historic-capitol-hill-calle-dos-cinco-history-revitalization/70411642007/
"Cashion is growing, but schools in latest OKC exurb may not be able to keep up",/story/business/real-estate/2023/07/24/cashion-oklahoma-schools-real-estate-okc-exurb-school-bond-failed/70405943007/
Thousands of Oklahomans don't have internet; projects to expand access Mike Sanders,/story/opinion/2023/08/03/opinion-oklahoma-investing-millions-in-broadband-infrastructure-accessibility/70400210007/
Stay open to all solutions when expanding internet access Joe Cabrera,/story/opinion/2023/08/03/797m-in-federal-funding-to-bridge-the-digital-divide-in-oklahoma/70393061007/
Seniors need to know benefits are available for all combat veterans Robin Gunn,/story/opinion/2023/08/01/opinion-guest-seniors-benefits-are-available-for-all-combat-veterans/70467531007/
'Wildlife smuggling attempt': Border patrol agents find seven hidden spider monkeys,/story/news/nation/2023/08/03/texas-border-patrol-find-seven-spider-monkeys-backpack/70525537007/
Rescued dog receives custom wheelchair from Mercedes-Benz,/story/life/animalkind/2023/08/03/mercedes-benz-gifts-wheelchair-neglected-rescued-dog/70516477007/
"87-year-old Maine woman fights off teenage attacker, then feeds him",/story/news/nation/2023/08/03/maine-woman-fights-off-attacker-then-feeds-him/70522374007/
"Grab leftover equipment from Brown's, Ingrid's at this OKC auction",/story/lifestyle/food/2023/08/02/browns-okc-ingrids-auction-bakery-equipment-up-for-sale/70507007007/
Sessions aim to give students practical lessons outside classrooms,/story/lifestyle/features/2023/08/03/fifth-street-baptist-offers-lessons-for-life-as-students-head-to-class/70507095007/
Oklahoma cafe ranked No. 3 in Southern Living's best steakhouses,/story/lifestyle/food/2023/08/02/oklahoma-cafe-in-top-10-of-southern-livings-most-legendary-steakhouses/70513103007/
,/picture-gallery/news/2023/08/03/oklahoma-city-united-methodist-church-project-transformation-day-camp/70466515007/
Enter Today!,https://oklahoman.gannettcontests.com/OKCMOA-Auguste-Rodin-Exhibitition-Giveaway/?itm_campaign=OCKMOA%20Rodin%20Exihbition&itm_medium=con&itm_source=secondStreet
Enter Now!,https://health.truecoverage.site/?itm_campaign=TrueCoverage&itm_medium=con&itm_source=secondStreet
Enter to WIN!,https://oklahoman.gannettcontests.com/Jellystone-Park-Wichita-Falls-2-Night-Luxury-Glamping-Giveaway/?itm_campaign=Jellystone%20Park%20Wichita%20Falls&itm_medium=con&itm_source=secondStreet
Oklahoma woman pleads guilty in Army hotel booking scheme,/story/news/crime/2023/08/03/fort-sill-oklahoma-army-hotel-booking-scheme-woman-pleads-guilty/70525005007/
Meet the OKC teen whose films have made it to the deadCenter Film Fest,/story/entertainment/2023/08/03/deadcenter-film-festival-ella-janes-okc-film-projects-qa/70308572007/
A look at underrated senior rising stars in Oklahoma HS football,/story/sports/high-school/football/2023/08/03/oklahoma-high-school-football-top-under-the-radar-seniors-in-ossaa/70509716007/
Oklahoma man pleads guilty to threatening to kill Gov. Stitt on Twitter,/story/news/crime/2023/08/03/oklahoma-man-pleads-guilty-twitter-threats-kill-kevin-stitt-ron-desantis-ted-cruz/70515989007/
These OKC public schools are requiring clear or mesh backpacks,/story/news/local/2023/08/03/okc-public-schools-clear-backpack-policy-see-list/70514644007/
,https://cm.oklahoman.com/site-feedback/?platform=Tangent-Desktop&url=https%3A%2F%2Fwww.oklahoman.com%2F&marketName=oklahoman&cta=Right-Rail
