headline,href
"'Twister' museum continues to spin up interest in films, weather",/story/lifestyle/2024/07/28/twister-movie-museum-wakita-oklahoma-twisters-2024/74342302007/
Is Oklahoma seeing a rise in biker gang violence?,/story/news/2024/07/25/biker-gang-violence-oklahoma-city-okc-whiskey-barrel-shooting/74327353007/
Small business owners know gradual increase to minimum wage a good thingMattece Mason,/story/opinion/columns/2024/07/28/opinion-small-business-owners-know-gradual-increase-to-oklahomas-minimum-wage-good-workers-business/74520659007/
"Sex ring operator stayed in control from prison, investigators allege",/story/news/2024/07/28/man-accused-operating-okc-sex-ring-from-vinita-ok-prison/74562482007/
A look at underrated 2025 class rising stars in Oklahoma…,/story/sports/high-school/football/2024/07/28/oklahoma-high-school-football-top-under-the-radar-2025-seniors-ossaa/74511802007/
OU linebacker Danny Stutsman is embracing the bigger…,/story/sports/college/sooners/2024/07/28/ou-football-linebacker-danny-stutsman-embracing-bigger-spotlight-in-final-season-oklahoma-sooners/74522626007/
Wakita's Twister The Movie Museum still rolling,/picture-gallery/entertainment/2024/07/28/wakitas-twister-the-movie-museum-keeps-spinning-with-films-legacy/74572740007/
OKC's Lyric Theatre tems with Deaf Austin Theatre for…,/videos/entertainment/2024/07/28/cinderella-lyric-theatre-okc-inclusive-deaf-hard-of-hearing-cast-crew/74531490007/
Lyric Theatre rehearses 'Cinderella' in sign language,/picture-gallery/entertainment/2024/07/28/lyric-theatre-okc-deaf-austin-theatre-cinderella-production/74510428007/
,
Is Oklahoma seeing a rise in biker gang violence?,/story/news/2024/07/25/biker-gang-violence-oklahoma-city-okc-whiskey-barrel-shooting/74327353007/
"Sex ring operator stayed in control from prison, investigators allege",/story/news/2024/07/28/man-accused-operating-okc-sex-ring-from-vinita-ok-prison/74562482007/
State lawmaker wants another study of traffic issues in Hochatown area,/story/news/politics/government/2024/07/28/hochatown-ok-traffic-oklahoma-legislature-study-mayor-dian-jordan/74556432007/
OU linebacker Danny Stutsman is embracing the bigger spotlight,/story/sports/college/sooners/2024/07/28/ou-football-linebacker-danny-stutsman-embracing-bigger-spotlight-in-final-season-oklahoma-sooners/74522626007/
Why OSU QB Alan Bowman's new mustache is about more than facial hair,/story/sports/college/cowboys/2024/07/28/oklahoma-state-football-quarterback-alan-bowman-nil-mustache-about-more-than-facial-hair/74490644007/
"SGA was again the closer. This time, Canada topped Greece in Olympics.",/story/sports/olympics/2024/07/27/canada-vs-greece-score-2024-paris-olympics-basketball-shai-gilgeous-alexander-giannis-antetokounmpo/74574704007/
"Gardner Tanenbaum buys Robinson Renaissance, plans more housing",/story/business/real-estate/2024/07/27/downtown-okc-robinson-renaissance-purchased-upscale-housing/74564988007/
Biden rent control plan gets renters' attention and owners' derision,/story/business/real-estate/2024/07/27/joe-biden-president-rent-control-plan-pontential-impacts-oklahoma/74430958007/
Conn's HomePlus stores are closing in Oklahoma: Where they are,/story/business/real-estate/2024/07/26/conns-homes-bankruptcy-oklahoma-store-closures-okc-tulsa/74557716007/
Letters on Ryan Walters' Bible mandate; state of Oklahoma politics,/story/opinion/letters/2024/07/27/opinion-ryan-walters-bible-mandate-state-of-oklahoma-politics-letters/74446580007/
Kamala Harris' Democratic candidacy for president unforgettable moment Nikki Nice,/story/opinion/columns/2024/07/27/kamala-harris-presidential-campaign-significant-women-color/74536438007/
Are you voting for Donald Trump or Kamala Harris? Tell us why,/story/opinion/2024/07/26/2024-elections-donald-trump-kamala-harris-presidential-elections/74559979007/
National Chicken Wing Day: Where to get free wings on Monday,/story/money/food/2024/07/28/national-chicken-wing-day-2024-deals-free/74139105007/
Hefty price tag: Starters homes are worth $1 million in 237 U.S. cities,/story/money/2024/07/28/starter-homes-worth-1-million-us-cities/74563510007/
Election Day is 100 days away: When does early voting start in each state?,/story/news/politics/elections/2024/07/28/when-does-early-voting-start/74540198007/
"'Twister' museum continues to spin up interest in films, weather",/story/lifestyle/2024/07/28/twister-movie-museum-wakita-oklahoma-twisters-2024/74342302007/
Hearing and deaf actors join forces for retelling of 'Cinderella' in OKC,/story/entertainment/2024/07/28/cinderella-lyric-theatre-production-austin-deaf-theatre-american-sign-language/74433085007/
Wakita's Twister The Movie Museum still rolling,/picture-gallery/entertainment/2024/07/28/wakitas-twister-the-movie-museum-keeps-spinning-with-films-legacy/74572740007/
,/picture-gallery/entertainment/2024/07/27/olivia-rodrigo-brings-her-guts-world-tour-to-paycom-center-in-okc-in-concert/74572452007/
Crossword & Games,https://puzzles.usatoday.com/?itm_campaign=Crossword%20%26amp%3B%20Games&itm_medium=con&itm_source=secondStreet
State lawmaker wants another study of traffic issues in Hochatown area,/story/news/politics/government/2024/07/28/hochatown-ok-traffic-oklahoma-legislature-study-mayor-dian-jordan/74556432007/
Hearing and deaf actors join forces for retelling of 'Cinderella' in OKC,/story/entertainment/2024/07/28/cinderella-lyric-theatre-production-austin-deaf-theatre-american-sign-language/74433085007/
GOAT Simone Biles winning power moves explained,/story/graphics/2024/07/21/paris-olympics-gymnastics-simone-biles-yurchenko-pike-triple-double/74351635007/
The Oklahoman's 2025 Super 30 high school football recruiting series,/story/sports/high-school/football/2024/06/22/oklahoma-high-school-football-2025-super-30-recruiting-series/74183734007/
"Oklahoma high school spring sports awards 2024 in baseball, golf, more",/story/sports/high-school/2024/06/13/oklahoma-high-school-spring-sports-awards-2024-baseball-golf-soccer-slowpitch-tennis-track-field/74081171007/
,https://cm.oklahoman.com/site-feedback/?platform=Tangent-Desktop&url=https%3A%2F%2Fwww.oklahoman.com%2F&marketName=oklahoman&cta=Right-Rail
