headline,href
Oklahoma's religious leaders want both reform and to welcome immigrants,/story/news/religion/2026/04/15/oklahoma-religious-faith-leaders-groups-immigration-reform/89212633007/
Why is Oklahoma's delegation staying silent on Trump's blasphemy?,/story/opinion/letters/2026/04/15/trump-blasphemous-jesus-depiction-should-have-been-called-out-letters/89553694007/
"Mussatto: How I would have voted for MVP, other NBA awards",/story/sports/nba/thunder/2026/04/15/okc-thunder-2025-26-nba-awards-ballot-shai-gilgeous-alexander-mvp-chet-holmgren-cason-wallace/89611005007/
Experts warn third grade retention harms students long term,/story/news/politics/2026/04/15/oklahoma-legislative-session-2026-third-grade-retention-impacts-according-to-experts/89609527007/
NWS confirms one tornado near Tulsa amid Tuesday severe…,/story/weather/2026/04/15/tornado-tulsa-last-night-confirmed-national-weather-service-storm-damage/89621673007/
Grammy winner Lupe Fiasco to headline OKC's Juneteenth…,/story/entertainment/music/2026/04/15/juneteenth-on-the-east-2026-okc-zoo-amphitheatre-lupe-fiasco-concert/89515653007/
Edmond City Council grapples with incentives for private…,/story/news/local/edmond/2026/04/15/edmond-ok-city-council-grapples-with-incentives-for-supporting-growing-attracting-private-business/89535972007/
,
"OU softball vs OSU today: How to watch, stream Bedlam…",/story/sports/college/softball/2026/04/15/ou-osu-channel-today-ncaa-softball-time-tv-schedule-streaming-info/89595348007/
"OSU's Campbell Smithwick, Brennan Phillips key Bedlam…",/story/sports/college/cowboys/2026/04/15/osu-baseball-score-vs-ou-bedlam-campbell-smithwick-brennan-phillips-cowboys-sooners/89619662007/
News,/news/
Oklahoma's religious leaders want both reform and to welcome immigrants,/story/news/religion/2026/04/15/oklahoma-religious-faith-leaders-groups-immigration-reform/89212633007/
Experts warn third grade retention harms students long term,/story/news/politics/2026/04/15/oklahoma-legislative-session-2026-third-grade-retention-impacts-according-to-experts/89609527007/
Immersion exhibit explores realities of refugees' journey,/story/news/nonprofits/2026/04/15/spero-project-sixth-street-immersive-experience-asylum-seekers-refugees/89303371007/
Sports,/sports/
"Mussatto: How I would have voted for MVP, other NBA awards",/story/sports/nba/thunder/2026/04/15/okc-thunder-2025-26-nba-awards-ballot-shai-gilgeous-alexander-mvp-chet-holmgren-cason-wallace/89611005007/
SEC softball power rankings: There's a new No. 1 as OU leaps Alabama,/story/sports/college/sooners/2026/04/15/sec-softball-power-rankings-oklahoma-alabama-crimson-tide-ou-sooners/89610754007/
"OU softball vs OSU today: How to watch, stream Bedlam softball game",/story/sports/college/softball/2026/04/15/ou-osu-channel-today-ncaa-softball-time-tv-schedule-streaming-info/89595348007/
Life,/life/
Grammy winner Lupe Fiasco to headline OKC's Juneteenth on the East,/story/entertainment/music/2026/04/15/juneteenth-on-the-east-2026-okc-zoo-amphitheatre-lupe-fiasco-concert/89515653007/
"OKC's best restaurants for March, according to OpenTable diners",/story/entertainment/dining/2026/04/15/best-restaurants-in-okc-opentable-march-2026-top-spots/89607146007/
Yelp names OKC's top-rated restaurants in April so far: See the list,/story/entertainment/dining/2026/04/15/best-restaurants-in-okc-yelp-april-2026/89608122007/
Business,/business/
Why CompSource policyholders say restructure raises concerning questions,/story/business/local/2026/04/15/compsource-oklahoma-policyholders-say-company-intentionally-vague-restucture-details/89611654007/
"Painted Tree Boutique stores close nationwide, including 3 in Oklahoma",/story/business/2026/04/14/painted-tree-boutique-stores-close-okc-edmond-moore/89611829007/
New restaurant Wildcat to open on Main Street in Oklahoma City,/story/business/2026/04/14/jones-assembly-okc-opening-new-restaurant-wildcat-mainstreet-downtown/89595556007/
Opinion,/opinion/
Why is Oklahoma's delegation staying silent on Trump's blasphemy?,/story/opinion/letters/2026/04/15/trump-blasphemous-jesus-depiction-should-have-been-called-out-letters/89553694007/
How to submit letters and guest columns to The Oklahoman,/story/opinion/letters/2026/03/24/easy-guide-to-submitting-letters-and-guest-columns-to-the-oklahoman/89230405007/
Is a fox guarding the insurance henhouse in Oklahoma? J. Robert Hunter,/story/opinion/columns/guest/2026/04/15/our-home-insurance-rates-are-tops-in-nation-lets-find-out-why-with-public-hearing-opinion/89557505007/
Trending,https://www.usatoday.com/news/trending/
"Fans resell Popeyes x One Piece bento boxes for as much as $1,000",/story/money/2026/04/15/popeyes-one-piece-bento-box-reselling-ebay/89620962007/
Disney Store to open new retail destination for fans. See locations,/story/money/shopping/2026/04/15/disney-store-popup-limited-time/89608473007/
Faulty Whirlpool fridge? You may be eligible to receive up to 75% back,/story/money/2026/04/14/whirlpool-class-action-settlement/89606750007/
Shopping,/shopping/
Did you also miss the Caitlin Clark shoe drop? Shop other CC gear:,/story/shopping/sports/fan-gear/wnba/2026/04/15/kobe-5-protro-x-caitlin-clark-nike-shoes-sold-out/89611102007/
Save 56% on this Homelite mini chainsaw at The Home Depot—no gas needed!,https://www.usatoday.com/story/shopping/deals/home/tools/2026/04/09/homelite-12v-lithium-battery-mini-chainsaw-deal-home-depot/89534636007/
Find out how a Walmart+ membership can help you save time and money,https://www.usatoday.com/story/shopping/sign-up-walmart-membership/82954651007/
,/picture-gallery/news/2026/04/15/spero-project-okc-see-inside-6th-street-experience-refugees-asylum-seekers/89353425007/
Hurry and Enter!,https://newsok.gannettcontests.com/2026-Spring-Project-Home-Improved-with-Ty-Pennington/?itm_campaign=Non%20sponsored%202026%20Ty%20Pennington%20PHI&itm_medium=con&itm_source=secondStreet
ENTER NOW,https://usatoday.gannettcontests.com/Bourbon--Beyond-VIP-Fly-Away-Prize-Package-2026/?itm_campaign=Bourbon%20and%20Beyond%202026&itm_medium=con&itm_source=secondStreet
ENTER to WIN!,https://oklahoman.gannettcontests.com/Pella-Oklahoma-2026-Spring-Project-Home-Improved-with-Ty-Pennington/?itm_campaign=Pella%20of%20Oklahoma%20City%20Project%20Home%20Improved%20Spring%202026&itm_medium=con&itm_source=secondStreet
Why CompSource policyholders say restructure raises concerning questions,/story/business/local/2026/04/15/compsource-oklahoma-policyholders-say-company-intentionally-vague-restucture-details/89611654007/
Immersion exhibit explores realities of refugees' journey,/story/news/nonprofits/2026/04/15/spero-project-sixth-street-immersive-experience-asylum-seekers-refugees/89303371007/
SEC softball power rankings: There's a new No. 1 as OU leaps Alabama,/story/sports/college/sooners/2026/04/15/sec-softball-power-rankings-oklahoma-alabama-crimson-tide-ou-sooners/89610754007/
Former death row inmate Julius Jones accused of prison contraband offenses,/story/news/crime/2026/04/14/oklahoma-former-death-row-inmate-julius-jones-support-kim-kardashian-new-charges/89610497007/
Video shows moments before Pauls Valley principal tackled school shooter,/story/news/crime/2026/04/14/video-shows-pauls-valley-principal-kirk-moore-stop-shooting/89613329007/
,https://cm.oklahoman.com/site-feedback/?platform=Tangent-Desktop&url=https%3A%2F%2Fwww.oklahoman.com%2F&marketName=oklahoman&cta=Right-Rail
