headline,href
"Teacher raises, longer school years approved under new Oklahoma laws",/story/news/politics/2026/05/25/new-education-laws-in-oklahoma-lengthen-school-year-raise-teacher-pay/90181976007/
Mussatto: Thunder needs one of Jalen Williams or Ajay Mitchell back,/story/sports/nba/thunder/2026/05/25/okc-thunder-san-antonio-spurs-game-4-score-nba-playoffs-wcf-jalen-williams-ajay-mitchell-injury/90248807007/
HISTORY UP FOR BIDS Three Guthrie downtown buildings will be sold at auction,/story/business/real-estate/2026/05/25/three-historic-buildings-in-guthrie-are-up-for-tax-auction/90118059007/
Here's what you need to know about GOP hopefuls for governor,/story/opinion/columns/2026/05/03/oklahoma-elections-2026-governor-race-meet-republican-primary-candidates/89704216007/
OKC chances of new WCWS contract may get boost from…,/story/sports/college/softball/womens-college-world-series/2026/05/24/wcws-womens-college-world-series-2026-okc-olympics-2028-devon-park-boost/89970324007/
Vote for the best Oklahoma high school football player…,/story/sports/high-school/football/2026/05/03/vote-best-oklahoma-high-school-football-player-of-all-time/89869070007/
Celebrate the Thunder's first NBA title with this…,/story/sports/nba/thunder/2025/12/17/celebrate-okc-thunder-nba-championship-commemorative-book/87805943007/
,
Celebrate Oklahoma high school basketball with 'The Big…,/story/sports/high-school/basketball/2025/12/17/celebrate-oklahoma-high-school-basketball-big-house-book/87806019007/
What you need to know about OKC Thunder schedule and how…,/story/sports/nba/thunder/2025/10/21/okc-thunder-schedule-dates-times-tv-streaming/86811489007/
News,/news/
"Teacher raises, longer school years approved under new Oklahoma laws",/story/news/politics/2026/05/25/new-education-laws-in-oklahoma-lengthen-school-year-raise-teacher-pay/90181976007/
See historic Guthrie buildings for sale due to unpaid property taxes,/picture-gallery/news/state/2026/05/25/see-three-historic-buildings-up-for-auction-in-guthrie/90200426007/
"Oklahoma Lottery Pick 3, Cash 5 results for May 24, 2026",/story/news/local/2026/05/24/oklahoma-lottery-results-sunday-may-24-2026/90248276007/
Sports,/sports/
Mussatto: Thunder needs one of Jalen Williams or Ajay Mitchell back,/story/sports/nba/thunder/2026/05/25/okc-thunder-san-antonio-spurs-game-4-score-nba-playoffs-wcf-jalen-williams-ajay-mitchell-injury/90248807007/
Carlson: Thunder now must protect home court vs Spurs to win the West,/story/sports/nba/thunder/2026/05/25/okc-thunder-vs-spurs-homecourt-advantage-nba-playoffs-game-4-wcf-clunker/90247268007/
Where will Oklahoma State baseball land in NCAA bracket?,/story/sports/college/cowboys/2026/05/25/oklahoma-state-baseball-bracketology-2026-ncaa-tournament-resume-osu-cowboys/90247894007/
Life,/life/
Dutch oven cooking on display at OKC's Chuck Wagon Festival,/picture-gallery/lifestyle/features/2026/05/23/see-photos-f35th-annual-chuck-wagon-festival-at-the-national-cowboy-western-museum-in-oklahoma-city/90237254007/
See our favorite photos from GalaxyCon Oklahoma City 2026,/picture-gallery/lifestyle/features/2026/05/23/galaxycon-fans-converge-in-oklahoma-city-on-memorial-day-weekend/90234468007/
OKANA Resort is fully open for its first summer,/story/entertainment/events/2026/05/22/okana-resort-okc-fully-open-summer-2026/90052766007/
Business,/business/
HISTORY UP FOR BIDS Three Guthrie downtown buildings will be sold at auction,/story/business/real-estate/2026/05/25/three-historic-buildings-in-guthrie-are-up-for-tax-auction/90118059007/
Are national stock markets open on Memorial Day? What to know,/story/business/finance/2026/05/24/are-markets-closed-on-memorial-day-see-2026-holiday-schedule/90213878007/
Are banks open on Memorial Day? Does mail run? Services affected in Oklahoma,/story/business/local/2026/05/23/are-banks-open-on-memorial-day-does-mail-run-whats-open-closed/90175452007/
Opinion,/opinion/
Here's what you need to know about GOP hopefuls for governor,/story/opinion/columns/2026/05/03/oklahoma-elections-2026-governor-race-meet-republican-primary-candidates/89704216007/
This Memorial Day remember: Art can help heal invisible wounds we carry Kuwantu Cammon,/story/opinion/columns/guest/2026/05/25/memorial-day-is-good-time-to-remember-that-art-can-help-heal-opinion/90240353007/
California's misguided efforts to protect swine had negative results Dr. Alexis Main,/story/opinion/columns/guest/2026/05/25/oklahoma-hog-barns-are-designed-to-meet-key-pig-needs-opinion/89882046007/
Trending,https://www.usatoday.com/news/trending/
"Powerball reaches $131M: What to know for Saturday, May 23",/story/money/lottery/2026/05/23/powerball-jackpot-131m-may-23-drawing/90224193007/
Mega Millions winning numbers as jackpot rises to $296M for May 22,/story/money/lottery/2026/05/22/mega-millions-296-million-jackpot-may-22-2026/90224006007/
Community rallies around animal shelter after rescue of 100-plus dogs,/story/pets-animals/2026/05/22/dogs-rescued-from-rv-spurs-big-donations-nevada/90215552007/
Your Daily PLAY,https://play.usatoday.com/
Get your clue to the USA Today Daily Crossword!,/story/entertainment/puzzles/crosswords/2026/05/25/shabby-crossword-clue/90248895007/
Ready for a Speed Round? Try the Quick Cross,https://play.usatoday.com/quick-cross
Read your free daily horoscope at USA TODAY.,/story/life/horoscopes/2026/05/25/horoscopes-today/90248947007/
Shopping,/shopping/
The vitamin C serum shoppers call a 'miracle in a bottle' is under $35,/story/shopping/deals/memorial-day/2026/05/25/truskin-vitamin-c-serum-amazon-deal/90246325007/
Grab 40% off a cordless tire inflator that fits in your glove box,https://www.usatoday.com/story/shopping/outdoors/emergency/2026/05/24/etenwolf-s1-portable-tire-inflator/90242133007/
I scanned Amazon’s Memorial Day sale and found some insane deals,https://www.usatoday.com/story/shopping/deals/memorial-day/2026/05/22/best-live-amazon-deals/90216023007/
,/picture-gallery/news/state/2026/05/25/see-three-historic-buildings-up-for-auction-in-guthrie/90200426007/
VOTE TODAY!,https://oklahoman.gannettcontests.com/2026-Oklahoman-Communitys-Choice-Awards/?itm_campaign=2026%20Oklahoma%20Community%26%2339%3Bs%20Choice&itm_medium=con&itm_source=secondStreet
ENTER NOW,https://www.oattravel.com/marketing/giveaway?itm_campaign=Overseas%20Adventure%20Travel&itm_medium=con&itm_source=secondStreet
ENTER — A CRUISE FOR 2!,https://usatoday.gannettcontests.com/Victory-Cruise-Lines-Discover-the-Great-Lakes/?itm_campaign=Victory%20Cruises%20Getaway&itm_medium=con&itm_source=secondStreet
Carlson: Thunder now must protect home court vs Spurs to win the West,/story/sports/nba/thunder/2026/05/25/okc-thunder-vs-spurs-homecourt-advantage-nba-playoffs-game-4-wcf-clunker/90247268007/
Where will Oklahoma State baseball land in NCAA bracket?,/story/sports/college/cowboys/2026/05/25/oklahoma-state-baseball-bracketology-2026-ncaa-tournament-resume-osu-cowboys/90247894007/
Where will OU baseball land in NCAA bracket?,/story/sports/college/sooners/2026/05/25/ou-baseball-bracketology-2026-ncaa-tournament-resume-oklahoma-sooners/90247565007/
How did Thunder grade out in Game 4 rout by Spurs? It's not pretty,/story/sports/nba/thunder/2026/05/25/thunder-spurs-report-card-sga-oscar-wemby-stats-game-4-nba-playoffs-wcf/90248177007/
"Wemby, Spurs smash Thunder in Game 4, even up West finals",/story/sports/nba/thunder/2026/05/24/thunder-vs-spurs-score-shai-gilgeous-alexander-victor-wembanyama-stats-nba-playoffs-game-4-wcf/90247330007/
,https://cm.oklahoman.com/site-feedback/?platform=Tangent-Desktop&url=https%3A%2F%2Fwww.oklahoman.com%2F&marketName=oklahoman&cta=Right-Rail
