headline,href
"Better audit of $1.3 billion spent during winter storm needed, commissioner says",/story/news/politics/government/2023/09/25/ong-2021-winter-storm-better-audit-billion-dollars-needed-commissioner-says/70911215007/
Effort underway to connect more Oklahomans in rural areas to the internet,/story/news/politics/government/2023/09/25/oklahoma-broadband-office-tribal-leaders-working-internet-access-smart-cities/70933788007/
Does the FBI actually have a file on you? Here's how to find out,/story/news/2023/09/25/how-to-request-fbi-file-freedom-of-information-act/70928800007/
Oklahoma fight over Catholic charter school draws national groups,/story/news/politics/government/2023/09/25/st-isidore-oklahoma-catholic-charter-school-legal-fight-who-are-the-lawyers/70931274007/
Daylight saving time 2023: When do the clocks 'fall…,/story/news/2023/09/12/daylight-savings-time-2023-when-do-we-fall-back-oklahoma/70830589007/
See what Public Eye investigations have found so far,/in-depth/news/local/2023/08/30/okc-public-eye-the-oklahoman-investigations-so-far/70595670007/
,
Vote: Landmark Fine Homes HS football player of the week…,/story/sports/high-school/football/2023/09/23/oklahoma-high-school-football-player-of-the-week-week-4-vote-landmark-fine-homes-poll/70948495007/
Relive OU softball's third straight WCWS title run with…,/story/sports/college/sooners/2023/09/11/ou-softball-book-patty-gasso-jocelyn-alo-oklahoma-sooners-wcws-three-peat-dynasty/70777302007/
Adopt a pet for Sept. 27,/story/lifestyle/2023/09/25/dogs-and-cats-are-available-for-adoption-at-okc-area-animal-shelters/70899468007/
"Better audit of $1.3 billion spent during winter storm needed, commissioner says",/story/news/politics/government/2023/09/25/ong-2021-winter-storm-better-audit-billion-dollars-needed-commissioner-says/70911215007/
Effort underway to connect more Oklahomans in rural areas to the internet,/story/news/politics/government/2023/09/25/oklahoma-broadband-office-tribal-leaders-working-internet-access-smart-cities/70933788007/
Does the FBI actually have a file on you? Here's how to find out,/story/news/2023/09/25/how-to-request-fbi-file-freedom-of-information-act/70928800007/
"Nippert Stadium, Goetta sausage make Cincinnati a unique Big 12 addition",/story/sports/college/sooners/2023/09/25/ou-football-sooners-goetta-sausage-a-unique-part-of-cincinnati-tailgating-scene/70954276007/
Oklahoma high school football Class 6A-I to C rankings for Week 5,/story/sports/high-school/football/2023/09/25/ossaa-football-class-6a-i-to-c-oklahoma-high-school-football-rankings-for-week-5/70956023007/
Lapses in pass coverage cost OSU football in loss vs. Iowa State,/story/sports/college/cowboys/2023/09/25/oklahoma-state-football-vs-iowa-state-defensive-pass-coverage-issues-easily-fixable/70947540007/
Commercial real estate transactions from across the Oklahoma City area,/story/business/real-estate/2023/09/22/okc-commercial-real-estate-transactions-september-2023/70909436007/
"Home Creations, based in Moore, expands to the Houston-area market",/story/business/real-estate/2023/09/22/houston-real-estate-okc-company-home-creations-building-homes-texas/70903533007/
"Amazon is hiring 3,400 people in Oklahoma, full-time, part-time, and seasonal jobs",/story/business/employment/2023/09/20/amazon-jobs-hiring-in-oklahoma-okc-christmas-holiday-season/70902963007/
"In neglecting Langston University, Oklahoma neglects its own potential Carla D. Pratt",/story/opinion/2023/09/24/in-neglecting-langston-university-oklahoma-neglects-its-own-potential/70910235007/
"Give yourself permission to lunge headfirst into interests, hobbies Russ Florence",/story/opinion/2023/09/24/opinion-guest-museum-of-osteology-a-result-of-childs-curiosity-pursuit-of-interest/70898518007/
Readers weigh in on a possible shutdown of the federal government,/story/opinion/2023/09/23/government-shutdown-would-affect-oklahomans-heres-what-you-told-us/70885550007/
"Molotov cocktail thrown at Cuban embassy in Washington, DC",/story/news/nation/2023/09/25/molotov-cocktail-attack-cuban-embassy/70959151007/
Italian mob boss dies after capture ended decades on the run,/story/news/world/2023/09/25/matteo-messina-denaro-dies/70959146007/
"Taylor Swift, Travis Kelce spotted leaving Chiefs game together",/story/entertainment/celebrities/2023/09/25/taylor-swift-travis-kelce-chiefs-convertible/70959191007/
Oklahoma's annual Bigfoot festival is coming up: What to know,/story/lifestyle/things-to-do/2023/09/22/honobia-bigfoot-festival-2023-starts-soon-in-oklahoma-what-to-know/70921029007/
Plan ahead to warn parents about adults-only party,/story/lifestyle/2023/09/25/planning-communication-can-help-create-an-adults-only-affair/70923800007/
Nature & You: Get crafty with Mother Nature's wild plant seed pods,/story/lifestyle/2023/09/25/wild-plant-seed-pods-can-be-your-next-inspiration-for-arts-crafts/70917723007/
,/picture-gallery/news/2023/09/23/see-photos-from-saturday-at-the-oklahoma-state-fair-in-oklahoma-city/70947749007/
ENTER TODAY,https://usatoday.gannettcontests.com/Cayman-Islands-Dept-of-Tourism-Dream-Getaway/?itm_campaign=Cayman%20Islands%20Dream%20Getaway&itm_medium=con&itm_source=secondStreet
NOMINATE TODAY,https://oklahoman.gannettcontests.com/Cardiovascular-Health-Clinic-Amazing-Teachers/rounds/1/gallery?itm_campaign=Cardiovascular%20Health%20Clinic%20Amazing%20Teacher%20Awards&itm_medium=con&itm_source=secondStreet
Vote Every Week!,https://www.oklahoman.com/sports/high-school/?itm_campaign=Athlete%20of%20the%20Week%20Landmark%20OKC&itm_medium=con&itm_source=secondStreet
Public Eye: Celebrity charity raising money off of Oklahoma husky rescue's work,/story/news/2023/09/25/husky-halfway-house-h3-oklahoma-wagmore-pets-taking-credit-work/70854364007/
"Hollywood screenwriters, studios reach tentative deal to end 146-day strike",/story/entertainment/tv/2023/09/24/hollywood-screenwriters-studios-reach-agreement-to-end-strike/70916099007/
"In neglecting Langston University, Oklahoma neglects its own potentialCarla D. Pratt",/story/opinion/2023/09/24/in-neglecting-langston-university-oklahoma-neglects-its-own-potential/70910235007/
"In United Methodist disaffiliation, exiting liberal churches a surprising minority",/story/news/religion/2023/09/24/oklahoma-united-methodist-church-disaffiliation-mosaic-church-lgbtq-rights/70767362007/
Oklahoma's annual Bigfoot festival is coming up: What to know,/story/lifestyle/things-to-do/2023/09/22/honobia-bigfoot-festival-2023-starts-soon-in-oklahoma-what-to-know/70921029007/
,https://cm.oklahoman.com/site-feedback/?platform=Tangent-Desktop&url=https%3A%2F%2Fwww.oklahoman.com%2F&marketName=oklahoman&cta=Right-Rail
