headline,href
FOR ALL THE ROSESOU-Alabama live updates: Sooners lead Crimson Tide 17-7 in CFPOklahoma hosts Alabama in the first round of the College Football Playoff on Friday at Owen Field in Norman. Follow for live updates.,/story/sports/college/sooners/2025/12/19/oklahoma-alabama-game-score-live-updates-highlights-college-football-playoff/87847457007/
"Oklahoma vs Alabama in College Football Playoff game, see top photos",/picture-gallery/sports/college/sooners/2025/12/19/oklahoma-vs-alabama-college-football-playoff-sooners-crimson-tide-cfp-photos/87811506007/
Inside Brent Venables' miraculous turnaround as OU football coach,/story/sports/college/sooners/2025/12/19/brent-venables-ou-football-coach-sooners-cfp-turnaround/87831737007/
See Oklahoma Sooners enter stadium before CFP matchup vs Alabama,/picture-gallery/sports/college/sooners/2025/12/19/alabama-vs-ou-game-today-see-photos-john-mateer-sooners-stadium/87851355007/
"Thunder vs Timberwolves live updates: SGA, OKC visit Anthony Edwards, Minnesota",/story/sports/nba/thunder/2025/12/19/thunder-timberwolves-score-live-updates-nba-game-highlights-stats-injury-report/87848881007/
What a judge ordered in 20-year-old lawsuit against poultry industry,/story/news/courts/2025/12/19/judge-holds-poultry-companies-liable-for-illinois-river-pollution/87853249007/
State to restore campaign finance site after 3 months offline,/story/news/politics/2025/12/19/oklahoma-ethics-commission-votes-to-immediately-restore-old-campaign-finance-website/87833564007/
"How do OU, Alabama stack up? Shane Beamer helps break down matchup",/story/sports/college/sooners/2025/12/19/alabama-oklahoma-college-football-playoff-game-matchup-shane-beamer-analysis/87832714007/
'Next Level Baker' crowns OKC Sweets baker as first…,/story/lifestyle/food/2025/12/19/okc-sweets-owner-crowned-first-winner-of-gordon-ramsey-next-level-baker/87843263007/
What we learned about OSU women's basketball ahead of…,/story/sports/college/cowboys/2025/12/19/oklahoma-state-womens-basketball-nonconference-record-entering-big-12-schedule-osu-cowgirls/87797017007/
,
What channel is Thunder vs Timberwolves on tonight? Time…,/story/sports/nba/thunder/2025/12/19/thunder-timberwolves-channel-today-nba-games-live-time-tv-schedule-streaming/87838403007/
Brown shooting suspect found dead; linked to MIT…,/story/news/nation/2025/12/18/brown-university-shooting-suspect-search/87827817007/
Celebrate the Thunder's first NBA title with this…,/story/sports/nba/thunder/2025/12/17/celebrate-okc-thunder-nba-championship-commemorative-book/87805943007/
Shopping,/shopping/
Shop Skechers Hands Free Slip-In shoes for winter,/story/shopping/2025/12/19/skechers-winter-shoes-apparel/87853309007/
Last-minute stocking stuffers for kids and adults,https://www.usatoday.com/story/shopping/2025/12/13/best-last-minute-stocking-stuffers-2025/87749476007/
Last-minute Skechers gifts that will arrive by Christmas Eve,/story/shopping/2025/12/19/skechers-holiday-gifts-christmas-eve-delivery/87851109007/
News,/news/
What a judge ordered in 20-year-old lawsuit against poultry industry,/story/news/courts/2025/12/19/judge-holds-poultry-companies-liable-for-illinois-river-pollution/87853249007/
State to restore campaign finance site after 3 months offline,/story/news/politics/2025/12/19/oklahoma-ethics-commission-votes-to-immediately-restore-old-campaign-finance-website/87833564007/
"From Jagger to Michael Jackson, new Epstein docs stir controversy",/story/news/politics/2025/12/19/epstein-files-release-day-live-updates/87701711007/
Sports,/sports/
OU-Alabama live updates: Sooners lead Crimson Tide 17-7 in CFP,/story/sports/college/sooners/2025/12/19/oklahoma-alabama-game-score-live-updates-highlights-college-football-playoff/87847457007/
"Thunder vs Timberwolves live updates: SGA, OKC visit Anthony Edwards, Minnesota",/story/sports/nba/thunder/2025/12/19/thunder-timberwolves-score-live-updates-nba-game-highlights-stats-injury-report/87848881007/
"How do OU, Alabama stack up? Shane Beamer helps break down matchup",/story/sports/college/sooners/2025/12/19/alabama-oklahoma-college-football-playoff-game-matchup-shane-beamer-analysis/87832714007/
Life,/life/
'Next Level Baker' crowns OKC Sweets baker as first winner,/story/lifestyle/food/2025/12/19/okc-sweets-owner-crowned-first-winner-of-gordon-ramsey-next-level-baker/87843263007/
Chick N Beer announces closing. What we know,/story/entertainment/dining/2025/12/19/what-we-know-about-chick-n-beers-upcoming-closure/87852348007/
OKC Sweets owner Stefanie Embree wins 'Next Level Baker' crown,/videos/entertainment/dining/2025/12/19/watch-okc-sweets-owner-stefanie-embree-win-next-level-baker-crown/87845742007/
Business,/business/
"Hegseth, Trump release new info on 'warrior dividend.' Who qualifies?",/story/business/economy/2025/12/18/who-qualifies-for-warrior-dividend-trump-details-military-checks-1776/87826309007/
Design changes to bring downtown OKC apartment tower back on track,/story/business/downtown/2025/12/18/construction-to-start-in-2026-on-redesigned-downtown-okc-apartment-tower/87817470007/
Millions are being spent on retail centers surrounding Penn Square Mall,/story/business/real-estate/2025/12/18/belle-isle-station-adjacent-to-penn-square-mall-okc-sold/87784538007/
Opinion,/opinion/
Oklahoma has an alarming rate of teacher attrition. It's a crisis Alexis Bowen,/story/opinion/columns/guest/2025/12/19/crisis-in-oklahoma-too-many-teachers-leaving-profession-too-soon/87660810007/
"This Christmas, stop letting others steal your time Bill Korman",/story/opinion/columns/guest/2025/12/19/during-christmas-season-do-not-let-others-steal-your-time/87818690007/
We need to change how we think about mass shootings Philip Chan and Amy Nunn,/story/opinion/2025/12/19/brown-university-shooting-gun-violence-public-health/87812875007/
Trending,https://www.usatoday.com/news/trending/
Check the Mega Millions winning numbers for Friday's $90M jackpot,/story/money/lottery/2025/12/19/mega-millions-winning-numbers/87851073007/
Use Instacart? You could be owed a refund. Here's why.,/story/money/2025/12/19/instacart-consumer-refunds-ftc-lawsuit/87845653007/
See Consumer Reports' list of least reliable cars for 2026,/story/cars/shopping/2025/12/18/top-10-least-reliable-cars-consumer-reports/87818025007/
,/picture-gallery/sports/college/sooners/2025/12/19/brian-bosworth-guest-picker-espn-college-gameday-oklahoma-alabama-cfp-game/87852684007/
ENTER NOW,https://usatoday.gannettcontests.com/Filtrete-Yourself/?itm_campaign=Filtrete%20Yourself%20Giveaway&itm_medium=con&itm_source=secondStreet
ENTER NOW! ENTER OFTEN!,https://oklahoman.gannettcontests.com/2025-Holiday-Wish-and-Win/?itm_campaign=2025%20Holiday%20Wish%20%26amp%3B%20Win%20%20-%20H%20%26amp%3B%20H%20Shooting%20Sports%20%2450k%20Giveaway&itm_medium=con&itm_source=secondStreet
Nominate Today!,https://www.profootballhof.com/news/2025/09/pro-football-hall-of-fame-awards-of-character-recognize-extraordinary-individuals/?utm_source=Localiq&utm_medium=promo&utm_campaign=awards&&itm_campaign=PFHOF%20Awards%20of%20Character&itm_medium=con&itm_source=secondStreet
"From Jagger to Michael Jackson, new Epstein docs stir controversy",/story/news/politics/2025/12/19/epstein-files-release-day-live-updates/87701711007/
Methodists commit to unity while other denomination on verge of schism,/story/news/religion/2025/12/17/anglican-communion-schism-oklahoma-methodists-sarah-mullally/87466415007/
OSU's Robert Jennings II to miss remainder of season due to hip injury,/story/sports/college/cowboys/2025/12/19/oklahoma-state-basketball-forward-robert-jennings-ii-hip-injury-update-out-for-2025-26-season/87854111007/
"Oklahoma vs Alabama fans at College Football Playoff game, see photos",/picture-gallery/sports/college/sooners/2025/12/19/alabama-vs-ou-game-see-fan-photos-before-college-football-playoffs/87851331007/
See the latest renderings of the OKC Thunder arena showing expansive features,/story/news/2025/12/19/see-new-okc-thunder-arena-renderings-thunder-alley/87834987007/
,https://cm.oklahoman.com/site-feedback/?platform=Tangent-Desktop&url=https%3A%2F%2Fwww.oklahoman.com%2F&marketName=oklahoman&cta=Right-Rail
