headline,href
"Make Oklahoma Healthy Again: What's in new campaign by Stitt, RFK Jr.",/story/news/2025/06/26/make-oklahoma-healthy-again-targets-fluoride-water-food-dyes/84352850007/
Thunder selects Northwestern's Brooks Barnhizer No. 44 in NBA Draft,/story/sports/nba/thunder/2025/06/26/brooks-barnhizer-okc-thunder-2025-nba-draft-pick-northwestern/84378708007/
2025 NBA Draft tracker: Every pick for the second round in Brooklyn,/story/sports/nba/thunder/2025/06/26/nba-draft-live-updates-2025-picks-tracker-order-results-second-round-okc-thunder/84373238007/
Oklahoma will no longer recommend fluoride in water supply,/story/news/politics/state/2025/06/26/fluoride-in-water-oklahoma-kevin-stitt-rfk-jr-make-oklahoma-healthy-again/84370323007/
Why it's 'surreal' for Jalen Williams to win first NBA…,/story/sports/nba/thunder/2025/06/26/okc-thunder-jalen-williams-wins-first-basketball-championship-nba-finals/84319381007/
Vote: The Oklahoman's Fans' Choice Super 30 All-Time…,/story/sports/high-school/football/2025/06/26/vote-the-oklahomans-fans-choice-super-30-all-time-defensive-player/84341549007/
OKC Thunder draft picks: Grades for selections in 2025…,/story/sports/nba/thunder/2025/06/25/okc-thunder-nba-draft-picks-tracker-2025-grades-thomas-sorber/84360004007/
"Here is the Thunder's roster, player contracts entering…",/story/sports/nba/thunder/2025/06/24/okc-thunder-roster-contracts-free-agents-2025-nba-offseason/84274655007/
DAYS OF THUNDER: How OKC captured its first NBA…,/story/sports/nba/thunder/2025/06/24/okc-thunder-nba-finals-schedule-results-championship-shai-gilgeous-alexander-stats/84328403007/
,
"Make Oklahoma Healthy Again: What's in new campaign by Stitt, RFK Jr.",/story/news/2025/06/26/make-oklahoma-healthy-again-targets-fluoride-water-food-dyes/84352850007/
Oklahoma will no longer recommend fluoride in water supply,/story/news/politics/state/2025/06/26/fluoride-in-water-oklahoma-kevin-stitt-rfk-jr-make-oklahoma-healthy-again/84370323007/
Severe thunderstorm warning issued for Oklahoma City: See live radar,/story/weather/2025/06/26/okc-weather-severe-thunderstorm-warning-issued-for-oklahoma-city-area/84376955007/
Thunder selects Northwestern's Brooks Barnhizer No. 44 in NBA Draft,/story/sports/nba/thunder/2025/06/26/brooks-barnhizer-okc-thunder-2025-nba-draft-pick-northwestern/84378708007/
2025 NBA Draft tracker: Every pick for the second round in Brooklyn,/story/sports/nba/thunder/2025/06/26/nba-draft-live-updates-2025-picks-tracker-order-results-second-round-okc-thunder/84373238007/
Super 30: Ada's Dawson Matthews has big goals after injuries,/story/sports/high-school/football/2025/06/26/oklahoma-high-school-football-dawson-matthews-ada-memphis-2026-recruiting-profile/84285903007/
'State of the art' — but Canoo EV deal came with plenty of red flags,/story/business/2025/06/18/oklahoma-lost-tesla-so-it-turned-to-canoo-despite-red-flags/78247643007/
"OKC Thunder's victory brought fans, much-needed business to downtown",/story/business/2025/06/26/okc-thunder-parade-economic-impact-of-nba-final-win-oklahoma-city/84354072007/
What's that new building? Popular business set to open in NW OKC,/story/business/real-estate/2025/06/25/hteao-opening-new-location-edmond-ok/84287178007/
Reflecting Oklahoma's politics: See our cartoons Todd Pendleton,/picture-gallery/opinion/cartoons/2025/06/20/reflecting-oklahomas-politics-see-our-cartoons/84285958007/
Trump's bill is anything but beautiful for many Oklahomans Trish Emig,/story/opinion/columns/guest/2025/06/26/trump-big-beaufiful-bill-has-medicaid-changes-harmful-to-oklahomans/84284380007/
Does SGA stand alongside legends on NBA's Mount Rushmore?,/story/opinion/columns/your-voice/2025/06/25/okc-thunder-shai-gilgeous-alexander-nba-greatest-players/84331039007/
"Fireball captured in videos may be meteorite, officials say",/story/news/nation/2025/06/26/daytime-fireball-meteorite-video/84375022007/
Jason Kelce rips off his pants for a good cause in patriotic video,/story/sports/2025/06/26/eagles-jason-kelce-rips-off-pants/84370563007/
Landscaper arrested after throwing party at client's home: Police,/story/news/nation/2025/06/26/landscaper-charged-over-throwing-party-at-home/84370575007/
Amazon Fire TVs are 48% off ahead of Prime Day! Shop early deals,https://www.usatoday.com/story/shopping/2025/06/22/early-amazon-prime-day-tv-deals/84275492007/
Under $200: Get Bissell's new CrossWave Edge vacuum today,/story/shopping/2025/06/26/vacuum-deal-bissell-crosswave-edge/84368709007/
Here's how to buy Dolly Parton tickets for 'Dolly: Live in Vegas',https://www.usatoday.com/story/shopping/2025/06/23/how-to-buy-dolly-parton-tickets-full-las-vegas-show-schedule/84321684007/
"Are arthritis supplements worth taking, or are they all hype?",/story/lifestyle/2025/06/24/do-popular-arthritis-supplements-work-bodywork/84262534007/
Celebrate the Fourth by giving a shelter pet a home,/story/lifestyle/2025/06/24/your-furever-friend-is-available-at-okc-area-shelters-adopt-a-pet/84246585007/
OKC widower is latest person to become Habitat for Humanity homeowner,/story/lifestyle/features/2025/06/24/habitat-for-humanity-oklahoma-city-development/84167919007/
,/picture-gallery/sports/nba/thunder/2025/06/26/brooks-barnhizer-okc-thunder-nba-draft-pick-former-northwestern-wildcats-guard/84379742007/
Enter Today!,https://usatoday.gannettcontests.com/The-Kansas-City-Steak-Company-Sizzling-Summer/?itm_campaign=The%20Kansas%20City%20Steak%20Company%20Sizzling%20Summer%20Sweepsteaks&itm_medium=con&itm_source=secondStreet
A Beautiful Giveaway,https://oklahoman.gannettcontests.com/Lyric-Theatre-Beautiful-The-Carole-King-Musical/?itm_campaign=Lyric%20Theatre%20Beautiful%20Ticket%20Giveaway&itm_medium=con&itm_source=secondStreet
Summer Athlete Polls,https://www.oklahoman.com/sports/high-school/?itm_campaign=Athlete%20of%20the%20Week%20Landmark%20OKC&itm_medium=con&itm_source=secondStreet
Super 30: Ada's Dawson Matthews has big goals after injuries,/story/sports/high-school/football/2025/06/26/oklahoma-high-school-football-dawson-matthews-ada-memphis-2026-recruiting-profile/84285903007/
Reflecting Oklahoma's politics: See our cartoons      Todd Pendleton,/picture-gallery/opinion/cartoons/2025/06/20/reflecting-oklahomas-politics-see-our-cartoons/84285958007/
'State of the art' — but Canoo EV deal came with plenty of red flags,/story/business/2025/06/18/oklahoma-lost-tesla-so-it-turned-to-canoo-despite-red-flags/78247643007/
USA Softball All-Star Showcase postponed due to inclement weather,/story/sports/college/softball/2025/06/26/usa-softball-all-star-showcase-live-updates-score-highlights-team-usa-vs-all-stars/84377106007/
NBA mock draft: Who will OKC Thunder select with No. 44 pick?,/story/sports/nba/thunder/2025/06/26/nba-draft-round-2-predictions-who-will-okc-thunder-take-with-no-44-pick/84374319007/
,https://cm.oklahoman.com/site-feedback/?platform=Tangent-Desktop&url=https%3A%2F%2Fwww.oklahoman.com%2F&marketName=oklahoman&cta=Right-Rail
