headline,href
Over 100 employees laid off at OKC cannabis company,/story/business/local/2024/10/01/oklahoma-warn-notices-mood-cannabis-lays-off-120-okc/75468001007/
"Vice presidential debate 2024: How to watch Walz, Vance on Tuesday",/story/news/politics/elections/2024/09/30/vice-presidential-debate-time-how-to-watch-tim-walz-jd-vance/75449689007/
Oklahoma rescue team saves four trapped in Hurricane Helene floodwaters,/story/news/2024/10/01/hurricane-helene-tenneesee-flooding-rescues-from-oklahoma-team/75471288007/
See the incredible murals from the Plaza Walls Mural Expo,/picture-gallery/news/local/2024/10/01/plaza-walls-mural-expo-plaza-district-festival-okc-photos/75437379007/
Oklahoma lawmaker says momentum is growing for cellphone…,/story/news/education/2024/10/01/cellphone-bans-oklahoma-schools-lawmakers-interim-study/75450496007/
Oklahoma man sentenced to federal prison for murdering…,/story/news/2024/10/01/stephens-county-jail-oklahoma-beating-death-walter-kassanavoid/75453810007/
What Ryan Walters says about teen's pronouns lawsuit…,/story/news/courts/2024/10/01/ryan-walters-oklahoma-pronouns-lawsuit-unattested-statements/75447234007/
Activist rapper Chuck D talks music as violence…,/story/news/local/oklahoma-city/2024/10/01/chuck-d-public-enemy-hip-hop-impact-okc-music/75364021007/
OU stock report: J.J. Hester on the rise after clutch…,/story/sports/college/sooners/2024/10/01/ou-football-stock-report-j-j-hester-michael-hawkins-jr-sooners-week-6/75455642007/
,
"Vice presidential debate 2024: How to watch Walz, Vance on Tuesday",/story/news/politics/elections/2024/09/30/vice-presidential-debate-time-how-to-watch-tim-walz-jd-vance/75449689007/
Oklahoma rescue team saves four trapped in Hurricane Helene floodwaters,/story/news/2024/10/01/hurricane-helene-tenneesee-flooding-rescues-from-oklahoma-team/75471288007/
See the incredible murals from the Plaza Walls Mural Expo,/picture-gallery/news/local/2024/10/01/plaza-walls-mural-expo-plaza-district-festival-okc-photos/75437379007/
OU stock report: J.J. Hester on the rise after clutch catch vs. Auburn,/story/sports/college/sooners/2024/10/01/ou-football-stock-report-j-j-hester-michael-hawkins-jr-sooners-week-6/75455642007/
A.J. Hinch redemption? Witt vs. Holliday? A look at Okies in playoffs,/story/sports/2024/10/01/tigers-manager-aj-hinch-astros-oklahoma-mlb-playoffs-bobby-witt-jr-jackson-holliday/75470249007/
Cross Canadian Ragweed reunion concert to benefit OSU NIL efforts,/story/sports/college/cowboys/2024/10/01/cross-canadian-ragweed-reunion-concert-oklahoma-state-nil-boone-pickens-stadium-turnpike-troubadors/75467639007/
Over 100 employees laid off at OKC cannabis company,/story/business/local/2024/10/01/oklahoma-warn-notices-mood-cannabis-lays-off-120-okc/75468001007/
OKC ranked one of the cheapest vacation spots in US: See the rankings,/story/business/travel/2024/10/01/okc-ranked-one-of-the-cheapest-vacation-spots-in-us-see-the-list/75396367007/
"Groendyke Transport Inc. acquires company, reenters northeastern market",/story/business/transportation/2024/10/01/groendyke-transport-oklahoma-acquires-linden-bulk-greg-hodgen/75449911007/
Opinion: Cellphones in classrooms are a problem. Better controls needed John Thompson,/story/opinion/2024/10/01/oklahoma-schools-cellphone-distraction-control/72747309007/
Opinion: A new approach is needed to address opioid epidemic in OK Wayland Cubit,/story/opinion/columns/2024/10/01/oklahoma-drug-problem-law-enforcement-fentanyl-opiods-police-holistic-approach/75291552007/
"ICYMI: September guest columns focused on debate, Ryan Walters and more",/story/opinion/2024/10/01/september-guest-columns-focused-on-debate-ryan-walters/75289516007/
Women's sports bar announces deal to create streaming channel,/story/money/2024/10/01/the-sports-bra-united-city-fc-streaming/75474247007/
"'The Daily Show’ live VP debate episode: Time, host, where to watch",/story/entertainment/tv/2024/10/01/daily-show-vp-debate-special/75471297007/
LA doctor killed was attacked by men with bats before death,/story/news/nation/2024/10/01/doctor-hamid-mirshojae-shot-la-attacked-before-death/75468202007/
Cross Canadian Ragweed makes major show announcement,/story/entertainment/2024/10/01/cross-canadian-ragweed-osu-show-turnpike-troubadours-great-divide-jason-boland-stragglers/75466057007/
'Twisters' is coming to 4K and Blu-ray: What bonus features to look for,/story/entertainment/2024/10/01/twisters-movie-blu-ray-dvd-extra-content-release-date/75470155007/
How to arrange your own cremation service,/story/lifestyle/2024/10/01/savvy-senior-offers-tips-on-arranging-your-own-cremation-service/75349082007/
,/picture-gallery/sports/nba/thunder/2024/09/30/oklahoma-city-thunder-media-day-2024-behind-the-scenes-photo-gallery/75457038007/
Winners Announced!,https://oklahoman.gannettcontests.com/2024-Oklahoman-Communitys-Choice-Awards-Winners/?itm_campaign=Oklahoma%202024%20BOB&itm_medium=con&itm_source=secondStreet
Vote Every Week!,https://www.oklahoman.com/sports/high-school/?itm_campaign=Athlete%20of%20the%20Week%20Landmark%20OKC&itm_medium=con&itm_source=secondStreet
Conservative group rep pitches plan for moving school board elections,/story/news/politics/state/2024/10/01/oklahoma-elections-2024-gop-wants-school-board-date-change/75467477007/
US Justice Department to investigate Tulsa Race Massacre,/story/news/2024/10/01/doj-launches-first-ever-federal-review-of-1921-tulsa-race-massacre/75465553007/
Cross Canadian Ragweed makes major show announcement,/story/entertainment/2024/10/01/cross-canadian-ragweed-osu-show-turnpike-troubadours-great-divide-jason-boland-stragglers/75466057007/
Opinion: Cellphones in classrooms are a problem. Better controls neededJohn Thompson,/story/opinion/2024/10/01/oklahoma-schools-cellphone-distraction-control/72747309007/
Jimmy Carter turns 100: What to know about the former president's historic milestone,/story/news/politics/elections/2024/10/01/jimmy-carter-100-birthday-what-to-know/75188858007/
,https://cm.oklahoman.com/site-feedback/?platform=Tangent-Desktop&url=https%3A%2F%2Fwww.oklahoman.com%2F&marketName=oklahoman&cta=Right-Rail
