headline,href
More NCAAMB Scores,/sports/ncaab/scores/
Not your average mission: Coffee shop chain's expansion is personal for Oklahoma families,/story/news/2025/03/27/not-your-average-joe-coffee-oklahoma-expanding-hiring-stella-nova/80187315007/
Sam Presti was right about Josh Giddey in Thunder-Bulls trade,/story/sports/nba/thunder/2025/03/30/sam-presti-josh-giddey-thunder-bulls-trade-alex-caruso/82731202007/
"OU loses first series of season to Tennessee, Karlyn Pickens",/story/sports/college/sooners/2025/03/30/ou-softball-vs-tennessee-finale-series-loss-oklahoma-sooners-ut-vols-karlyn-pickens/82730647007/
Oklahoma illicit marijuana market worth more than $100B,/story/news/politics/2025/03/30/oklahoma-bureau-of-narcotics-illicit-market-worth-more-than-100b/82730023007/
"Oklahoma high school track & field storylines, athletes…",/story/sports/high-school/basketball/2025/03/30/oklahoma-high-school-track-field-storylines-athletes-to-watch-2025-season/82712551007/
When do SSI recipients get their April checks? See the…,/story/money/2025/03/29/ssi-payment-check-schedule-april/80733076007/
Oklahoma HS basketball: Lenny Hatchett stepping down at…,/story/sports/high-school/basketball/2025/03/26/oklahoma-high-school-basketball-coaching-changes-2024-25/82654182007/
"OU softball schedule: Dates, times, TV channels for 2025…",/story/sports/college/sooners/2025/02/06/ou-softball-schedule-dates-times-tv-streaming-2025-oklahoma-sooners/78024860007/
"Oklahoma State softball schedule: Dates, times, TV for…",/story/sports/college/cowboys/2025/02/06/oklahoma-state-softball-schedule-dates-times-tv-streaming-2025-osu-cowgirls/78024679007/
,
Not your average mission: Coffee shop chain's expansion is personal for Oklahoma families,/story/news/2025/03/27/not-your-average-joe-coffee-oklahoma-expanding-hiring-stella-nova/80187315007/
Oklahoma illicit marijuana market worth more than $100B,/story/news/politics/2025/03/30/oklahoma-bureau-of-narcotics-illicit-market-worth-more-than-100b/82730023007/
What education bills have advanced in Oklahoma Legislature?,/story/news/politics/2025/03/30/dei-ban-more-recess-among-issues-advancing-in-oklahoma-legislature/82729506007/
Sam Presti was right about Josh Giddey in Thunder-Bulls trade,/story/sports/nba/thunder/2025/03/30/sam-presti-josh-giddey-thunder-bulls-trade-alex-caruso/82731202007/
"OU loses first series of season to Tennessee, Karlyn Pickens",/story/sports/college/sooners/2025/03/30/ou-softball-vs-tennessee-finale-series-loss-oklahoma-sooners-ut-vols-karlyn-pickens/82730647007/
OSU women's basketball adds Tyla Heard from transfer portal,/story/sports/college/cowboys/2025/03/30/oklahoma-state-women-basketball-adds-tyla-heard-transfer-portal-sister-stailee-osu-cowgirls/82731435007/
"Macy's, Kohl's, JCPenney closing stores in 29 states: What to know",/story/business/2025/03/28/macys-jcpenney-kohls-closing-100-stores-is-oklahoma-affected/82703604007/
Shake Shack to join growing list of upscale restaurants at OAK in OKC,/story/business/2025/03/27/shake-shake-opening-location-in-oklahoma-city/82690185007/
See inside Oklahoma's top 'wishlisted' Airbnb featuring a classic film theme,/story/business/real-estate/2025/03/27/airbnb-oklahoma-cabin-in-hochatown-top-wishlisted-listing/82652928007/
President Trump's actions hurt vets he pledged to support Rita Maxwell,/story/opinion/columns/guest/2025/03/30/trump-cuts-va-hurt-veterans-who-defended-nation-betrayal-contrary-to-campaign-promise/82665563007/
Want to fix our border crisis? Keep funding foreign aid. Kelly Ryan,/story/opinion/columns/guest/2025/03/29/us-foreign-aid-migrants-usaid-refugees/82709510007/
Change direction on schools; help find specialized foster parents,/story/opinion/letters/2025/03/29/wrong-direction-on-education-and-need-for-foster-parents-letters/82654612007/
Kristi Noem's Rolex draws ire: Other controversial political fashion,/story/news/politics/2025/03/30/kristi-noem-rolex-political-fashion/82731179007/
'The White Lotus': When to watch the Season 3 finale,/story/entertainment/tv/2025/03/30/white-lotus-season-3-finale/82731086007/
7.0 magnitude earthquake strikes off coast of Tonga,/story/news/world/2025/03/30/tonga-earthquake-tsunami/82730049007/
"The lowest prices on Apple AirPods Pro, Apple AirTags end soon",/story/shopping/2025/03/29/amazon-big-spring-sale-ends-soon-apple-deals/82694047007/
Ends soon: Get Disney+ and Hulu for $2.99 a month for four months,/story/shopping/2025/03/29/last-chance-disney-hulu-streaming-bundle-deal/82721166007/
16 last-chance Amazon deals you'll want in your shopping cart,/story/shopping/2025/03/30/best-last-chance-amazon-big-spring-deals/82729262007/
What to know for farmers market season in the OKC metro area,/story/lifestyle/food/2025/03/29/farmers-markets-schedules-in-okc-norman-edmond-moore/82697702007/
"Based on the classic movie, new musical 'Some Like It Hot' heading to OKC",/story/entertainment/2025/03/29/new-some-like-it-hot-musical-heads-to-okc-on-national-tour-what-to-know/82657256007/
OU museum celebrating iconic Frankoma Pottery's Norman roots in exhibit,/story/entertainment/2025/03/29/oklahomas-iconic-frankoma-pottery-company-gets-a-museum-showcase-at-ou/77087054007/
,/picture-gallery/news/religion/2025/03/30/prison-fellowship-academy-students-graduate-at-mabel-bassett/82679747007/
Enter Now!,https://usatoday.gannettcontests.com/2025-Project-Home-Improved/?itm_campaign=2025%20Project%20Home%20Improved%20Gen&itm_medium=con&itm_source=secondStreet
Enter Today!,https://usatoday.gannettcontests.com/Kansas-City-Steak-Company-Spring-SweepSteaks/?itm_campaign=Kansas%20City%20Steak%20Company%20Spring%20SweepSteaks&itm_medium=con&itm_source=secondStreet
Nominate Today!,https://oklahoman.gannettcontests.com/2025-Oklahoman-Communitys-Choice-Awards/?itm_campaign=Oklahoma%20Bob&itm_medium=con&itm_source=secondStreet
What education bills have advanced in Oklahoma Legislature?,/story/news/politics/2025/03/30/dei-ban-more-recess-among-issues-advancing-in-oklahoma-legislature/82729506007/
Hundreds attend Boren's memorial service Saturday at St. Luke's Church,/story/news/politics/government/2025/03/29/david-boren-praised-by-many-at-memorial-political-academic-skill-senator-governor-ou-president/82721508007/
OSU women's basketball adds Tyla Heard from transfer portal,/story/sports/college/cowboys/2025/03/30/oklahoma-state-women-basketball-adds-tyla-heard-transfer-portal-sister-stailee-osu-cowgirls/82731435007/
Mike Mazzei to run for Oklahoma governor in 2026,/story/news/politics/2025/03/30/mike-mazzei-joins-gentner-drummond-charles-mccall-in-26-governor-race/82729378007/
The key to UConn's win against OU? Simple. A transcendent superstar.,/story/sports/college/sooners/2025/03/30/ou-basketball-uconn-paige-bueckers-superstar-ncaa-tournament-oklahoma-sooners-aaliyah-chavez/82722837007/
,https://cm.oklahoman.com/site-feedback/?platform=Tangent-Desktop&url=https%3A%2F%2Fwww.oklahoman.com%2F&marketName=oklahoman&cta=Right-Rail
