headline,href
Is Oklahoma seeing a rise in biker gang violence?,/story/news/2024/07/25/biker-gang-violence-oklahoma-city-okc-whiskey-barrel-shooting/74327353007/
Small business owners know gradual increase to minimum wage a good thingMattece Mason,/story/opinion/columns/2024/07/28/opinion-small-business-owners-know-gradual-increase-to-oklahomas-minimum-wage-good-workers-business/74520659007/
"Sex ring operator stayed in control from prison, investigators allege",/story/news/2024/07/28/man-accused-operating-okc-sex-ring-from-vinita-ok-prison/74562482007/
State lawmaker wants another study of traffic issues in Hochatown area,/story/news/politics/government/2024/07/28/hochatown-ok-traffic-oklahoma-legislature-study-mayor-dian-jordan/74556432007/
The Oklahoman's 2025 Super 30 high school football…,/story/sports/high-school/football/2024/06/22/oklahoma-high-school-football-2025-super-30-recruiting-series/74183734007/
Oklahoma high school spring sports awards 2024 in…,/story/sports/high-school/2024/06/13/oklahoma-high-school-spring-sports-awards-2024-baseball-golf-soccer-slowpitch-tennis-track-field/74081171007/
USA vs Serbia basketball: James leads USA to 2024 Paris…,/story/sports/olympics/2024/07/28/usa-serbia-basketball-live-updates-score-highlights-2024-paris-olympics/74572985007/
Bipartisan law helped provide funding for OKC…,/story/opinion/columns/2024/07/28/opinion-mayor-david-holt-biden-harris-administration-believed-in-bipartisan-law-funds-help-okc/74458287007/
,
A look at underrated 2025 class rising stars in Oklahoma…,/story/sports/high-school/football/2024/07/28/oklahoma-high-school-football-top-under-the-radar-2025-seniors-ossaa/74511802007/
Is Oklahoma seeing a rise in biker gang violence?,/story/news/2024/07/25/biker-gang-violence-oklahoma-city-okc-whiskey-barrel-shooting/74327353007/
"Sex ring operator stayed in control from prison, investigators allege",/story/news/2024/07/28/man-accused-operating-okc-sex-ring-from-vinita-ok-prison/74562482007/
State lawmaker wants another study of traffic issues in Hochatown area,/story/news/politics/government/2024/07/28/hochatown-ok-traffic-oklahoma-legislature-study-mayor-dian-jordan/74556432007/
"Olympic gymnastics recap: Recap, highlights of Simone Biles, Team USA",/story/sports/olympics/2024/07/28/gymnastics-olympics-results-live-updates/74192925007/
USA vs Serbia basketball: James leads USA to 2024 Paris Olympics win,/story/sports/olympics/2024/07/28/usa-serbia-basketball-live-updates-score-highlights-2024-paris-olympics/74572985007/
A look at underrated 2025 class rising stars in Oklahoma HS football,/story/sports/high-school/football/2024/07/28/oklahoma-high-school-football-top-under-the-radar-2025-seniors-ossaa/74511802007/
"Gardner Tanenbaum buys Robinson Renaissance, plans more housing",/story/business/real-estate/2024/07/27/downtown-okc-robinson-renaissance-purchased-upscale-housing/74564988007/
Biden rent control plan gets renters' attention and owners' derision,/story/business/real-estate/2024/07/27/joe-biden-president-rent-control-plan-pontential-impacts-oklahoma/74430958007/
Conn's HomePlus stores are closing in Oklahoma: Where they are,/story/business/real-estate/2024/07/26/conns-homes-bankruptcy-oklahoma-store-closures-okc-tulsa/74557716007/
Small business owners know gradual increase to minimum wage a good thing Mattece Mason,/story/opinion/columns/2024/07/28/opinion-small-business-owners-know-gradual-increase-to-oklahomas-minimum-wage-good-workers-business/74520659007/
Pornhub promoted child sex abuse videos. Then she intervened. Ingrid Jacques,/story/opinion/columnist/2024/07/28/pornhub-videos-sex-trafficking-laila-mickelwait/74532636007/
Bipartisan law helped provide funding for OKC infrastructure needs David Holt,/story/opinion/columns/2024/07/28/opinion-mayor-david-holt-biden-harris-administration-believed-in-bipartisan-law-funds-help-okc/74458287007/
See the results of the latest JD Power satisfaction survey,/story/money/cars/2024/07/28/jd-power-ratings-satisfaction-survey/74579565007/
National Chicken Wing Day: Where to get free wings on Monday,/story/money/food/2024/07/28/national-chicken-wing-day-2024-deals-free/74139105007/
Hefty price tag: Starters homes are worth $1 million in 237 U.S. cities,/story/money/2024/07/28/starter-homes-worth-1-million-us-cities/74563510007/
Hearing and deaf actors join forces for retelling of 'Cinderella' in OKC,/story/entertainment/2024/07/28/cinderella-lyric-theatre-production-austin-deaf-theatre-american-sign-language/74433085007/
"'Twister' museum continues to spin up interest in films, weather",/story/lifestyle/2024/07/28/twister-movie-museum-wakita-oklahoma-twisters-2024/74342302007/
Wakita's Twister The Movie Museum still rolling,/picture-gallery/entertainment/2024/07/28/wakitas-twister-the-movie-museum-keeps-spinning-with-films-legacy/74572740007/
,/picture-gallery/entertainment/2024/07/27/olivia-rodrigo-brings-her-guts-world-tour-to-paycom-center-in-okc-in-concert/74572452007/
Crossword & Games,https://puzzles.usatoday.com/?itm_campaign=Crossword%20%26amp%3B%20Games&itm_medium=con&itm_source=secondStreet
Hearing and deaf actors join forces for retelling of 'Cinderella' in OKC,/story/entertainment/2024/07/28/cinderella-lyric-theatre-production-austin-deaf-theatre-american-sign-language/74433085007/
"'Twister' museum continues to spin up interest in films, weather",/story/lifestyle/2024/07/28/twister-movie-museum-wakita-oklahoma-twisters-2024/74342302007/
Oklahoma couple's phone software scheme took $88 million,/story/news/2024/07/28/oklahoma-couple-and-new-jersey-man-pleaded-guilty-in-phone-scheme/74579673007/
Pornhub promoted child sex abuse videos. Then she intervened.Ingrid Jacques,/story/opinion/columnist/2024/07/28/pornhub-videos-sex-trafficking-laila-mickelwait/74532636007/
"Olympic gymnastics recap: Recap, highlights of Simone Biles, Team USA",/story/sports/olympics/2024/07/28/gymnastics-olympics-results-live-updates/74192925007/
,https://cm.oklahoman.com/site-feedback/?platform=Tangent-Desktop&url=https%3A%2F%2Fwww.oklahoman.com%2F&marketName=oklahoman&cta=Right-Rail
