headline,href
Man convicted of murder in shooting of Rose State College student,/story/news/crime/2025/08/29/rose-state-college-shooting-2023-brandon-morrissette-convicted-murder/85876358007/
Oklahoma student choked unconscious in locker room video,/story/news/2025/08/29/caney-valley-student-choked-unconscious-locker-room-video-oklahoma/85893789007/
"Most Trump tariffs are illegal, appeals court rules",/story/news/politics/2025/08/29/most-trump-tariffs-are-not-legal-us-appeals-court-rules/85895611007/
Inside the world of coaches’ wives who help make HS football possible,/story/sports/high-school/football/2025/08/29/friday-night-lights-coaches-wives-help-make-oklahoma-high-school-football-possible/85833161007/
Vote: Who is Oklahoma HS football's top defensive back…,/story/sports/high-school/football/2025/08/28/vote-who-is-oklahoma-high-school-football-top-defensive-back-for-2025-season/85856660007/
Taylor Swift and Travis Kelce are getting married. Stay…,/story/opinion/columnist/2025/08/26/taylor-swift-engagement-travis-kelce/85835208007/
,
What to know about the 2025 OSU football schedule…,/story/sports/college/cowboys/2025/08/26/oklahoma-state-football-schedule-dates-times-tv-streaming-2025-osu-cowboys/85833212007/
"What to know about the 2025 OU football schedule, roster…",/story/sports/college/sooners/2025/08/26/ou-football-schedule-dates-times-tv-streaming-2025-oklahoma-sooners/85827439007/
"Oklahoma seat belt usage is just 86%, with life-altering…",/story/opinion/columns/guest/2025/08/29/oklahoma-labor-day-weekend-seatbelts-prevents-tragedies/85888422007/
Man convicted of murder in shooting of Rose State College student,/story/news/crime/2025/08/29/rose-state-college-shooting-2023-brandon-morrissette-convicted-murder/85876358007/
Oklahoma student choked unconscious in locker room video,/story/news/2025/08/29/caney-valley-student-choked-unconscious-locker-room-video-oklahoma/85893789007/
"Most Trump tariffs are illegal, appeals court rules",/story/news/politics/2025/08/29/most-trump-tariffs-are-not-legal-us-appeals-court-rules/85895611007/
Inside the world of coaches’ wives who help make HS football possible,/story/sports/high-school/football/2025/08/29/friday-night-lights-coaches-wives-help-make-oklahoma-high-school-football-possible/85833161007/
"Brent Venables contract: OU football coach salary, bonus, buyout info",/story/sports/college/sooners/2025/08/29/ou-football-brent-venables-contract-salary-buyout-details-oklahoma-sooners-coach/85895620007/
Oklahoma football coach takes salary cut of $1 million for 2025 season,/story/sports/ncaaf/sec/2025/08/29/brent-venables-oklahoma-pay-cut-contract/85893417007/
Total Wine approved to open Oklahoma store amid long legal battle,/story/business/2025/08/29/moore-liquor-store-total-wine-gets-license-from-able-commission-opening-soon/85887532007/
Oklahoma is getting another Whole Foods Market: What to know,/story/business/2025/08/29/is-whole-foods-coming-to-edmond-ok-what-to-know-about-approved-plans/85865719007/
Oklahoma National Stockyards again up for sale as buyer backs out,/story/business/agricultural/2025/08/28/oklahoma-national-stockyards-buyer-backs-out-whats-next/85859303007/
"Oklahoma seat belt usage is just 86%, with life-altering consequences Tim Gatz",/story/opinion/columns/guest/2025/08/29/oklahoma-labor-day-weekend-seatbelts-prevents-tragedies/85888422007/
"ICYMI: Ryan Walters, UCO paper were hot topics for August Viewpoints",/story/opinion/2025/08/29/ryan-walters-undocumented-students-uco-newspaper-hot-topics-august-viewpoints/85866904007/
"As John Lennon might say, let’s 'give peace a chance' in Ukraine Andy Lester",/story/opinion/columns/guest/2025/08/29/zelenskyy-trump-putin-ukraine-russia-peace-talks/85832509007/
When do SSI recipients get their September checks? See schedule,/story/money/2025/08/29/ssi-payment-check-schedule-september/85800909007/
Where will Labor Day protests take place? Here's what to know.,/story/news/politics/2025/08/29/workers-over-billionaires-protests-labor-day-locations/85866698007/
Former Cracker Barrel executive on logo change: 'Pitiful',/story/money/2025/08/29/cracker-barrel-logo-founder-tommy-lowe/85889049007/
QVC’s on-air favorites are up to 50% off for Labor Day weekend,/story/shopping/2025/08/29/shop-qvc-on-air-favorites-labor-day/85892725007/
Samsung's foldable smartphone is $300 off this Labor Day weekend,/story/shopping/2025/08/29/foldable-samsung-galaxy-z-fold7-smartphone-deal/85892551007/
Struggling to sleep? Ozlo Sleepbuds are $35 off for a limited time,https://www.usatoday.com/story/shopping/2025/08/21/ozlo-sleepbuds-back-to-school-sale/85710031007/
TSO goes on massive holiday tour,/videos/entertainment/2025/08/29/trans-siberian-orchestra-2025-holiday-tour/85894171007/
The eviction vote led to a new HOH winner on 'Big Brother' 27,/story/entertainment/television/2025/08/29/who-won-hoh-see-who-got-evicted-became-hoh-on-big-brother-thursday/85885074007/
A Texas metal band with deep Red Dirt roots readies to play Rocklahoma,/story/entertainment/2025/08/29/waves-in-april-band-rocklahoma/85813387007/
,/picture-gallery/entertainment/2025/08/29/see-photos-over-the-years-of-rentiesvilles-dusk-til-dawn-blues-festival/85862018007/
Enter Today!,https://palmbeachpost.gannettcontests.com/Ireland-US-Experience-Football-Getaway/?itm_campaign=Ireland%20US%20Experience&itm_medium=con&itm_source=secondStreet
ENTER NOW! ENTER OFTEN!,https://oklahoman.gannettcontests.com/2025-Oklahoma-State-Fair/?itm_campaign=2025%20Oklahoma%20State%20Fair%20Ultimate%20Giveaway&itm_medium=con&itm_source=secondStreet
Winners Announced!,https://oklahoman.gannettcontests.com/2025-Oklahoman-Communitys-Choice-Awards-Winners/?itm_campaign=Oklahoma%20Bob&itm_medium=con&itm_source=secondStreet
OHP responds to AG's opinion of 'unlawful' troop realignment plan,/story/news/politics/state/2025/08/29/oklahoma-highway-patrol-tulsa-ok-okc-responds-ag-drummond-opinion/85867874007/
"Brent Venables contract: OU football coach salary, bonus, buyout info",/story/sports/college/sooners/2025/08/29/ou-football-brent-venables-contract-salary-buyout-details-oklahoma-sooners-coach/85895620007/
Oklahoma football coach takes salary cut of $1 million for 2025 season,/story/sports/ncaaf/sec/2025/08/29/brent-venables-oklahoma-pay-cut-contract/85893417007/
Oklahoma high school football: Class C 2025 district previews,/story/sports/high-school/football/2025/08/29/oklahoma-high-school-football-class-c-2025-district-previews/85873804007/
Inside John Mateer's journey to OU football and 'bigger stage' of SEC,/story/sports/college/sooners/2025/08/28/ou-football-john-mateer-stats-hometown-transfer-portal-oklahoma-sooners/85807961007/
,https://cm.oklahoman.com/site-feedback/?platform=Tangent-Desktop&url=https%3A%2F%2Fwww.oklahoman.com%2F&marketName=oklahoman&cta=Right-Rail
