headline,href
Tulsa loses Supreme Court request to stall ticket ruling,/story/news/politics/government/2023/08/04/scotus-neil-gorsuch-denies-tulsa-oklahoma-request-tribal-reservation-ticketing/70531842007/
Oklahoma's tax free weekend begins Aug. 4: How to save for back-to-school,/story/news/local/2023/07/21/tax-free-weekend-oklahoma-2023-back-to-school-what-to-know/70437238007/
"Oklahoma man charged in death of ex-wife, child kidnapping",/story/news/crime/2023/08/04/chase-ainsworth-formally-charged-death-ex-wife-samatha-rose-child-stealing-okc-oklahoma/70528131007/
OKC program to divert 911 calls for illegal fireworks will continue,/story/news/2023/08/04/okc-911-illegal-fireworks-calls-diverted-successfully-city-says/70505739007/
What parents need to know for back-to-school in the OKC…,/story/news/education/2023/08/02/okc-back-to-school-oklahoma-guide-when-does-school-start-tax-free-weekend-vaccines/70439474007/
Coming soon: The Oklahoman's Public Eye is looking out…,/story/news/local/2023/07/27/the-oklahoman-okc-public-eye-how-to-submit-problem/70464561007/
What history tells us about Gundy & OSU quarterback…,/story/sports/college/cowboys/2023/08/04/oklahoma-state-football-mike-gundy-osu-quarterback-competitions-alan-bowman-garret-rangel/70522004007/
9 things these Oklahoma City podcasters have 'had it'…,/story/lifestyle/2023/08/04/ive-had-it-podcast-top-9-moments-okc/70523698007/
,
"Longtime arts, nature supporter William 'Bill' Kerr dies",/story/news/state/2023/08/03/july-4-passing-of-william-bill-kerr-robert-s-kerrs-son-leaves-void-in-support-for-arts-nature/70521486007/
Tulsa loses Supreme Court request to stall ticket ruling,/story/news/politics/government/2023/08/04/scotus-neil-gorsuch-denies-tulsa-oklahoma-request-tribal-reservation-ticketing/70531842007/
Oklahoma's tax free weekend begins Aug. 4: How to save for back-to-school,/story/news/local/2023/07/21/tax-free-weekend-oklahoma-2023-back-to-school-what-to-know/70437238007/
"Oklahoma man charged in death of ex-wife, child kidnapping",/story/news/crime/2023/08/04/chase-ainsworth-formally-charged-death-ex-wife-samatha-rose-child-stealing-okc-oklahoma/70528131007/
What history tells us about Gundy & OSU quarterback competitions,/story/sports/college/cowboys/2023/08/04/oklahoma-state-football-mike-gundy-osu-quarterback-competitions-alan-bowman-garret-rangel/70522004007/
A look at underrated senior rising stars in Oklahoma HS football,/story/sports/high-school/football/2023/08/03/oklahoma-high-school-football-top-under-the-radar-seniors-in-ossaa/70509716007/
Pac-12 Conference's demise is a sad day in collegiate athletics,/story/sports/columns/berry-tramel/2023/08/04/pac-12-demise-sad-day-collegiate-athletics-washington-oregon-big-ten-move/70532382007/
Local investors pay millions for Memorial Square in north OKC,/story/business/real-estate/2023/08/04/mazaheri-properties-buys-retail-power-centers-in-okc-fort-worth-texas-marshalls-p-f-changs-qdoba/70498649007/
Yellow Corp.'s idled orange trucks first took off in OKC in 1924 — now they've shut down,/story/business/real-estate/2023/08/03/yellow-corp-trucking-company-okc-shuts-down-200-jobs-lost/70504884007/
What's driving a potential renaissance in OKC's Historic Capitol Hill,/story/business/local/2023/07/30/okc-historic-capitol-hill-calle-dos-cinco-history-revitalization/70411642007/
"College student: Unplugging meant peaceful chores, quiet drives MaryAnne Whetstone",/story/opinion/2023/08/04/college-student-simple-yardwork-gave-her-mind-and-emotions-a-break/70495424007/
Pinnell: We need to focus on increasing Oklahoma’s labor force Matt Pinnell,/story/opinion/2023/08/04/guest-we-can-build-strong-workforce-by-showcasing-oklahoma-to-world/70524763007/
"This year, let us stop and take it all in, Ferris Bueller style Rodney ""Lj"" Littlejohn",/story/opinion/2023/08/04/ferris-bueller-reminds-us-life-moves-quickly-stop-and-take-it-all-in/70495301007/
How to avoid bed bugs on vacation and what to do if you take them home,/story/travel/2023/08/04/bedbug-signs-size-prevention-tips/70290606007/
Video game console giveaway spawns massive crowd in New York,/story/news/nation/2023/08/04/kai-cenat-twitch-streamer-playstation-giveaway-sparks-melee/70532109007/
Here's where Mega Millions jackpot winners can collect anonymously,/story/news/nation/2023/08/04/anonymous-lottery-states/70531258007/
Meet the unapologetic OKC friends behind the hit podcast 'I've Had It',/story/lifestyle/2023/08/04/ive-had-it-podcast-tour-2023-oklahoma-ties-jennifer-welch-angie-pumps-sullivan/70487205007/
"Hope is Alive marks 10 years of helping others with event, concert",/story/lifestyle/2023/08/04/hope-is-alive-ministries-okc-10-year-celebration-of-hope-sobriety/70438324007/
9 things these Oklahoma City podcasters have 'had it' with,/story/lifestyle/2023/08/04/ive-had-it-podcast-top-9-moments-okc/70523698007/
,/picture-gallery/news/2023/08/03/oklahoma-city-united-methodist-church-project-transformation-day-camp/70466515007/
Enter Today!,https://oklahoman.gannettcontests.com/OKCMOA-Auguste-Rodin-Exhibitition-Giveaway/?itm_campaign=OCKMOA%20Rodin%20Exihbition&itm_medium=con&itm_source=secondStreet
Enter Now!,https://health.truecoverage.site/?itm_campaign=TrueCoverage&itm_medium=con&itm_source=secondStreet
Enter to WIN!,https://oklahoman.gannettcontests.com/Jellystone-Park-Wichita-Falls-2-Night-Luxury-Glamping-Giveaway/?itm_campaign=Jellystone%20Park%20Wichita%20Falls&itm_medium=con&itm_source=secondStreet
Local investors pay millions for Memorial Square in north OKC,/story/business/real-estate/2023/08/04/mazaheri-properties-buys-retail-power-centers-in-okc-fort-worth-texas-marshalls-p-f-changs-qdoba/70498649007/
Meet the unapologetic OKC friends behind the hit podcast 'I've Had It',/story/lifestyle/2023/08/04/ive-had-it-podcast-tour-2023-oklahoma-ties-jennifer-welch-angie-pumps-sullivan/70487205007/
How the Clara Luper Institute empowers OKC teachers to give students agency,/story/news/education/2023/08/04/clara-luper-institute-okc-oklahoma-empowers-teachers/70469223007/
"Hope is Alive marks 10 years of helping others with event, concert",/story/lifestyle/2023/08/04/hope-is-alive-ministries-okc-10-year-celebration-of-hope-sobriety/70438324007/
Yellow Corp.'s idled orange trucks first took off in OKC in 1924 — now they've shut down,/story/business/real-estate/2023/08/03/yellow-corp-trucking-company-okc-shuts-down-200-jobs-lost/70504884007/
,https://cm.oklahoman.com/site-feedback/?platform=Tangent-Desktop&url=https%3A%2F%2Fwww.oklahoman.com%2F&marketName=oklahoman&cta=Right-Rail
