headline,href
How Oklahoma lawmakers ended a two-month education gridlock in 8 hours,/story/news/state/2023/05/21/oklahoma-legislature-teacher-pay-school-vouchers-how-lawmakers-reached-deal/70228929007/
The journey to James Beard finalist: Chef Andrew Black,/story/lifestyle/food/2023/05/21/grey-sweater-okc-meet-chef-andrew-black-james-beard-finalist/70180273007/
'Picasso of Native American art' Benjamin Harjo Jr. dies,/story/entertainment/2023/05/20/prominent-oklahoma-native-american-artist-benjamin-harjo-jr-dies/70240000007/
OU softball embraced grieving girl after the Moore tornado in 2013. Both were changed.,/story/sports/college/sooners/2023/05/20/ou-softball-forged-bond-with-casey-angle-after-2013-moore-tornado/70238535007/
The journey to James Beard finalist: Chef Jeff…,/story/lifestyle/food/2023/05/21/ma-der-lao-kitchen-okc-james-beard-finalist-meet-chef-jeff-chanchaleune/70180467007/
"2023 NCAA softball tournament: Schedule, bracket, times…",/story/sports/college/softball/2023/05/14/2023-ncaa-softball-tournament-schedule-bracket-wcws-okc/70217042007/
Big 12 basketball coaches endorse Brett Yormark's bold…,/story/sports/college/big-12/2023/05/21/big-12-basketball-coaches-readily-endorse-commissioner-brett-yormark/70239368007/
"'Hamilton' returns, giving more OKC fans a shot at the…",/story/entertainment/2023/05/21/hamilton-returns-giving-more-okc-fans-a-shot-at-the-hit-musical/70225506007/
,
"Big 12 baseball tournament 2023: Schedule, bracket, game…",/story/sports/college/big-12/2023/05/20/big-12-baseball-tournament-2023-schedule-bracket-times-tv-streaming/70240399007/
How Oklahoma lawmakers ended a two-month education gridlock in 8 hours,/story/news/state/2023/05/21/oklahoma-legislature-teacher-pay-school-vouchers-how-lawmakers-reached-deal/70228929007/
"Mexican, Oklahoma leaders celebrate Mexican consulate opening in OKC",/story/news/2023/05/20/oklahoma-citys-mexican-consulate-now-open-for-business/70239656007/
Photos: Mexican consulate opens in Oklahoma,/picture-gallery/news/2023/05/20/photos-mexican-consulate-opens-oklahoma/11918830002/
OU softball embraced grieving girl after the Moore tornado in 2013. Both were changed.,/story/sports/college/sooners/2023/05/20/ou-softball-forged-bond-with-casey-angle-after-2013-moore-tornado/70238535007/
Cowboys crush Sooners to claim share of Big 12 baseball crown,/story/sports/college/big-12/2023/05/20/ou-vs-osu-score-bedlam-baseball-updates-highlights-sooners-oklahoma-state-cowboys-big-12/70239402007/
"OU routs Missouri to reach NCAA regional final, push win streak to 45",/story/sports/college/sooners/2023/05/20/ou-vs-missouri-softball-score-updates-highlights-ncaa-tournament-oklahoma-sooners/70239529007/
"OKC and Tulsa apartments, for the money, are a lot bigger than most",/story/business/real-estate/2023/05/20/okc-tulsa-oklahoma-rent-apartment-space-rentcafe/70224475007/
"JackBe's second location, in Edmond, is also company headquarters",/story/business/2023/05/19/jackbe-okc-edmond-oklahoma-drive-thru-grocery-innovation/70228619007/
Nonprofit offering legal help for renters facing in eviction in two OKC zip codes,/story/business/real-estate/2023/05/17/okc-renters-facing-eviction-legal-help-right-to-council-nonprofit-legal-aid-services-oklahoma/70218633007/
"Henryetta parents, readers respond to question about sleepovers",/story/opinion/2023/05/20/henryetta-parents-readers-respond-to-question-about-sleepovers/70223048007/
"Letters to the editor for May 21, 2023",/story/opinion/2023/05/20/letters-to-the-editor-immigration-a-historic-school-chilly-brunches/70202788007/
Guest: Wondering if you're making a difference? Seek out a nonprofit Marnie Taylor,/story/opinion/2023/05/19/working-to-make-a-difference-not-only-changes-th-does-more-than-change-the-world-it-changes-you-too/70207794007/
The journey to James Beard finalist: Chef Andrew Black,/story/lifestyle/food/2023/05/21/grey-sweater-okc-meet-chef-andrew-black-james-beard-finalist/70180273007/
Meet the two James Beard finalists putting Oklahoma in the culinary spotlight,/story/lifestyle/food/2023/05/21/okc-chefs-andrew-black-jeff-chanchaleune-vying-james-beard-award-putting-oklahoma-culinary-map/70225414007/
The journey to James Beard finalist: Chef Jeff Chanchaleune,/story/lifestyle/food/2023/05/21/ma-der-lao-kitchen-okc-james-beard-finalist-meet-chef-jeff-chanchaleune/70180467007/
,/picture-gallery/sports/college/sooners/2023/05/20/ou-softball-reaches-regional-final-after-beating-missouri-photos/11920233002/
Enter Now!,https://health.truecoverage.site/?itm_campaign=TrueCoverage&itm_medium=con&itm_source=secondStreet
Winners Announced!,https://cdn.gatehousemedia.com/gh-sites/global/ads/contests/winners/2023SpringHomeMakeover_WINNERAD__494x10_newlogo.pdf?itm_campaign=2023%20Spring%20Home%20Winners&itm_medium=con&itm_source=secondStreet
Cowboys crush Sooners to claim share of Big 12 baseball crown,/story/sports/college/big-12/2023/05/20/ou-vs-osu-score-bedlam-baseball-updates-highlights-sooners-oklahoma-state-cowboys-big-12/70239402007/
"OU routs Missouri to reach NCAA regional final, push win streak to 45",/story/sports/college/sooners/2023/05/20/ou-vs-missouri-softball-score-updates-highlights-ncaa-tournament-oklahoma-sooners/70239529007/
"Kilfoyl, OSU shut out Wichita State, advance to NCAA regional final",/story/sports/college/cowboys/2023/05/20/oklahoma-state-vs-wichita-state-score-ncaa-softball-tournament-updates-highlights-cowgirls-shockers/70239462007/
Former Sooner TaShawn Thomas knows all about Victor Wembanyama,/story/sports/nba/thunder/2023/05/19/victor-wembanyama-nba-draft-2023-metropolitans-92-tashawn-thomas-ou-sooners-basketball/70230635007/
Meet the two James Beard finalists putting Oklahoma in the culinary spotlight,/story/lifestyle/food/2023/05/21/okc-chefs-andrew-black-jeff-chanchaleune-vying-james-beard-award-putting-oklahoma-culinary-map/70225414007/
,https://cm.oklahoman.com/site-feedback/?platform=Tangent-Desktop&url=https%3A%2F%2Fwww.oklahoman.com%2F&marketName=oklahoman&cta=Right-Rail
