headline,href
CHAPTER SIXLive updates from Thunder vs Spurs in Game 6 of West finalsShai Gilgeous-Alexander and the OKC Thunder will travel to face Victor Wembanyama and the San Antonio Spurs in Game 6 of the Western Conference finals.,/story/sports/nba/thunder/2026/05/28/thunder-spurs-score-live-updates-nba-playoffs-game-6-western-conference-finals-injury-report-wcf/90290622007/
Jalen Williams available for Thunder vs Spurs in Game 6 of West finals,/story/sports/nba/thunder/2026/05/28/jalen-williams-injury-update-thunder-spurs-nba-playoffs-game-6-wcf/90304274007/
OKC Thunder vs San Antonio Spurs in Game 6 of NBA Western Conference finals,/picture-gallery/sports/nba/thunder/2026/05/28/okc-thunder-vs-san-antonio-spurs-game-6-nba-western-conference-finals/90304109007/
Ajay Mitchell injury update for Thunder-Spurs Game 6 of NBA Playoffs,/story/sports/nba/thunder/2026/05/28/ajay-mitchell-injury-update-calf-thunder-spurs-nba-playoffs-game-6-wcf/90299166007/
Brent Swadley found guilty in fraud trial,/story/news/crime/2026/05/28/jury-reaches-guity-verdict-in-brent-swadleys-fraud-trial/90298998007/
Oklahoma church brings Thunder spirit to Sunday service,/story/news/2026/05/28/nba-playoffs-2026-okc-thunder-shirt-giveaway-acts-2-united-methodist-church/90268284007/
New details emerge in wrong-way driving case as DA's office makes charges,/story/news/crime/2026/05/28/canadian-county-da-charges-wrong-way-driver-in-yukon-collision-with-murder/90299316007/
Tulsa's prosecution agreement with tribe voided by Oklahoma court,/story/news/tribes/2026/05/28/oklahoma-court-voids-tulsa-prosecution-agreement-with-muscogee-nation/90300302007/
USA TODAY Sports Network 2026 NCAA softball All-American…,/story/sports/college/softball/2026/05/28/usa-today-sports-network-2026-ncaa-softball-all-american-awards/90261809007/
"Nebraska softball vs Arkansas live updates, score…",/story/sports/nba/thunder/2026/05/28/nebraska-arkansas-score-updates-ncaa-softball-today-womens-college-world-series-wcws-game-4/90304905007/
The secret behind Josh Holliday's success at OSU…,/story/sports/college/cowboys/2026/05/28/oklahoma-state-baseball-consistency-coach-josh-holliday-ncaa-tuscaloosa-regional/90295901007/
,
Tulsa's Admiral Twin Drive-In marks 75 years with…,/story/entertainment/movies/2026/05/28/admiral-twin-drive-in-tulsa-ok-celebrates-75-years/90298028007/
"Tennessee vs Texas highlights: Morrison, Vols upset…",/story/sports/college/softball/2026/05/28/texas-tennessee-score-updates-ncaa-softball-today-womens-college-world-series-wcws-game-2/90297721007/
News,/news/
Brent Swadley found guilty in fraud trial,/story/news/crime/2026/05/28/jury-reaches-guity-verdict-in-brent-swadleys-fraud-trial/90298998007/
Oklahoma church brings Thunder spirit to Sunday service,/story/news/2026/05/28/nba-playoffs-2026-okc-thunder-shirt-giveaway-acts-2-united-methodist-church/90268284007/
New details emerge in wrong-way driving case as DA's office makes charges,/story/news/crime/2026/05/28/canadian-county-da-charges-wrong-way-driver-in-yukon-collision-with-murder/90299316007/
Sports,/sports/
Live updates from Thunder vs Spurs in Game 6 of West finals,/story/sports/nba/thunder/2026/05/28/thunder-spurs-score-live-updates-nba-playoffs-game-6-western-conference-finals-injury-report-wcf/90290622007/
Alabama vs UCLA highlights: Brooke Wells' HR lifts Crimson Tide in WCWS,/story/sports/college/softball/2026/05/28/ucla-alabama-score-updates-ncaa-softball-today-womens-college-world-series-wcws-game-3/90302274007/
"Carlson: Texas Tech is the WCWS villain, and it's having fun in role",/story/sports/college/softball/2026/05/28/texas-tech-softball-wcws-schedule-matador-club-ttu-red-raiders/90299845007/
Life,/life/
Tulsa's Admiral Twin Drive-In marks 75 years with special events,/story/entertainment/movies/2026/05/28/admiral-twin-drive-in-tulsa-ok-celebrates-75-years/90298028007/
Tulsa Admiral Twin Drive-In turns 75. Look back on its history,/picture-gallery/entertainment/movies/2026/05/28/tulsa-admiral-twin-drive-in-turns-75-history/90298502007/
See the Route 66 boot monument being installed in Oklahoma City,/picture-gallery/entertainment/arts/2026/05/27/route-66-monument-cowboy-western-heritage-museum-boot-sculpture-photos/90278453007/
Business,/business/
"Oklahoma business leaders want education spending over tax cuts, poll shows",/story/business/economy/2026/05/27/oklahoma-business-leaders-poll-shows-desire-education-spending-over-tax-cuts/90263823007/
Oklahoma business leaders back education funding in new poll,/videos/business/employment/2026/05/27/oklahoma-business-leaders-say-they-want-education-funding-over-tax-cuts/90267554007/
Three Guthrie downtown buildings will be sold at auction,/story/business/real-estate/2026/05/25/three-historic-buildings-in-guthrie-are-up-for-tax-auction/90118059007/
Opinion,/opinion/
"In Oklahoma, state testing should only be used for diagnostic purposes John Thompson",/story/opinion/columns/guest/2026/05/28/oklahoma-needs-to-stop-investing-so-much-in-test-prep-opinion/90268219007/
"AI here to stay, but not in my backyard, many say",/story/opinion/letters/2026/05/28/nimby-sentiment-returns-need-for-big-data-centers-makes-ai-a-mixed-blessing-letters/90247563007/
Democracy requires participation. Vote June 16,/story/opinion/editorials/2026/05/28/vote-june-16-lets-improve-our-low-primary-election-participation-oeta-minimum-wage-editorial/90266987007/
Trending,https://www.usatoday.com/news/trending/
A mogul is buying a Vegas icon. What to know about the $17.6B deal,/story/money/2026/05/28/tilman-fertitta-caesars-entertainment-deal-agreement/90299436007/
Doctors deliver baby gorilla via rare emergency C-section. See photos,/story/pets-animals/wildlife/2026/05/28/baby-gorilla-emergency-c-section-photos/90293695007/
"Dana White says UFC White House event is patriotic, not political",/story/news/politics/2026/05/28/dana-white-white-house-event-patriotic-political/90285186007/
Your Daily PLAY,https://play.usatoday.com/
Can You Crack Every Clue in Today’s Crossword Puzzle?,https://play.usatoday.com/crossword
Stumped? Get your clue to the USA Today Daily Crossword!,/story/entertainment/puzzles/crosswords/2026/05/28/attempt-crossword-clue/90291021007/
Need a news break? USA TODAY's PLAY has what you need.,/story/entertainment/2025/11/25/puzzles-games-horoscopes-usa-today-play/87454927007/
Shopping,/shopping/
Get help from anywhere in the world with Travelzoo's newest hotline,/story/shopping/deals/travel/2026/05/28/travelzoo-travel-enthusiast-hotline-2026/90305727007/
Think your mattress is clean? A UV bed vacuum can tell you (75% off),/story/shopping/deals/home/mattresses/2026/05/28/mattress-vacuum-cleaner-amazon-deal/90298864007/
Millie Bobby Brown drops $20 moisturizer for 'pineapple whip summer',/story/shopping/entertainment/celebrity/2026/05/28/millie-bobby-brown-pineapple-whipped-moisturizer/90299292007/
,/picture-gallery/sports/college/softball/womens-college-world-series/2026/05/28/ucla-vs-alabama-ncaa-softball-womens-college-world-series-game-3-photos/90262910007/
ENTER NOW,https://www.oattravel.com/marketing/giveaway?itm_campaign=Overseas%20Adventure%20Travel&itm_medium=con&itm_source=secondStreet
ENTER — A CRUISE FOR 2!,https://usatoday.gannettcontests.com/Victory-Cruise-Lines-Discover-the-Great-Lakes/?itm_campaign=Victory%20Cruises%20Getaway&itm_medium=con&itm_source=secondStreet
ENTER NOW,https://usatoday.gannettcontests.com/Bourbon--Beyond-VIP-Fly-Away-Prize-Package-2026/?itm_campaign=Bourbon%20and%20Beyond%202026&itm_medium=con&itm_source=secondStreet
Alabama vs UCLA highlights: Brooke Wells' HR lifts Crimson Tide in WCWS,/story/sports/college/softball/2026/05/28/ucla-alabama-score-updates-ncaa-softball-today-womens-college-world-series-wcws-game-3/90302274007/
"Carlson: Texas Tech is the WCWS villain, and it's having fun in role",/story/sports/college/softball/2026/05/28/texas-tech-softball-wcws-schedule-matador-club-ttu-red-raiders/90299845007/
"Drummond sues Stitt, PAC spenders over alleged 'smear campaign'",/story/news/politics/2026/05/28/gentner-drummond-lawsuit-kevin-stitt-school-freedom-fund-oklahoma-attack-ads/90295086007/
"Trump's $1.776 billion settlement a 'fraud,' retired judges say",/story/news/courts/2026/05/28/trump-slush-fund-lawsuit-retired-judges-lawsuit-robert-henry/90295929007/
"WCWS scores, bracket, TV schedule for 2026 NCAA softball tournament",/story/sports/college/softball/2026/05/28/wcws-scores-tv-channel-bracket-schedule-ncaa-softball-tournament/90290960007/
,https://cm.oklahoman.com/site-feedback/?platform=Tangent-Desktop&url=https%3A%2F%2Fwww.oklahoman.com%2F&marketName=oklahoman&cta=Right-Rail
