headline,href
"Winter storm updates: Snow ending, but ice and frigid temps persist Sunday",/story/weather/2026/01/25/live-okc-weather-forecast-snow-oklahoma-winter-storm-updates/88301368007/
Which transfers will have the biggest impact for OSU football?,/story/sports/college/cowboys/2026/01/25/oklahoma-state-football-transfer-portal-additions-biggest-impact-2026-season-osu-cowboys/88270890007/
Oklahoma clergy recount what they witnessed in Minneapolis,/story/news/2026/01/25/minneapolis-protests-renee-nicole-good-okc-clergy-visit/88244069007/
OK-based USA Rare Earth gets $1.6B investment from US,/story/business/local/2026/01/25/oklahomas-usa-rare-earth-to-get-1-6b-from-us-government/88344755007/
"What OU football's Brent Venables, others said about AD…",/story/sports/college/sooners/2026/01/25/what-ou-football-brent-venables-bob-stoops-joe-castiglion-said-about-ad-roger-denny-oklahoma-sooners/88345022007/
Vote: Landmark Fine Homes HS girls athlete of week for…,/story/sports/high-school/athlete-of-the-week/2026/01/20/vote-landmark-fine-homes-oklahoma-high-school-girls-athlete-of-week-jan-12-18/88255164007/
Vote: Landmark Fine Homes HS boys athlete of week for…,/story/sports/high-school/athlete-of-the-week/2026/01/20/vote-landmark-fine-homes-oklahoma-high-school-boys-athlete-of-week-jan-12-18/88255238007/
"OSU football transfer portal tracker: Who's in, who's…",/story/sports/college/cowboys/2026/01/16/oklahoma-state-football-transfer-portal-tracker-live-updates-2026-osu-cowboys-roster/88218188007/
"OU football transfer portal tracker: Who's in, who's out…",/story/sports/college/sooners/2026/01/16/ou-football-transfer-portal-tracker-live-updates-2026-oklahoma-sooners-roster/88198365007/
,
News,/news/
"Winter storm updates: Snow ending, but ice and frigid temps persist Sunday",/story/weather/2026/01/25/live-okc-weather-forecast-snow-oklahoma-winter-storm-updates/88301368007/
Oklahoma clergy recount what they witnessed in Minneapolis,/story/news/2026/01/25/minneapolis-protests-renee-nicole-good-okc-clergy-visit/88244069007/
"Stitt reflects on his last year, his legacy and what comes next",/story/news/politics/2026/01/25/gov-kevin-stitt-on-his-last-year-his-legacy-and-disagreeing-with-trump/88064392007/
Sports,/sports/
Which transfers will have the biggest impact for OSU football?,/story/sports/college/cowboys/2026/01/25/oklahoma-state-football-transfer-portal-additions-biggest-impact-2026-season-osu-cowboys/88270890007/
"What OU football's Brent Venables, others said about AD Roger Denny",/story/sports/college/sooners/2026/01/25/what-ou-football-brent-venables-bob-stoops-joe-castiglion-said-about-ad-roger-denny-oklahoma-sooners/88345022007/
How Edmond Memorial swimmer Max Spory became a swimming phenom,/story/sports/high-school/swimming-diving/2026/01/25/oklahoma-high-school-boys-swimming-edmond-memorial-max-spory-autistic/88290157007/
Life,/life/
Winter Storm Fern cancels OKC shows on Disney's 'Beauty and the Beast' tour,/story/entertainment/2026/01/24/winter-storm-cancels-okc-shows-on-disneys-beauty-and-beast-national-tour/88016835007/
"From book signings to 'Blind Dates,' check out these Oklahoma events",/story/lifestyle/2026/01/25/oklahoma-book-events-books-author-signings-new-releases/88266985007/
OU dinosaur fossil helps 'Jurassic World Rebirth' get Oscar nomination,/story/entertainment/2026/01/24/oklahoma-fossil-helped-jurassic-world-rebirth-nab-oscar-nomination/88330320007/
Business,/business/
OK-based USA Rare Earth gets $1.6B investment from US,/story/business/local/2026/01/25/oklahomas-usa-rare-earth-to-get-1-6b-from-us-government/88344755007/
Oklahoma power grid operator plans to expedite connecting some data centers,/story/business/2026/01/23/oklahoma-data-centers-power-grid-connection-southwest-power-pool/88318978007/
New owners of OKC indoor sports facility prepare for next tenant,/story/business/real-estate/2026/01/22/former-indoor-soccer-facility-in-oklahoma-city-sells-for-4-12-million/88304844007/
Opinion,/opinion/
Task force's work will loom large for employees with disabilities Sen. Julia Kirt and Rep. Ellyn Hefner,/story/opinion/columns/guest/2026/01/25/big-questions-ahead-for-oklahoma-workers-with-disabilities/88273332007/
Big Tech will swap humans for AI within years – if we let them David Krueger,/story/opinion/2026/01/24/ai-chip-manufacturing-data-centers-humanity/88215945007/
Oklahoma needs a different teaching strategy to fix reading struggles John Thompson,/story/opinion/columns/guest/2026/01/23/new-teaching-methods-needed-to-improve-reading-skills-test-driven-instruction-should-be-rejected/88288848007/
Trending,https://www.usatoday.com/news/trending/
PETA wants to replace Groundhog Day's Phil with 3D hologram,/story/news/nation/2026/01/25/petas-punxsutawney-phil-hologram-groundhog-day/88321416007/
Check the winning numbers for Saturday's Powerball drawing,/story/money/lottery/2026/01/24/powerball-winning-numbers-saturday-january-24-2026/88327101007/
Mega Millions winning numbers for Jan. 23 drawing: $266M jackpot,/story/money/lottery/2026/01/23/mega-millions-winning-numbers-january-23-jackpot-drawing/88309182007/
Shopping,/shopping/
Get your Olivia Dean 2026 concert tickets before they're gone,/story/shopping/2026/01/24/olivia-dean-concert-tickets-how-to-buy-the-art-of-loving-live-tour/88289096007/
This might be the best birthday party idea for adults this winter,https://www.usatoday.com/story/shopping/2026/01/10/five-iron-golf-simulator-play-practice-party/88110579007/
Save big at Mattress Firm's Presidents Day sale now,/story/shopping/2026/01/24/mattress-firm-presidents-day-sale/88338295007/
,/picture-gallery/sports/college/sooners/2026/01/24/oklahoma-sooners-vs-missouri-tigers-in-sec-mens-basketball-game/88339969007/
Winners Announced!,https://media.secondstreetapp.com/7272236?itm_campaign=2025%20Wish%20and%20Win%20Winners!&itm_medium=con&itm_source=secondStreet
Nominate Today!,https://www.profootballhof.com/news/2025/09/pro-football-hall-of-fame-awards-of-character-recognize-extraordinary-individuals/?utm_source=Localiq&utm_medium=promo&utm_campaign=awards&&itm_campaign=PFHOF%20Awards%20of%20Character&itm_medium=con&itm_source=secondStreet
Vote Each Week!,https://www.oklahoman.com/sports/high-school/?itm_campaign=Athlete%20of%20the%20Week%20Landmark%20OKC&itm_medium=con&itm_source=secondStreet
"Stitt reflects on his last year, his legacy and what comes next",/story/news/politics/2026/01/25/gov-kevin-stitt-on-his-last-year-his-legacy-and-disagreeing-with-trump/88064392007/
Winter Storm Fern cancels OKC shows on Disney's 'Beauty and the Beast' tour,/story/entertainment/2026/01/24/winter-storm-cancels-okc-shows-on-disneys-beauty-and-beast-national-tour/88016835007/
"Winter storm blankets OKC with snow, dangerously cold temperatures remain",/story/news/2026/01/24/winter-storm-brings-snow-sleet-ice-danger-to-oklahoma-more-to-come/88305221007/
"Oklahoma hit snow, ice and wind in extreme winter storm, see photos",/picture-gallery/weather/2026/01/23/snow-storm-2026-weather-ok-oklahoma-city-okc-photos/88317078007/
Help us honor 250 women who shaped the United States,/story/news/local/2026/01/20/usa-today-women-who-shaped-the-nation-nomination-form-oklahoma-city/88264855007/
,https://cm.oklahoman.com/site-feedback/?platform=Tangent-Desktop&url=https%3A%2F%2Fwww.oklahoman.com%2F&marketName=oklahoman&cta=Right-Rail
