headline,href
Shai Gilgeous-Alexander selected starter for 2025 NBA All-Star Game,/story/sports/nba/thunder/2025/01/23/nba-all-star-game-starters-shai-gilgeous-alexander-okc-thunder/77913431007/
Gundy addresses 'most difficult December' as OSU football coach,/story/sports/college/cowboys/2025/01/23/oklahoma-state-football-mike-gundy-osu-cowboys-coaching-staff-todd-grantham-doug-meacham/77894410007/
Judge criticizes Trump over pardons in Oklahoman's Jan. 6 case,/story/news/2025/01/23/federal-judges-on-oklahomans-case-criticizes-trump-and-pardons/77869213007/
"Pharmacy staff shortages, erratic hours are putting Oklahomans at risk",/story/business/2025/01/23/walgreens-oklahoma-cvs-lead-local-pharmacy-staff-shortages-oklahoma/77045463007/
Oklahoma HS basketball: Takeaways from opening day of…,/live-story/sports/high-school/basketball/2025/01/23/oklahoma-high-school-basketball-scores-results-opening-day-tournaments/77911386007/
Judge blocks Trump's birthright citizenship executive…,/story/news/politics/elections/2025/01/23/judge-blocks-trump-birthright-order/77908147007/
Oscar 2025: See the full list of Academy Award nominees,/story/entertainment/movies/2025/01/23/oscar-nominations-2025-list/77850102007/
Vote: Landmark Fine Homes girls HS athlete of the week…,/story/sports/high-school/2025/01/20/vote-landmark-fine-homes-girls-high-school-athlete-of-the-week-jan-13-19/77734854007/
Vote for Landmark Fine Homes boys athlete of the week…,/story/sports/high-school/2025/01/20/vote-landmark-fine-homes-boys-high-school-athlete-of-the-week-jan-13-19/77837957007/
,
Judge criticizes Trump over pardons in Oklahoman's Jan. 6 case,/story/news/2025/01/23/federal-judges-on-oklahomans-case-criticizes-trump-and-pardons/77869213007/
"Oklahomans to see new medical marijuana licensing, inspection software",/story/news/politics/2025/01/23/oklahomans-to-see-new-medical-marijuana-licensing-inspection-software/77880360007/
Judge blocks Trump's birthright citizenship executive order,/story/news/politics/elections/2025/01/23/judge-blocks-trump-birthright-order/77908147007/
Shai Gilgeous-Alexander selected starter for 2025 NBA All-Star Game,/story/sports/nba/thunder/2025/01/23/nba-all-star-game-starters-shai-gilgeous-alexander-okc-thunder/77913431007/
Gundy addresses 'most difficult December' as OSU football coach,/story/sports/college/cowboys/2025/01/23/oklahoma-state-football-mike-gundy-osu-cowboys-coaching-staff-todd-grantham-doug-meacham/77894410007/
SGA or Jokic? Who has the edge in midseason NBA MVP race?,/story/sports/nba/thunder/2025/01/23/okc-thunder-shai-gilgeous-alexander-2024-25-nba-mvp-midseason-nikola-jokic-denver-nuggets/77884243007/
"Pharmacy staff shortages, erratic hours are putting Oklahomans at risk",/story/business/2025/01/23/walgreens-oklahoma-cvs-lead-local-pharmacy-staff-shortages-oklahoma/77045463007/
Sen. Lankford says monopolies are 'a killer' for rural pharmacies,/story/business/2025/01/23/oklahoma-pharmacy-rural-towns-senator-james-lankford-benefit-managers/77452232007/
"OKC's housing, downtown retail, entertainment to grow, panel reveals",/story/business/2025/01/23/okcs-housing-retail-entertainment-options-to-grow-panel-reveals/77888180007/
"After one-arm salute, Musk doubles down with Nazi jokes. Too far yet? Rex Huppke",/story/opinion/columnist/2025/01/23/elon-musk-nazi-jokes-gesture-adl/77893432007/
"Trump, GOP attack bishop. Guess they missed something in Bible study. Rex Huppke",/story/opinion/columnist/2025/01/23/trump-response-bishop-budde-fox-news/77881230007/
What's in a name? You can decide for OKC soccer professional team Court Jeske,/story/opinion/columns/2025/01/23/okc-soccer-new-professional-team-name-ideas/77850267007/
Big Lots: What locations are for sale? Here's the list.,/story/money/2025/01/23/big-lots-stores-closing-bankruptcy-for-sale/77904541007/
California wildfires prompt more evacuations: See maps,/story/news/nation/2025/01/23/fires-evacuation-map-california-hughes-palisades-laguna/77901393007/
Teen girls arrested in connection to the 'heinous' murder of 13-year-old,/story/news/nation/2025/01/23/kaniyah-baker-murder-teen-girls-arrested/77899662007/
Target's new Stanley Tumblers are already selling out: Shop colorful hues and Valentine's Day drops,/story/shopping/2025/01/23/stanley-tumblers-at-target/77911719007/
Cheapest ticket price for the NFL's Conference Championship games?,/story/shopping/2025/01/23/eagles-commanders-nfc-championship-game-ticket-prices-chiefs-bills-afc-championship-ticket-prices/77904159007/
"😻Your pet will love the Valentine's Day toys, treats, outfits and more at Chewy",/story/shopping/2025/01/23/chewy-valentines-day-shop/77904683007/
Oscar 2025: See the full list of Academy Award nominees,/story/entertainment/movies/2025/01/23/oscar-nominations-2025-list/77850102007/
Pioneering Oklahoma disc jockey Dale Wehba dies,/story/entertainment/2025/01/23/dale-wehba-okc-rock-radio-dj-dies/77867750007/
'Duck Dynasty: The Revival' to air this summer: What to know,/story/entertainment/television/2025/01/23/new-duck-dynasty-show-2025-how-to-watch-duck-dynasty-the-revival/77901953007/
,/picture-gallery/sports/nba/thunder/2025/01/02/okc-thunder-vs-l-a-clippers-at-paycom-center-see-our-top-photos/77411304007/
Congratulations Winners!,https://cdn.gatehousemedia.com/gh-sites/global/ads/contests/winners/FootballFandom_WinnerAd_FantasyLife.pdf?itm_campaign=2024%20Football%20Fandom%20Winners&itm_medium=con&itm_source=secondStreet
Winners Announced!,https://oklahoman.gannettcontests.com/2024-Oklahoman-Communitys-Choice-Awards-Winners/?itm_campaign=Oklahoma%202024%20BOB&itm_medium=con&itm_source=secondStreet
Vote Every Week!,https://www.oklahoman.com/sports/high-school/?itm_campaign=Athlete%20of%20the%20Week%20Landmark%20OKC&itm_medium=con&itm_source=secondStreet
Sen. Lankford says monopolies are 'a killer' for rural pharmacies,/story/business/2025/01/23/oklahoma-pharmacy-rural-towns-senator-james-lankford-benefit-managers/77452232007/
"Oklahomans to see new medical marijuana licensing, inspection software",/story/news/politics/2025/01/23/oklahomans-to-see-new-medical-marijuana-licensing-inspection-software/77880360007/
SGA or Jokic? Who has the edge in midseason NBA MVP race?,/story/sports/nba/thunder/2025/01/23/okc-thunder-shai-gilgeous-alexander-2024-25-nba-mvp-midseason-nikola-jokic-denver-nuggets/77884243007/
Thunder-Mavericks FanDuel Sports Network broadcast unavailable for some viewers,/story/sports/nba/thunder/2025/01/23/thunder-mavericks-game-fanduel-sports-network-broadcast-issues/77916639007/
"OKC Thunder vs Dallas Mavericks live score updates: Highlights, stats",/story/sports/nba/thunder/2025/01/23/thunder-mavericks-score-nba-game-live-updates-highlights-stats/77914169007/
,https://cm.oklahoman.com/site-feedback/?platform=Tangent-Desktop&url=https%3A%2F%2Fwww.oklahoman.com%2F&marketName=oklahoman&cta=Right-Rail
