headline,href
Families seek answers after deaths of 7 Pottawatomie County jail inmates,/story/news/2023/09/06/pottawatomie-county-public-safety-center-seven-jail-deaths-unexplained/70770097007/
Stitt appoints Native affairs liaison; draws more criticism from tribes,/story/news/2023/09/05/gov-kevin-stitt-appoints-native-affairs-liaison-as-criticism-grows-cherokee-nation-wes-nofire/70764848007/
Oklahoma kindergartners are the least-vaccinated in the region,/story/news/education/2023/09/06/vaccine-exemptions-oklahoma-kindergardeners-leaset-vaccinated-region/70767011007/
Homeless Alliance seeks donations to help unsheltered beat the heat,/story/news/2023/09/06/homeless-alliance-okc-weather-heat-donations-sought-how-to-help/70768345007/
'Team Norman' seeks to relaunch proposal for an arena…,/story/news/2023/09/05/ou-norman-oklahoma-entertainment-arena-district-proposal-1-billion/70767139007/
Hispanic Heritage Month: Here's what to know about OKC's…,/story/lifestyle/things-to-do/2023/09/05/when-is-hispanic-heritage-month-and-what-does-it-celebrate-oklahoma-city-fiesta-de-las-americas/70738516007/
"OTA PlatePay systems can't read tribal tags, costing…",/story/news/2023/09/05/oklahoma-turnpike-authority-losing-millions-from-cashless-tolling/70728548007/
Public Eye: Why do some doctors charge extra for the…,/story/news/2023/09/05/oklahoma-health-care-costs-facility-fee-hospital-bills/70568733007/
,
Who has the best BBQ in Oklahoma? Vote in Round 1 of our…,/story/lifestyle/food/2023/09/05/best-places-barbecue-oklahoma-okc-tulsa-bbq-vote/70652317007/
See the latest upgrades coming to Paycom ahead of proposal for a new arena,/story/news/2023/09/06/paycom-center-okc-upgrades-ahead-thunder-arena-proposal/70765833007/
Ryan Walters says Oklahoma now partners with PragerU for videos,/story/news/politics/government/2023/09/05/prageru-kids-oklahoma-ryan-walters-parternship-videos-classrooms/70770313007/
Stitt appoints Native affairs liaison; draws more criticism from tribes,/story/news/2023/09/05/gov-kevin-stitt-appoints-native-affairs-liaison-as-criticism-grows-cherokee-nation-wes-nofire/70764848007/
Gilgeous-Alexander vs. Doncic is FIBA World Cup's Thrilla in Manila,/story/sports/nba/thunder/2023/09/05/fiba-world-cup-shai-gilgeous-alexander-vs-luka-doncic-basketball-thrilla-in-manila/70761722007/
The Oklahoman's Class 6A-I to C HS football rankings for Week 2,/story/sports/high-school/football/2023/09/04/oklahoma-high-school-football-the-oklahomans-2023-week-2-class-6a-c-rankings/70754728007/
Why transfer WR De’Zhaun Stribling has look of major player for OSU,/story/sports/college/cowboys/2023/09/06/oklahoma-state-football-dezhaun-stribling-washington-state-transfer-portal-osu-cowboys/70765637007/
First 'horizontal apartments' hit the OKC rental market: What to know,/story/business/real-estate/2023/09/04/trulo-build-for-rent-horizontal-apartments-oklahoma-city-no-shared-walls-new-alternative-housing/70654228007/
"Incentives get people to move to Duncan and Tulsa, but not to small towns",/story/business/real-estate/2023/09/04/tulsa-oklahoma-duncan-moving-incentives-do-not-work-smaller-towns/70546462007/
Commercial real estate transactions from across the OKC metro area,/story/business/real-estate/2023/09/02/commercial-real-estate-transactions-from-across-the-okc-metro-area/70712183007/
"Guests: Officers should protect the public, not focus on bottom line Dan Alban and Daryl James",/story/opinion/2023/09/05/opinion-guests-civil-forfeiture-process-skews-law-enforcement-priorities/70641361007/
Hospitality goes a long way toward feeling a sense of belongingness Nancy E. Snow,/story/opinion/2023/09/03/how-being-hospitable-can-help-our-fractured-world/70703029007/
Guest: How do we keep guns out of the hands of those who attack? Rep. Andy Fugate,/story/opinion/2023/09/03/opinion-guest-stats-show-oklahomans-less-safe-from-gun-violence-than-five-years-ago/70722849007/
"Nearly 145,000 Kia vehicles recalled due to major safety hazard",/story/money/cars/2023/09/06/kia-motor-2023-recall-backup-camera-clips/70774595007/
Sailors rescued after inflatable catamaran damaged by shark attacks: Video,/story/news/world/2023/09/06/catamaran-shark-attacks-coral-sea-video/70774407007/
"Crony capitalism, Blursday: Over 500 new words added to Dictionary.com",/story/news/nation/2023/09/06/dictionary-com-new-words-definitions/70721660007/
Hispanic Heritage Month: Here's what to know about OKC's celebrations,/story/lifestyle/things-to-do/2023/09/05/when-is-hispanic-heritage-month-and-what-does-it-celebrate-oklahoma-city-fiesta-de-las-americas/70738516007/
Who has the best BBQ in Oklahoma? Vote in Round 1 of our bracket,/story/lifestyle/food/2023/09/05/best-places-barbecue-oklahoma-okc-tulsa-bbq-vote/70652317007/
Adopt a pet,/story/lifestyle/2023/09/05/dogs-and-cats-are-available-for-adoption-at-okc-area-animal-shelters/70701384007/
,/picture-gallery/sports/college/sooners/2023/09/02/college-football-is-back-photos-from-the-ous-game-against-arkansas-state-sooners/70741591007/
Can you survive?,https://www.usatoday.com/survivor-pool/ac025063-20c7-4988-9922-c9d04a4053b6/leaderboard?itm_campaign=USA%20TODAY%20Survivor%20Pool%202023&itm_medium=con&itm_source=secondStreet
Enter to WIN!,https://oklahoman.gannettcontests.com/Jellystone-Park-Wichita-Falls-2-Night-Luxury-Glamping-Giveaway/?itm_campaign=Jellystone%20Park%20Wichita%20Falls&itm_medium=con&itm_source=secondStreet
ENTER NOW! ENTER OFTEN!,https://oklahoman.gannettcontests.com/2023-Oklahoma-State-Fair-Ultimate/?itm_campaign=2023%20Oklahoma%20State%20Fair%20Ultimate%20Giveaway&itm_medium=con&itm_source=secondStreet
'Bare bones' design likely for MAPS 4 pedestrian bridge and river dam,/story/news/2023/09/06/maps-4-okc-pedestrian-bridge-oklahoma-river-budget-cuts/70767221007/
Attorney says officer at Choctaw football shooting may have been 'targeting' client,/story/news/crime/2023/09/06/choctaw-football-shooting-man-may-have-been-targeted-police-lawyer/70771977007/
Oklahoma school to offer nation's first bachelor's in gunsmithing,/story/news/2023/09/06/murray-state-college-oklahoma-gunsmithing-bachelors-manufacturing-business/70772011007/
Acting chairman of Pardon and Parole Board accused of unwanted contact,/story/news/2023/09/05/oklahoma-pardon-parole-board-chairman-edward-konieczny-accusation-epispocal-church/70772434007/
Ryan Walters says Oklahoma now partners with PragerU for videos,/story/news/politics/government/2023/09/05/prageru-kids-oklahoma-ryan-walters-parternship-videos-classrooms/70770313007/
,https://cm.oklahoman.com/site-feedback/?platform=Tangent-Desktop&url=https%3A%2F%2Fwww.oklahoman.com%2F&marketName=oklahoman&cta=Right-Rail
