headline,href
Why OKC's home opener vs. Atlanta was 'special' for Cason Wallace,/story/sports/nba/thunder/2024/10/28/okc-thunder-vs-atlanta-hawks-cason-wallace-brother-keaton/75887842007/
OSDE spending under Ryan Walters focus of upcoming legislative report,/story/news/education/2024/10/28/ryan-walters-oklahoma-state-department-education-watchdog-spending-report/75897421007/
Rush Fire burning in Wichita Mountains Wildlife Refuge: See wildfire photos,/picture-gallery/news/2024/10/28/oklahoma-wildfire-burning-in-wichita-mountains-refuge-see-photos/75894051007/
Early voting starts this week. When will the results be in?,/story/news/politics/elections/2024/10/28/early-voting-starts-soon-in-oklahoma-when-can-we-see-the-results/75845673007/
"Classen Circle building combines old, new to recreate…",/story/business/real-estate/2024/10/28/classen-circle-okc-donnay-building-landmark-finding-new-life/75690218007/
"Politicians, stop putting party first. It's holding…",/story/opinion/columns/2024/03/21/oklahoma-government-politial-decay-state-and-nation-madison-horn/73024529007/
State will find new operator for troubled Greer Center,/story/news/politics/government/2024/10/28/oklahoma-wont-renew-contract-with-longtime-greer-center-operator/75906674007/
,
Oklahoma-based Crest Foods phasing out paper bags: What…,/story/business/2024/10/28/crest-foods-phasing-out-paper-sacks-for-plastic-bags-oklahoma/75899561007/
OSU's Mike Gundy 'wasn't as firm' on effort because of…,/story/sports/college/cowboys/2024/10/28/oklahoma-state-football-mike-gundy-osu-cowboys-defense-tackling/75895897007/
OSDE spending under Ryan Walters focus of upcoming legislative report,/story/news/education/2024/10/28/ryan-walters-oklahoma-state-department-education-watchdog-spending-report/75897421007/
Rush Fire burning in Wichita Mountains Wildlife Refuge: See wildfire photos,/picture-gallery/news/2024/10/28/oklahoma-wildfire-burning-in-wichita-mountains-refuge-see-photos/75894051007/
Early voting starts this week. When will the results be in?,/story/news/politics/elections/2024/10/28/early-voting-starts-soon-in-oklahoma-when-can-we-see-the-results/75845673007/
Why OKC's home opener vs. Atlanta was 'special' for Cason Wallace,/story/sports/nba/thunder/2024/10/28/okc-thunder-vs-atlanta-hawks-cason-wallace-brother-keaton/75887842007/
The Oklahoman's Class 6A-I to C HS football rankings for Week 9,/story/sports/high-school/football/2024/10/28/oklahoma-high-school-football-class-6a-i-to-c-rankings-2024-season-ossaa-week-9/75871948007/
OSU's Mike Gundy 'wasn't as firm' on effort because of injury concerns,/story/sports/college/cowboys/2024/10/28/oklahoma-state-football-mike-gundy-osu-cowboys-defense-tackling/75895897007/
"Classen Circle building combines old, new to recreate OKC landmark",/story/business/real-estate/2024/10/28/classen-circle-okc-donnay-building-landmark-finding-new-life/75690218007/
Oklahoma-based Crest Foods phasing out paper bags: What we know,/story/business/2024/10/28/crest-foods-phasing-out-paper-sacks-for-plastic-bags-oklahoma/75899561007/
"Oklahoma Starbucks workers denied petition, once again",/story/business/2024/10/25/labor-board-dismisses-oklahoma-starbucks-employee-petition-a-2nd-time/75684632007/
"Politicians, stop putting party first. It's holding Oklahoma back. Madison Horn",/story/opinion/columns/2024/03/21/oklahoma-government-politial-decay-state-and-nation-madison-horn/73024529007/
Opinion: Election disinformation is rampant – and helping Trump Chris Brennan,/story/opinion/columnist/2024/10/27/disinformation-russia-china-election-trump-harris/75827330007/
Opinion: Don't think a single Edmond fire station vote keeps taxes low Paula Burkes,/story/opinion/columns/guest/2024/10/28/edmond-voters-property-taxes-impact-bond-election-fire-station-capital-improvements/75845206007/
Powerball winning numbers for Oct. 28 drawing: $28 million jackpot,/story/money/lottery/2024/10/28/powerball-winning-numbers/75903579007/
Arson burns hundreds of ballots at boxes in Portland and Washington,/story/news/nation/2024/10/28/ballots-destroyed-arson-fires-portland-washington/75901758007/
Respiratory illness on the rise in children: How to prevent spread,/story/news/health/2024/10/28/walking-pneumonia-respiratory-infection-cdc/75897987007/
Looking for the purrfect pet? OKC-area animal shelters can provide one,/story/lifestyle/2024/10/28/dogs-and-cats-are-available-for-adoption-at-okc-area-animal-shelters/75769297007/
Nature & You: Why don't sleeping birds fall out of trees?,/story/lifestyle/2024/10/28/mother-nature-gave-birds-ability-to-sleep-in-trees-without-falling/75822094007/
"Two churches counter political division, strife with focus on kindness",/story/lifestyle/2024/10/27/two-okc-churches-pushing-back-on-election-division-and-strife/75570839007/
,/picture-gallery/sports/college/sooners/2024/10/26/ou-football-vs-ole-miss-best-photos-from-sooners-week-9-game/75865087007/
Enter Today!,https://oklahoman.gannettcontests.com/OKC-Broadway-How-the-Grinch-Stole-Christmas-Ticket/?itm_campaign=OKC%20Broadway%20How%20the%20Grinch%20Stole%20Christmas%20Ticket%20Sweepstakes&itm_medium=con&itm_source=secondStreet
Winners Announced!,https://oklahoman.gannettcontests.com/2024-Oklahoman-Communitys-Choice-Awards-Winners/?itm_campaign=Oklahoma%202024%20BOB&itm_medium=con&itm_source=secondStreet
The Oklahoman's Class 6A-I to C HS football rankings for Week 9,/story/sports/high-school/football/2024/10/28/oklahoma-high-school-football-class-6a-i-to-c-rankings-2024-season-ossaa-week-9/75871948007/
Behind the race to represent Oklahoma's 5th District in Congress,/story/news/politics/elections/2024/10/28/stephanie-bice-madison-horn-compete-in-oklahoma-5th-district-us-house-race/75842441007/
"Murderer in Oklahoma prison ordered fatal shooting, grand jury alleges",/story/news/2024/10/28/murderer-accused-of-having-witness-killed-running-drug-ring-from-prison/75838999007/
"Cases reviewed by police oversight board include shootings, complaints",/story/news/local/oklahoma-city/2024/10/28/cases-reviewed-by-okc-public-safety-advisory-board-include-shootings-complaints/75823528007/
Election 2024 updates: Trump criticizes Michelle Obama; Harris campaigns in Michigan,/story/news/politics/elections/2024/10/28/election-2024-live-updates-harris-trump-polls/75879249007/
,https://cm.oklahoman.com/site-feedback/?platform=Tangent-Desktop&url=https%3A%2F%2Fwww.oklahoman.com%2F&marketName=oklahoman&cta=Right-Rail
