headline,href
Weekly vigils for immigration justice restarted after ICE controversies,/story/news/local/oklahoma-city/2025/08/07/oklahoma-county-ice-deportations-vigils-for-immigrants-restart/85528949007/
"Board members call out Ryan Walters for TV claims, insults",/story/news/education/2025/08/06/ryan-walters-oklahoma-tv-osbe-members-respond/85542043007/
ConocoPhillips to sell Anadarko Basin assets for $1.3B,/story/business/energy-resource/2025/08/07/conocophillips-selling-anadarko-assets-oklahoma-more-than-1-billion/85555673007/
Oklahoma superintendents push back on state's low education rankings,/story/news/education/2025/08/07/oklahoma-education-rankings-how-okc-metro-superintendents-reacted/85548240007/
"Bethany man charged in girlfriend's death, among other…",/story/news/crime/2025/08/07/bethany-ok-man-charged-homicide-girlfriend-firearm-possession/85543063007/
United Airlines resumes flights after resolving tech…,/story/travel/news/2025/08/06/united-airlines-system-outage-causes-flight-disruptions-nationwide/85552621007/
Vote: Who is best Oklahoma high school WR/TE for 2025…,/story/sports/high-school/football/2025/08/06/oklahoma-high-school-football-vote-top-wide-receiver-tight-end-2025-season/85470165007/
My Gen Z friends are having doubts about Trump. Here's…,/story/opinion/voices/2025/08/06/trump-jeffrey-epstein-gen-z-republican-voters/85513159007/
,
I'm a Texas conservative. Republicans here look really…,/story/opinion/columnist/2025/08/05/texas-redistricting-republicans-democrats-abbott/85509379007/
Weekly vigils for immigration justice restarted after ICE controversies,/story/news/local/oklahoma-city/2025/08/07/oklahoma-county-ice-deportations-vigils-for-immigrants-restart/85528949007/
"Board members call out Ryan Walters for TV claims, insults",/story/news/education/2025/08/06/ryan-walters-oklahoma-tv-osbe-members-respond/85542043007/
Oklahoma superintendents push back on state's low education rankings,/story/news/education/2025/08/07/oklahoma-education-rankings-how-okc-metro-superintendents-reacted/85548240007/
How Gentry Williams' leadership is helping OU's young CB's,/story/sports/college/sooners/2025/08/07/ou-football-cb-gentry-williams-injuries-leadership-help-young-oklahoma-sooners/85523518007/
Vote: Who is best Oklahoma high school WR/TE for 2025 season?,/story/sports/high-school/football/2025/08/06/oklahoma-high-school-football-vote-top-wide-receiver-tight-end-2025-season/85470165007/
Kendal Daniels agonized over Bedlam switch. Why it was 'best decision',/story/sports/college/sooners/2025/08/07/ou-football-kendal-daniels-transfer-portal-bedlam-osu-cowboys-oklahoma-sooners/85549010007/
"Rapid residential growth, expanded roads drawing new retail to NW OKC",/story/business/real-estate/2025/08/07/walmart-homeland-more-retail-coming-northwest-okc/84410222007/
What's tax free this weekend? What to know in Oklahoma,/story/business/2025/07/31/whats-tax-free-this-weekend-what-to-know-during-oklahomas-tax-holiday/85439273007/
JCPenney stores sold for $947M. Which Oklahoma stores are affected?,/story/business/2025/07/30/jcpenney-sells-stores-in-1b-deal-are-any-in-oklahoma-full-list-map/85436871007/
Even cows on the ranch seem to know we can't outrun the future of AI Mark McBride,/story/opinion/columns/guest/2025/08/07/ai-oklahoma-economic-education-business-growth/85539861007/
OKC has a housing crisis. It needs Congress to put people first JoBeth Hamon,/story/opinion/columns/guest/2025/08/07/oklahoma-city-homeless-congress-budget-housing/85524843007/
U.S. Rep. Lucas spends a little time saying not much William C. Wertz,/story/opinion/columns/2025/08/06/trump-oklahoma-lucas-economy-tariff-farms/85444419007/
Tropical Storm Dexter to strengthen in north Atlantic: See tracker,/story/news/weather/2025/08/07/tropical-storm-dexter-path-tracker-spaghetti-models/85554890007/
Bud Light unveils limited-edition NFL team cans for the 2025 season,/story/sports/nfl/2025/08/07/bud-light-nfl-team-cans-2025-season/85543472007/
"Plastic surgeons react to Skims sold out, hyped face wrap",/story/entertainment/celebrities/2025/08/07/skims-face-wrap-doctors-react/85526707007/
"Shop Best Buy's back-to-school tech deals on Apple, Samsung, Bose",/story/shopping/2025/08/06/best-buy-back-to-school-tech-sale/85551863007/
The TikTok-viral Laneige tinted lip serum is on sale for $15 🫦,/story/shopping/2025/08/06/laneige-glaze-craze-tinted-lip-serum-amazon-deal/85545106007/
Krispy Kreme Crocs are officially on the menu! Shop the collab here,/story/shopping/2025/08/05/shop-new-crocs-krispy-kreme-collaboration/85514717007/
Monthly men's ministry gathering to celebrate 5th anniversary,/story/lifestyle/2025/08/07/cbmc-oklahomas-mens-united-breakfast-initiative-celebrates-five-years/85431675007/
OKC theater stages rare Shakespearean rom-com for first time in 20 years,/story/entertainment/2025/08/07/oklahoma-shakespeare-in-the-park-loves-labours-lost-production/85382375007/
When does Spirit Halloween open? What to know about OKC store hours,/story/lifestyle/2025/08/07/when-does-spirit-halloween-open-what-to-know-about-oklahoma-city-locations/85541250007/
,/picture-gallery/news/2025/08/07/greater-okc-chambers-state-of-the-schools-2025-see-photos/85550087007/
Summer Athlete Polls,https://www.oklahoman.com/sports/high-school/?itm_campaign=Athlete%20of%20the%20Week%20Landmark%20OKC&itm_medium=con&itm_source=secondStreet
"Rapid residential growth, expanded roads drawing new retail to NW OKC",/story/business/real-estate/2025/08/07/walmart-homeland-more-retail-coming-northwest-okc/84410222007/
Ree Drummond's son loses appeal of driver's license revocation,/story/news/2025/08/07/pioneer-womans-son-bryce-drummond-drivers-license-revocation-appeal-denied/85525223007/
How Gentry Williams' leadership is helping OU's young CB's,/story/sports/college/sooners/2025/08/07/ou-football-cb-gentry-williams-injuries-leadership-help-young-oklahoma-sooners/85523518007/
"How OKC, Edmond, Yukon and more are enforcing school cell phone ban",/story/news/education/2025/08/06/oklahoma-cell-phone-ban-school-policies-okc-edmond-yukon/85272991007/
When will the memorial service for former Gov. George Nigh be held?,/story/news/politics/state/2025/08/02/time-date-of-memorial-service-for-former-gov-george-nigh-is-set/85490769007/
,https://cm.oklahoman.com/site-feedback/?platform=Tangent-Desktop&url=https%3A%2F%2Fwww.oklahoman.com%2F&marketName=oklahoman&cta=Right-Rail
