headline,href
More NCAAMB Scores,/sports/ncaab/scores/
Liz Scott provides OU turning point in run to women's NCAA Tournament,/story/sports/college/sooners/2025/03/21/march-madness-liz-scott-stats-oklahoma-basketball-womens-ncaa-tournament/82592327007/
"As Trump aims to 'close' Education Dept., here's how OK would be affected",/story/news/education/2025/03/22/the-department-of-education-impacts-on-oklahoma-donald-trump/82589510007/
An Oklahoma church is hosting some of the biggest names in GOP politics,/story/news/2025/03/22/sheridan-church-tulsa-ok-gop-hosts-eric-trump-kash-patel/82595035007/
Inside ties that bind Thunder and March Madness legend Rick Pitino,/story/sports/nba/thunder/2025/03/22/march-madness-rick-pitino-billy-donovan-richard-pitino-mark-daigneault-okc-thunder/82586704007/
Oklahoma Senate to people — stay out of our business,/story/opinion/columns/2025/03/11/senate-aims-to-make-initiative-petitions-harder-to-propose-threat-to-direct-democracy/81944420007/
Celebrate Oklahoma high school basketball with 'The Big…,/story/sports/high-school/basketball/2025/02/27/oklahoma-high-school-basketball-book-the-big-house-state-fair-arena/80708941007/
Vote: Landmark Fine Homes boys HS athlete of the week…,/story/sports/high-school/athlete-of-the-week/2025/03/17/vote-landmark-fine-homes-boys-high-school-athlete-of-the-week-march-10-16/82495195007/
Vote: Landmark Fine Homes girls HS athlete of the week…,/story/sports/high-school/athlete-of-the-week/2025/03/17/vote-landmark-fine-homes-girls-high-school-athlete-of-the-week-for-march-10-16/82486298007/
OSSAA basketball state tournament 2025: Everything you…,/story/sports/high-school/basketball/2025/03/04/oklahoma-high-school-basketball-2025-ossaa-state-tournament-previews-results/81198708007/
,
"As Trump aims to 'close' Education Dept., here's how OK would be affected",/story/news/education/2025/03/22/the-department-of-education-impacts-on-oklahoma-donald-trump/82589510007/
An Oklahoma church is hosting some of the biggest names in GOP politics,/story/news/2025/03/22/sheridan-church-tulsa-ok-gop-hosts-eric-trump-kash-patel/82595035007/
Tesla recalls almost all Cybertrucks: See Oklahoma service centers,/story/news/2025/03/21/tesla-recalls-almost-all-cybertrucks-where-to-service-in-oklahoma/82589677007/
Liz Scott provides OU turning point in run to women's NCAA Tournament,/story/sports/college/sooners/2025/03/21/march-madness-liz-scott-stats-oklahoma-basketball-womens-ncaa-tournament/82592327007/
Inside ties that bind Thunder and March Madness legend Rick Pitino,/story/sports/nba/thunder/2025/03/22/march-madness-rick-pitino-billy-donovan-richard-pitino-mark-daigneault-okc-thunder/82586704007/
NCAA wrestling championships Day 2 recap: Spratley headed to finals,/story/sports/college/cowboys/2025/03/21/ncaa-wrestling-championships-score-live-updates-results-day-2-wells-fargo-center-osu-cowboys/82567010007/
Tax filing deadline is next month. Here's how to request an extension,/story/business/finance/2025/03/19/what-to-know-about-irs-tax-filing-deadline-free-file-and-extensions/82542838007/
"Dogs, owners happy about new OKC Midtown Mutts Dog Park opening",/story/business/downtown/2025/03/15/upgraded-oklahoma-city-dog-park-attracts-canines-owners-to-midtown/80066392007/
Bill focuses on shopping cart thefts; critics say it targets homeless,/story/business/2025/03/13/shopping-cart-legislation-sparks-discussion-on-thefts-homelessness/82363916007/
Oklahoma Senate to people — stay out of our business William C. Wertz,/story/opinion/columns/2025/03/11/senate-aims-to-make-initiative-petitions-harder-to-propose-threat-to-direct-democracy/81944420007/
"Norman residents want turnpike to take a hike, and let panel hear about it",/story/opinion/cartoons/2025/03/22/norman-residents-voice-ire-during-turnpike-access-vote-cartoon/82599491007/
"Letters on tariffs' impact, Medicaid cuts, Oklahoma public education",/story/opinion/letters/2025/03/22/letters-tariffs-medicaid-cuts-benefit-rich-hurt-poor-middle-class-stitt-oklahoma-education/82531207007/
"When do new episodes of '1923' come out? Date, time, Season 2 schedule",/story/entertainment/tv/2025/03/22/1923-season-2-episodes-date-time-schedule/82585155007/
Mega Millions winning numbers for March 21: $324 million jackpot,/story/money/lottery/2025/03/21/mega-millions-winning-numbers/82601950007/
Colorado gray wolf killed for attacking sheep in Wyoming: Officials,/story/news/nation/2025/03/21/colorado-gray-wolf-killed-sheep-attack-wyoming/82598581007/
"14 kitchen hacks: Save on cheese graters, mandolines, burger presses",/story/shopping/2025/03/21/amazon-big-spring-sale-kitchen-gadgets-cookware/82580923007/
10 linen closet organizers on sale to help you streamline your storage,/story/shopping/2025/03/22/amazon-spring-deals-linen-closet-organizers/82495197007/
Get your Kentucky vs. llinois men's March Madness tickets now,/story/shopping/2025/03/22/how-to-buy-kentucky-vs-lllinois-march-madness-tickets/82606710007/
Chef Bobby Flay got candid with audience at Oklahoma casino event,/story/lifestyle/food/2025/03/22/choctaw-nation-oklahoma-bobby-flay-experience/80853236007/
Revised touring version of musical 'Peter Pan' flies high in OKC run,/story/entertainment/2025/03/21/the-revised-national-tour-of-the-aged-musical-peter-pan-soars-in-okc/82526582007/
Red Earth Festival celebrating Native American art over OKC's spring break,/story/entertainment/2025/03/21/okcs-oklahoma-city-red-earth-festival-showcases-native-american-art-over-spring-break/82526564007/
,/picture-gallery/sports/nba/thunder/2025/03/21/oklahoma-city-thunder-vs-charlotte-hornets-at-paycom-center-photos/82601462007/
Enter Today!,https://usatoday.gannettcontests.com/Kansas-City-Steak-Company-Spring-SweepSteaks/?itm_campaign=Kansas%20City%20Steak%20Company%20Spring%20SweepSteaks&itm_medium=con&itm_source=secondStreet
Nominate Today!,https://oklahoman.gannettcontests.com/2025-Oklahoman-Communitys-Choice-Awards/?itm_campaign=Oklahoma%20Bob&itm_medium=con&itm_source=secondStreet
ENTER TODAY,https://www.kalahariresorts.com/win?itm_campaign=Get%20Kalaharid%20Away&itm_medium=con&itm_source=secondStreet#//?
Chef Bobby Flay got candid with audience at Oklahoma casino event,/story/lifestyle/food/2025/03/22/choctaw-nation-oklahoma-bobby-flay-experience/80853236007/
NCAA wrestling championships Day 2 recap: Spratley headed to finals,/story/sports/college/cowboys/2025/03/21/ncaa-wrestling-championships-score-live-updates-results-day-2-wells-fargo-center-osu-cowboys/82567010007/
Danae Fletcher lifts OU women's gymnastics team where she can,/story/sports/college/sooners/2025/03/21/ou-womens-gymnastics-danae-fletcher-injury-sooners-sec-championships-schedule/82576028007/
"George Foreman, former heavyweight boxing champ, dies at 76",/story/sports/boxing/2025/03/21/george-foreman-dies-former-heavyweight-boxing-champion/82605166007/
How Stailee Heard's competitive drive got OSU to NCAA Tournament,/story/sports/college/cowboys/2025/03/21/stailee-heard-stats-oklahoma-state-basketball-womens-ncaa-tournament-march-madness/82594867007/
,https://cm.oklahoman.com/site-feedback/?platform=Tangent-Desktop&url=https%3A%2F%2Fwww.oklahoman.com%2F&marketName=oklahoman&cta=Right-Rail
