headline,href
New leader buoyed by optimism at critical turning point for OKCPS,/story/news/education/2024/06/27/okcps-new-superintendent-jamie-polk-back-to-school-2024/74102839007/
Is OU prepared for SEC football? Sooners may be better than you think,/story/sports/college/sooners/2024/06/30/ou-football-sec-2024-oklahoma-sooners-brent-venables/74175491007/
Two Oklahoma City churches are of one mind on Christian nationalism,/story/news/2024/06/30/two-oklahoma-city-churches-hold-joint-service-christian-nationalism/74211633007/
ARPA money is still available for OKC food businesses. What we know,/story/lifestyle/food/2024/06/30/american-rescue-plan-act-funding-oklahoma-okc-restaurant-industry/74207625007/
Who are the biggest name free agent signees in Thunder…,/story/sports/nba/thunder/2024/06/30/okc-thunder-biggest-name-free-agent-signees-history/74259321007/
"How do OU, Texas stack up with other SEC programs?",/story/sports/college/sooners/2024/06/30/sec-expansion-oklahoma-sooners-texas-longhorns-compare-to-14-schools/74186981007/
,
Undrafted NBA free agents tracker: Signings for Thunder…,/story/sports/nba/thunder/2024/06/27/undrafted-nba-free-agents-tracker-okc-thunder-signing-updates/74240430007/
The Oklahoman's 2025 Super 30 high school football…,/story/sports/high-school/football/2024/06/22/oklahoma-high-school-football-2025-super-30-recruiting-series/74183734007/
Celebrate OU softball's fourth straight WCWS title with…,/story/sports/college/sooners/2024/06/14/ou-softball-book-wcws-championship-four-peat-oklahoma-sooners/74094737007/
New leader buoyed by optimism at critical turning point for OKCPS,/story/news/education/2024/06/27/okcps-new-superintendent-jamie-polk-back-to-school-2024/74102839007/
Two Oklahoma City churches are of one mind on Christian nationalism,/story/news/2024/06/30/two-oklahoma-city-churches-hold-joint-service-christian-nationalism/74211633007/
Lawmaker says initiative petition changes will make process more restrictive,/story/news/politics/government/2024/06/30/oklahoma-ballot-initiative-process-changes-hb-1105/74125795007/
Is OU prepared for SEC football? Sooners may be better than you think,/story/sports/college/sooners/2024/06/30/ou-football-sec-2024-oklahoma-sooners-brent-venables/74175491007/
CJ Simon has a different pregame ritual. He's found success at Moore.,/story/sports/high-school/football/2024/06/30/oklahoma-high-school-football-cj-simon-moore-2025-recruiting-profile/74205902007/
Who are the biggest name free agent signees in Thunder history?,/story/sports/nba/thunder/2024/06/30/okc-thunder-biggest-name-free-agent-signees-history/74259321007/
Beverly Hills brokerage The Agency Oklahoma City opens in Edmond,/story/business/real-estate/2024/06/27/buying-beverly-hills-mauricio-umansky-opens-the-agency-okc-real-housewives-beverly-hills/74207651007/
Arts Institute ready for space at Edmond park after plans finalized,/story/business/real-estate/2024/06/14/edmond-fine-arts-institute-ready-for-space-at-new-art-park-oklahoma-okc-oklahoma-city/74083792007/
"Oklahoma wheat harvest is more than half complete, with varying yields",/story/business/agricultural/2024/06/14/oklahoma-hard-red-winter-wheat-harvest-more-than-half-done-despite-weather-rain-challenges/74084467007/
"For OU, SEC is right conference for the right time Joseph Harroz Jr.",/story/opinion/columns/2024/06/30/university-oklahoma-sooners-sec-sports/74224196007/
"From teachers to community, everyone seems to agree on this reading plan Mary Mélon-Tully",/story/opinion/columns/2024/06/30/opinion-oklahoma-reading-levels-for-fourth-graders-is-low-okcps-uses-this-plan-to-reach-students/74157287007/
"Medicaid expansion, 'Ole Man River,' political balance | Letters",/story/opinion/letters/2024/06/29/letters-medicaid-expansion-ole-man-river-political-balance/74169499007/
Utah fire captain killed in whitewater rafting accident,/story/news/nation/2024/06/30/fire-captain-dies-whitewater-rafting-dinosaur-national-monument/74263618007/
See the best photos from Pride events worldwide,/story/news/nation/2024/06/30/pride-month-parades-celebrations-2024-photos/74261851007/
Value menus are taking over: Where to get cheap fast food this summer,/story/money/food/2024/06/30/value-meal-menu-news-2024/74236790007/
ARPA money is still available for OKC food businesses. What we know,/story/lifestyle/food/2024/06/30/american-rescue-plan-act-funding-oklahoma-okc-restaurant-industry/74207625007/
Taylor Swift dedicates song to Stevie Nicks: ‘She's a hero of mine’,/story/entertainment/music/2024/06/30/stevie-nicks-attends-final-eras-tour-night-in-dublin-ireland/74231704007/
OKC Pride: Top moments at OKC PrideFest Saturday,/picture-gallery/lifestyle/features/2024/06/29/okc-pridefest-2024-scissortail-park-oklahoma-pride-alliance/74256369007/
,/picture-gallery/news/2024/06/30/okc-oklahoma-city-pride-fest-parade-route-2024/74262761007/
ENTER TODAY!,https://usatoday.gannettcontests.com/Service-Experts-Home-of-the-Future/?itm_campaign=Service%20Experts%20Gordons%20Home%20of%20the%20Future&itm_medium=con&itm_source=secondStreet
"For OU, SEC is right conference for the right timeJoseph Harroz Jr.",/story/opinion/columns/2024/06/30/university-oklahoma-sooners-sec-sports/74224196007/
Lawmaker says initiative petition changes will make process more restrictive,/story/news/politics/government/2024/06/30/oklahoma-ballot-initiative-process-changes-hb-1105/74125795007/
Taylor Swift dedicates song to Stevie Nicks: ‘She's a hero of mine’,/story/entertainment/music/2024/06/30/stevie-nicks-attends-final-eras-tour-night-in-dublin-ireland/74231704007/
Historian who predicted 9 of last 10 elections says Dems shouldn't drop Biden,/story/news/politics/elections/2024/06/30/lichtman-dems-replace-biden/74260967007/
CJ Simon has a different pregame ritual. He's found success at Moore.,/story/sports/high-school/football/2024/06/30/oklahoma-high-school-football-cj-simon-moore-2025-recruiting-profile/74205902007/
,https://cm.oklahoman.com/site-feedback/?platform=Tangent-Desktop&url=https%3A%2F%2Fwww.oklahoman.com%2F&marketName=oklahoman&cta=Right-Rail
