headline,href
Gov. Stitt ties new compact with Chickasaw Nation to tribal tag dispute,/story/news/2024/01/24/tribal-tag-compact-chickasaw-nation-oklahoma-governor-kevin-stitt-fact-check/72325553007/
These Oklahoma counties ranked among the nation's 25 unhealthiest,/story/news/healthcare/2024/01/24/new-report-ranks-two-oklahoma-counties-among-the-unhealthiest/72313185007/
Oklahoma Republican senator wants ranked choice voting banned,/story/news/2024/01/24/will-oklahoma-get-ranked-choice-voting-senator-julie-daniels-introduces-ban/72282467007/
"Oklahoma County jail population lower, but report says more reforms needed",/story/news/local/2024/01/24/oklahoma-county-jail-pouplation-racial-disparity-crime-justice-institute-analysis/72202697007/
Vote for The Oklahoman's HS boys athlete of the week for…,/story/sports/high-school/2024/01/22/oklahoma-high-school-boys-athletes-of-the-week-poll-vote-landmark-fine-homes-jan-16-22/72308991007/
Vote for The Oklahoman's HS girls athletes of week for…,/story/sports/high-school/2024/01/22/oklahoma-high-school-girls-athletes-of-the-week-poll-vote-landmark-fine-homes-jan-16-22/72308984007/
The Oklahoman's Best of Sports Photos 2023,/picture-gallery/sports/2023/12/27/ou-football-osu-okc-thunder-the-oklahoman-best-photos-2023/71815599007/
Relive OU softball's third straight WCWS title run with…,/story/sports/college/sooners/2023/09/11/ou-softball-book-patty-gasso-jocelyn-alo-oklahoma-sooners-wcws-three-peat-dynasty/70777302007/
Elgin girls basketball coach resigns because of 'unruly'…,/story/sports/high-school/basketball/2024/01/24/oklahoma-high-school-basketball-elgin-girls-coach-whitney-ludwell-resigns-unruly-team-parent/72333342007/
,
Gov. Stitt ties new compact with Chickasaw Nation to tribal tag dispute,/story/news/2024/01/24/tribal-tag-compact-chickasaw-nation-oklahoma-governor-kevin-stitt-fact-check/72325553007/
These Oklahoma counties ranked among the nation's 25 unhealthiest,/story/news/healthcare/2024/01/24/new-report-ranks-two-oklahoma-counties-among-the-unhealthiest/72313185007/
Oklahoma Republican senator wants ranked choice voting banned,/story/news/2024/01/24/will-oklahoma-get-ranked-choice-voting-senator-julie-daniels-introduces-ban/72282467007/
Elgin girls basketball coach resigns because of 'unruly' team parent,/story/sports/high-school/basketball/2024/01/24/oklahoma-high-school-basketball-elgin-girls-coach-whitney-ludwell-resigns-unruly-team-parent/72333342007/
How Dale boys basketball is rolling on quest for 3rd state championship,/story/sports/high-school/basketball/2024/01/24/dale-millwood-score-oklahoma-high-school-basketball-dayton-forsythe/72332819007/
OKC Metro High School Sports Awards: Meet the volleyball nominees,/story/sports/high-school/sports-awards/2024/01/24/okc-metro-high-school-sports-awards-meet-the-volleyball-nominees/72312364007/
Zillow scam: Oklahoma official going after real estate fraudster,/story/business/real-estate/2024/01/22/zillow-scam-oklahoma-official-going-after-online-home-sale-fraudster/72260927007/
Investors clean up with new car washes in the Oklahoma City area,/story/business/real-estate/2024/01/22/car-washes-near-me-probably-investors-are-building-them-everywhere-okc-oklahoma-city-okie-express/72087372007/
"Retail predictions: What are the chances OKC could get Shake Shack, IKEA in 2024?",/story/business/real-estate/2024/01/19/shake-shack-peloton-ikea-in-oklahoma-city-in-n-out-pappadeaux-h-e-b-buc-ees/72271094007/
It would take a decade for US to rebuild its manufacturing base Andre B. Snodgrass,/story/opinion/2024/01/23/opinion-guest-china-has-means-ability-to-deny-us-critical-minerals/71806307007/
It’s time to secure real dental care for Oklahomans Paul S. Wood,/story/opinion/2024/01/23/opinion-guest-dental-insurance-could-be-more-responsive-to-patients-dental-care-needs/72187165007/
A $15 minimum wage in Oklahoma is a recipe for disaster Rebekah Paxton,/story/opinion/2024/01/22/opinion-guest-raising-minimum-wage-tends-to-hurt-most-vulnerable-workers/72161366007/
A look at the 'Pawn Stars' Harrison family following tragic family death,/story/entertainment/tv/2024/01/24/pawn-stars-adam-death-rick-harrison-family/72324977007/
"Amid 2023's 'summer of strikes', union membership hit historic low",/story/money/2024/01/24/labor-union-membership-by-year/72329342007/
'After all these years': WWII vet gets diploma after leaving school to serve,/story/life/militarykind/2024/01/24/arthur-masterson-wwii-veteran-high-school-diploma/72311005007/
OKC's Darci Lynne rocks in first 'AGT: Fantasy League': What to know,/story/entertainment/2024/01/23/darci-lynne-okc-americas-got-talent-fantasy-league-performance/72322729007/
First look: What to expect at the new Birdie's by Chef Kevin Lee,/story/lifestyle/food/2024/01/23/birdies-edmond-ok-menu-chef-kevin-lee-dining-options/72313965007/
"Girl Scout Cookies in Oklahoma: Where to find them, cost and more",/story/lifestyle/2024/01/23/where-to-find-girl-scout-cookies-2024-oklahoma-cookie-sales-start/72255193007/
,/picture-gallery/sports/nba/thunder/2024/01/23/okc-thunder-hosts-portland-trail-blazers-see-our-top-photos/72330264007/
NOMINATE TODAY,https://oklahoman.gannettcontests.com/Cardiovascular-Health-Clinic-Amazing-Teachers/rounds/1/gallery?itm_campaign=Cardiovascular%20Health%20Clinic%20Amazing%20Teacher%20Awards&itm_medium=con&itm_source=secondStreet
Vote Every Week!,https://www.oklahoman.com/sports/high-school/?itm_campaign=Athlete%20of%20the%20Week%20Landmark%20OKC&itm_medium=con&itm_source=secondStreet
Winners Announced,https://oklahoman.gannettcontests.com/2023-Oklahoma-Communitys-Choice-Awards-Winners/?itm_campaign=Oklahoma%20Readers%26%2339%3B%20Choice%202023&itm_medium=con&itm_source=secondStreet
Air Evac flight crew stood out during military service and pandemic,/story/news/state/2024/01/24/helicopter-crash-weatherford-oklahoma-air-evac-crewmembers-killed-adam-tebben-russell-haslam/72324058007/
OKC's Darci Lynne rocks in first 'AGT: Fantasy League': What to know,/story/entertainment/2024/01/23/darci-lynne-okc-americas-got-talent-fantasy-league-performance/72322729007/
Longtime public defender Bob Ravitz dies at 71,/story/news/2024/01/23/bob-ravitz-oklahoma-county-public-defender-dies-at-71/72327259007/
First look: What to expect at the new Birdie's by Chef Kevin Lee,/story/lifestyle/food/2024/01/23/birdies-edmond-ok-menu-chef-kevin-lee-dining-options/72313965007/
"Girl Scout Cookies in Oklahoma: Where to find them, cost and more",/story/lifestyle/2024/01/23/where-to-find-girl-scout-cookies-2024-oklahoma-cookie-sales-start/72255193007/
,https://cm.oklahoman.com/site-feedback/?platform=Tangent-Desktop&url=https%3A%2F%2Fwww.oklahoman.com%2F&marketName=oklahoman&cta=Right-Rail
