headline,href
Ryan Walters orders districts to show video about religious office,/story/news/education/2024/11/15/ryan-walters-oklahoma-religious-video-order-trump-bibles/76338979007/
Stitt says state will deport undocumented immigrants in prison custody,/story/news/politics/government/2024/11/15/oklahoma-mass-deportations-kevin-stitt-migrants-prisons/76340265007/
"How Thunder has assembled small-ball lineups, even before necessity",/story/sports/nba/thunder/2024/11/15/okc-thunder-small-ball-lineups-chet-holmgren-isaiah-hartenstein-injuries/76341129007/
Live updates: Mike Tyson-Jake Paul fight takes spotlight on Netflix,/story/sports/boxing/2024/11/15/mike-tyson-jake-paul-live-updates-highlights/76266132007/
Federal dollars used in OKC thanks to Biden's…,/story/news/2024/11/15/whats-happened-for-okc-3-years-into-the-bipartisan-infrastructure-law/76296350007/
This denomination you've never heard of has the second…,/story/news/2024/11/14/oklahoma-assemblies-of-god-churches-second-highest-in-state/75307217007/
,
"OU basketball, Porter Moser focused on length with 2025…",/story/sports/college/sooners/2024/11/15/ou-basketball-porter-moser-focused-on-length-with-2025-recruiting-class/76337374007/
"Thunder vs Suns prediction, picks, odds: Latest news…",/story/sports/nba/thunder/2024/11/15/thunder-suns-prediction-picks-odds-latest-news-injury-updates/76334020007/
OKC Thunder's Ajay Mitchell calls Thanksgiving Bingo for…,/picture-gallery/news/2024/11/15/okc-thunder-ajay-mitchell-thanksgiving-bingo-photos/76264311007/
Ryan Walters orders districts to show video about religious office,/story/news/education/2024/11/15/ryan-walters-oklahoma-religious-video-order-trump-bibles/76338979007/
Stitt says state will deport undocumented immigrants in prison custody,/story/news/politics/government/2024/11/15/oklahoma-mass-deportations-kevin-stitt-migrants-prisons/76340265007/
"'Warning signs' ahead of Lindsay financial woes, state auditor finds",/story/news/2024/11/15/lindsay-oklahoma-financial-mismanagement-lost-taxpayers-millions-of-dollars-audit/76297283007/
"How Thunder has assembled small-ball lineups, even before necessity",/story/sports/nba/thunder/2024/11/15/okc-thunder-small-ball-lineups-chet-holmgren-isaiah-hartenstein-injuries/76341129007/
Live updates: Mike Tyson-Jake Paul fight takes spotlight on Netflix,/story/sports/boxing/2024/11/15/mike-tyson-jake-paul-live-updates-highlights/76266132007/
High school football championship predictions for Class 6A-I to C,/story/sports/high-school/football/2024/11/15/oklahoma-high-school-football-championship-predictions-for-ossaa-class-6a-c/76243317007/
"Economists warn some Trump policies will hurt state, national economy",/story/business/economy/2024/11/15/trump-tariffs-inflation-impacts-oklahoma-okc-economy/76302865007/
Major road closures expected in downtown OKC as arena project begins,/story/business/local/2024/11/14/okc-thunder-nba-arena-construction-traffic-arena-demolition/76288990007/
Oklahoma Workforce Commission to revamp state workforce through education,/story/business/employment/2024/11/14/oklahoma-workforce-commission-prosperity-summit-education-child-care/76135501007/
Mike Tyson vs Jake Paul: Who will win? Vote in our poll,/story/opinion/2024/11/15/mike-tyson-jake-paul-who-will-win-vote/76331297007/
What Oklahoma lawmakers heard when they knocked on doors William C. Wertz,/story/opinion/columns/2024/11/15/ryan-walters-dissatisfaction-immigration-economy-oklahoma-lawmakers-door-to-door-campaign/76128415007/
Election results show what values we Americans prioritize David Myers,/story/opinion/columns/2024/11/15/convicted-criminal-president-troubling-lessons-confusion-next-generation-children/76235822007/
"Roman officials share concern, hope for Airbnb's Colosseum experience",/story/travel/news/2024/11/15/roman-colosseum-airbnb-gladiator-night-controversy/76338344007/
Armed driver rideshare service BlackWolf coming to 3 Texas cities,/story/news/nation/2024/11/15/blackwolf-armed-driver-rideshare-service-texas/76331189007/
Cash App settlement: Here's how to file a claim before the deadline,/story/money/personalfinance/2024/11/15/cash-app-security-settlement-deadline/76264854007/
Trailblazing 'Thanksgiving Play' hilariously skewers American myth-making,/story/entertainment/2024/11/15/the-thanksgiving-play-okc-review/76087934007/
Third HTeaO in OKC set for Saturday opening,/story/lifestyle/food/2024/11/15/hteao-okc-new-location-opening-may-avenue/76332387007/
Five Oklahoma hotels to host festive Reindeer Alley holiday pop-ups,/story/lifestyle/food/2024/11/14/reindeer-alley-holiday-pop-ups-coming-to-4-okc-metro-1-tulsa-hotels/76262613007/
,/picture-gallery/news/2024/11/13/bricktown-okc-christmas-tree-photos/76259597007/
ENTER NOW! ENTER OFTEN!,https://oklahoman.gannettcontests.com/2024-Holiday-Wish-and-Win/?itm_campaign=2024%20Holiday%20Wish%20%26amp%3B%20Win%20Sweepstakes%20-%20Oklahoma%20City&itm_medium=con&itm_source=secondStreet
ENTER TODAY!,https://usatoday.gannettcontests.com/PERGOLUX-Black-Friday/?itm_campaign=PERGOLUX%20Black%20Friday%20Sweepstakes&itm_medium=con&itm_source=secondStreet
WIN TICKETS!,https://oklahoman.gannettcontests.com/Paycom-Center-Justin-Timberlake-Tickets/?itm_campaign=Paycom%20Center%20Justin%20Timberlake%20Tickets&itm_medium=con&itm_source=secondStreet
"Economists warn some Trump policies will hurt state, national economy",/story/business/economy/2024/11/15/trump-tariffs-inflation-impacts-oklahoma-okc-economy/76302865007/
"'Warning signs' ahead of Lindsay financial woes, state auditor finds",/story/news/2024/11/15/lindsay-oklahoma-financial-mismanagement-lost-taxpayers-millions-of-dollars-audit/76297283007/
"Day of the Dead, new Senators: A week in your community through our photographer's eyes",/picture-gallery/news/local/2024/11/15/the-oklahoman-best-photos-community-in-a-week/76296248007/
High school football championship predictions for Class 6A-I to C,/story/sports/high-school/football/2024/11/15/oklahoma-high-school-football-championship-predictions-for-ossaa-class-6a-c/76243317007/
New Oklahoma rule requires students to fill out FAFSA to graduate,/story/news/education/2024/11/15/oklahoma-fafsa-rule-for-graduation-what-to-know/76297457007/
,https://cm.oklahoman.com/site-feedback/?platform=Tangent-Desktop&url=https%3A%2F%2Fwww.oklahoman.com%2F&marketName=oklahoman&cta=Right-Rail
