headline,href
Gov. Stitt adds another new member to Oklahoma State Board of Education,/story/news/education/2025/04/28/ryan-walters-oklahoma-state-board-education-kevin-stitt-appoints-becky-carson/83327865007/
Prom 2025: All the glamorous photos from Oklahoma City-area schools,/story/news/education/2025/04/19/prom-202-photos-okc-schools-celebrate-in-style/83096973007/
Big 12 softball power rankings: Texas Tech takes ultimate top spot,/story/sports/college/big-12/2025/04/28/big-12-softball-power-rankings-texas-tech-dominates-wins-conference-title-red-raiders-nijaree-canady/83323483007/
How OKC is prepping for a long layoff between NBA Playoffs rounds,/story/sports/nba/thunder/2025/04/28/okc-thunder-nba-playoffs-rest-first-round-western-conference-semifinals-denver-nuggest-la-clippers/83315719007/
OU women's gymnastics team holds rally for Sooners' NCAA…,/picture-gallery/sports/college/sooners/2025/04/28/ou-womens-gymnastics-team-holds-rally-for-sooners-ncaa-championship/83336238007/
Oklahoma State football adds Tulsa QB Banks Bowen via…,/story/sports/college/cowboys/2025/04/28/oklahoma-state-football-quarterback-banks-bowen-tulsa-transfer-portal-osu-cowboys/83335770007/
,
OU basketball lands Alabama forward Derrion Reid in…,/story/sports/college/sooners/2025/04/28/ou-basketball-derrion-reid-alabama-transfer-portal-oklahoma-sooners/83335155007/
Country music acts Whiskey Myers and Riley Green to play…,/story/entertainment/2025/04/28/whiskey-myers-and-riley-green-to-play-autumn-okc-concerts-what-to-know/83331664007/
Local church votes to end 'spiritual affiliation' with…,/story/news/2025/04/28/oklahoma-city-church-votes-to-cut-ties-with-global-denomination/83332388007/
Gov. Stitt adds another new member to Oklahoma State Board of Education,/story/news/education/2025/04/28/ryan-walters-oklahoma-state-board-education-kevin-stitt-appoints-becky-carson/83327865007/
Prom 2025: All the glamorous photos from Oklahoma City-area schools,/story/news/education/2025/04/19/prom-202-photos-okc-schools-celebrate-in-style/83096973007/
Local church votes to end 'spiritual affiliation' with denomination,/story/news/2025/04/28/oklahoma-city-church-votes-to-cut-ties-with-global-denomination/83332388007/
Big 12 softball power rankings: Texas Tech takes ultimate top spot,/story/sports/college/big-12/2025/04/28/big-12-softball-power-rankings-texas-tech-dominates-wins-conference-title-red-raiders-nijaree-canady/83323483007/
How OKC is prepping for a long layoff between NBA Playoffs rounds,/story/sports/nba/thunder/2025/04/28/okc-thunder-nba-playoffs-rest-first-round-western-conference-semifinals-denver-nuggest-la-clippers/83315719007/
Why 25th OKC Memorial Marathon was like 'microcosm of life',/story/sports/2025/04/28/oklahoma-city-memorial-marathon-25th-anniversary-okc-mayor-david-holt/83312695007/
"Sam's Club remodeling 600 stores in Oklahoma, US: What we know",/story/business/2025/04/28/sams-club-remodel-in-oklahoma-us-as-part-of-register-free-move/83325077007/
"Industry experts say AI needs energy, and energy exploration needs AI",/story/business/energy-resource/2025/04/27/ai-energy-resources-oklahoma-city-summit-experts-pitch-coal-nuclear/83211323007/
"Harold Hamm started small, became leading voice in energy industry",/story/business/energy-resource/2025/04/27/harold-hamm-oklahoma-ai-conference-draws-power-brokers-nation/83276762007/
ICYMI: Here are some topics that had columnists storming mad in April,/story/opinion/2025/04/28/columnists-in-apchrist-the-king-to-ryan-walters-columnists-had-a-lot-to-talk-about-in-april-opinion/83211104007/
Workers' Memorial Day recognizes those injured or killed on the job Joseph C. “Joe” Biscone II,/story/opinion/columns/guest/2025/04/28/workplace-rules-and-fairness-in-compensation-claims-needed-for-those-in-dangerous-jobs/83252000007/
"Autism disinformation fragments research funding, devalues people Kelly Dyer Fry",/story/opinion/columns/guest/2025/04/27/autism-disinformation-discrimination-research-funding-devalues-people/83254801007/
Powerball winning numbers for April 28: Jackpot resets to $20 million,/story/money/lottery/2025/04/28/powerball-winning-numbers/83334823007/
Nearly 50% of Americans don't want trans issues in politics: Poll,/story/news/politics/2025/04/28/transgender-issues-politics-poll-19th-news/83330965007/
New York Democrat running for county legislature seat missing for days,/story/news/nation/2025/04/28/democrat-petros-krommidas-missing-nassau-county-police/83329539007/
Martha Stewart’s iconic home line is up to 60% off at Wayfair,/story/shopping/2025/04/28/wayfair-spring-way-day-martha-stewart-home-collection-deals/83263992007/
Way Day ends tonight! Get last-chance deals with up to 80% off 🛍️,/story/shopping/2025/04/28/last-chance-wayfair-april-way-day-deals/83323068007/
"Skip the flowers: Save up to $1,456 on HexClad cookware for mom 🔥",/story/shopping/2025/04/28/hexclad-mothers-day-cookware-sale/83323752007/
Country music acts Whiskey Myers and Riley Green to play fall OKC shows,/story/entertainment/2025/04/28/whiskey-myers-and-riley-green-to-play-autumn-okc-concerts-what-to-know/83331664007/
Did chef Kevin Lee survive week one of '24 in 24: Last Chef Standing'?,/story/lifestyle/food/2025/04/28/what-happened-in-the-first-week-of-24-in-24-last-chef-standing-oklahoma-citys-chef-kevin-lee/83318694007/
These were our favorite moments from Westmoore High School's prom,/picture-gallery/lifestyle/2025/04/27/westmoore-high-school-2025-prom-photos/83011123007/
,/picture-gallery/news/local/2025/04/28/okc-memorial-marathon-2025-photos-starting-line-crowds/83329372007/
Enter Now!,https://usatoday.gannettcontests.com/2025-Project-Home-Improved/?itm_campaign=2025%20Project%20Home%20Improved%20Gen&itm_medium=con&itm_source=secondStreet
ENTER TODAY,https://www.kalahariresorts.com/win?itm_campaign=Get%20Kalaharid%20Away&itm_medium=con&itm_source=secondStreet#//?
Vote Every Week!,https://www.oklahoman.com/sports/high-school/?itm_campaign=Athlete%20of%20the%20Week%20Landmark%20OKC&itm_medium=con&itm_source=secondStreet
Why 25th OKC Memorial Marathon was like 'microcosm of life',/story/sports/2025/04/28/oklahoma-city-memorial-marathon-25th-anniversary-okc-mayor-david-holt/83312695007/
Vote: Landmark Fine Homes girls HS athlete of the week for April 21-27,/story/sports/high-school/athlete-of-the-week/2025/04/28/vote-landmark-fine-homes-girls-high-school-athlete-of-the-week-for-april-21-27/83327546007/
Vote: Landmark Fine Homes boys HS athlete of the week for April 21-27,/story/sports/high-school/athlete-of-the-week/2025/04/28/vote-landmark-fine-homes-boys-high-school-athlete-of-the-week-for-april-21-27/83327912007/
"Oklahoma high school winter sports All-State, All-City teams for 2024-25",/story/sports/high-school/2025/04/11/oklahoma-high-school-basketball-swimming-wrestling-awards-2025/83043358007/
Celebrate Oklahoma high school basketball with 'The Big House' book,/story/sports/high-school/basketball/2025/02/27/oklahoma-high-school-basketball-book-the-big-house-state-fair-arena/80708941007/
,https://cm.oklahoman.com/site-feedback/?platform=Tangent-Desktop&url=https%3A%2F%2Fwww.oklahoman.com%2F&marketName=oklahoman&cta=Right-Rail
