headline,href
Conference championship weekend: What games matter most for OU fans?,/story/sports/college/football/2025/12/04/college-football-playoffs-oklahoma-alabama-vs-georgia-texas-tech-vs-byu/87604725007/
Brent Swadley wanted AG off his criminal case. Judge said no,/story/news/2025/12/06/swadles-bbq-owner-case-ag-gentner-drummond-allowed-stay-on-case/87628971007/
Former failed bank CEO charged with fraud on loans to friends,/story/business/2025/12/06/lindsay-ok-former-bank-ceo-indicted-fraud/87623871007/
Dean McGee Eye Institute celebrates 50 years of success stories,/story/news/healthcare/2025/12/06/dean-mcgee-eye-institute-okc-marks-50-years/87453386007/
"Oklahoma high school football Week 14 schedule, scores…",/story/sports/high-school/football/2025/12/04/oklahoma-high-school-football-scores-ossaa-week-14-playoff-championships-semifinals-updates-stats/87601040007/
How one OKC church used funding from Oklahoma's Choosing…,/story/news/2025/12/03/okc-putnam-city-baptist-church-parenting-services-program-choosing-childbirth-act-oklahoma/86935443007/
Oklahoma Class 6A-I football: Bixby vs. Owasso…,/story/sports/high-school/football/2025/12/05/oklahoma-high-school-football-2025-ossaa-class-6a-i-state-championship-bixby-vs-owasso-preview/87608918007/
Class 5A preview: How Carl Albert & McGuinness match up…,/story/sports/high-school/football/2025/12/05/oklahoma-high-school-football-2025-ossaa-class-5a-championship-carl-albert-vs-mcguinness-preview/87608636007/
,
Vote: Landmark Fine Homes HS boys athlete of the week…,/story/sports/high-school/athlete-of-the-week/2025/12/01/vote-landmark-fine-homes-high-school-boys-athlete-of-the-week-for-nov-24-30/87551601007/
How to watch college football conference title games today with Sling,/story/shopping/2025/12/06/how-to-watch-stream-ncaa-college-football-title-games-with-sling/87585523007/
Save up to $80 on festive Le Creuset holiday cookware,/story/shopping/2025/12/05/le-creuset-deals-holiday-collection-2025/87628712007/
🎁 11 brands that offer customized holiday gift options,https://www.usatoday.com/story/shopping/best-retailers-for-customized-gifts/86688763007/
Brent Swadley wanted AG off his criminal case. Judge said no,/story/news/2025/12/06/swadles-bbq-owner-case-ag-gentner-drummond-allowed-stay-on-case/87628971007/
Dean McGee Eye Institute celebrates 50 years of success stories,/story/news/healthcare/2025/12/06/dean-mcgee-eye-institute-okc-marks-50-years/87453386007/
MacKenzie Scott donates millions to 5th Oklahoma college,/story/news/education/campus/2025/12/06/mackenzie-scott-makes-another-donation-to-an-oklahoma-college-eastern-oklahoma-state-university/87628283007/
Conference championship weekend: What games matter most for OU fans?,/story/sports/college/football/2025/12/04/college-football-playoffs-oklahoma-alabama-vs-georgia-texas-tech-vs-byu/87604725007/
"Oklahoma high school football Week 14 schedule, scores, highlights",/story/sports/high-school/football/2025/12/04/oklahoma-high-school-football-scores-ossaa-week-14-playoff-championships-semifinals-updates-stats/87601040007/
Oklahoma Class 6A-I football: Bixby vs. Owasso championship preview,/story/sports/high-school/football/2025/12/05/oklahoma-high-school-football-2025-ossaa-class-6a-i-state-championship-bixby-vs-owasso-preview/87608918007/
Former failed bank CEO charged with fraud on loans to friends,/story/business/2025/12/06/lindsay-ok-former-bank-ceo-indicted-fraud/87623871007/
"When are OKC stores, malls open for Christmas shopping? See holiday hours",/story/business/local/2025/12/05/holiday-hours-for-okc-malls-stores-walmart-target-penn-square-mall-quail-springs/87589294007/
See OKC Thunder players go holiday shopping with kids at Target for Holiday Assist,/picture-gallery/business/local/2025/12/05/okc-thunder-holiday-assist-target-shopping-photos/87614490007/
Congress is finally taking biotechnology seriously Rodd Moesel,/story/opinion/columns/guest/2025/12/05/at-ou-and-other-centers-biotechnology-is-shaping-our-future-opinion/87205972007/
Lack of teacher training may have sparked essay controversy John Kainer,/story/opinion/columns/guest/2025/12/05/samantha-fulnecky-ou-essay-controversy-teacher-training/87605325007/
Cheaper electricity requires better transmission lines William Langdon,/story/opinion/columns/guest/2025/12/04/oklahoma-can-lead-america-in-providing-less-expensive-electricity/87307576007/
Mega Millions winning numbers for Dec. 5 drawing with $50M jackpot,/story/money/lottery/2025/12/05/mega-millions-winning-numbers/87631838007/
Discord Checkpoint is here. See how you used the platform in 2025,/story/tech/gaming/2025/12/05/discord-wrapped-checkpoint-2025-recap/87619799007/
Which 25 US cities have the worst traffic? See this data firm's list.,/story/news/nation/2025/12/05/us-cities-worst-traffic-list/87610171007/
Here's how to see various versions of 'The Nutcracker' in OKC at Christmas,/story/entertainment/2025/12/05/different-versions-of-the-nutcracker-are-dancing-in-okc-this-christmas/87622141007/
Recap: Did OKC's Stefanie Embree survive 'Next Level Baker' premiere,/story/entertainment/2025/12/05/fox-next-level-baker-recap-did-okc-contestant-survive/87622035007/
North Italia is on the way. Where to eat in the meantime at Penn Square,/story/entertainment/dining/2025/12/05/penn-square-mall-restaurants-okc-north-italia-plans-cheesecake-factory/87609785007/
,/picture-gallery/sports/nba/thunder/2025/12/05/okc-thunder-vs-dallas-mavericks-at-paycom-center-see-our-top-photos/87636502007/
ENTER TODAY!,https://usatoday.gannettcontests.com/New-Years-Eve-Live-Nashvilles-Big-Bash-2025/?itm_campaign=2025%20Nashville%20New%20Years%20Eve%20Sweepstake&itm_medium=con&itm_source=secondStreet
Enter Today!,https://oklahoman.gannettcontests.com/2025-The-Great-Holiday-Grocery/?itm_campaign=Homeland%20Great%20Holiday%20Grocery%20Giveaway&itm_medium=con&itm_source=secondStreet
ENTER TODAY!,https://oklahoman.gannettcontests.com/Oklahoma-City-Ballet-2025-The-Nutcracker/?itm_campaign=OKC%20Ballet%202025%20The%20Nutcracker%20Sweepstakes&itm_medium=con&itm_source=secondStreet
MacKenzie Scott donates millions to 5th Oklahoma college,/story/news/education/campus/2025/12/06/mackenzie-scott-makes-another-donation-to-an-oklahoma-college-eastern-oklahoma-state-university/87628283007/
OSU returning money after mental health hospital project falls through,/story/news/education/campus/2025/12/06/osu-oklahoma-returning-millions-after-mental-health-hospital-project-falls-through/87627380007/
Hundreds rally to support OU teacher amid Samantha Fulnecky essay debate,/story/news/local/norman/2025/12/05/samantha-fulnecky-ou-essay-protest-norman-ok-teacher/87628785007/
Oklahoma's AG sides with homeowners in lawsuit against State Farm,/story/news/state/2025/12/05/oklahoma-state-farm-hail-lawsuits-attorney-general-gentner-drummond/87622901007/
More economic development expected to boost OKC streetcar ridership,/story/news/2025/12/05/okc-streetcar-fares-free-starting-2026/87625569007/
,https://cm.oklahoman.com/site-feedback/?platform=Tangent-Desktop&url=https%3A%2F%2Fwww.oklahoman.com%2F&marketName=oklahoman&cta=Right-Rail
