headline,href
Ryan Walters threatens Oklahoma districts about video in recent interview,/story/news/education/2024/11/23/ryan-walters-oklahoma-state-board-education-meeting-canceled-media-blitz/76501349007/
"Oklahoma high school football: Week 12 schedule, scores, highlights",/story/sports/high-school/football/2024/11/22/oklahoma-high-school-football-scores-schedule-stats-for-2024-ossaa-week-12/76504451007/
Sen. Markwayne Mullin calls Walters' Bible mandate a 'slippery slope',/story/news/politics/2024/11/22/ryan-walters-oklahoma-bible-mandate-markwayne-mullin/76496678007/
"Proposed state question on open primaries draws criticism, support",/story/news/2024/11/23/oklahoma-open-primary-state-question-835/76499707007/
Walterscheids nearing end of 11-year run of sons playing…,/story/sports/college/cowboys/2024/11/22/oklahoma-state-football-cole-walterscheid-kody-osu-cowboys-roster/76484802007/
How Oklahoma State had a hand in the Fiesta Bowl's lofty…,/story/sports/college/cowboys/2024/11/23/oklahoma-state-football-helped-stabilize-fiesta-bowl-50-years-ago-college-football-playoff-1974/76484814007/
Vote: Landmark Fine Homes boys HS athlete of the week…,/story/sports/high-school/football/2024/11/17/vote-landmark-fine-homes-boys-high-school-athlete-of-the-week-for-nov-10-16/76371072007/
Where are Oklahoma high school athletes going to play in…,/story/sports/high-school/2024/11/13/national-signing-day-oklahoma-high-school-athletes-signed-for-2025-class/76234274007/
,
When was last time Oklahoma football missed a bowl game?,/story/sports/college/football/2024/11/23/oklahoma-football-missed-bowl-game-streak/76432606007/
Ryan Walters threatens Oklahoma districts about video in recent interview,/story/news/education/2024/11/23/ryan-walters-oklahoma-state-board-education-meeting-canceled-media-blitz/76501349007/
Sen. Markwayne Mullin calls Walters' Bible mandate a 'slippery slope',/story/news/politics/2024/11/22/ryan-walters-oklahoma-bible-mandate-markwayne-mullin/76496678007/
"Proposed state question on open primaries draws criticism, support",/story/news/2024/11/23/oklahoma-open-primary-state-question-835/76499707007/
"Oklahoma high school football: Week 12 schedule, scores, highlights",/story/sports/high-school/football/2024/11/22/oklahoma-high-school-football-scores-schedule-stats-for-2024-ossaa-week-12/76504451007/
Draymond Green disapproves? Pfft! Here's why Thunder postgame is fab,/story/sports/nba/thunder/2024/11/22/okc-thunder-tv-postgame-group-interviews-antics-fun-jalen-williams-shai-gilgeous-alexander/76450578007/
How Adam Dorrel led UCO Bronchos football to NCAA Division II playoffs,/story/sports/college/football/2024/11/22/adam-dorrel-uco-bronchos-football-ncaa-division-ii-playoffs-central-oklahoma/76488760007/
Rural communities in Oklahoma to receive thousands of dollars from USDA,/story/business/local/2024/11/21/oklahoma-historic-black-towns-usda-rural-development-program/76196267007/
New OSU complex name to honor late T. Boone Pickens,/story/business/2024/11/20/new-osu-facility-to-be-named-after-t-boone-pickens/76429757007/
Airport officials say proposed Legends Tower will endanger flight safety,/story/business/downtown/2024/11/20/proposed-okc-skyscraper-construction-delayed-as-airports-raise-concern/76140729007/
Ryan Walters wasn't picked to be Education Secretary. What now?,/story/opinion/letters/2024/11/22/ryan-walters-oklahoma-education-secretary-nomination-trump-what-next/76483638007/
Grateful but need to grow: Thanksgiving wish list for Okla. | Opinion Todd Pendleton,/story/opinion/2024/11/22/thanksgiving-wish-list-for-oklahoma-opinion/76497939007/
Oklahoma's Thanksgiving wish list: 10 aspects we're grateful for or wish to grow Todd Pendleton,/picture-gallery/opinion/2024/11/22/oklahomas-thanksgiving-wish-list-where-we-can-be-grateful-grow/76502978007/
Mega Millions winning numbers for November 22: $453 million jackpot,/story/money/lottery/2024/11/22/mega-millions-winning-numbers/76503982007/
PlayStation 5: Where to find Black Friday deals,/story/shopping/2024/11/22/ps5-black-friday-2024-deals/76484740007/
'Pink tote mom': Latest social trend strikes much more serious tone,/story/tech/2024/11/22/pink-tote-lid-moments-mom-tiktok/76496378007/
Our favorite colorful displays at OKC Zoo Safari Lights,/picture-gallery/lifestyle/features/2024/11/22/okc-zoo-safari-lights-2024-photos/76501776007/
Creepily crowd-pleasing 'Beetlejuice' musical plays OKC: What to know,/story/entertainment/2024/11/22/beetlejuice-musical-review-oklahoma-city/76207961007/
"Meet OKC's most influential faith leaders: Community builders, advocates, confidantes",/picture-gallery/lifestyle/faith/2024/11/22/meet-oklahoma-citys-most-influential-faith-spiritual-leaders/76500343007/
,/picture-gallery/sports/nba/thunder/2024/11/17/okc-thunder-vs-dallas-mavericks-at-paycom-center-see-top-photos/76389591007/
Enter Your Pet Photo Today,https://newsok.gannettcontests.com/USAs-Favorite-Pet/?itm_campaign=2024%20USAs%20Favorite%20Pet%20Photos%20Non-Sponsored&itm_medium=con&itm_source=secondStreet
Enter today!,https://oklahoman.gannettcontests.com/Oklahoma-City-Ballet-2024-The-Nutcracker-Ticket/?itm_campaign=OKC%20Ballet-The%20Nutcracker%20Ticket%20Sweepstakes&itm_medium=con&itm_source=secondStreet
ENTER NOW! ENTER OFTEN!,https://oklahoman.gannettcontests.com/2024-Holiday-Wish-and-Win/?itm_campaign=2024%20Holiday%20Wish%20%26amp%3B%20Win%20Sweepstakes%20-%20Oklahoma%20City&itm_medium=con&itm_source=secondStreet
"Settlement approved between OKC, family of man shot by police in 2020",/story/news/local/oklahoma-city/2024/11/22/okc-approves-settlement-in-bennie-edwards-police-shooting/76481481007/
Draymond Green disapproves? Pfft! Here's why Thunder postgame is fab,/story/sports/nba/thunder/2024/11/22/okc-thunder-tv-postgame-group-interviews-antics-fun-jalen-williams-shai-gilgeous-alexander/76450578007/
Meet the OKC volunteers who make Thanksgiving happen year after year,/story/news/2024/11/21/thanksgiving-2024-dinners-okc-long-term-volunteers/75675502007/
How Adam Dorrel led UCO Bronchos football to NCAA Division II playoffs,/story/sports/college/football/2024/11/22/adam-dorrel-uco-bronchos-football-ncaa-division-ii-playoffs-central-oklahoma/76488760007/
FAFSA now open: What students need to know about new Oklahoma rule,/story/news/education/2024/11/22/fafsa-applications-oklahoma-law-to-graduate/76494130007/
,https://cm.oklahoman.com/site-feedback/?platform=Tangent-Desktop&url=https%3A%2F%2Fwww.oklahoman.com%2F&marketName=oklahoman&cta=Right-Rail
