headline,href
"Class 6A-II 2023 football district previews: Polls, storylines & more",/story/sports/high-school/football/2023/08/13/oklahoma-high-school-football-2023-class-6a-ii-district-previews-players-watch-coaches-poll/70570977007/
"From prehistoric sea to wildlife refuge, dig into Oklahoma's salt flats",/story/news/environment/2023/08/13/great-salt-plains-enid-oklahoma-crystal-hunting-history-conservation/70470018007/
Former Oklahoma County judge could lose law license over sex scandal,/story/news/2023/08/12/oklahoma-supreme-court-former-county-judge-tim-henderson-sex-scandal/70578282007/
Check out the set list and highlights of Zach Bryan's Oklahoma concert,/story/entertainment/2023/08/13/zach-bryan-played-two-sold-out-tulsa-shows-as-part-of-his-new-tour/70546327007/
Once blighted industrial district set to be new home for…,/story/news/local/2023/08/11/kosu-okc-the-spy-joining-once-blighted-industrial-district-oklahoma-city/70562038007/
FBI investigating misspending of Oklahoma education funds,/story/news/2023/08/10/fbi-investigation-misspent-education-covid-money-ryan-walters-nonprofit/70570734007/
"After a year on the job, prison chief says 'culture…",/story/news/politics/government/2023/08/10/oklahoma-department-corrections-prison-director-steven-harpe-changes/70478519007/
'Farmers' Almanac' predicts a soggy winter in Oklahoma…,/story/news/state/2023/08/10/oklahoma-farmers-almanac-2023-winter-forecast-soggy-cold-weather/70553162007/
,
How can Venables turn around OU football? 'Competitive…,/story/sports/college/sooners/2023/08/13/ou-football-brent-venables-seek-competitive-depth-for-2023-turnaround/70581155007/
"From prehistoric sea to wildlife refuge, dig into Oklahoma's salt flats",/story/news/environment/2023/08/13/great-salt-plains-enid-oklahoma-crystal-hunting-history-conservation/70470018007/
Former Oklahoma County judge could lose law license over sex scandal,/story/news/2023/08/12/oklahoma-supreme-court-former-county-judge-tim-henderson-sex-scandal/70578282007/
Tornado aftermath is time for a 'repair and refresh' at OBU,/story/news/2023/08/13/oklahoma-baptist-university-fall-semester-shawnee-tornado-april-2023/70506524007/
"Class 6A-II 2023 football district previews: Polls, storylines & more",/story/sports/high-school/football/2023/08/13/oklahoma-high-school-football-2023-class-6a-ii-district-previews-players-watch-coaches-poll/70570977007/
How can Venables turn around OU football? 'Competitive depth' is key,/story/sports/college/sooners/2023/08/13/ou-football-brent-venables-seek-competitive-depth-for-2023-turnaround/70581155007/
Is an NFL Lite model coming to college football? 'Could happen',/story/sports/college/football/2023/08/13/college-football-could-end-up-in-nfl-model-in-conference-realignment/70573369007/
OKC apartment rents fall across all types while studio rents plummet,/story/business/real-estate/2023/08/11/apartments-okc-rent-studio-apartments-plummeting-analysis/70560554007/
Commercial real estate deals from around the Oklahoma City metro area,/story/business/real-estate/2023/08/10/okc-commercial-real-estate-transactions-august-2023/70561843007/
"OKC retailers are projected to grow, but some still on the downturn",/story/business/real-estate/2023/08/09/retail-recovery-in-oklahoma-city-andretti-indoor-karting-and-games-dicks-house-of-sport-oak-stacks/70546575007/
Guest: How OKC sit-ins helped my parents teach me about racism Michael Korenblit,/story/opinion/2023/08/13/guest-13-okc-kids-helped-change-oklahoma-us-history-for-the-better/70554509007/
Guest: We cannot be silent while others are discriminated against Elder Markus Tovstiga,/story/opinion/2023/08/13/guest-we-cannot-be-silent-while-others-are-discriminated-against/70545060007/
Social structures that taught courtesy in the past have broken down Nancy E. Snow,/story/opinion/2023/08/13/a-return-to-civility-means-each-individual-must-reverse-the-trend/70495119007/
How to watch the next episode of 'Only Murders in the Building',/story/entertainment/tv/2023/08/13/only-murders-in-the-building-season-3-how-to-watch/70575111007/
These influencers want to show you what college is really like,/story/news/education/2023/08/13/college-influencers-youtube/70567235007/
Why are back-to-school dates so different between states?,/story/news/education/2023/08/13/why-us-back-to-school-dates-vary/70532779007/
Cancer patients in rural Oklahoma face higher cancer mortality rates,/story/lifestyle/2023/08/12/cancer-treatments-rural-oklahoma-patients-higher-mortality-rates/70403252007/
"Peak time to see Perseids in Oklahoma, other meteor shows this summer",/story/lifestyle/things-to-do/2023/08/08/perseid-meteor-shower-oklahoma-how-to-see-delta-aquariid/70544090007/
Suspense and terror abound in 'Misery' showing at 3rd Act Theatre,/story/lifestyle/2023/08/12/3rd-act-theatre-in-oklahoma-city-is-putting-on-stephen-kings-misery/70547218007/
,/picture-gallery/news/2023/08/10/okcps-first-day-of-school-august-2023-photos/70568879007/
Enter Today!,https://oklahoman.gannettcontests.com/OKCMOA-Auguste-Rodin-Exhibitition-Giveaway/?itm_campaign=OCKMOA%20Rodin%20Exihbition&itm_medium=con&itm_source=secondStreet
Enter Now!,https://health.truecoverage.site/?itm_campaign=TrueCoverage&itm_medium=con&itm_source=secondStreet
Enter to WIN!,https://oklahoman.gannettcontests.com/Jellystone-Park-Wichita-Falls-2-Night-Luxury-Glamping-Giveaway/?itm_campaign=Jellystone%20Park%20Wichita%20Falls&itm_medium=con&itm_source=secondStreet
Guest: How OKC sit-ins helped my parents teach me about racismMichael Korenblit,/story/opinion/2023/08/13/guest-13-okc-kids-helped-change-oklahoma-us-history-for-the-better/70554509007/
Tornado aftermath is time for a 'repair and refresh' at OBU,/story/news/2023/08/13/oklahoma-baptist-university-fall-semester-shawnee-tornado-april-2023/70506524007/
Cherokee Nation film director building a hub for Native storytelling,/story/entertainment/2023/08/11/jennifer-loren-cherokee-nation-oklahoma-creating-hub-native-storytelling/65415994007/
"Death toll from Maui wildfire reaches 93, making it the deadliest in the US in more than 100 years",/story/news/nation/2023/08/12/maui-hawaii-wildfire-live-updates/70581299007/
What to know about the two-day OKC Asian District Night Market Festival,/story/entertainment/events/2023/08/12/asian-district-night-market-festival-2023-okc-what-to-know/70513767007/
,https://cm.oklahoman.com/site-feedback/?platform=Tangent-Desktop&url=https%3A%2F%2Fwww.oklahoman.com%2F&marketName=oklahoman&cta=Right-Rail
