headline,href
Insurance rates in Oklahoma are skyrocketing. Here's what you can do,/story/news/2023/09/15/oklahoma-car-insurance-homeowners-insurance-most-expensive-united-states/70853044007/
"Oklahoma high school football: Week 3 scores, highlights, stats",/story/sports/high-school/football/2023/09/14/ossaa-football-2023-week-3-scores-oklahoma-high-school-schedule-highlights-stats-live-updates/70850047007/
New OKC rabbi celebrates Jewish New Year overseas as Navy chaplain,/story/news/2023/09/15/rosh-hashana-okc-rabbi-celebrates-jewish-new-year-navy/70824057007/
Oklahoma poll workers are getting a raise for the 2024 elections,/story/news/2023/09/15/oklahoma-elections-2024-poll-workers-to-get-a-raise-july/70864139007/
Those little dirt mounds in your lawn are from…,/story/news/2023/09/15/earthworms-oklahoma-what-are-castings-how-to-manage/70850019007/
"Oklahoma State Fair opens with new attractions, familiar…",/story/entertainment/2023/09/15/oklahoma-state-fair-2023-day-1-events-lumberjack-show-attractions/70828774007/
OKC is getting its own Chicago Bean: See the planned…,/story/news/2023/09/15/okc-real-estate-the-oka-development-2-million-art-sculptures/70824739007/
,
Is OKC's new NBA arena going to increase taxes? A new…,/story/news/local/2023/09/15/okc-thunder-new-arena-funding-maps4-new-tax-questions/70843484007/
How has Bricktown changed in the 40 years since it…,/story/news/2023/09/14/bricktown-okc-tourist-destination-increasingly-attractive-place-to-move-study/70784589007/
Insurance rates in Oklahoma are skyrocketing. Here's what you can do,/story/news/2023/09/15/oklahoma-car-insurance-homeowners-insurance-most-expensive-united-states/70853044007/
New OKC rabbi celebrates Jewish New Year overseas as Navy chaplain,/story/news/2023/09/15/rosh-hashana-okc-rabbi-celebrates-jewish-new-year-navy/70824057007/
Oklahoma poll workers are getting a raise for the 2024 elections,/story/news/2023/09/15/oklahoma-elections-2024-poll-workers-to-get-a-raise-july/70864139007/
Josiah Johnson's unique path from Mac Jones' backup to OSU tight end,/story/sports/college/cowboys/2023/09/15/oklahoma-state-football-josiah-johnson-mac-jones-bolles-school-backup-quarterback/70848413007/
"Four Downs: Will Tawee Walker, OU top 200 rushing yards vs. Tulsa?",/story/sports/college/sooners/2023/09/15/ou-football-vs-tulsa-tawee-walker-oklahoma-sooners-running-backs-tulsa-defense/70860335007/
"Oklahoma high school football: Week 3 scores, highlights, stats",/story/sports/high-school/football/2023/09/14/ossaa-football-2023-week-3-scores-oklahoma-high-school-schedule-highlights-stats-live-updates/70850047007/
Commercial real estate transactions from across the Oklahoma City area,/story/business/real-estate/2023/09/15/commercial-real-estate-transactions-from-across-the-oklahoma-city-area/70843546007/
See the most expensive and least expensive house in OKC's Parade of Homes,/story/business/real-estate/2023/09/13/parade-of-homes-2023-okc-most-expensive-home-cheapest-home/70788336007/
Airlines offer more Florida flights from OKC; airport parking goes up,/story/business/travel/2023/09/11/southwest-american-airlines-offer-more-florida-flights-from-okc-will-rogers-airport-parking-goes-up/70823278007/
Robin Gunn: Reignite the fire of being a lifelong learner Robin Gunn,/story/opinion/2023/09/15/opinion-robin-gunn-older-adults-can-become-lifelong-learners-improving-cognitive-health/70840566007/
Oliver Anthony’s 'Rich Men North of Richmond' is a plea for change Alex Seojoon Kim,/story/opinion/2023/09/15/opinion-young-perspective-rich-men-north-of-richmond-a-hit-but-does-it-have-to-be-political/70831921007/
Guests: Oklahoma food bank strives to make no one go hungry Stacy Dykstra and Phi Nguyen,/story/opinion/2023/09/14/opinion-guests-what-you-can-do-to-help-end-hunger-in-oklahoma/70826984007/
"After his mom got run over by a car.in Arizona, baby burro gets another chance at life",/story/news/nation/2023/09/15/arizona-burro-rescued-state-trooper/70868598007/
Hollywood on strike: See which stars have walked the picket lines,/story/entertainment/2023/09/15/hollywood-celebrities-have-shown-up-on-the-wga-sag-aftra-picket-lines/70866179007/
West Virginia 10-year-old on hunting trip with grandfather found dead,/story/news/nation/2023/09/15/west-virginia-10-year-old-found-dead-gunshot-wound-hunting-trip/70865409007/
ODWC wants you to wash your emotional support water bottle. Here's how,/story/lifestyle/2023/09/15/oklahoma-department-of-wildlife-conservation-twitter-how-to-wash-water-bottle/70862529007/
Vote now in the second round of our Best Barbecue Bracket,/story/lifestyle/food/2023/09/12/bbq-in-oklahoma-voting-bracket-edge-craft-phat-tabbs/70826127007/
Explore the history of oilman E.W. Marland at Ponca City landmark,/story/lifestyle/2023/09/15/discover-oklahoma-marland-grand-home-offers-look-at-oilmans-legacy/70823941007/
,/picture-gallery/sports/high-school/football/2023/09/14/oklahoma-high-school-football-stillwater-takes-on-norman/70859054007/
ENTER TODAY,https://usatoday.gannettcontests.com/Cayman-Islands-Dept-of-Tourism-Dream-Getaway/?itm_campaign=Cayman%20Islands%20Dream%20Getaway&itm_medium=con&itm_source=secondStreet
NOMINATE TODAY,https://oklahoman.gannettcontests.com/Cardiovascular-Health-Clinic-Amazing-Teachers/rounds/1/gallery?itm_campaign=Cardiovascular%20Health%20Clinic%20Amazing%20Teacher%20Awards&itm_medium=con&itm_source=secondStreet
Vote Every Week!,https://www.oklahoman.com/sports/high-school/?itm_campaign=Athlete%20of%20the%20Week%20Landmark%20OKC&itm_medium=con&itm_source=secondStreet
Remains exhumed from cemetery as search for Tulsa Race Massacre victims resumes,/story/news/2023/09/15/tulsa-race-massacre-remains-exhumed-oaklawn-cemetery-oklahoma/70866321007/
Police share tips after 4 children went missing on fair's opening day,/story/news/2023/09/15/oklahoma-state-fair-2023-safety-tips-for-kids-missing/70865391007/
ODWC wants you to wash your emotional support water bottle. Here's how,/story/lifestyle/2023/09/15/oklahoma-department-of-wildlife-conservation-twitter-how-to-wash-water-bottle/70862529007/
Affidavit alleges man told friends his plan to kill for truck parts,/story/news/crime/2023/09/15/christopher-somers-glencoe-ok-arrested-murder-chop-shop/70862064007/
"Four Downs: Will Tawee Walker, OU top 200 rushing yards vs. Tulsa?",/story/sports/college/sooners/2023/09/15/ou-football-vs-tulsa-tawee-walker-oklahoma-sooners-running-backs-tulsa-defense/70860335007/
,https://cm.oklahoman.com/site-feedback/?platform=Tangent-Desktop&url=https%3A%2F%2Fwww.oklahoman.com%2F&marketName=oklahoman&cta=Right-Rail
