headline,href
State Supreme Court holds the key to surprise county jail inspections,/story/news/2024/09/25/oklahoma-supreme-court-county-jail-surprise-inspections/75363636007/
"New, expanded Stroud Travel Plaza to reopen along Turner Turnpike in 2026",/story/news/2024/09/25/turner-turnpike-stroud-travel-plaza-oklahoma-construction-2024/75127799007/
Nearly 200 weapons seized in OKC crime sweep,/story/news/2024/09/25/okc-police-federal-agencies-arrest-50-seize-hundreds-guns/75349009007/
Apple retail workers at Penn Square Mall vote 'Yes' to new contract,/story/business/local/2024/09/25/okc-apple-union-workers-ratify-new-contract/75351734007/
"Whether you're Republican or Democrat, retirement saving…",/story/money/2024/09/21/republicans-democrats-agree-retirement-crisis/75246270007/
Vote: Landmark Fine Homes girls HS athletes of the week…,/story/sports/high-school/2024/09/22/vote-landmark-fine-homes-girls-high-school-athletes-of-the-week-for-sept-15-21/75337593007/
,
Vote: Landmark Fine Homes boys HS athletes of the week…,/story/sports/high-school/2024/09/22/vote-landmark-fine-homes-boys-high-school-athletes-of-the-week-for-sept-15-21/75337324007/
Everything you need to know about the 2024 Oklahoma HS…,/story/sports/high-school/football/2024/08/12/oklahoma-high-school-football-2024-season-preview-ossaa-top-players/74763812007/
OPINION: It's Hispanic Heritage Month. Let's celebrates…,/story/opinion/columns/2024/09/25/oklahoma-bilingual-language-program-teachers-students-diversity-hispanic-heritage-month/75352536007/
State Supreme Court holds the key to surprise county jail inspections,/story/news/2024/09/25/oklahoma-supreme-court-county-jail-surprise-inspections/75363636007/
"New, expanded Stroud Travel Plaza to reopen along Turner Turnpike in 2026",/story/news/2024/09/25/turner-turnpike-stroud-travel-plaza-oklahoma-construction-2024/75127799007/
Nearly 200 weapons seized in OKC crime sweep,/story/news/2024/09/25/okc-police-federal-agencies-arrest-50-seize-hundreds-guns/75349009007/
Oklahoma high school football: Ranking top 10 games for Week 4,/story/sports/high-school/football/2024/09/24/oklahoma-high-school-football-ranking-top-10-games-for-week-4/75351327007/
Why Sooners' QB decision vs. Auburn came quickly for Brent Venables,/story/sports/college/sooners/2024/09/25/ou-football-coach-brent-venables-starting-qb-michael-hawkins-jr-jackson-arnold/75366030007/
Here's what to make of Brent Venables' version of Dillon Gabriel story,/story/sports/college/sooners/2024/09/25/ou-football-qb-dillon-gabriel-transfer-brent-venables-jackson-arnold/75366784007/
Apple retail workers at Penn Square Mall vote 'Yes' to new contract,/story/business/local/2024/09/25/okc-apple-union-workers-ratify-new-contract/75351734007/
Canoo EV facility officially becomes a Foreign Trade Zone,/story/business/briefs/2024/09/24/oklahoma-jobs-canoo-ev-manufacturing-mental-health-care/75338078007/
Need a new job? What to know about truck driver training,/story/business/briefs/2024/09/23/ok-business-briefs-truck-driver-training-lock-in-natural-gas-rates/75212011007/
OPINION: It's Hispanic Heritage Month. Let's celebrates bilingual teachers Mary Melon-Tully,/story/opinion/columns/2024/09/25/oklahoma-bilingual-language-program-teachers-students-diversity-hispanic-heritage-month/75352536007/
Opinion: Seeking public office? Now there's help for child care Janelle Stecklein,/story/opinion/columns/2024/09/24/oklahoma-ethics-commission-win-use-of-campaign-funds-cost-childcare-jobs-workforce/75346906007/
Opinion: Cyberattacks a growing threat. Companies must prepare employees Ashley Perkins,/story/opinion/columns/2024/09/24/small-businesses-are-target-of-sophisticated-cyberattacks-guest-opinion/75148761007/
Storm tracker: See projected path of Tropical Storm Helene,/story/news/weather/2024/09/25/storm-tracker-helene-hurricane-path-spaghetti-models/75373550007/
Halloween shopping is on. But will we spend as much as last year?,/story/money/shopping/2024/09/25/halloween-shopping-costumes-decorations-candy/75365226007/
Surgeons complete first-of-its-kind double lung transplant on cancer patient,/story/news/health/2024/09/25/double-lung-transplant-northwestern-medicine-cancer-patient/75362407007/
It's the Brewery Bracket Finals. Who will win it all?,/story/lifestyle/food/2024/09/23/oklahoma-things-to-do-vote-best-brewery-stonecloud-vs-skydance/75349940007/
"Tulsa restaurant's chips, agave spirits praised in New York Times list",/story/lifestyle/2024/09/24/noche-woodfired-grill-and-agave-bar-was-honored-by-the-new-york-times/75363703007/
Reba McEntire becomes fancy a Funko Pop! figure: Here's how to get one,/story/entertainment/2024/09/24/reba-mcentire-funko-pop-where-to-buy/75364019007/
,/picture-gallery/sports/college/cowboys/2024/09/21/oklahoma-state-vs-utah-football-game-photos/75308738007/
Winners Announced!,https://oklahoman.gannettcontests.com/2024-Oklahoman-Communitys-Choice-Awards-Winners/?itm_campaign=Oklahoma%202024%20BOB&itm_medium=con&itm_source=secondStreet
Vote Every Week!,https://www.oklahoman.com/sports/high-school/?itm_campaign=Athlete%20of%20the%20Week%20Landmark%20OKC&itm_medium=con&itm_source=secondStreet
Consultant approved for new OKC arena construction,/story/news/local/oklahoma-city/2024/09/25/okc-thunder-nba-arena-council-approves-contract-caa-icon-consulting/75364656007/
How this nonprofit fights for Oklahomans who don't have a voice,/story/news/politics/government/2024/09/25/oklahoma-policy-institute-shiloh-kantz-nonpartisan-help-poor/74737644007/
Peace Needs conference brings nationwide gun violence experts to OKC,/story/news/local/oklahoma-city/2024/09/24/live-free-okc-peace-needs-conference-jabee-david-holt/75306326007/
It's the Brewery Bracket Finals. Who will win it all?,/story/lifestyle/food/2024/09/23/oklahoma-things-to-do-vote-best-brewery-stonecloud-vs-skydance/75349940007/
Oklahoma high school football: Ranking top 10 games for Week 4,/story/sports/high-school/football/2024/09/24/oklahoma-high-school-football-ranking-top-10-games-for-week-4/75351327007/
,https://cm.oklahoman.com/site-feedback/?platform=Tangent-Desktop&url=https%3A%2F%2Fwww.oklahoman.com%2F&marketName=oklahoman&cta=Right-Rail
