headline,href
"Lawmakers, dancers divided over stricter stripping laws",/story/news/politics/2026/05/04/oklahoma-strippers-lawmakers-divided-over-stricter-age-licensing-laws/89105135007/
At least a dozen injured in mass shooting at lake party in Edmond,/story/news/crime/2026/05/04/oklahoma-mass-shooting-near-arcadia-lake-leaves-10-injured-edmond/89925946007/
LeBron James is already beating Father Time. Will the Thunder be next?,/story/sports/nba/thunder/2026/05/04/lebron-james-los-angeles-lakers-vs-okc-thunder-nba-playoffs-western-conference-semifinal/89920527007/
Oklahoma voters to decide on property tax cap changes,/story/news/politics/elections/2026/05/04/oklahoma-property-tax-vote-elections-2026-sjr-39/89898488007/
Celebrate the Thunder's first NBA title with this…,/story/sports/nba/thunder/2025/12/17/celebrate-okc-thunder-nba-championship-commemorative-book/87805943007/
Celebrate Oklahoma high school basketball with 'The Big…,/story/sports/high-school/basketball/2025/12/17/celebrate-oklahoma-high-school-basketball-big-house-book/87806019007/
What you need to know about OKC Thunder schedule and how…,/story/sports/nba/thunder/2025/10/21/okc-thunder-schedule-dates-times-tv-streaming/86811489007/
,
No Luka means a big problem for Lakers against Thunder…,/story/sports/nba/thunder/2026/05/04/okc-thunder-vs-los-angeles-lakers-2026-nba-playoffs-prediction-luka-doncic-injury/89921993007/
Prep Spotlight: Getting to know Del City's Victoria…,/story/sports/high-school/soccer/2026/05/04/oklahoma-high-school-girls-soccer-victoria-carrion-del-city-prep-spotlight/89921715007/
News,/news/
"Lawmakers, dancers divided over stricter stripping laws",/story/news/politics/2026/05/04/oklahoma-strippers-lawmakers-divided-over-stricter-age-licensing-laws/89105135007/
At least a dozen injured in mass shooting at lake party in Edmond,/story/news/crime/2026/05/04/oklahoma-mass-shooting-near-arcadia-lake-leaves-10-injured-edmond/89925946007/
Oklahoma voters to decide on property tax cap changes,/story/news/politics/elections/2026/05/04/oklahoma-property-tax-vote-elections-2026-sjr-39/89898488007/
Sports,/sports/
LeBron James is already beating Father Time. Will the Thunder be next?,/story/sports/nba/thunder/2026/05/04/lebron-james-los-angeles-lakers-vs-okc-thunder-nba-playoffs-western-conference-semifinal/89920527007/
No Luka means a big problem for Lakers against Thunder. Does LA have a chance?,/story/sports/nba/thunder/2026/05/04/okc-thunder-vs-los-angeles-lakers-2026-nba-playoffs-prediction-luka-doncic-injury/89921993007/
Prep Spotlight: Getting to know Del City's Victoria Carrion,/story/sports/high-school/soccer/2026/05/04/oklahoma-high-school-girls-soccer-victoria-carrion-del-city-prep-spotlight/89921715007/
Life,/life/
Oklahoma creative sector shows economic impact for Arts & Culture Day,/story/entertainment/arts/2026/05/02/arts-culture-day-at-the-oklahoma-capitol-draws-hundreds-of-creatives/89423301007/
Flaming Lips' Wayne Coyne to show his visual art in OKC exhibition,/story/entertainment/2026/05/02/okc-art-exhibit-happily-one-freak-will-show-the-work-of-wayne-coyne/89855415007/
Inside Flaming Lips Wayne Coyne's 'King's Mouth' art exhibit,/picture-gallery/entertainment/arts/2026/05/02/the-flaming-lips-exhibit-photos-oklahoma-contemporary-arts-center-okc/89895267007/
Business,/business/
Oklahoma voters could face property tax cap changes,/videos/business/finance/2026/05/04/oklahoma-voters-could-face-property-tax-cap-changes/89900173007/
Nominations open for 2026 Oklahoma Top Workplaces,/story/business/employment/2026/05/03/nominations-now-open-for-2026-oklahoma-top-workplaces/89893484007/
"Gas prices continue to climb in US, Oklahoma as people search for ways to save",/story/business/economy/2026/05/02/why-did-gas-prices-go-up-costs-continue-to-climb-in-us-oklahoma/89875756007/
Opinion,/opinion/
Here's what you need to know about GOP hopefuls for governor,/story/opinion/columns/2026/05/03/oklahoma-elections-2026-governor-race-meet-republican-primary-candidates/89704216007/
Distrust of health officials on vaccines is causing measles resurgence Matthew Vermillion,/story/opinion/columns/guest/2026/05/01/oklahomans-need-transparency-consistency-on-vaccines-opinion/89814006007/
We should all learn to love one another. But following the law is a start Robert Henry,/story/opinion/columns/guest/2026/05/01/on-law-day-we-should-remember-laws-are-for-all-of-us-even-the-government/89863080007/
Trending,https://www.usatoday.com/news/trending/
Pirro says agent 'definitely' shot by DC press dinner shooting suspect,/story/news/politics/2026/05/03/dc-press-dinner-shooting-suspect-agent-us-attorney/89920442007/
$20M Powerball jackpot: Winning numbers for May 2 drawing,/story/money/lottery/2026/05/02/powerball-winning-numbers-saturday-may-2-2026/89899731007/
Mega Millions $178M jackpot. See winning numbers for May 1 drawing,/story/money/lottery/2026/05/01/mega-millions-178-million-jackpot-may-1/89898320007/
Shopping,/shopping/
What golf clubs and equipment does 3-time PGA champion Cam Young use?,https://golfweek.usatoday.com/story/sports/golf/equipment/2026/05/03/cameron-young-golf-equipment-cadillac-championship-2026/89922395007/
The best Mother's Day gift? Tickets to a night out,/story/shopping/gifts/mothers-day/2026/05/04/mothers-day-experience-gift-idea-tickets-concert-comedy-show-sporting-event/89920974007/
The Collagen Co. has $10 off best-selling Glow Shakes,/story/shopping/trending/2026/05/04/the-collagen-co-new-launches-deals/89873553007/
,/picture-gallery/sports/college/sooners/2026/05/04/kendall-wells-oklahoma-sooners-softball-north-oconee-high-school/89918429007/
Stamp Out Hunger!,https://www.regionalfoodbank.org/stamp-out-hunger/?itm_campaign=Regional%20Food%20Bank%20Stamp%20Out%20Hunger&itm_medium=con&itm_source=secondStreet
ENTER NOW,https://www.oattravel.com/marketing/giveaway?itm_campaign=Overseas%20Adventure%20Travel&itm_medium=con&itm_source=secondStreet
ENTER — A CRUISE FOR 2!,https://usatoday.gannettcontests.com/Victory-Cruise-Lines-Discover-the-Great-Lakes/?itm_campaign=Victory%20Cruises%20Getaway&itm_medium=con&itm_source=secondStreet
Former OSU student gets major settlement in jail strip search lawsuit,/story/news/courts/2026/05/04/oklahoma-state-student-gets-major-settlement-after-jail-strip-search/89886239007/
Arch constructed to honor Oklahoma National Guard nears completion,/story/news/state/2026/05/04/arch-oklahoma-state-capitol-building-nears-completion-national-guard/89889217007/
See who was nominated for The Oklahoman's Student of the Week,/story/news/2026/05/04/the-oklahoman-student-of-the-week-vote-poll-may-4/89754219007/
Multiple law enforcement agencies respond to shooting near Arcadia Lake,/story/news/crime/2026/05/03/arcadia-lake-edmond-shooting-police-respond/89924787007/
"Oklahoma high school winter sports All-State, All-City teams for 2025-26",/story/sports/high-school/2026/04/27/oklahoma-high-school-basketball-swimming-wrestling-awards-2026/89617919007/
,https://cm.oklahoman.com/site-feedback/?platform=Tangent-Desktop&url=https%3A%2F%2Fwww.oklahoman.com%2F&marketName=oklahoman&cta=Right-Rail
