headline,href
Live: See latest forecast as Oklahomans brace for major winter storm,/story/weather/2026/01/23/winter-storm-live-updates-oklahoma-okc-weather-snow-forecast-warning-alerts/88268917007/
Is school cancelled today? See districts affected by winter storm Jan. 23,/story/news/education/2026/01/22/oklahoma-school-closures-closings-okc-weather-road-conditions-today-see-list/88264636007/
"Chavez, OU women's basketball are 'back' after South Carolina upset",/story/sports/college/sooners/2026/01/23/ou-womens-basketball-score-vs-south-carolina-aaliyah-chavez-stats/88312897007/
Oversight body finds no misconduct of judge in Jesse Butler case,/story/news/crime/2026/01/23/complaints-council-finds-no-misconduct-from-judge-susan-worthington-in-jesse-butler-case/88307194007/
New BNSF facility improves logistics for Hobby Lobby…,/story/business/transportation/2026/01/22/bnsf-hobby-lobby-celebrate-new-intermodal-facility-okc/88304197007/
U.S. judge says tribal lawsuit against state prosecutors…,/story/news/courts/2026/01/22/oklahoma-tribal-sovereignty-lawsuit-can-continue-iski-ballard-mcgirt-scotus/88300014007/
Help us honor 250 women who shaped the United States,/story/news/local/2026/01/20/usa-today-women-who-shaped-the-nation-nomination-form-oklahoma-city/88264855007/
,
New faces guiding Newcastle basketball amid stellar…,/story/sports/high-school/basketball/2026/01/22/oklahoma-high-school-basketball-newcastle-thriving-rebuild-coach-jessie-brown/88306415007/
Vote: Landmark Fine Homes HS girls athlete of week for…,/story/sports/high-school/athlete-of-the-week/2026/01/20/vote-landmark-fine-homes-oklahoma-high-school-girls-athlete-of-week-jan-12-18/88255164007/
News,/news/
Live: See latest forecast as Oklahomans brace for major winter storm,/story/weather/2026/01/23/winter-storm-live-updates-oklahoma-okc-weather-snow-forecast-warning-alerts/88268917007/
Is school cancelled today? See districts affected by winter storm Jan. 23,/story/news/education/2026/01/22/oklahoma-school-closures-closings-okc-weather-road-conditions-today-see-list/88264636007/
Oversight body finds no misconduct of judge in Jesse Butler case,/story/news/crime/2026/01/23/complaints-council-finds-no-misconduct-from-judge-susan-worthington-in-jesse-butler-case/88307194007/
Sports,/sports/
"Chavez, OU women's basketball are 'back' after South Carolina upset",/story/sports/college/sooners/2026/01/23/ou-womens-basketball-score-vs-south-carolina-aaliyah-chavez-stats/88312897007/
New faces guiding Newcastle basketball amid stellar start in 5A,/story/sports/high-school/basketball/2026/01/22/oklahoma-high-school-basketball-newcastle-thriving-rebuild-coach-jessie-brown/88306415007/
Look inside OU gymnastics' $18 million expansion — 'It's amazing',/story/sports/college/sooners/2026/01/23/oklahoma-gymnastics-facility-expansion-cost-kj-kindler-sooners-viersen-gymnastics-center/88302628007/
Life,/life/
"'HECK OF A CLASS' Teachers, volunteers, businesses honored at Governor's Arts Awards",/story/entertainment/arts/2026/01/23/oklahoma-governors-arts-awards-winners-teachers-volunteers-more/88025500007/
Tulsa-based Horton Records marks 20 years as its founder is honored,/story/entertainment/2026/01/23/tulsas-horton-records-celebrates-20th-birthday-as-founder-is-honored/88025637007/
2 Oklahoma City-area restaurants named to Yelp's Top 100 list for 2026,/story/entertainment/dining/2026/01/22/yelp-top-100-restaurants-list-2026-oklahoma-city/88305488007/
Business,/business/
New owners of OKC indoor sports facility prepare for next tenant,/story/business/real-estate/2026/01/22/former-indoor-soccer-facility-in-oklahoma-city-sells-for-4-12-million/88304844007/
New BNSF facility improves logistics for Hobby Lobby freight,/story/business/transportation/2026/01/22/bnsf-hobby-lobby-celebrate-new-intermodal-facility-okc/88304197007/
Hobby Lobby and BNSF Partner for Intermodal Site in OKC,/picture-gallery/business/2026/01/22/okc-bnsf-railway-hobby-lobby-intermodal-facility-officially-opens/88304137007/
Opinion,/opinion/
Oklahoma needs a different teaching strategy to fix reading struggles John Thompson,/story/opinion/columns/guest/2026/01/23/new-teaching-methods-needed-to-improve-reading-skills-test-driven-instruction-should-be-rejected/88288848007/
Legislators enter OU essay fray with measure that sends wrong message Kevin Bolling,/story/opinion/columns/guest/2026/01/23/legislation-response-fulnecky-ou-essay-saga-sends-wrong-message/88252393007/
Are ICE actions justified or misuse of power? Readers share takes,/story/opinion/letters/2026/01/22/are-ice-actions-a-misuse-of-power-readers-weigh-in-letters/88285053007/
Trending,https://www.usatoday.com/news/trending/
Was Don Lemon charged in Minnesota church protest? Here's what happened.,/story/news/politics/2026/01/22/don-lemon-not-charged-3-minnesota-church-protestors-arrested/88307377007/
Ted Cruz spotted on flight out of Texas as state braces for storm,/story/news/politics/2026/01/21/ted-cruz-flight-california-texas-storm/88292089007/
Check here the winning numbers for Wednesday's Powerball drawing,/story/money/lottery/2026/01/21/powerball-winning-numbers-wednesday-january-21-2026/88291608007/
Shopping,/shopping/
Want 40% off Ritual vitamins and supplements? Shop this sale,/story/shopping/2026/01/23/ritual-new-years-sale-vitamins-supplements/88176401007/
Welcome to Whoop's new era of design‑driven wearable tech,/story/shopping/2026/01/23/samuel-ross-whoop-collaboration/88281062007/
How to book your Atlantis Bahamas luxury vacation,/story/shopping/2026/01/22/atlantis-bahamas-travel-guide/88304230007/
,/picture-gallery/news/2026/01/23/46th-oklahoma-governors-arts-awards/88276428007/
Winners Announced!,https://media.secondstreetapp.com/7272236?itm_campaign=2025%20Wish%20and%20Win%20Winners!&itm_medium=con&itm_source=secondStreet
Nominate Today!,https://www.profootballhof.com/news/2025/09/pro-football-hall-of-fame-awards-of-character-recognize-extraordinary-individuals/?utm_source=Localiq&utm_medium=promo&utm_campaign=awards&&itm_campaign=PFHOF%20Awards%20of%20Character&itm_medium=con&itm_source=secondStreet
Vote Each Week!,https://www.oklahoman.com/sports/high-school/?itm_campaign=Athlete%20of%20the%20Week%20Landmark%20OKC&itm_medium=con&itm_source=secondStreet
"'HECK OF A CLASS' Teachers, volunteers, businesses honored at Governor's Arts Awards",/story/entertainment/arts/2026/01/23/oklahoma-governors-arts-awards-winners-teachers-volunteers-more/88025500007/
"Oklahoma City preparing for winter snowstorm, freezing temps",/story/weather/severe/2026/01/23/okc-oklahoma-city-weather-forecast-winter-storm-freezing-temps-update/88301101007/
"How are Oklahoma roads? See current conditions, OKC snow routes",/story/weather/2026/01/23/live-okc-weather-friday-oklahoma-road-conditions-closures-updates/88264834007/
House budget chairman wants to fund Oklahoma's Promise with TSET earnings,/story/news/politics/2026/01/22/oklahoma-bill-would-dismantle-tset-board-send-earnings-to-oklahomas-promise/88303878007/
New owners of OKC indoor sports facility prepare for next tenant,/story/business/real-estate/2026/01/22/former-indoor-soccer-facility-in-oklahoma-city-sells-for-4-12-million/88304844007/
,https://cm.oklahoman.com/site-feedback/?platform=Tangent-Desktop&url=https%3A%2F%2Fwww.oklahoman.com%2F&marketName=oklahoman&cta=Right-Rail
