headline,href
Some lawmakers want to keep investigating OSDE spending,/story/news/politics/government/2024/10/30/ryan-walters-oklahoma-osde-report-leaves-lawmakers-questions/75919841007/
Oklahoma Sen. Julie Daniels says she supports change in abortion law,/story/news/politics/government/2024/10/30/oklahoma-senator-says-changes-in-state-abortion-law-necessary/75250118007/
"OSDE fell apart as Ryan Walters chased national stage, critics say",/story/news/2024/10/30/ryan-walters-oklahoma-state-department-education-national-stage/75919064007/
Latino-owned business owners find help in boosting growth,/story/business/local/2024/10/30/latino-accelerator-program-okc-businesses/75699752007/
See who was nominated for The Oklahoman's Student of the…,/story/news/2024/10/28/the-oklahoman-student-of-the-week-vote-poll/75823595007/
"OKC Thunder schedule: Dates, times, TV channels for…",/story/sports/nba/thunder/2024/10/24/thunder-schedule-dates-times-tv-streaming/75705777007/
,
Opinion: Embracing compromise is a key element in a…,/story/opinion/columns/guest/2024/10/30/civility-opinions-democracy-respect-political-engagement-society/75914958007/
"Attitude, work ethic made OSU's Isaia Glass 'perfect…",/story/sports/college/cowboys/2024/10/30/oklahoma-state-football-ol-isaia-glass-arizona-state-transfer-osu-cowboys/75918446007/
Why OU not fighting to keep Dillon Gabriel is a…,/story/sports/college/sooners/2024/10/30/ou-football-qb-jackson-arnold-dillon-gabriel-transfer-portal-oregon-ducks/75900469007/
Some lawmakers want to keep investigating OSDE spending,/story/news/politics/government/2024/10/30/ryan-walters-oklahoma-osde-report-leaves-lawmakers-questions/75919841007/
Oklahoma Sen. Julie Daniels says she supports change in abortion law,/story/news/politics/government/2024/10/30/oklahoma-senator-says-changes-in-state-abortion-law-necessary/75250118007/
"OSDE fell apart as Ryan Walters chased national stage, critics say",/story/news/2024/10/30/ryan-walters-oklahoma-state-department-education-national-stage/75919064007/
Vote: Landmark Fine Homes girls HS athlete of the week for Oct. 20-26,/story/sports/high-school/2024/10/28/vote-landmark-fine-homes-girls-high-school-athlete-of-the-week-for-oct-20-26/75884388007/
Vote: Landmark Fine Homes boys HS athlete of the week for Oct. 20-26,/story/sports/high-school/2024/10/28/vote-landmark-fine-homes-boys-high-school-athlete-of-the-week-for-oct-20-26/75884077007/
"Attitude, work ethic made OSU's Isaia Glass 'perfect fit' with Cowboys",/story/sports/college/cowboys/2024/10/30/oklahoma-state-football-ol-isaia-glass-arizona-state-transfer-osu-cowboys/75918446007/
Latino-owned business owners find help in boosting growth,/story/business/local/2024/10/30/latino-accelerator-program-okc-businesses/75699752007/
Expand Energy announced profit gains in third quarter in first report,/story/business/energy-resource/2024/10/29/expand-energy-oklahoma-financial-report-2024-profits/75914723007/
Oklahoma-based Crest Foods phasing out paper bags: What we know,/story/business/2024/10/28/crest-foods-phasing-out-paper-sacks-for-plastic-bags-oklahoma/75899561007/
Opinion: Embracing compromise is a key element in a civil society Emily Stacey/Oklahoma Voice,/story/opinion/columns/guest/2024/10/30/civility-opinions-democracy-respect-political-engagement-society/75914958007/
"Opinion: In memory of a deceased friend, I'm casting my vote Jacquelyne Finley",/story/opinion/columns/guest/2024/10/29/friend-advocate-died-vote-presidential-election-democracy-faith-league-of-women-voters/75841295007/
Opinion: Oklahoma's healthy pension system is worth preserving Bradley Ward,/story/opinion/columns/guest/2024/10/29/oklahoma-oks-public-pension-system-funded-and-healthy-unfunded-liabilities-legislature-retirement/75670791007/
Floods in Spain kill at least 62 people: See photos of the damage,/story/news/world/2024/10/30/floods-valencia-spain-photos/75934805007/
"Halloween deals 2024: Food discounts at Chipotle, Dunkin', Wendy's, more",/story/money/food/2024/10/30/halloween-deals-2024/75500477007/
Presidential election polls 2024: Latest surveys on Harris vs. Trump,/story/news/politics/elections/2024/10/30/presidential-election-polls-2024-harris-trump/75933756007/
What happened to OKC's Kevin Lee in the finale of 'Last Bite Hotel?',/story/lifestyle/food/2024/10/29/food-network-last-bite-hotel-finale-oklahoma-city-chef-kevin-lee-final-fate-decided-how-he-did/75927042007/
Oklahoma singer Jake Tankersley goes to Battle on 'The Voice' Season 26,/story/entertainment/2024/10/29/the-voice-season-27-jake-tankersley-oklahoma/75913390007/
Can magnets treat pain or other conditions? Doctor offers advice,/story/lifestyle/2024/10/29/bodywork-is-magnet-therapy-a-good-way-to-treat-pain-other-conditions/75816706007/
,/picture-gallery/sports/college/sooners/2024/10/26/ou-football-vs-ole-miss-best-photos-from-sooners-week-9-game/75865087007/
Enter Today!,https://oklahoman.gannettcontests.com/OKC-Broadway-How-the-Grinch-Stole-Christmas-Ticket/?itm_campaign=OKC%20Broadway%20How%20the%20Grinch%20Stole%20Christmas%20Ticket%20Sweepstakes&itm_medium=con&itm_source=secondStreet
Winners Announced!,https://oklahoman.gannettcontests.com/2024-Oklahoman-Communitys-Choice-Awards-Winners/?itm_campaign=Oklahoma%202024%20BOB&itm_medium=con&itm_source=secondStreet
"Election 2024 live updates: Where will Trump, Harris campaign today?",/story/news/politics/elections/2024/10/30/election-2024-live-updates-trump-harris/75923764007/
In-person early voting in Oklahoma starts today: Here's where to vote,/story/news/politics/elections/2024/10/30/early-voting-in-oklahoma-election-2024-starts-today-locations-hours-okc-metro/75934764007/
Area south of Pawhuska told to evacuate as wildfire spreads,/story/news/fire/2024/10/29/oklahoma-wildfire-prompts-evacuation-of-osage-county-area-south-of-pawhuska/75924259007/
Vote: Landmark Fine Homes girls HS athlete of the week for Oct. 20-26,/story/sports/high-school/2024/10/28/vote-landmark-fine-homes-girls-high-school-athlete-of-the-week-for-oct-20-26/75884388007/
Vote: Landmark Fine Homes boys HS athlete of the week for Oct. 20-26,/story/sports/high-school/2024/10/28/vote-landmark-fine-homes-boys-high-school-athlete-of-the-week-for-oct-20-26/75884077007/
,https://cm.oklahoman.com/site-feedback/?platform=Tangent-Desktop&url=https%3A%2F%2Fwww.oklahoman.com%2F&marketName=oklahoman&cta=Right-Rail
